document_modified,version,versionLocalName,version_isDefinedBy,version_issued,version_status,replaces_version,replaces1_version,replaces2_version,label,rdfs_comment,dcterms_description,examples,rdf_type,tdwgutility_abcdEquivalence,tdwgutility_organizedInClass,tdwgutility_decision,tdwgutility_usageScope,term_localName
2025-08-17T14:26:42-05:00,http://rs.tdwg.org/eco/iri/version/nonTargetTaxa-2025-07-10,nonTargetTaxa-2025-07-10,http://rs.tdwg.org/eco/iri/version/,2025-07-10,recommended,http://rs.tdwg.org/eco/iri/version/nonTargetTaxa-2024-03-26,,,Non-target Taxa (IRI),A taxon reported during the dwc:Event that is outside of the target taxonomic scope (the combination of ecoiri:targetTaxonomicScope and ecoiri:excludedTaxonomicScope).,This term is meant to allow a taxon that is considered outside of the taxonomic scope and yet was reported in the dataset to be shared. This term is relevant only if a target taxonomic scope is declared and eco:hasNonTargetTaxa is ‘true’. Taxonomic scope is based on the combination of ecoiri:targetTaxonomicScope and ecoiri:excludedTaxonomicScope. Non-target taxa (in some disciplines called “bycatch”) can be reported at any taxonomic level. Terms in the ecoiri: namespace are intended to be used in RDF with non-literal objects.,,http://www.w3.org/1999/02/22-rdf-syntax-ns#Property,not in ABCD,http://rs.tdwg.org/dwc/terms/attributes/UseWithIRI,,,nonTargetTaxa
2025-08-17T14:26:42-05:00,http://rs.tdwg.org/eco/iri/version/protocolNames-2025-07-10,protocolNames-2025-07-10,http://rs.tdwg.org/eco/iri/version/,2025-07-10,recommended,http://rs.tdwg.org/eco/iri/version/protocolNames-2024-03-26,,,Protocol Names (IRI),Categorical descriptive name for the methods used during the dwc:Event.,Recommended best practice is to use an IRI from a controlled vocabulary. Terms in the ecoiri: namespace are intended to be used in RDF with non-literal objects.,,http://www.w3.org/1999/02/22-rdf-syntax-ns#Property,not in ABCD,http://rs.tdwg.org/dwc/terms/attributes/UseWithIRI,,,protocolNames
2025-08-17T14:26:42-05:00,http://rs.tdwg.org/eco/iri/version/samplingEffortProtocol-2025-07-10,samplingEffortProtocol-2025-07-10,http://rs.tdwg.org/eco/iri/version/,2025-07-10,recommended,http://rs.tdwg.org/eco/iri/version/samplingEffortProtocol-2025-06-12,,,Sampling Effort Protocol (IRI),"A method or protocol used to determine the sampling effort, denoted by an IRI.","This protocol should be associated with the values reported in eco:samplingEffortValue and eco:samplingEffortUnit. This is a specialization of eco:protocolDescriptions focused on effort, distinct from the survey method. The effort relates to the intensity of sampling and therefore can assist in interpreting estimates of completeness. Terms in the ecoiri: namespace are intended to be used in RDF with non-literal objects.",,http://www.w3.org/1999/02/22-rdf-syntax-ns#Property,not in ABCD,http://rs.tdwg.org/dwc/terms/attributes/UseWithIRI,,,samplingEffortProtocol
2025-08-17T14:26:42-05:00,http://rs.tdwg.org/eco/iri/version/samplingPerformedBy-2025-07-10,samplingPerformedBy-2025-07-10,http://rs.tdwg.org/eco/iri/version/,2025-07-10,recommended,http://rs.tdwg.org/eco/iri/version/samplingPerformedBy-2024-03-26,,,Sampling Performed By (IRI),"A person, group, or organization responsible for recording the dwc:Event.","The sampling dwc:Event could be at any level of hierarchy. In the case of a higher level (parent) dwc:Event, include all the organizations or people involved in the child dwc:Events that contributed to the parent dwc:Event. Terms in the ecoiri: namespace are intended to be used in RDF with non-literal objects.",,http://www.w3.org/1999/02/22-rdf-syntax-ns#Property,not in ABCD,http://rs.tdwg.org/dwc/terms/attributes/UseWithIRI,,,samplingPerformedBy
2025-08-17T14:26:42-05:00,http://rs.tdwg.org/eco/iri/version/targetDegreeOfEstablishmentScope-2025-07-10,targetDegreeOfEstablishmentScope-2025-07-10,http://rs.tdwg.org/eco/iri/version/,2025-07-10,recommended,http://rs.tdwg.org/eco/iri/version/targetDegreeOfEstablishmentScope-2024-03-26,,,Target Degree of Establishment Scope (IRI),The degree of establishment of the dwc:Organisms targeted for sampling during the dwc:Event.,"Recommended best practice is to use an IRI from the controlled vocabulary designated for use with this term, listed at http://rs.tdwg.org/dwc/doc/doe/. For details, refer to https://doi.org/10.3897/biss.3.38084 . Terms in the ecoiri: namespace are intended to be used in RDF with non-literal objects.",`http://rs.tdwg.org/dwcem/values/e001`; `http://rs.tdwg.org/dwcem/values/e005`,http://www.w3.org/1999/02/22-rdf-syntax-ns#Property,not in ABCD,http://rs.tdwg.org/dwc/terms/attributes/UseWithIRI,,,targetDegreeOfEstablishmentScope
2025-08-17T14:26:42-05:00,http://rs.tdwg.org/eco/iri/version/targetGrowthFormScope-2025-07-10,targetGrowthFormScope-2025-07-10,http://rs.tdwg.org/eco/iri/version/,2025-07-10,recommended,http://rs.tdwg.org/eco/iri/version/targetGrowthFormScope-2024-03-26,,,Target Growth Form Scope (IRI),The growth form or habit of the dwc:Organisms targeted for sampling during the dwc:Event.,Recommended best practice is to use an IRI from a controlled vocabulary. Terms in the ecoiri: namespace are intended to be used in RDF with non-literal objects.,,http://www.w3.org/1999/02/22-rdf-syntax-ns#Property,not in ABCD,http://rs.tdwg.org/dwc/terms/attributes/UseWithIRI,,,targetGrowthFormScope
2025-08-17T14:26:42-05:00,http://rs.tdwg.org/eco/iri/version/targetHabitatScope-2025-07-10,targetHabitatScope-2025-07-10,http://rs.tdwg.org/eco/iri/version/,2025-07-10,recommended,http://rs.tdwg.org/eco/iri/version/targetHabitatScope-2024-03-26,,,Target Habitat Scope (IRI),The habitat targeted for sampling during the dwc:Event.,Recommended best practice is to use an IRI from a controlled vocabulary. Terms in the ecoiri: namespace are intended to be used in RDF with non-literal objects.,,http://www.w3.org/1999/02/22-rdf-syntax-ns#Property,not in ABCD,http://rs.tdwg.org/dwc/terms/attributes/UseWithIRI,,,targetHabitatScope
2025-08-17T14:26:42-05:00,http://rs.tdwg.org/eco/iri/version/targetLifeStageScope-2025-07-10,targetLifeStageScope-2025-07-10,http://rs.tdwg.org/eco/iri/version/,2025-07-10,recommended,http://rs.tdwg.org/eco/iri/version/targetLifeStageScope-2024-03-26,,,Target Life Stage Scope (IRI),The age class or life stage of the dwc:Organisms targeted for sampling during the dwc:Event.,This term is defined based on dwciri:lifeStage (http://rs.tdwg.org/dwc/terms/iri/lifeStage). Recommended best practice is to use an IRI from the same controlled vocabulary as for dwciri:lifeStage. Terms in the ecoiri: namespace are intended to be used in RDF with non-literal objects.,,http://www.w3.org/1999/02/22-rdf-syntax-ns#Property,not in ABCD,http://rs.tdwg.org/dwc/terms/attributes/UseWithIRI,,,targetLifeStageScope
2025-08-17T14:26:42-05:00,http://rs.tdwg.org/eco/iri/version/targetTaxonomicScope-2025-07-10,targetTaxonomicScope-2025-07-10,http://rs.tdwg.org/eco/iri/version/,2025-07-10,recommended,http://rs.tdwg.org/eco/iri/version/targetTaxonomicScope-2024-03-26,,,Target Taxonomic Scope (IRI),The taxonomic group targeted for sampling during the dwc:Event.,"The dwc:Event to which the ecoiri:targetTaxonomicScope refers could be at any level of hierarchy. In the case of a higher level (parent) dwc:Event, include all taxonomic groups surveyed in the child dwc:Events that contributed to the parent dwc:Event. Terms in the ecoiri: namespace are intended to be used in RDF with non-literal objects.",,http://www.w3.org/1999/02/22-rdf-syntax-ns#Property,not in ABCD,http://rs.tdwg.org/dwc/terms/attributes/UseWithIRI,,,targetTaxonomicScope
2025-08-17T14:26:42-05:00,http://rs.tdwg.org/eco/iri/version/taxonCompletenessProtocols-2025-07-10,taxonCompletenessProtocols-2025-07-10,http://rs.tdwg.org/eco/iri/version/,2025-07-10,recommended,http://rs.tdwg.org/eco/iri/version/taxonCompletenessProtocols-2024-03-26,,,Taxon Completeness Protocols (IRI),"A method or protocol used to determine ecoiri:taxonCompletenessReported, denoted by an IRI.",This term allows users to determine how comprehensively an area has been sampled. Terms in the ecoiri: namespace are intended to be used in RDF with non-literal objects.,,http://www.w3.org/1999/02/22-rdf-syntax-ns#Property,not in ABCD,http://rs.tdwg.org/dwc/terms/attributes/UseWithIRI,,,taxonCompletenessProtocols
2025-08-17T14:26:42-05:00,http://rs.tdwg.org/eco/iri/version/taxonCompletenessReported-2025-07-10,taxonCompletenessReported-2025-07-10,http://rs.tdwg.org/eco/iri/version/,2025-07-10,recommended,http://rs.tdwg.org/eco/iri/version/taxonCompletenessReported-2024-03-26,,,Taxon Completeness Reported (IRI),Statement about whether the taxonomic completeness of the dwc:Event was assessed.,"This term is meant to alert users that the inventory was conducted in such a way that all of the target taxa (the combination of ecoiri:targetTaxonomicScope and ecoiri:excludedTaxonomicScope) should have been detectable if they were present during the dwc:Event. This term can provide data users with a qualitative measure of how comprehensively an area has been surveyed, which assists in interpreting species populations, areas of occupancy, inferring species absences, etc. This term is only relevant if the dwc:Event used restricted search or open search methods. If taxonomic completeness was assessed, the methods used or an explanation of the basis of the completeness should covered by ecoiri:taxonCompletenessProtocols. Recommended best practice is to use an IRI from the controlled vocabulary designated for use with this term, listed at http://rs.tdwg.org/dwc/doc/tcr/. Terms in the ecoiri: namespace are intended to be used in RDF with non-literal objects.",`http://rs.tdwg.org/ecotcr/values/tcr01`; `http://rs.tdwg.org/ecotcr/values/tcr01`,http://www.w3.org/1999/02/22-rdf-syntax-ns#Property,not in ABCD,http://rs.tdwg.org/dwc/terms/attributes/UseWithIRI,,,taxonCompletenessReported
