"identifier","context","text"
"Owner:label","Label for Copyright Owner http://rs.tdwg.org/dwc/terms/Owner",""
"Owner:rdfs_comment","Comment for Copyright Owner http://rs.tdwg.org/dwc/terms/Owner",""
"Owner:dcterms_description","Description for Copyright Owner http://rs.tdwg.org/dwc/terms/Owner",""
"UsageTerms:label","Label for License Terms http://rs.tdwg.org/dwc/terms/UsageTerms",""
"UsageTerms:rdfs_comment","Comment for License Terms http://rs.tdwg.org/dwc/terms/UsageTerms",""
"UsageTerms:dcterms_description","Description for License Terms http://rs.tdwg.org/dwc/terms/UsageTerms",""
"WebStatement:label","Label for License URL http://rs.tdwg.org/dwc/terms/WebStatement",""
"WebStatement:rdfs_comment","Comment for License URL http://rs.tdwg.org/dwc/terms/WebStatement",""
"WebStatement:dcterms_description","Description for License URL http://rs.tdwg.org/dwc/terms/WebStatement",""
