term_localName,label,rdfs_comment,dcterms_description,examples,rdf_type,tdwgutility_abcdEquivalence,tdwgutility_organizedInClass,tdwgutility_decision,tdwgutility_usageScope
locationRemarks,Location Remarks,Comments or notes about the dcterms:Location.,,`under water since 2005`,http://www.w3.org/1999/02/22-rdf-syntax-ns#Property,DataSets/DataSet/Units/Unit/Gathering/AreaDetail,http://purl.org/dc/terms/Location,,simple
decimalLatitude,Decimal Latitude,"The geographic latitude (in decimal degrees, using the spatial reference system given in dwc:geodeticDatum) of the geographic center of a dcterms:Location. Positive values are north of the Equator, negative values are south of it. Legal values lie between -90 and 90, inclusive.",,`-41.0983423`,http://www.w3.org/1999/02/22-rdf-syntax-ns#Property,DataSets/DataSet/Units/Unit/Gathering/SiteCoordinateSets/SiteCoordinates/CoordinatesLatLon/LatitudeDecimal,http://purl.org/dc/terms/Location,,simple
decimalLongitude,Decimal Longitude,"The geographic longitude (in decimal degrees, using the spatial reference system given in dwc:geodeticDatum) of the geographic center of a dcterms:Location. Positive values are east of the Greenwich Meridian, negative values are west of it. Legal values lie between -180 and 180, inclusive.",,`-121.1761111`,http://www.w3.org/1999/02/22-rdf-syntax-ns#Property,DataSets/DataSet/Units/Unit/Gathering/SiteCoordinateSets/SiteCoordinates/CoordinatesLatLon/LongitudeDecimal,http://purl.org/dc/terms/Location,,simple
geodeticDatum,Geodetic Datum,"The ellipsoid, geodetic datum, or spatial reference system (SRS) upon which the geographic coordinates given in dwc:decimalLatitude and dwc:decimalLongitude are based.","Recommended best practice is to use the EPSG code of the SRS, if known. Otherwise use a controlled vocabulary for the name or code of the geodetic datum, if known. Otherwise use a controlled vocabulary for the name or code of the ellipsoid, if known. If none of these is known, use the value `unknown`. This term has an equivalent in the dwciri: namespace that allows only an IRI as a value, whereas this term allows for any string literal value.",`EPSG:4326`; `WGS84`; `NAD27`; `Campo Inchauspe`; `European 1950`; `Clarke 1866`; `unknown`,http://www.w3.org/1999/02/22-rdf-syntax-ns#Property,DataSets/DataSet/Units/Unit/Gathering/SiteCoordinateSets/SiteCoordinates/CoordinatesLatLon/SpatialDatum,http://purl.org/dc/terms/Location,,simple
coordinateUncertaintyInMeters,Coordinate Uncertainty In Meters,"The horizontal distance (in meters) from the given dwc:decimalLatitude and dwc:decimalLongitude describing the smallest circle containing the whole of the dcterms:Location. Leave the value empty if the uncertainty is unknown, cannot be estimated, or is not applicable (because there are no coordinates). Zero is not a valid value for this term.",,`30` (reasonable lower limit on or after 2000-05-01 of a GPS reading under good conditions if the actual precision was not recorded at the time); `100` (reasonable lower limit before 2000-05-01 of a GPS reading under good conditions if the actual precision was not recorded at the time); `71` (uncertainty for a UTM coordinate having 100 meter precision and a known spatial reference system),http://www.w3.org/1999/02/22-rdf-syntax-ns#Property,DataSets/DataSet/Units/Unit/Gathering/SiteCoordinateSets/SiteCoordinates/CoordinatesLatLon/CoordinateErrorDistanceInMeters,http://purl.org/dc/terms/Location,,simple
coordinatePrecision,Coordinate Precision,A decimal representation of the precision of the coordinates given in the dwc:decimalLatitude and dwc:decimalLongitude.,,`0.00001` (normal GPS limit for decimal degrees); `0.000278` (nearest second); `0.01667` (nearest minute); `1.0` (nearest degree),http://www.w3.org/1999/02/22-rdf-syntax-ns#Property,DataSets/DataSet/Units/Unit/Gathering/SiteCoordinateSets/SiteCoordinates/CoordinatesLatLong/ISOAccuracy or DataSets/DataSet/Units/Unit/Gathering/SiteCoordinateSets/SiteCoordinates/CoordinatesLatLong/AccuracyStatement,http://purl.org/dc/terms/Location,,simple
pointRadiusSpatialFit,Point Radius Spatial Fit,"The ratio of the area of the point-radius (dwc:decimalLatitude, dwc:decimalLongitude, dwc:coordinateUncertaintyInMeters) to the area of the true (original, or most specific) spatial representation of the dcterms:Location. Legal values are 0, greater than or equal to 1, or undefined. A value of 1 is an exact match or 100% overlap. A value of 0 should be used if the given point-radius does not completely contain the original representation. The dwc:pointRadiusSpatialFit is undefined (and should be left empty) if the original representation is any geometry without area (e.g., a point or polyline) and without uncertainty and the given georeference is not that same geometry (without uncertainty). If both the original and the given georeference are the same point, the dwc:pointRadiusSpatialFit is 1.","Detailed explanations with graphical examples can be found in the Georeferencing Best Practices, Chapman and Wieczorek, 2020 (https://doi.org/10.15468/doc-gg7h-s853).",`0`; `1`; `1.5708`,http://www.w3.org/1999/02/22-rdf-syntax-ns#Property,DataSets/DataSet/Units/Unit/Gathering/SiteCoordinateSets/SiteCoordinates/PointRadiusSpatialFit,http://purl.org/dc/terms/Location,,simple
verbatimCoordinates,Verbatim Coordinates,"The verbatim original spatial coordinates of the dcterms:Location. The coordinate ellipsoid, geodeticDatum, or full Spatial Reference System (SRS) for these coordinates should be stored in dwc:verbatimSRS and the coordinate system should be stored in dwc:verbatimCoordinateSystem.",,`41 05 54S 121 05 34W`; `17T 630000 4833400`,http://www.w3.org/1999/02/22-rdf-syntax-ns#Property,{DataSets/DataSet/Units/Unit/Gathering/SiteCoordinateSets/SiteCoordinates/CoordinatesLatLon/CoordinatesText or DataSets/DataSet/Units/Unit/Gathering/SiteCoordinateSets/SiteCoordinates/CoordinatesUTM/UTMText},http://purl.org/dc/terms/Location,,simple
verbatimLatitude,Verbatim Latitude,"The verbatim original latitude of the dcterms:Location. The coordinate ellipsoid, geodeticDatum, or full Spatial Reference System (SRS) for these coordinates should be stored in dwc:verbatimSRS and the coordinate system should be stored in dwc:verbatimCoordinateSystem.",,`41 05 54.03S`,http://www.w3.org/1999/02/22-rdf-syntax-ns#Property,DataSets/DataSet/Units/Unit/Gathering/SiteCoordinateSets/SiteCoordinates/CoordinatesLatLon/VerbatimLatitude,http://purl.org/dc/terms/Location,,simple
verbatimLongitude,Verbatim Longitude,"The verbatim original longitude of the dcterms:Location. The coordinate ellipsoid, geodeticDatum, or full Spatial Reference System (SRS) for these coordinates should be stored in dwc:verbatimSRS and the coordinate system should be stored in dwc:verbatimCoordinateSystem.",,"`121d 10' 34"" W`",http://www.w3.org/1999/02/22-rdf-syntax-ns#Property,DataSets/DataSet/Units/Unit/Gathering/SiteCoordinateSets/SiteCoordinates/CoordinatesLatLon/VerbatimLongitude,http://purl.org/dc/terms/Location,,simple
verbatimCoordinateSystem,Verbatim Coordinate System,The coordinate format for the dwc:verbatimLatitude and dwc:verbatimLongitude or the dwc:verbatimCoordinates of the dcterms:Location.,"Recommended best practice is to use a controlled vocabulary. This term has an equivalent in the dwciri: namespace that allows only an IRI as a value, whereas this term allows for any string literal value.",`decimal degrees`; `degrees decimal minutes`; `degrees minutes seconds`; `UTM`,http://www.w3.org/1999/02/22-rdf-syntax-ns#Property,(partly) DataSets/DataSet/Units/Unit/Gathering/SiteCoordinateSets/SiteCoordinates/CoordinatesGrid/GridCellSystem,http://purl.org/dc/terms/Location,,simple
verbatimSRS,Verbatim SRS,"The ellipsoid, geodetic datum, or spatial reference system (SRS) upon which coordinates given in dwc:verbatimLatitude and dwc:verbatimLongitude, or dwc:verbatimCoordinates are based.","Recommended best practice is to use the EPSG code of the SRS, if known. Otherwise use a controlled vocabulary for the name or code of the geodetic datum, if known. Otherwise use a controlled vocabulary for the name or code of the ellipsoid, if known. If none of these is known, use the value `unknown`. This term has an equivalent in the dwciri: namespace that allows only an IRI as a value, whereas this term allows for any string literal value.",`unknown`; `EPSG:4326`; `WGS84`; `NAD27`; `Campo Inchauspe`; `European 1950`; `Clarke 1866`,http://www.w3.org/1999/02/22-rdf-syntax-ns#Property,not in ABCD,http://purl.org/dc/terms/Location,,simple
footprintWKT,Footprint WKT,"A Well-Known Text (WKT) representation of the shape (footprint, geometry) that defines the dcterms:Location. A dcterms:Location may have both a point-radius representation (see dwc:decimalLatitude) and a footprint representation, and they may differ from each other.","This term has an equivalent in the dwciri: namespace that allows only an IRI as a value, whereas this term allows for any string literal value.","`POLYGON ((10 20, 11 20, 11 21, 10 21, 10 20))` (the one-degree bounding box with opposite corners at longitude=10, latitude=20 and longitude=11, latitude=21)",http://www.w3.org/1999/02/22-rdf-syntax-ns#Property,DataSets/DataSet/Units/Unit/Gathering/FootprintWKT (ABCD v2.06b),http://purl.org/dc/terms/Location,,simple
footprintSRS,Footprint SRS,"The ellipsoid, geodetic datum, or spatial reference system (SRS) upon which the geometry given in dwc:footprintWKT is based.","Recommended best practice is to use the EPSG code of the SRS, if known. Otherwise use a controlled vocabulary for the name or code of the geodetic datum, if known. Otherwise use a controlled vocabulary for the name or code of the ellipsoid, if known. If none of these is known, use the value `unknown`. It is also permitted to provide the SRS in Well-Known-Text, especially if no EPSG code provides the necessary values for the attributes of the SRS. Do not use this term to describe the SRS of the dwc:decimalLatitude and dwc:decimalLongitude, nor of any verbatim coordinates - use the dwc:geodeticDatum and dwc:verbatimSRS instead. This term has an equivalent in the dwciri: namespace that allows only an IRI as a value, whereas this term allows for any string literal value.","`epsg:4326`; `GEOGCS[""GCS_WGS_1984"", DATUM[""D_WGS_1984"", SPHEROID[""WGS_1984"",6378137,298.257223563]], PRIMEM[""Greenwich"",0], UNIT[""Degree"",0.0174532925199433]]` (WKT for the standard WGS84 Spatial Reference System EPSG:4326)",http://www.w3.org/1999/02/22-rdf-syntax-ns#Property,not in ABCD,http://purl.org/dc/terms/Location,,simple
footprintSpatialFit,Footprint Spatial Fit,"The ratio of the area of the dwc:footprintWKT to the area of the true (original, or most specific) spatial representation of the dcterms:Location. Legal values are 0, greater than or equal to 1, or undefined. A value of 1 is an exact match or 100% overlap. A value of 0 should be used if the given dwc:footprintWKT does not completely contain the original representation. The dwc:footprintSpatialFit is undefined (and should be left empty) if the original representation is any geometry without area (e.g., a point or polyline) and without uncertainty and the given georeference is not that same geometry (without uncertainty). If both the original and the given georeference are the same point, the dwc:footprintSpatialFit is 1.","Detailed explanations with graphical examples can be found in the Georeferencing Best Practices, Chapman and Wieczorek, 2020 (https://doi.org/10.15468/doc-gg7h-s853).",`0`; `1`; `1.5708`,http://www.w3.org/1999/02/22-rdf-syntax-ns#Property,DataSets/DataSet/Units/Unit/Gathering/FootprintSpatialFit,http://purl.org/dc/terms/Location,,simple
georeferencedBy,Georeferenced By,"A list (concatenated and separated) of names of people, groups, or organizations who determined the georeference (spatial representation) for the dcterms:Location.","Recommended best practice is to separate the values in a list with space vertical bar space (` | `). This term has an equivalent in the dwciri: namespace that allows only an IRI as a value, whereas this term allows for any string literal value.",`Brad Millen (ROM)`; `Kristina Yamamoto | Janet Fang`,http://www.w3.org/1999/02/22-rdf-syntax-ns#Property,not in ABCD,http://purl.org/dc/terms/Location,,simple
georeferencedDate,Georeferenced Date,The date on which the dcterms:Location was georeferenced.,Recommended best practice is to use a date that conforms to ISO 8601-1:2019.,`1963-03-08T14:07-0600` (8 Mar 1963 at 2:07pm in the time zone six hours earlier than UTC); `2009-02-20T08:40Z` (20 February 2009 8:40am UTC); `2018-08-29T15:19` (3:19pm local time on 29 August 2018); `1809-02-12` (some time during 12 February 1809); `1906-06` (some time in June 1906); `1971` (some time in the year 1971); `2007-03-01T13:00:00Z/2008-05-11T15:30:00Z` (some time during the interval between 1 March 2007 1pm UTC and 11 May 2008 3:30pm UTC); `1900/1909` (some time during the interval between the beginning of the year 1900 and the end of the year 1909); `2007-11-13/15` (some time in the interval between 13 November 2007 and 15 November 2007),http://www.w3.org/1999/02/22-rdf-syntax-ns#Property,not in ABCD,http://purl.org/dc/terms/Location,,simple
georeferenceProtocol,Georeference Protocol,"A description or reference to the methods used to determine the spatial footprint, coordinates, and uncertainties.","This term has an equivalent in the dwciri: namespace that allows only an IRI as a value, whereas this term allows for any string literal value.","`Georeferencing Quick Reference Guide (Zermoglio et al. 2020, https://doi.org/10.35035/e09p-h128)`",http://www.w3.org/1999/02/22-rdf-syntax-ns#Property,DataSets/DataSet/Units/Unit/Gathering/SiteCoordinateSets/SiteCoordinates/CoordinateMethod,http://purl.org/dc/terms/Location,,simple
georeferenceSources,Georeference Sources,"A list (concatenated and separated) of maps, gazetteers, or other resources used to georeference the dcterms:Location, described specifically enough to allow anyone in the future to use the same resources.","Recommended best practice is to separate the values in a list with space vertical bar space (` | `). This term has an equivalent in the dwciri: namespace that allows only an IRI as a value, whereas this term allows for any string literal value.",`https://www.geonames.org/`; `USGS 1:24000 Florence Montana Quad 1967 | Terrametrics 2008 on Google Earth`; `GeoLocate`,http://www.w3.org/1999/02/22-rdf-syntax-ns#Property,DataSets/DataSet/Units/Unit/Gathering/SiteCoordinateSets/SiteCoordinates/GeoreferenceSources,http://purl.org/dc/terms/Location,,simple
georeferenceRemarks,Georeference Remarks,"Notes or comments about the spatial description determination, explaining assumptions made in addition or opposition to the those formalized in the method referred to in dwc:georeferenceProtocol.",,`Assumed distance by road (Hwy. 101)`,http://www.w3.org/1999/02/22-rdf-syntax-ns#Property,DataSets/DataSet/Units/Unit/Gathering/SiteCoordinateSets/SiteCoordinates/GeoreferenceRemarks,http://purl.org/dc/terms/Location,,simple
geologicalContextID,Geological Context ID,"An identifier for the set of information associated with a dwc:GeologicalContext (the location within a geological context, such as stratigraphy). May be a global unique identifier or an identifier specific to the data set.",,`https://opencontext.org/subjects/e54377f7-4452-4315-b676-40679b10c4d9`,http://www.w3.org/1999/02/22-rdf-syntax-ns#Property,not in ABCD,http://rs.tdwg.org/dwc/terms/GeologicalContext,,simple
earliestEonOrLowestEonothem,Earliest Eon Or Lowest Eonothem,"The full name of the earliest possible geochronologic eon or lowest chrono-stratigraphic eonothem or the informal name (""Precambrian"") attributable to the stratigraphic horizon from which the cataloged item was collected.",,`Phanerozoic`; `Proterozoic`,http://www.w3.org/1999/02/22-rdf-syntax-ns#Property,not in ABCD,http://rs.tdwg.org/dwc/terms/GeologicalContext,,simple
latestEonOrHighestEonothem,Latest Eon Or Highest Eonothem,"The full name of the latest possible geochronologic eon or highest chrono-stratigraphic eonothem or the informal name (""Precambrian"") attributable to the stratigraphic horizon from which the cataloged item was collected.",,`Phanerozoic`; `Proterozoic`,http://www.w3.org/1999/02/22-rdf-syntax-ns#Property,not in ABCD,http://rs.tdwg.org/dwc/terms/GeologicalContext,,simple
earliestEraOrLowestErathem,Earliest Era Or Lowest Erathem,The full name of the earliest possible geochronologic era or lowest chronostratigraphic erathem attributable to the stratigraphic horizon from which the cataloged item was collected.,,`Cenozoic`; `Mesozoic`,http://www.w3.org/1999/02/22-rdf-syntax-ns#Property,not in ABCD,http://rs.tdwg.org/dwc/terms/GeologicalContext,,simple
latestEraOrHighestErathem,Latest Era Or Highest Erathem,The full name of the latest possible geochronologic era or highest chronostratigraphic erathem attributable to the stratigraphic horizon from which the cataloged item was collected.,,`Cenozoic`; `Mesozoic`,http://www.w3.org/1999/02/22-rdf-syntax-ns#Property,not in ABCD,http://rs.tdwg.org/dwc/terms/GeologicalContext,,simple
earliestPeriodOrLowestSystem,Earliest Period Or Lowest System,The full name of the earliest possible geochronologic period or lowest chronostratigraphic system attributable to the stratigraphic horizon from which the cataloged item was collected.,,`Neogene`; `Tertiary`; `Quaternary`,http://www.w3.org/1999/02/22-rdf-syntax-ns#Property,not in ABCD,http://rs.tdwg.org/dwc/terms/GeologicalContext,,simple
latestPeriodOrHighestSystem,Latest Period Or Highest System,The full name of the latest possible geochronologic period or highest chronostratigraphic system attributable to the stratigraphic horizon from which the cataloged item was collected.,,`Neogene`; `Tertiary`; `Quaternary`,http://www.w3.org/1999/02/22-rdf-syntax-ns#Property,not in ABCD,http://rs.tdwg.org/dwc/terms/GeologicalContext,,simple
earliestEpochOrLowestSeries,Earliest Epoch Or Lowest Series,The full name of the earliest possible geochronologic epoch or lowest chronostratigraphic series attributable to the stratigraphic horizon from which the cataloged item was collected.,,`Holocene`; `Pleistocene`; `Ibexian Series`,http://www.w3.org/1999/02/22-rdf-syntax-ns#Property,not in ABCD,http://rs.tdwg.org/dwc/terms/GeologicalContext,,simple
latestEpochOrHighestSeries,Latest Epoch Or Highest Series,The full name of the latest possible geochronologic epoch or highest chronostratigraphic series attributable to the stratigraphic horizon from which the cataloged item was collected.,,`Holocene`; `Pleistocene`; `Ibexian Series`,http://www.w3.org/1999/02/22-rdf-syntax-ns#Property,not in ABCD,http://rs.tdwg.org/dwc/terms/GeologicalContext,,simple
earliestAgeOrLowestStage,Earliest Age Or Lowest Stage,The full name of the earliest possible geochronologic age or lowest chronostratigraphic stage attributable to the stratigraphic horizon from which the cataloged item was collected.,,`Atlantic`; `Boreal`; `Skullrockian`,http://www.w3.org/1999/02/22-rdf-syntax-ns#Property,not in ABCD,http://rs.tdwg.org/dwc/terms/GeologicalContext,,simple
latestAgeOrHighestStage,Latest AgeOr Highest Stage,The full name of the latest possible geochronologic age or highest chronostratigraphic stage attributable to the stratigraphic horizon from which the cataloged item was collected.,,`Atlantic`; `Boreal`; `Skullrockian`,http://www.w3.org/1999/02/22-rdf-syntax-ns#Property,not in ABCD,http://rs.tdwg.org/dwc/terms/GeologicalContext,,simple
group,Group,The full name of the lithostratigraphic group from which the cataloged item was collected.,,`Bathurst`; `Lower Wealden`,http://www.w3.org/1999/02/22-rdf-syntax-ns#Property,not in ABCD,http://rs.tdwg.org/dwc/terms/GeologicalContext,,simple
formation,Formation,The full name of the lithostratigraphic formation from which the cataloged item was collected.,,`Notch Peak Formation`; `House Limestone`; `Fillmore Formation`,http://www.w3.org/1999/02/22-rdf-syntax-ns#Property,not in ABCD,http://rs.tdwg.org/dwc/terms/GeologicalContext,,simple
member,Member,The full name of the lithostratigraphic member from which the cataloged item was collected.,,`Lava Dam Member`; `Hellnmaria Member`,http://www.w3.org/1999/02/22-rdf-syntax-ns#Property,not in ABCD,http://rs.tdwg.org/dwc/terms/GeologicalContext,,simple
Identification,Identification,"A taxonomic determination (e.g., the assignment to a dwc:Taxon).",,A subspecies determination of an organism.,http://www.w3.org/2000/01/rdf-schema#Class,DataSets/DataSet/Units/Unit/Identifications/Identification,,,extension
identificationID,Identification ID,An identifier for the dwc:Identification (the body of information associated with the assignment of a scientific name). May be a global unique identifier or an identifier specific to the data set.,,`9992`,http://www.w3.org/1999/02/22-rdf-syntax-ns#Property,not in ABCD,http://rs.tdwg.org/dwc/terms/Identification,,simple
verbatimIdentification,Verbatim Identification,A string representing the taxonomic identification as it appeared in the original record.,"This term is meant to allow the capture of an unaltered original identification/determination, including identification qualifiers, hybrid formulas, uncertainties, etc. This term is meant to be used in addition to dwc:scientificName (and dwc:identificationQualifier etc.), not instead of it.",`Peromyscus sp.`; `Ministrymon sp. nov. 1`; `Anser anser × Branta canadensis`; `Pachyporidae?`; `Potentilla × pantotricha Soják`; `Aconitum pilipes × A. variegatum`; `Lepomis auritus x cyanellus`,http://www.w3.org/1999/02/22-rdf-syntax-ns#Property,not in ABCD,http://rs.tdwg.org/dwc/terms/Identification,,simple
identificationQualifier,Identification Qualifier,"A brief phrase or a standard term (""cf."", ""aff."") to express the determiner's doubts about the dwc:Identification.","This term has an equivalent in the dwciri: namespace that allows only an IRI as a value, whereas this term allows for any string literal value.","`aff. agrifolia var. oxyadenia` (for `Quercus aff. agrifolia var. oxyadenia` with accompanying values `Quercus` in genus, `agrifolia`  in specificEpithet, `oxyadenia`  in infraspecificEpithet, and `var.` in taxonRank); `cf. var. oxyadenia` (for `Quercus agrifolia cf. var. oxyadenia` with accompanying values `Quercus` in genus, `agrifolia` in specificEpithet, `oxyadenia` in infraspecificEpithet, and `var.` in taxonRank)",http://www.w3.org/1999/02/22-rdf-syntax-ns#Property,DataSets/DataSet/Units/Unit/Identifications/Identification/TaxonIdentified/IdentificationQualifier,http://rs.tdwg.org/dwc/terms/Identification,,simple
typeStatus,Type Status,"A list (concatenated and separated) of nomenclatural types (type status, typified scientific name, publication) applied to the subject.","Recommended best practice is to separate the values in a list with space vertical bar space (` | `). This term has an equivalent in the dwciri: namespace that allows only an IRI as a value, whereas this term allows for any string literal value.","`holotype of Ctenomys sociabilis. Pearson O. P., and M. I. Christie. 1985. Historia Natural, 5(37):388`; `holotype of Pinus abies | holotype of Picea abies`",http://www.w3.org/1999/02/22-rdf-syntax-ns#Property,DataSets/DataSet/Units/Unit/SpecimenUnit/NomenclaturalTypeDesignations/NomenclaturalTypeText,http://rs.tdwg.org/dwc/terms/Identification,,simple
identifiedBy,Identified By,"A list (concatenated and separated) of names of people, groups, or organizations who assigned the dwc:Taxon to the subject.","Recommended best practice is to separate the values in a list with space vertical bar space (` | `). This term has an equivalent in the dwciri: namespace that allows only an IRI as a value, whereas this term allows for any string literal value.",`James L. Patton`; `Theodore Pappenfuss | Robert Macey`,http://www.w3.org/1999/02/22-rdf-syntax-ns#Property,DataSets/DataSet/Units/Unit/Identifications/Identification/Identifiers/IdentifiersText,http://rs.tdwg.org/dwc/terms/Identification,,simple
identifiedByID,Identified By ID,"A list (concatenated and separated) of the globally unique identifier for the person, people, groups, or organizations responsible for assigning the dwc:Taxon to the subject.","Recommended best practice is to provide a single identifier that disambiguates the details of the identifying agent. If a list is used, the order of the identifiers on the list should not be assumed to convey any semantics. Recommended best practice is to separate the values in a list with space vertical bar space (` | `).",`https://orcid.org/0000-0002-1825-0097` (for an individual); `https://orcid.org/0000-0002-1825-0097 | https://orcid.org/0000-0002-1825-0098` (for a list of people),http://www.w3.org/1999/02/22-rdf-syntax-ns#Property,not in ABCD,http://rs.tdwg.org/dwc/terms/Identification,,simple
dateIdentified,Date Identified,The date on which the subject was determined as representing the dwc:Taxon.,Recommended best practice is to use a date that conforms to ISO 8601-1:2019.,`1963-03-08T14:07-0600` (8 Mar 1963 at 2:07pm in the time zone six hours earlier than UTC); `2009-02-20T08:40Z` (20 February 2009 8:40am UTC); `2018-08-29T15:19` (3:19pm local time on 29 August 2018); `1809-02-12` (some time during 12 February 1809); `1906-06` (some time in June 1906); `1971` (some time in the year 1971); `2007-03-01T13:00:00Z/2008-05-11T15:30:00Z` (some time during the interval between 1 March 2007 1pm UTC and 11 May 2008 3:30pm UTC); `1900/1909` (some time during the interval between the beginning of the year 1900 and the end of the year 1909); `2007-11-13/15` (some time in the interval between 13 November 2007 and 15 November 2007),http://www.w3.org/1999/02/22-rdf-syntax-ns#Property,DataSets/DataSet/Units/Unit/Identifications/Identification/Date/DateText,http://rs.tdwg.org/dwc/terms/Identification,,simple
