term_localName,label,rdfs_comment,dcterms_description,examples,rdf_type,tdwgutility_abcdEquivalence,tdwgutility_organizedInClass,tdwgutility_decision,tdwgutility_usageScope
institutionID,Institution ID,An identifier for the institution having custody of the object(s) or information referred to in the record.,"For physical specimens, the recommended best practice is to use a globally unique and resolvable identifier from a collections registry such as the Research Organization Registry (ROR) or the GBIF Registry of Scientific Collections (https://www.gbif.org/grscicoll).",`https://ror.org/015hz7p22`; `http://grscicoll.org/institution/museum-southwestern-biology`; `https://www.gbif.org/grscicoll/institution/e3d4dcc4-81e2-444c-8a5c-41d1044b5381`,http://www.w3.org/1999/02/22-rdf-syntax-ns#Property,DataSets/DataSet/Units/Unit/SourceInstitutionID,http://rs.tdwg.org/dwc/terms/,,simple
collectionID,Collection ID,An identifier for the collection or dataset from which the record was derived.,"For physical specimens, the recommended best practice is to use a globally unique and resolvable identifier from a collections registry such as the GBIF Registry of Scientific Collections (https://www.gbif.org/grscicoll).",`https://www.gbif.org/grscicoll/collection/fbd3ed74-5a21-4e01-b86a-33d36f032d9c`,http://www.w3.org/1999/02/22-rdf-syntax-ns#Property,DataSets/DataSet/Units/Unit/SourceID,http://rs.tdwg.org/dwc/terms/,,simple
institutionCode,Institution Code,The name (or acronym) in use by the institution having custody of the object(s) or information referred to in the record.,,`MVZ`; `FMNH`; `CLO`; `UCMP`,http://www.w3.org/1999/02/22-rdf-syntax-ns#Property,DataSets/DataSet/Units/Unit/SourceInstitutionID,http://rs.tdwg.org/dwc/terms/,,simple
collectionCode,Collection Code,"The name, acronym, coden, or initialism identifying the collection or data set from which the record was derived.",,`Mammals`; `Hildebrandt`; `EBIRD`; `VP`,http://www.w3.org/1999/02/22-rdf-syntax-ns#Property,DataSets/DataSet/Units/Unit/SourceID,http://rs.tdwg.org/dwc/terms/,,simple
datasetName,Dataset Name,The name identifying the data set from which the record was derived.,,`Grinnell Resurvey Mammals`; `Lacey Ctenomys Recaptures`,http://www.w3.org/1999/02/22-rdf-syntax-ns#Property,DataSets/DataSet/Units/Unit/SourceID,http://rs.tdwg.org/dwc/terms/,,simple
ownerInstitutionCode,Owner Institution Code,The name (or acronym) in use by the institution having ownership of the object(s) or information referred to in the record.,,`NPS`; `APN`; `InBio`,http://www.w3.org/1999/02/22-rdf-syntax-ns#Property,not in ABCD,http://rs.tdwg.org/dwc/terms/,,simple
basisOfRecord,Basis of Record,The specific nature of the data record.,Recommended best practice is to use a controlled vocabulary such as the set of local names of the identifiers for classes in Darwin Core.,`PreservedSpecimen`; `FossilSpecimen`; `LivingSpecimen`; `MaterialSample`; `Event`; `HumanObservation`; `MachineObservation`; `Taxon`; `Occurrence`; `MaterialCitation`,http://www.w3.org/1999/02/22-rdf-syntax-ns#Property,DataSets/DataSet/Units/Unit/RecordBasis,http://rs.tdwg.org/dwc/terms/,,simple
informationWithheld,Information Withheld,"Additional information that exists, but that has not been shared in the given record.","This term has an equivalent in the dwciri: namespace that allows only an IRI as a value, whereas this term allows for any string literal value.",`location information not given for endangered species`; `collector identities withheld | ask about tissue samples`,http://www.w3.org/1999/02/22-rdf-syntax-ns#Property,DataSets/DataSet/Units/Unit/InformationWithheld,http://rs.tdwg.org/dwc/terms/,,simple
dataGeneralizations,Data Generalizations,Actions taken to make the shared data less specific or complete than in its original form. Suggests that alternative data of higher quality may be available on request.,"This term has an equivalent in the dwciri: namespace that allows only an IRI as a value, whereas this term allows for any string literal value.",`Coordinates generalized from original GPS coordinates to the nearest half degree grid cell`.,http://www.w3.org/1999/02/22-rdf-syntax-ns#Property,not in ABCD,http://rs.tdwg.org/dwc/terms/,,simple
dynamicProperties,Dynamic Properties,"A list of additional measurements, facts, characteristics, or assertions about the record. Meant to provide a mechanism for structured content.",Recommended best practice is to use a key:value encoding schema for a data interchange format such as JSON.,"`{""heightInMeters"":1.5}`; `{""targusLengthInMeters"":0.014, ""weightInGrams"":120}`; `{""natureOfID"":""expert identification"", ""identificationEvidence"":""cytochrome B sequence""}`; `{""relativeHumidity"":28, ""airTemperatureInCelsius"":22, ""sampleSizeInKilograms"":10}`; `{""aspectHeading"":277, ""slopeInDegrees"":6}`; `{""iucnStatus"":""vulnerable"", ""taxonDistribution"":""Neuquén, Argentina""}`",http://www.w3.org/1999/02/22-rdf-syntax-ns#Property,not in ABCD,http://rs.tdwg.org/dwc/terms/,,simple
Occurrence,Occurrence,An existence of a dwc:Organism at a particular place at a particular time.,,A wolf pack on the shore of Kluane Lake in 1988. A virus in a plant leaf in the New York Botanical Garden at 15:29 on 2014-10-23. A fungus in Central Park in the summer of 1929.,http://www.w3.org/2000/01/rdf-schema#Class,DataSets/DataSet/Units/Unit,,,extension
occurrenceID,Occurrence ID,"An identifier for the dwc:Occurrence (as opposed to a particular digital record of the dwc:Occurrence). In the absence of a persistent global unique identifier, construct one from a combination of identifiers in the record that will most closely make the dwc:occurrenceID globally unique.","Recommended best practice is to use a persistent, globally unique identifier.",`http://arctos.database.museum/guid/MSB:Mamm:233627`; `000866d2-c177-4648-a200-ead4007051b9`; `urn:catalog:UWBM:Bird:89776`,http://www.w3.org/1999/02/22-rdf-syntax-ns#Property,DataSets/DataSet/Units/Unit/UnitGUID,http://rs.tdwg.org/dwc/terms/Occurrence,,simple
catalogNumber,Catalog Number,An identifier (preferably unique) for the record within the data set or collection.,,`145732`; `145732a`; `2008.1334`; `R-4313`,http://www.w3.org/1999/02/22-rdf-syntax-ns#Property,DataSets/DataSet/Units/Unit/UnitID,http://rs.tdwg.org/dwc/terms/Occurrence,,simple
recordNumber,Record Number,"An identifier given to the dwc:Occurrence at the time it was recorded. Often serves as a link between field notes and a dwc:Occurrence record, such as a specimen collector's number.","This term has an equivalent in the dwciri: namespace that allows only an IRI as a value, whereas this term allows for any string literal value.",`OPP 7101`,http://www.w3.org/1999/02/22-rdf-syntax-ns#Property,DataSets/DataSet/Units/Unit/CollectorsFieldNumber,http://rs.tdwg.org/dwc/terms/Occurrence,,simple
recordedBy,Recorded By,"A list (concatenated and separated) of names of people, groups, or organizations responsible for recording the original dwc:Occurrence. The primary collector or observer, especially one who applies a personal identifier (dwc:recordNumber), should be listed first.","Recommended best practice is to separate the values in a list with space vertical bar space (` | `). This term has an equivalent in the dwciri: namespace that allows only an IRI as a value, whereas this term allows for any string literal value.",`José E. Crespo`; `Oliver P. Pearson | Anita K. Pearson` (where the value in recordNumber `OPP 7101` corresponds to the collector number for the specimen in the field catalog of Oliver P. Pearson),http://www.w3.org/1999/02/22-rdf-syntax-ns#Property,DataSets/DataSet/Units/Unit/Gathering/GatheringAgents/GatheringAgentsText,http://rs.tdwg.org/dwc/terms/Occurrence,,simple
recordedByID,Recorded By ID,"A list (concatenated and separated) of the globally unique identifier for the person, people, groups, or organizations responsible for recording the original dwc:Occurrence.","Recommended best practice is to provide a single identifier that disambiguates the details of the identifying agent. If a list is used, it is recommended to separate the values in the list with space vertical bar space (` | `). The order of the identifiers on any list for this term can not be guaranteed to convey any semantics.",`https://orcid.org/0000-0002-1825-0097` (for an individual); `https://orcid.org/0000-0002-1825-0097 | https://orcid.org/0000-0002-1825-0098` (for a list of people),http://www.w3.org/1999/02/22-rdf-syntax-ns#Property,not in ABCD,http://rs.tdwg.org/dwc/terms/Occurrence,,simple
individualCount,Individual Count,The number of individuals present at the time of the dwc:Occurrence.,,`0`; `1`; `25`,http://www.w3.org/1999/02/22-rdf-syntax-ns#Property,DataSets/DataSet/Units/Unit/Gathering/SiteMeasurementsOrFacts/SiteMeasurementOrFact/MeasurementOrFactAtomised/LowerValue,http://rs.tdwg.org/dwc/terms/Occurrence,,simple
organismQuantity,Organism Quantity,A number or enumeration value for the quantity of dwc:Organisms.,A dwc:organismQuantity must have a corresponding dwc:organismQuantityType.,`27` (organismQuantity) with `individuals` (organismQuantityType); `12.5` (organismQuantity) with `% biomass` (organismQuantityType); `r` (organismQuantity) with `Braun-Blanquet Scale` (organismQuantityType); `many` (organismQuantity) with `individuals` (organismQuantityType),http://www.w3.org/1999/02/22-rdf-syntax-ns#Property,not in ABCD,http://rs.tdwg.org/dwc/terms/Occurrence,,simple
organismQuantityType,Organism Quantity Type,The type of quantification system used for the quantity of dwc:Organisms.,"A dwc:organismQuantityType must have a corresponding dwc:organismQuantity. This term has an equivalent in the dwciri: namespace that allows only an IRI as a value, whereas this term allows for any string literal value.",`27` (organismQuantity) with `individuals` (organismQuantityType); `12.5` (organismQuantity) with `% biomass` (organismQuantityType); `r` (organismQuantity) with `Braun-Blanquet Scale` (organismQuantityType); `many` (organismQuantity) with `individuals` (organismQuantityType),http://www.w3.org/1999/02/22-rdf-syntax-ns#Property,not in ABCD,http://rs.tdwg.org/dwc/terms/Occurrence,,simple
sex,Sex,The sex of the biological individual(s) represented in the dwc:Occurrence.,"Recommended best practice is to use a controlled vocabulary. This term has an equivalent in the dwciri: namespace that allows only an IRI as a value, whereas this term allows for any string literal value.",`female`; `male`; `hermaphrodite`,http://www.w3.org/1999/02/22-rdf-syntax-ns#Property,DataSets/DataSet/Units/Unit/Sex,http://rs.tdwg.org/dwc/terms/Occurrence,,simple
lifeStage,Life Stage,The age class or life stage of the dwc:Organism(s) at the time the dwc:Occurrence was recorded.,"Recommended best practice is to use a controlled vocabulary. This term has an equivalent in the dwciri: namespace that allows only an IRI as a value, whereas this term allows for any string literal value.",`zygote`; `larva`; `juvenile`; `adult`; `seedling`; `flowering`; `fruiting`,http://www.w3.org/1999/02/22-rdf-syntax-ns#Property,DataSets/DataSet/Units/Unit/MycologicalUnit/MycologicalSexualStage or DataSets/DataSet/Units/Unit/MycologicalUnit/MycologicalLiveStages/MycologicalLiveStage or DataSets/DataSet/Units/Unit/ZoologicalUnit/PhasesOrStages/PhaseOrStage,http://rs.tdwg.org/dwc/terms/Occurrence,,simple
reproductiveCondition,Reproductive Condition,The reproductive condition of the biological individual(s) represented in the dwc:Occurrence.,"Recommended best practice is to use a controlled vocabulary. This term has an equivalent in the dwciri: namespace that allows only an IRI as a value, whereas this term allows for any string literal value.",`non-reproductive`; `pregnant`; `in bloom`; `fruit-bearing`,http://www.w3.org/1999/02/22-rdf-syntax-ns#Property,not in ABCD,http://rs.tdwg.org/dwc/terms/Occurrence,,simple
caste,Caste,Categorisation of individuals for eusocial species (including some mammals and arthropods).,"Recommended best practice is to use a controlled vocabulary that aligns best with the dwc:Taxon. This term has an equivalent in the dwciri: namespace that allows only an IRI as a value, whereas this term allows for any string literal value.",`queen`; `male alate`; `intercaste`; `minor worker`; `soldier`; `ergatoid`,http://www.w3.org/1999/02/22-rdf-syntax-ns#Property,not in ABCD,http://rs.tdwg.org/dwc/terms/Occurrence,,simple
behavior,Behavior,The behavior shown by the subject at the time the dwc:Occurrence was recorded.,"This term has an equivalent in the dwciri: namespace that allows only an IRI as a value, whereas this term allows for any string literal value.",`roosting`; `foraging`; `running`,http://www.w3.org/1999/02/22-rdf-syntax-ns#Property,not in ABCD,http://rs.tdwg.org/dwc/terms/Occurrence,,simple
vitality,Vitality,An indication of whether a dwc:Organism was alive or dead at the time of collection or observation.,"Recommended best practice is to use a controlled vocabulary. Intended to be used with records having a dwc:basisOfRecord of `PreservedSpecimen`, `MaterialSample`, or `HumanObservation`. This term has an equivalent in the dwciri: namespace that allows only an IRI as a value, whereas this term allows for any string literal value.",`alive`; `dead`; `mixedLot`; `uncertain`; `notAssessed`,http://www.w3.org/1999/02/22-rdf-syntax-ns#Property,not in ABCD,http://rs.tdwg.org/dwc/terms/Occurrence,,simple
establishmentMeans,Establishment Means,Statement about whether a dwc:Organism has been introduced to a given place and time through the direct or indirect activity of modern humans.,"Recommended best practice is to use controlled value strings from the controlled vocabulary designated for use with this term, listed at http://rs.tdwg.org/dwc/doc/em/. For details, refer to https://doi.org/10.3897/biss.3.38084. This term has an equivalent in the dwciri: namespace that allows only an IRI as a value, whereas this term allows for any string literal value.",`native`; `nativeReintroduced`; `introduced`; `introducedAssistedColonisation`; `vagrant`; `uncertain`,http://www.w3.org/1999/02/22-rdf-syntax-ns#Property,DataSets/DataSet/Units/Unit/Gathering/EstablishmentMeans,http://rs.tdwg.org/dwc/terms/Occurrence,,simple
degreeOfEstablishment,Degree of Establishment,"The degree to which a dwc:Organism survives, reproduces, and expands its range at the given place and time.","Recommended best practice is to use controlled value strings from the controlled vocabulary designated for use with this term, listed at http://rs.tdwg.org/dwc/doc/doe/. For details, refer to https://doi.org/10.3897/biss.3.38084. This term has an equivalent in the dwciri: namespace that allows only an IRI as a value, whereas this term allows for any string literal value.",`native`; `captive`; `cultivated`; `released`; `failing`; `casual`; `reproducing`; `established`; `colonising`; `invasive`; `widespreadInvasive`,http://www.w3.org/1999/02/22-rdf-syntax-ns#Property,,http://rs.tdwg.org/dwc/terms/Occurrence,,simple
pathway,Pathway,The process by which a dwc:Organism came to be in a given place at a given time.,"Recommended best practice is to use controlled value strings from the controlled vocabulary designated for use with this term, listed at http://rs.tdwg.org/dwc/doc/pw/. For details, refer to https://doi.org/10.3897/biss.3.38084. This term has an equivalent in the dwciri: namespace that allows only an IRI as a value, whereas this term allows for any string literal value.",`releasedForUse`; `otherEscape`; `transportContaminant`; `transportStowaway`; `corridor`; `unaided`,http://www.w3.org/1999/02/22-rdf-syntax-ns#Property,,http://rs.tdwg.org/dwc/terms/Occurrence,,simple
georeferenceVerificationStatus,Georeference Verification Status,A categorical description of the extent to which the georeference has been verified to represent the best possible spatial description for the dcterms:Location of the dwc:Occurrence.,"Recommended best practice is to use a controlled vocabulary. This term has an equivalent in the dwciri: namespace that allows only an IRI as a value, whereas this term allows for any string literal value.",`unable to georeference`; `requires georeference`; `requires verification`; `verified by data custodian`; `verified by contributor`,http://www.w3.org/1999/02/22-rdf-syntax-ns#Property,DataSets/DataSet/Units/Unit/Gathering/SiteCoordinateSets/SiteCoordinates/GeoreferenceVerificationStatus,http://rs.tdwg.org/dwc/terms/Occurrence,,simple
occurrenceStatus,Occurrence Status,A statement about the presence or absence of a dwc:Taxon at a dcterms:Location.,"For dwc:Occurrences, the default vocabulary is recommended to consist of `present` and `absent`, but can be extended by implementers with good justification. This term has an equivalent in the dwciri: namespace that allows only an IRI as a value, whereas this term allows for any string literal value.",`present`; `absent`,http://www.w3.org/1999/02/22-rdf-syntax-ns#Property,not in ABCD,http://rs.tdwg.org/dwc/terms/Occurrence,,simple
preparations,Preparations,A list (concatenated and separated) of preparations and preservation methods for a specimen.,"Recommended best practice is to separate the values in a list with space vertical bar space (` | `). This term has an equivalent in the dwciri: namespace that allows only an IRI as a value, whereas this term allows for any string literal value.",`fossil`; `cast`; `photograph`; `DNA extract`; `skin | skull | skeleton`; `whole animal (ETOH) | tissue (EDTA)`,http://www.w3.org/1999/02/22-rdf-syntax-ns#Property,DataSets/DataSet/Units/Unit/SpecimenUnit/Preparations/PreparationsText,http://rs.tdwg.org/dwc/terms/Occurrence,,simple
disposition,Disposition,The current state of a specimen with respect to the collection identified in dwc:collectionCode or dwc:collectionID.,"Recommended best practice is to use a controlled vocabulary. This term has an equivalent in the dwciri: namespace that allows only an IRI as a value, whereas this term allows for any string literal value.",`in collection`; `missing`; `voucher elsewhere`; `duplicates elsewhere`,http://www.w3.org/1999/02/22-rdf-syntax-ns#Property,DataSets/DataSet/Units/Unit/SpecimenUnit/Disposition,http://rs.tdwg.org/dwc/terms/Occurrence,,simple
associatedMedia,Associated Media,"A list (concatenated and separated) of identifiers (publication, global unique identifier, URI) of media associated with the dwc:Occurrence.",,`https://arctos.database.museum/media/10520962 | https://arctos.database.museum/media/10520964`,http://www.w3.org/1999/02/22-rdf-syntax-ns#Property,DataSets/DataSet/Units/Unit/MultimediaObjects,http://rs.tdwg.org/dwc/terms/Occurrence,,simple
associatedOccurrences,Associated Occurrences,A list (concatenated and separated) of identifiers of other dwc:Occurrence records and their associations to this dwc:Occurrence.,"This term can be used to provide a list of associations to other dwc:Occurrences. Note that the dwc:ResourceRelationship class is an alternative means of representing associations, and with more detail. Recommended best practice is to separate the values in a list with space vertical bar space (` | `).","`""parasite collected from"":""https://arctos.database.museum/guid/MSB:Mamm:215895?seid=950760""`; `""encounter previous to"":""http://arctos.database.museum/guid/MSB:Mamm:292063?seid=3175067"" | ""encounter previous to"":""http://arctos.database.museum/guid/MSB:Mamm:292063?seid=3177393"" | ""encounter previous to"":""http://arctos.database.museum/guid/MSB:Mamm:292063?seid=3177394"" | ""encounter previous to"":""http://arctos.database.museum/guid/MSB:Mamm:292063?seid=3177392"" | ""encounter previous to"":""http://arctos.database.museum/guid/MSB:Mamm:292063?seid=3609139""`",http://www.w3.org/1999/02/22-rdf-syntax-ns#Property,DataSets/DataSet/Units/Unit/Associations/UnitAssociation/AssociatedUnitSourceInstitutionCode + DataSets/DataSet/Units/Unit/Associations/UnitAssociation/AssociatedUnitSourceName + DataSets/DataSet/Units/Unit/Associations/UnitAssociation/AssociatedUnitID,http://rs.tdwg.org/dwc/terms/Occurrence,,simple
associatedReferences,Associated References,"A list (concatenated and separated) of identifiers (publication, bibliographic reference, global unique identifier, URI) of literature associated with the dwc:Occurrence.","Recommended best practice is to separate the values in a list with space vertical bar space (` | `). Note that the dwc:ResourceRelationship class is an alternative means of representing associations, and with more detail. Note also that the intended usage of the term dcterms:references in Darwin Core when applied to a dwc:Occurrence is to point to the definitive source representation of that dwc:Occurrence if one is available. Note also that the intended usage of dcterms:bibliographicCitation in Darwin Core when applied to a dwc:Occurrence is to provide the preferred way to cite the dwc:Occurrence itself.","`http://www.sciencemag.org/cgi/content/abstract/322/5899/261`; `Christopher J. Conroy, Jennifer L. Neuwald. 2008. Phylogeographic study of the California vole, Microtus californicus Journal of Mammalogy, 89(3):755-767.`; `Steven R. Hoofer and Ronald A. Van Den Bussche. 2001. Phylogenetic Relationships of Plecotine Bats and Allies Based on Mitochondrial Ribosomal Sequences. Journal of Mammalogy 82(1):131-137. | Walker, Faith M., Jeffrey T. Foster, Kevin P. Drees, Carol L. Chambers. 2014. Spotted bat (Euderma maculatum) microsatellite discovery using illumina sequencing. Conservation Genetics Resources.`",http://www.w3.org/1999/02/22-rdf-syntax-ns#Property,DataSets/DataSet/Units/Unit/UnitReferences,http://rs.tdwg.org/dwc/terms/Occurrence,,simple
associatedSequences,Associated Sequences,"A list (concatenated and separated) of identifiers (publication, global unique identifier, URI) of genetic sequence information associated with the dwc:Occurrence.",,`http://www.ncbi.nlm.nih.gov/nuccore/U34853.1`; `http://www.ncbi.nlm.nih.gov/nuccore/GU328060 | http://www.ncbi.nlm.nih.gov/nuccore/AF326093`,http://www.w3.org/1999/02/22-rdf-syntax-ns#Property,DataSets/DataSet/Units/Unit/Sequences/Sequence/ID-in-Database + constant,http://rs.tdwg.org/dwc/terms/Occurrence,,simple
associatedTaxa,Associated Taxa,A list (concatenated and separated) of identifiers or names of dwc:Taxon records and the associations of this dwc:Occurrence to each of them.,"This term can be used to provide a list of associations to dwc:Taxon records other than the one defined in the dwc:Occurrence. Note that the dwc:ResourceRelationship class is an alternative means of representing associations, and with more detail. This term is not apt for establishing relationships between dwc:Taxon records, only between specific dwc:Occurrences of a dwc:Organism with other dwc:Taxon records. Recommended best practice is to separate the values in a list with space vertical bar space (` | `).","`""host"":""Quercus alba""`; `""host"":""gbif.org/species/2879737""`; `""parasitoid of"":""Cyclocephala signaticollis"" | ""predator of"":""Apis mellifera""`",http://www.w3.org/1999/02/22-rdf-syntax-ns#Property,DataSets/DataSet/Units/Unit/Gathering/Synecology/AssociatedTaxa,http://rs.tdwg.org/dwc/terms/Occurrence,,simple
otherCatalogNumbers,Other Catalog Numbers,"A list (concatenated and separated) of previous or alternate fully qualified catalog numbers or other human-used identifiers for the same dwc:Occurrence, whether in the current or any other data set or collection.",Recommended best practice is to separate the values in a list with space vertical bar space (` | `).,`FMNH:Mammal:1234`; `NPS YELLO6778 | MBG 33424`,http://www.w3.org/1999/02/22-rdf-syntax-ns#Property,DataSets/DataSet/Units/Unit/SpecimenUnit/History/PreviousUnitsText,http://rs.tdwg.org/dwc/terms/Occurrence,,simple
occurrenceRemarks,Occurrence Remarks,Comments or notes about the dwc:Occurrence.,,`found dead on road`,http://www.w3.org/1999/02/22-rdf-syntax-ns#Property,DataSets/DataSet/Units/Unit/Notes,http://rs.tdwg.org/dwc/terms/Occurrence,,simple
Organism,Organism,A particular organism or defined group of organisms considered to be taxonomically homogeneous.,"Instances of the dwc:Organism class are intended to facilitate linking one or more dwc:Identification instances to one or more dwc:Occurrence instances. Therefore, things that are typically assigned scientific names (such as viruses, hybrids, and lichens) and aggregates whose dwc:Occurrences are typically recorded (such as packs, clones, and colonies) are included in the scope of this class.",A specific bird. A specific wolf pack. A specific instance of a bacterial culture.,http://www.w3.org/2000/01/rdf-schema#Class,not in ABCD,,,extension
organismID,Organism ID,An identifier for the dwc:Organism instance (as opposed to a particular digital record of the dwc:Organism). May be a globally unique identifier or an identifier specific to the data set.,,`http://arctos.database.museum/guid/WNMU:Mamm:1249`,http://www.w3.org/1999/02/22-rdf-syntax-ns#Property,not in ABCD,http://rs.tdwg.org/dwc/terms/Organism,,simple
organismName,Organism Name,A textual name or label assigned to a dwc:Organism instance.,,`Huberta`; `Boab Prison Tree`; `J pod`,http://www.w3.org/1999/02/22-rdf-syntax-ns#Property,not in ABCD,http://rs.tdwg.org/dwc/terms/Organism,,simple
organismScope,Organism Scope,A description of the kind of dwc:Organism instance. Can be used to indicate whether the dwc:Organism instance represents a discrete organism or if it represents a particular type of aggregation.,"Recommended best practice is to use a controlled vocabulary. This term is not intended to be used to specify a type of dwc:Taxon. To describe the kind of dwc:Organism using a URI object in RDF, use rdf:type (http://www.w3.org/1999/02/22-rdf-syntax-ns#type) instead.",`multicellular organism`; `virus`; `clone`; `pack`; `colony`,http://www.w3.org/1999/02/22-rdf-syntax-ns#Property,not in ABCD,http://rs.tdwg.org/dwc/terms/Organism,,simple
