term_localName,label,rdfs_comment,dcterms_description,examples,rdf_type,tdwgutility_abcdEquivalence,tdwgutility_organizedInClass,tdwgutility_decision,tdwgutility_usageScope
identificationReferences,Identification References,"A list (concatenated and separated) of references (publication, global unique identifier, URI) used in the dwc:Identification.",Recommended best practice is to separate the values in a list with space vertical bar space (` | `).,"`Aves del Noroeste Patagonico. Christie et al. 2004.`; `Stebbins, R. Field Guide to Western Reptiles and Amphibians. 3rd Edition. 2003. | Irschick, D.J. and Shaffer, H.B. (1997). The polytypic species revisited: Morphological differentiation among tiger salamanders (Ambystoma tigrinum) (Amphibia: Caudata). Herpetologica, 53(1), 30-49.`",http://www.w3.org/1999/02/22-rdf-syntax-ns#Property,DataSets/DataSet/Units/Unit/Identifications/Identification/References,http://rs.tdwg.org/dwc/terms/Identification,,simple
identificationVerificationStatus,Identification Verification Status,A categorical indicator of the extent to which the taxonomic identification has been verified to be correct.,"Recommended best practice is to use a controlled vocabulary such as that used in HISPID and ABCD. This term has an equivalent in the dwciri: namespace that allows only an IRI as a value, whereas this term allows for any string literal value.","`0` (""unverified"" in HISPID/ABCD).",http://www.w3.org/1999/02/22-rdf-syntax-ns#Property,not in ABCD,http://rs.tdwg.org/dwc/terms/Identification,,simple
identificationRemarks,Identification Remarks,Comments or notes about the dwc:Identification.,,`Distinguished between Anthus correndera and Anthus hellmayri based on the comparative lengths of the uñas.`,http://www.w3.org/1999/02/22-rdf-syntax-ns#Property,DataSets/DataSet/Units/Unit/Identifications/Identification/Notes,http://rs.tdwg.org/dwc/terms/Identification,,simple
taxonID,Taxon ID,An identifier for the set of dwc:Taxon information. May be a global unique identifier or an identifier specific to the data set.,,`8fa58e08-08de-4ac1-b69c-1235340b7001`; `32567`; `https://www.gbif.org/species/212`,http://www.w3.org/1999/02/22-rdf-syntax-ns#Property,not in ABCD,http://rs.tdwg.org/dwc/terms/Taxon,,simple
acceptedNameUsageID,Accepted Name Usage ID,An identifier for the name usage (documented meaning of the name according to a source) of the currently valid (zoological) or accepted (botanical) taxon.,This term should be used for synonyms or misapplied names to refer to the dwc:taxonID of a dwc:Taxon record that represents the accepted (botanical) or valid (zoological) name. For Darwin Core Archives the related record should be present locally in the same archive.,`tsn:41107` (ITIS); `urn:lsid:ipni.org:names:320035-2` (IPNI); `2704179` (GBIF); `6W3C4` (COL),http://www.w3.org/1999/02/22-rdf-syntax-ns#Property,not in ABCD,http://rs.tdwg.org/dwc/terms/Taxon,,simple
parentNameUsageID,Parent Name Usage ID,"An identifier for the name usage (documented meaning of the name according to a source) of the direct, most proximate higher-rank parent taxon (in a classification) of the most specific element of the dwc:scientificName.",This term should be used for accepted names to refer to the dwc:taxonID of a dwc:Taxon record that represents the next higher taxon rank in the same taxonomic classification. For Darwin Core Archives the related record should be present locally in the same archive.,`tsn:41074` (ITIS); `urn:lsid:ipni.org:names:30001404-2` (IPNI); `2704173` (GBIF); `6T8N` (COL),http://www.w3.org/1999/02/22-rdf-syntax-ns#Property,not in ABCD,http://rs.tdwg.org/dwc/terms/Taxon,,simple
originalNameUsageID,Original Name Usage ID,An identifier for the name usage (documented meaning of the name according to a source) in which the terminal element of the dwc:scientificName was originally established under the rules of the associated dwc:nomenclaturalCode.,"This term should be used to refer to the dwc:taxonID of a dwc:Taxon record that represents the usage of the terminal element of the dwc:scientificName as originally established under the rules of the associated dwc:nomenclaturalCode. For example, for names governed by the ICNafp, this term would establish the relationship between a record representing a subsequent combination and the record for its corresponding basionym. Unlike basionyms, however, this term can apply to scientific names at all ranks. For Darwin Core Archives the related record should be present locally in the same archive.",`tsn:41107` (ITIS); `urn:lsid:ipni.org:names:320035-2` (IPNI); `2704179` (GBIF); `6W3C4` (COL),http://www.w3.org/1999/02/22-rdf-syntax-ns#Property,not in ABCD,http://rs.tdwg.org/dwc/terms/Taxon,,simple
nameAccordingToID,Name According To ID,An identifier for the source in which the specific taxon concept circumscription is defined or implied. See dwc:nameAccordingTo.,,`https://doi.org/10.1016/S0269-915X(97)80026-2`,http://www.w3.org/1999/02/22-rdf-syntax-ns#Property,not in ABCD,http://rs.tdwg.org/dwc/terms/Taxon,,simple
namePublishedInID,Name Published In ID,An identifier for the publication in which the dwc:scientificName was originally established under the rules of the associated dwc:nomenclaturalCode.,"A citation of the first publication of the name in its given combination, not the basionym / original name. Recombinations are often not published in zoology, in which case dwc:namePublishedInID should be empty.",,http://www.w3.org/1999/02/22-rdf-syntax-ns#Property,not in ABCD,http://rs.tdwg.org/dwc/terms/Taxon,,simple
taxonConceptID,Taxon Concept ID,An identifier for the taxonomic concept to which the record refers - not for the nomenclatural details of a dwc:Taxon.,,`8fa58e08-08de-4ac1-b69c-1235340b7001`,http://www.w3.org/1999/02/22-rdf-syntax-ns#Property,not in ABCD,http://rs.tdwg.org/dwc/terms/Taxon,,simple
scientificName,Scientific Name,"The full scientific name, with authorship and date information if known. When forming part of a dwc:Identification, this should be the name in lowest level taxonomic rank that can be determined. This term should not contain identification qualifications, which should instead be supplied in the dwc:identificationQualifier term.","This term should not contain identification qualifications, which should instead be supplied in the IdentificationQualifier term. When applied to an Organism or Occurrence, this term should be used to represent the scientific name that was applied to the associated Organism in accordance with the Taxon to which it was or is currently identified. Names should be compliant to the most recent nomenclatural code. For example, names of hybrids for algae, fungi and plants should follow the rules of the International Code of Nomenclature for algae, fungi, and plants (Schenzhen Code Articles H.1, H.2 and H.3). Thus, use the multiplication sign `×` (Unicode `U+00D7`, HTML `&times;`) to identify a hybrid, not `x` or `X`, if possible.","`Coleoptera` (order); `Vespertilionidae` (family); `Manis` (genus); `Ctenomys sociabilis` (genus + specificEpithet); `Ambystoma tigrinum diaboli` (genus + specificEpithet + infraspecificEpithet); `Roptrocerus typographi (Györfi, 1952)` (genus + specificEpithet + scientificNameAuthorship); `Quercus agrifolia var. oxyadenia (Torr.) J.T. Howell` (genus + specificEpithet + taxonRank + infraspecificEpithet + scientificNameAuthorship); `×Agropogon littoralis (Sm.) C. E. Hubb.`; `Mentha ×smithiana R. A. Graham`; `Agrostis stolonifera L. × Polypogon monspeliensis (L.) Desf.`",http://www.w3.org/1999/02/22-rdf-syntax-ns#Property,DataSets/DataSet/Units/Unit/Identifications/Identification/TaxonIdentified/ScientificName/FullScientificNameString,http://rs.tdwg.org/dwc/terms/Taxon,,simple
acceptedNameUsage,Accepted Name Usage,"The full name, with authorship and date information if known, of the currently valid (zoological) or accepted (botanical) dwc:Taxon.","The full scientific name, with authorship and date information if known, of the accepted (botanical) or valid (zoological) name in cases where the provided dwc:scientificName is considered by the reference indicated in the dwc:accordingTo property, or of the content provider, to be a synonym or misapplied name. When applied to a dwc:Organism or dwc:Occurrence, this term should be used in cases where a content provider regards the provided dwc:scientificName to be inconsistent with the taxonomic perspective of the content provider. For example, there are many discrepancies within specimen collections and observation datasets between the recorded name (e.g., the most recent identification from an expert who examined a specimen, or a field identification for an observed dwc:Organism), and the name asserted by the content provider to be taxonomically accepted.",`Tamias minimus` (valid name for `Eutamias minimus`),http://www.w3.org/1999/02/22-rdf-syntax-ns#Property,not in ABCD,http://rs.tdwg.org/dwc/terms/Taxon,,simple
parentNameUsage,Parent Name Usage,"The full name, with authorship and date information if known, of the direct, most proximate higher-rank parent dwc:Taxon (in a classification) of the most specific element of the dwc:scientificName.",,`Rubiaceae`; `Gruiformes`; `Testudinae`,http://www.w3.org/1999/02/22-rdf-syntax-ns#Property,DataSets/DataSet/Units/Unit/Identifications/Identification/TaxonIdentified/HigherTaxa/HigherTaxon/HigherTaxonName,http://rs.tdwg.org/dwc/terms/Taxon,,simple
originalNameUsage,Original Name Usage,"The taxon name, with authorship and date information if known, as it originally appeared when first established under the rules of the associated dwc:nomenclaturalCode. The basionym (botany) or basonym (bacteriology) of the dwc:scientificName or the senior/earlier homonym for replaced names.","The full scientific name, with authorship and date information if known, of the name usage in which the terminal element of the dwc:scientificName was originally established under the rules of the associated dwc:nomenclaturalCode. For example, for names governed by the ICNafp, this term would indicate the basionym of a record representing a subsequent combination. Unlike basionyms, however, this term can apply to scientific names at all ranks.",`Pinus abies`; `Gasterosteus saltatrix Linnaeus 1768`,http://www.w3.org/1999/02/22-rdf-syntax-ns#Property,not in ABCD,http://rs.tdwg.org/dwc/terms/Taxon,,simple
nameAccordingTo,Name According To,"The reference to the source in which the specific taxon concept circumscription is defined or implied - traditionally signified by the Latin ""sensu"" or ""sec."" (from secundum, meaning ""according to""). For taxa that result from identifications, a reference to the keys, monographs, experts and other sources should be given.","This term provides context to the dwc:scientificName. Together with the dwc:scientificName, separated by `sensu` or `sec.`, it forms the taxon concept label, which may be seen as having the same relationship to dwc:taxonConceptID as, for example, dwc:acceptedNameUsage has to dwc:acceptedNameUsageID. When not provided, in Taxon Core data sets the dwc:nameAccordingTo can be taken to be the data set. In this case the data set mostly provides sufficient context to infer the delimitation of the taxon and its relationship with other taxa. In Occurrence Core data sets, when not provided, dwc:nameAccordingTo can be an underlying taxonomy of the data set, e.g. Plants of the World Online (http://powo.science.kew.org/) for vascular plant records in iNaturalist (in which case it should be provided), or, which is the case for most dwc:PreservedSpecimen data sets, the dwc:Identification, in which case there is no further context.","`Franz NM, Cardona-Duque J (2013) Description of two new species and phylogenetic reassessment of Perelleschus Wibmer & O’Brien, 1986 (Coleoptera: Curculionidae), with a complete taxonomic concept history of Perelleschus sec. Franz & Cardona-Duque, 2013. Syst Biodivers. 11: 209–236.` (as the full citation of the Franz & Cardona-Duque (2013) in Perelleschus splendida sec. Franz & Cardona-Duque (2013))",http://www.w3.org/1999/02/22-rdf-syntax-ns#Property,not in ABCD,http://rs.tdwg.org/dwc/terms/Taxon,,simple
namePublishedIn,Name Published In,A reference for the publication in which the dwc:scientificName was originally established under the rules of the associated dwc:nomenclaturalCode.,"A citation of the first publication of the name in its given combination, not the basionym / original name. Recombinations are often not published in zoology, in which case dwc:namePublishedIn should be empty.","`Pearson O. P., and M. I. Christie. 1985. Historia Natural, 5(37):388`; `Forel, Auguste, Diagnosies provisoires de quelques espèces nouvelles de fourmis de Madagascar, récoltées par M. Grandidier., Annales de la Societe Entomologique de Belgique, Comptes-rendus des Seances 30, 1886`",http://www.w3.org/1999/02/22-rdf-syntax-ns#Property,DataSets/DataSet/Units/Unit/SpecimenUnit/NomenclaturalTypeDesignations/NomenclaturalTypeDesignation/NomenclaturalReference/TitleCitation,http://rs.tdwg.org/dwc/terms/Taxon,,simple
namePublishedInYear,Name Published In Year,The four-digit year in which the dwc:scientificName was published.,,`1915`; `2008`,http://www.w3.org/1999/02/22-rdf-syntax-ns#Property,not in ABCD,http://rs.tdwg.org/dwc/terms/Taxon,,simple
higherClassification,Higher Classification,A list (concatenated and separated) of taxa names terminating at the rank immediately superior to the referenced dwc:Taxon.,"Recommended best practice is to separate the values in a list with space vertical bar space (` | `), with terms in order from the highest taxonomic rank to the lowest.",`Plantae | Tracheophyta | Magnoliopsida | Ranunculales | Ranunculaceae | Ranunculus`; `Animalia`; `Animalia | Chordata | Vertebrata | Mammalia | Theria | Eutheria | Rodentia | Hystricognatha | Hystricognathi | Ctenomyidae | Ctenomyini | Ctenomys`,http://www.w3.org/1999/02/22-rdf-syntax-ns#Property,not in ABCD,http://rs.tdwg.org/dwc/terms/Taxon,,simple
kingdom,Kingdom,The full scientific name of the kingdom in which the dwc:Taxon is classified.,,`Animalia`; `Archaea`; `Bacteria`; `Chromista`; `Fungi`; `Plantae`; `Protozoa`; `Viruses`,http://www.w3.org/1999/02/22-rdf-syntax-ns#Property,DataSets/DataSet/Units/Unit/Identifications/Identification/TaxonIdentified/HigherTaxa/HigherTaxon/HigherTaxonName with HigherTaxa/HigherTaxon/HigherTaxonRank = regnum,http://rs.tdwg.org/dwc/terms/Taxon,,simple
phylum,Phylum,The full scientific name of the phylum or division in which the dwc:Taxon is classified.,,`Chordata` (phylum); `Bryophyta` (division),http://www.w3.org/1999/02/22-rdf-syntax-ns#Property,DataSets/DataSet/Units/Unit/Identifications/Identification/TaxonIdentified/HigherTaxa/HigherTaxon/HigherTaxonName with HigherTaxa/HigherTaxon/HigherTaxonRank = phylum,http://rs.tdwg.org/dwc/terms/Taxon,,simple
class,Class,The full scientific name of the class in which the dwc:Taxon is classified.,,`Mammalia`; `Hepaticopsida`,http://www.w3.org/1999/02/22-rdf-syntax-ns#Property,DataSets/DataSet/Units/Unit/Identifications/Identification/TaxonIdentified/HigherTaxa/HigherTaxon/HigherTaxonName with HigherTaxa/HigherTaxon/HigherTaxonRank = classis,http://rs.tdwg.org/dwc/terms/Taxon,,simple
order,Order,The full scientific name of the order in which the dwc:Taxon is classified.,,`Carnivora`; `Monocleales`,http://www.w3.org/1999/02/22-rdf-syntax-ns#Property,DataSets/DataSet/Units/Unit/Identifications/Identification/TaxonIdentified/HigherTaxa/HigherTaxon/HigherTaxonName with HigherTaxa/HigherTaxon/HigherTaxonRank = ordo,http://rs.tdwg.org/dwc/terms/Taxon,,simple
superfamily,Superfamily,The full scientific name of the family in which the dwc:Taxon is classified.,"A taxonomic category subordinate to an order and superior to a family. According to ICZN article 29.2, the suffix `-oidea` is used for a superfamily name.",`Achatinoidea`; `Cerithioidea`; `Helicoidea`; `Hypsibioidea`; `Valvatoidea`; `Zonitoidea`,http://www.w3.org/1999/02/22-rdf-syntax-ns#Property,ScientificNameIdentified/HigherTaxon/HigherTaxonRank (enumeration value: superfamilia),http://rs.tdwg.org/dwc/terms/Taxon,,simple
family,Family,The full scientific name of the family in which the dwc:Taxon is classified.,,`Felidae`; `Monocleaceae`,http://www.w3.org/1999/02/22-rdf-syntax-ns#Property,DataSets/DataSet/Units/Unit/Identifications/Identification/TaxonIdentified/HigherTaxa/HigherTaxon/HigherTaxonName with HigherTaxa/HigherTaxon/HigherTaxonRank = familia,http://rs.tdwg.org/dwc/terms/Taxon,,simple
subfamily,Subfamily,The full scientific name of the subfamily in which the dwc:Taxon is classified.,,`Periptyctinae`; `Orchidoideae`; `Sphindociinae`,http://www.w3.org/1999/02/22-rdf-syntax-ns#Property,"DataSets/DataSet/Units/Unit/Identifications/Identification/Result/TaxonIdentified/HigherTaxa/HigherTaxon/HigherTaxonName if DataSets/DataSet/Units/Unit/Identifications/Identification/Result/TaxonIdentified/HigherTaxa/HigherTaxon/HigherTaxonRank == ""subfamilia""",http://rs.tdwg.org/dwc/terms/Taxon,,simple
tribe,Tribe,The full scientific name of the tribe in which the dwc:Taxon is classified.,,`Ortaliini`; `Arethuseae`,http://www.w3.org/1999/02/22-rdf-syntax-ns#Property,ScientificNameIdentified/HigherTaxon/HigherTaxonRank (enumeration value: ),http://rs.tdwg.org/dwc/terms/Taxon,,simple
subtribe,Subtribe,The full scientific name of the subtribe in which the dwc:Taxon is classified.,,`Plotinini`; `Typhaeini`,http://www.w3.org/1999/02/22-rdf-syntax-ns#Property,ScientificNameIdentified/HigherTaxon/HigherTaxonRank (enumeration value: ),http://rs.tdwg.org/dwc/terms/Taxon,,simple
genus,Genus,The full scientific name of the genus in which the dwc:Taxon is classified.,,`Puma`; `Monoclea`,http://www.w3.org/1999/02/22-rdf-syntax-ns#Property,{DataSets/DataSet/Units/Unit/Identifications/Identification/TaxonIdentified/ScientificName/NameAtomised/Bacterial/GenusOrMonomial or DataSets/DataSet/Units/Unit/Identifications/Identification/TaxonIdentified/ScientificName/NameAtomised/Botanical/GenusOrMonomial or DataSets/DataSet/Units/Unit/Identifications/Identification/TaxonIdentified/ScientificName/NameAtomised/Viral/GenusOrMonomial or DataSets/DataSet/Units/Unit/Identifications/Identification/TaxonIdentified/ScientificName/NameAtomised/Zoological/GenusOrMonomial},http://rs.tdwg.org/dwc/terms/Taxon,,simple
genericName,Generic Name,The genus part of the dwc:scientificName without authorship.,For synonyms the accepted genus and the genus part of the name may be different. The term dwc:genericName should be used together with dwc:specificEpithet to form a binomial and with dwc:infraspecificEpithet to form a trinomial. The term dwc:genericName should only be used for combinations. Uninomials of generic rank do not have a dwc:genericName.,"`Felis` (for scientificName `Felis concolor`, with accompanying values of `Puma concolor` in acceptedNameUsage and `Puma` in genus)",http://www.w3.org/1999/02/22-rdf-syntax-ns#Property,not in ABCD,http://rs.tdwg.org/dwc/terms/Taxon,,simple
subgenus,Subgenus,The full scientific name of the subgenus in which the dwc:Taxon is classified. Values should include the genus to avoid homonym confusion.,,`Strobus`; `Amerigo`; `Pilosella`,http://www.w3.org/1999/02/22-rdf-syntax-ns#Property,DataSets/DataSet/Units/Unit/Identifications/Identification/TaxonIdentified/ScientificName/NameAtomised/Zoological/Subgenus,http://rs.tdwg.org/dwc/terms/Taxon,,simple
infragenericEpithet,Infrageneric Epithet,The infrageneric part of a binomial name at ranks above species but below genus.,"The term dwc:infragenericEpithet should be used in conjunction with dwc:genericName, dwc:specificEpithet, dwc:infraspecificEpithet, dwc:taxonRank and dwc:scientificNameAuthorship to represent the individual elements of the complete dwc:scientificName. It can be used to indicate the subgenus placement of a species, which in zoology is often given in parentheses. Can also be used to share infrageneric names such as botanical sections (e.g., `Vicia sect. Cracca`).",`Abacetillus` (for scientificName `Abacetus (Abacetillus) ambiguus`); `Cracca` (for scientificName `Vicia sect. Cracca`),http://www.w3.org/1999/02/22-rdf-syntax-ns#Property,DataSets/DataSet/Units/Unit/Identifications/Identification/Result/TaxonIdentified/ScientificName/NameAtomised/Bacterial/Subgenus (for bacterial names) or  DataSets/DataSet/Units/Unit/Identifications/Identification/Result/TaxonIdentified/ScientificName/NameAtomised/Zoological/Subgenus (for zoological names) or DataSets/DataSet/Units/Unit/Identifications/Identification/Result/TaxonIdentified/ScientificName/NameAtomised/Botanical/FirstEpithet (for botanical names),http://rs.tdwg.org/dwc/terms/Taxon,,simple
specificEpithet,Specific Epithet,The name of the first or species epithet of the dwc:scientificName.,,`concolor`; `gottschei`,http://www.w3.org/1999/02/22-rdf-syntax-ns#Property,{DataSets/DataSet/Units/Unit/Identifications/Identification/TaxonIdentified/ScientificName/NameAtomised/Bacterial/SpeciesEpithet or DataSets/DataSet/Units/Unit/Identifications/Identification/TaxonIdentified/ScientificName/NameAtomised/Botanical/FirstEpithet or DataSets/DataSet/Units/Unit/Identifications/Identification/TaxonIdentified/ScientificName/NameAtomised/Zoological/SpeciesEpithet},http://rs.tdwg.org/dwc/terms/Taxon,,simple
infraspecificEpithet,Infraspecific Epithet,"The name of the lowest or terminal infraspecific epithet of the dwc:scientificName, excluding any rank designation.","In botany, name strings in literature and identifications may have multiple infraspecific ranks. According to the International Code of Nomenclature for algae, fungi, and plants (Schenzhen Code Articles 6.7 & Art. 24.1), valid names only have two epithets, with the lowest rank being the dwc:infraspecificEpithet. For example: the dwc:infraspecificEpithet in the string `Indigofera charlieriana subsp. sessilis var. scaberrima` is `scaberrima` and the dwc:scientificName is `Indigofera charlieriana var. scaberrima (Schinz) J.B.Gillett`. Use dwc:verbatimIdentification for the full name string used in a dwc:Identification.","`concolor` (for scientificName `Puma concolor concolor (Linnaeus, 1771)`); `oxyadenia` (for scientificName `Quercus agrifolia var. oxyadenia (Torr.) J.T. Howell`); `laxa` (for scientificName `Cheilanthes hirta f. laxa (Kunze) W.Jacobsen & N.Jacobsen`); `scaberrima` (for scientificName `Indigofera charlieriana var. scaberrima (Schinz) J.B.Gillett`)",http://www.w3.org/1999/02/22-rdf-syntax-ns#Property,DataSets/DataSet/Units/Unit/Identifications/Identification/TaxonIdentified/ScientificName/NameAtomised/Bacterial/SubspeciesEpithet or DataSets/DataSet/Units/Unit/Identifications/Identification/TaxonIdentified/ScientificName/NameAtomised/Botanical/SecondEpithet or DataSets/DataSet/Units/Unit/Identifications/Identification/TaxonIdentified/ScientificName/NameAtomised/Zoological/SubspeciesEpithet,http://rs.tdwg.org/dwc/terms/Taxon,,simple
cultivarEpithet,Cultivar Epithet,"Part of the name of a cultivar, cultivar group or grex that follows the dwc:scientificName.","According to the Rules of the Cultivated Plant Code, a cultivar name consists of a botanical name followed by a cultivar epithet. The value given as the dwc:cultivarEpithet should exclude any quotes. The term dwc:taxonRank should be used to indicate which type of cultivated plant name (e.g. cultivar, cultivar group, grex) is concerned. This epithet, including any enclosing apostrophes or suffix, should be provided in dwc:scientificName as well.",`King Edward` (for scientificName `Solanum tuberosum 'King Edward'` and taxonRank `cultivar`); `Mishmiense` (for scientificName `Rhododendron boothii Mishmiense Group` and taxonRank `cultivar group`); `Atlantis` (for scientificName `Paphiopedilum Atlantis grex` and taxonRank `grex`),http://www.w3.org/1999/02/22-rdf-syntax-ns#Property,http://rs.tdwg.org/abcd/terms/cultivarName or http://rs.tdwg.org/abcd/terms/cultivarGroupName or http://rs.tdwg.org/abcd/terms/breed (ABCD 3.0),http://rs.tdwg.org/dwc/terms/Taxon,,simple
taxonRank,Taxon Rank,The taxonomic rank of the most specific name in the dwc:scientificName.,"Recommended best practice is to use a controlled vocabulary. The taxon ranks of algae, fungi and plants are defined in the International Code of Nomenclature for algae, fungi, and plants (Schenzhen Code Articles H3.2, H4.4 and H.3.1).",`subspecies`; `varietas`; `forma`; `species`; `genus`; `nothogenus`; `nothospecies`; `nothosubspecies`,http://www.w3.org/1999/02/22-rdf-syntax-ns#Property,DataSets/DataSet/Units/Unit/Identifications/Identification/TaxonIdentified/ScientificName/NameAtomised/Botanical/Rank,http://rs.tdwg.org/dwc/terms/Taxon,,simple
verbatimTaxonRank,Verbatim Taxon Rank,The taxonomic rank of the most specific name in the dwc:scientificName as it appears in the original record.,,`Agamospecies`; `sub-lesus`; `prole`; `apomict`; `nothogrex`; `sp.`; `subsp.`; `var.`,http://www.w3.org/1999/02/22-rdf-syntax-ns#Property,not in ABCD,http://rs.tdwg.org/dwc/terms/Taxon,,simple
