term_localName,label,rdfs_comment,dcterms_description,examples,rdf_type,tdwgutility_abcdEquivalence,tdwgutility_organizedInClass,tdwgutility_decision,tdwgutility_usageScope
associatedOrganisms,Associated Organisms,A list (concatenated and separated) of identifiers of other dwc:Organisms and the associations of this dwc:Organism to each of them.,"This term can be used to provide a list of associations to other dwc:Organisms. Note that the dwc:ResourceRelationship class is an alternative means of representing associations, and with more detail. Recommended best practice is to separate the values in a list with space vertical bar space (` | `).","`""sibling of"":""http://arctos.database.museum/guid/DMNS:Mamm:14171""`; `""parent of"":""http://arctos.database.museum/guid/MSB:Mamm:196208"" | ""parent of"":""http://arctos.database.museum/guid/MSB:Mamm:196523"" | ""sibling of"":""http://arctos.database.museum/guid/MSB:Mamm:142638""`",http://www.w3.org/1999/02/22-rdf-syntax-ns#Property,not in ABCD,http://rs.tdwg.org/dwc/terms/Organism,,simple
previousIdentifications,Previous Identifications,A list (concatenated and separated) of previous assignments of names to the dwc:Organism.,Recommended best practice is to separate the values in a list with space vertical bar space (` | `).,"`Chalepidae`; `Pinus abies`; `Anthus sp., field ID by G. Iglesias | Anthus correndera, expert ID by C. Cicero 2009-02-12 based on morphology`",http://www.w3.org/1999/02/22-rdf-syntax-ns#Property,DataSets/DataSet/Units/Unit/Identifications/Identification with PreferredFlag = false,http://rs.tdwg.org/dwc/terms/Organism,,simple
organismRemarks,Organism Remarks,Comments or notes about the dwc:Organism instance.,,`One of a litter of six`,http://www.w3.org/1999/02/22-rdf-syntax-ns#Property,not in ABCD,http://rs.tdwg.org/dwc/terms/Organism,,simple
materialSampleID,Material Sample ID,"An identifier for the dwc:MaterialSample (as opposed to a particular digital record of the dwc:MaterialSample). In the absence of a persistent global unique identifier, construct one from a combination of identifiers in the record that will most closely make the dwc:materialSampleID globally unique.","Recommended best practice is to use a persistent, globally unique identifier.",`06809dc5-f143-459a-be1a-6f03e63fc083`,http://www.w3.org/1999/02/22-rdf-syntax-ns#Property,not in ABCD,http://rs.tdwg.org/dwc/terms/MaterialSample,,simple
verbatimLabel,Verbatim Label,"A serialized encoding intended to represent the literal, i.e., character by character, textual content of a label affixed on, near, or explicitly associated with a material entity, free from interpretation, translation, or transliteration.","The content of this term should include no embellishments, prefixes, headers or other additions made to the text. Abbreviations must not be expanded and supposed misspellings must not be corrected. Lines or breakpoints between blocks of text that could be verified by seeing the original labels or images of them may be used. Examples of material entities include preserved specimens, fossil specimens, and material samples. Best practice is to use UTF-8 for all characters. Best practice is to add comment “verbatimLabel derived from human transcription” in dwc:occurrenceRemarks.",Examples can be found at https://dwc.tdwg.org/examples/verbatimLabel.,http://www.w3.org/1999/02/22-rdf-syntax-ns#Property,Marks/Mark/MarkText,http://rs.tdwg.org/dwc/terms/MaterialSample,,simple
eventType,Event Type,The nature of the dwc:Event.,"Recommended best practice is to use a controlled vocabulary. Regardless of the dwc:eventType, the interval of the dwc:Event can be captured in dwc:eventDate. This term has an equivalent in the dwciri: namespace that allows only an IRI as a value, whereas this term allows for any string literal value.",`Sample`; `Observation`; `Site Visit`; `Biotic Interaction`; `Bioblitz`; `Expedition`; `Survey`; `Project`,http://www.w3.org/1999/02/22-rdf-syntax-ns#Property,not in ABCD,http://rs.tdwg.org/dwc/terms/Event,,simple
eventID,Event ID,An identifier for the set of information associated with a dwc:Event (something that occurs at a place and time). May be a global unique identifier or an identifier specific to the data set.,,`INBO:VIS:Ev:00009375`,http://www.w3.org/1999/02/22-rdf-syntax-ns#Property,DataSets/DataSet/Units/Unit/Gathering/Code,http://rs.tdwg.org/dwc/terms/Event,,simple
parentEventID,Parent Event ID,An identifier for the broader dwc:Event that groups this and potentially other dwc:Events.,Use a globally unique identifier for a dwc:Event or an identifier for a dwc:Event that is specific to the data set.,"`A1` (parentEventID to identify the main Whittaker Plot in nested samples, each with its own eventID - `A1:1`, `A1:2`).",http://www.w3.org/1999/02/22-rdf-syntax-ns#Property,not in ABCD,http://rs.tdwg.org/dwc/terms/Event,,simple
fieldNumber,Field Number,An identifier given to the dwc:Event in the field. Often serves as a link between field notes and the dwc:Event.,"This term has an equivalent in the dwciri: namespace that allows only an IRI as a value, whereas this term allows for any string literal value.",`RV Sol 87-03-08`,http://www.w3.org/1999/02/22-rdf-syntax-ns#Property,DataSets/DataSet/Units/Unit/Gathering/Code,http://rs.tdwg.org/dwc/terms/Event,,simple
eventDate,Event Date,"The date-time or interval during which a dwc:Event occurred. For occurrences, this is the date-time when the dwc:Event was recorded. Not suitable for a time in a geological context.",Recommended best practice is to use a date that conforms to ISO 8601-1:2019.,`1963-03-08T14:07-0600` (8 Mar 1963 at 2:07pm in the time zone six hours earlier than UTC); `2009-02-20T08:40Z` (20 February 2009 8:40am UTC); `2018-08-29T15:19` (3:19pm local time on 29 August 2018); `1809-02-12` (some time during 12 February 1809); `1906-06` (some time in June 1906); `1971` (some time in the year 1971); `2007-03-01T13:00:00Z/2008-05-11T15:30:00Z` (some time during the interval between 1 March 2007 1pm UTC and 11 May 2008 3:30pm UTC); `1900/1909` (some time during the interval between the beginning of the year 1900 and the end of the year 1909); `2007-11-13/15` (some time in the interval between 13 November 2007 and 15 November 2007),http://www.w3.org/1999/02/22-rdf-syntax-ns#Property,accessible from DataSets/DataSet/Units/Unit/Gathering/ISODateTimeBegin and DataSets/DataSet/Units/Unit/Gathering/ISODateTimeEnd,http://rs.tdwg.org/dwc/terms/Event,,simple
eventTime,Event Time,The time or interval during which a dwc:Event occurred.,Recommended best practice is to use a time of day that conforms to ISO 8601-1:2019.,`14:07-0600` (2:07pm in the time zone six hours earlier than UTC); `08:40:21Z` (8:40:21am UTC); `13:00:00Z/15:30:00Z` (the interval between 1pm UTC and 3:30pm UTC),http://www.w3.org/1999/02/22-rdf-syntax-ns#Property,accessible from DataSets/DataSet/Units/Unit/Gathering/ISODateTimeBegin and DataSets/DataSet/Units/Unit/Gathering/ISODateTimeEnd,http://rs.tdwg.org/dwc/terms/Event,,simple
startDayOfYear,Start Day Of Year,"The earliest integer day of the year on which the dwc:Event occurred (1 for January 1, 365 for December 31, except in a leap year, in which case it is 366).",,"`1` (1 January); `366` (31 December); `365` (30 December in a leap year, 31 December in a non-leap year)",http://www.w3.org/1999/02/22-rdf-syntax-ns#Property,DataSets/DataSet/Units/Unit/Gathering/DateTime/DayNumberBegin,http://rs.tdwg.org/dwc/terms/Event,,simple
endDayOfYear,End Day Of Year,"The latest integer day of the year on which the dwc:Event occurred (1 for January 1, 365 for December 31, except in a leap year, in which case it is 366).",,"`1` (1 January); `32` (1 February); `366` (31 December); `365` (30 December in a leap year, 31 December in a non-leap year)",http://www.w3.org/1999/02/22-rdf-syntax-ns#Property,DataSets/DataSet/Units/Unit/Gathering/DateTime/DayNumberEnd,http://rs.tdwg.org/dwc/terms/Event,,simple
year,Year,"The four-digit year in which the dwc:Event occurred, according to the Common Era Calendar.",,`1160`; `2008`,http://www.w3.org/1999/02/22-rdf-syntax-ns#Property,accessible from DataSets/DataSet/Units/Unit/Gathering/ISODateTimeBegin,http://rs.tdwg.org/dwc/terms/Event,,simple
month,Month,The integer month in which the dwc:Event occurred.,,`1` (January); `10` (October),http://www.w3.org/1999/02/22-rdf-syntax-ns#Property,accessible from DataSets/DataSet/Units/Unit/Gathering/ISODateTimeBegin,http://rs.tdwg.org/dwc/terms/Event,,simple
day,Day,The integer day of the month on which the dwc:Event occurred.,,`9`; `28`,http://www.w3.org/1999/02/22-rdf-syntax-ns#Property,accessible from DataSets/DataSet/Units/Unit/Gathering/ISODateTimeBegin,http://rs.tdwg.org/dwc/terms/Event,,simple
verbatimEventDate,Verbatim EventDate,The verbatim original representation of the date and time information for a dwc:Event.,,`spring 1910`; `Marzo 2002`; `1999-03-XX`; `17IV1934`,http://www.w3.org/1999/02/22-rdf-syntax-ns#Property,DataSets/DataSet/Units/Unit/Gathering/DateTime/DateText,http://rs.tdwg.org/dwc/terms/Event,,simple
habitat,Habitat,A category or description of the habitat in which the dwc:Event occurred.,"This term has an equivalent in the dwciri: namespace that allows only an IRI as a value, whereas this term allows for any string literal value.",`oak savanna`; `pre-cordilleran steppe`,http://www.w3.org/1999/02/22-rdf-syntax-ns#Property,DataSets/DataSet/Units/Unit/Gathering/Biotope/Text,http://rs.tdwg.org/dwc/terms/Event,,simple
samplingProtocol,Sampling Protocol,"The names of, references to, or descriptions of the methods or protocols used during a dwc:Event.","Recommended best practice is describe a dwc:Event with no more than one sampling protocol. In the case of a summary Event with multiple protocols, in which a specific protocol can not be attributed to specific dwc:Occurrences, the recommended best practice is to separate the values in a list with space vertical bar space (` | `). This term has an equivalent in the dwciri: namespace that allows only an IRI as a value, whereas this term allows for any string literal value.","`UV light trap`; `mist net`; `bottom trawl`; `ad hoc observation | point count`; `Penguins from space: faecal stains reveal the location of emperor penguin colonies, https://doi.org/10.1111/j.1466-8238.2009.00467.x`; `Takats et al. 2001. Guidelines for Nocturnal Owl Monitoring in North America. Beaverhill Bird Observatory and Bird Studies Canada, Edmonton, Alberta. 32 pp., http://www.bsc-eoc.org/download/Owl.pdf`",http://www.w3.org/1999/02/22-rdf-syntax-ns#Property,DataSets/DataSet/Units/Unit/Gathering/Method,http://rs.tdwg.org/dwc/terms/Event,,simple
sampleSizeValue,Sample Size Value,"A numeric value for a measurement of the size (time duration, length, area, or volume) of a sample in a sampling dwc:Event.",A dwc:sampleSizeValue must have a corresponding dwc:sampleSizeUnit.,`5` (sampleSizeValue) with `metre` (sampleSizeUnit),http://www.w3.org/1999/02/22-rdf-syntax-ns#Property,not in ABCD,http://rs.tdwg.org/dwc/terms/Event,,simple
sampleSizeUnit,Sample Size Unit,"The unit of measurement of the size (time duration, length, area, or volume) of a sample in a sampling dwc:Event.","A dwc:sampleSizeUnit must have a corresponding dwc:sampleSizeValue, e.g., `5` for dwc:sampleSizeValue with `m` for dwc:sampleSizeUnit. This term has an equivalent in the dwciri: namespace that allows only an IRI as a value, whereas this term allows for any string literal value.",`minute`; `hour`; `day`; `metre`; `square metre`; `cubic metre`,http://www.w3.org/1999/02/22-rdf-syntax-ns#Property,not in ABCD,http://rs.tdwg.org/dwc/terms/Event,,simple
samplingEffort,Sampling Effort,The amount of effort expended during a dwc:Event.,,`40 trap-nights`; `10 observer-hours`; `10 km by foot`; `30 km by car`,http://www.w3.org/1999/02/22-rdf-syntax-ns#Property,not in ABCD,http://rs.tdwg.org/dwc/terms/Event,,simple
fieldNotes,Field Notes,"One of a) an indicator of the existence of, b) a reference to (publication, URI), or c) the text of notes taken in the field about the dwc:Event.","This term has an equivalent in the dwciri: namespace that allows only an IRI as a value, whereas this term allows for any string literal value.",`Notes available in the Grinnell-Miller Library.`,http://www.w3.org/1999/02/22-rdf-syntax-ns#Property,DataSets/DataSet/Units/Unit/FieldNotes,http://rs.tdwg.org/dwc/terms/Event,,simple
eventRemarks,Event Remarks,Comments or notes about the dwc:Event.,,`After the recent rains the river is nearly at flood stage.`,http://www.w3.org/1999/02/22-rdf-syntax-ns#Property,DataSets/DataSet/Units/Unit/Gathering/Notes,http://rs.tdwg.org/dwc/terms/Event,,simple
locationID,Location ID,An identifier for the set of dcterms:Location information. May be a global unique identifier or an identifier specific to the data set.,,`https://opencontext.org/subjects/768A875F-E205-4D0B-DE55-BAB7598D0FD1`,http://www.w3.org/1999/02/22-rdf-syntax-ns#Property,not in ABCD,http://purl.org/dc/terms/Location,,simple
higherGeographyID,Higher Geography ID,An identifier for the geographic region within which the dcterms:Location occurred.,Recommended best practice is to use a persistent identifier from a controlled vocabulary such as the Getty Thesaurus of Geographic Names.,"`http://vocab.getty.edu/tgn/1002002` (Antártida e Islas del Atlántico Sur, Territorio Nacional de la Tierra del Fuego, Argentina).",http://www.w3.org/1999/02/22-rdf-syntax-ns#Property,not in ABCD,http://purl.org/dc/terms/Location,,simple
higherGeography,Higher Geography,A list (concatenated and separated) of geographic names less specific than the information captured in the dwc:locality term.,"Recommended best practice is to separate the values in a list with space vertical bar space (` | `), with terms in order from least specific to most specific.","`North Atlantic Ocean`; `South America | Argentina | Patagonia | Parque Nacional Nahuel Huapi | Neuquén | Los Lagos` with accompanying values `South America` (continent) `Argentina` (country), `Neuquén` (first order division), and `Los Lagos` (second order division)",http://www.w3.org/1999/02/22-rdf-syntax-ns#Property,{DataSets/DataSet/Units/Unit/Gathering/LocalityText or DataSets/DataSet/Units/Unit/Gathering/NamedAreas/NamedArea/AreaName},http://purl.org/dc/terms/Location,,simple
continent,Continent,The name of the continent in which the dcterms:Location occurs.,"Recommended best practice is to use a controlled vocabulary such as the Getty Thesaurus of Geographic Names. Recommended best practice is to leave this field blank if the dcterms:Location spans multiple entities at this administrative level or if the dcterms:Location might be in one or another of multiple possible entities at this level. Multiplicity and uncertainty of the geographic entity can be captured either in the term dwc:higherGeography or in the term dwc:locality, or both.",`Africa`; `Antarctica`; `Asia`; `Europe`; `North America`; `Oceania`; `South America`,http://www.w3.org/1999/02/22-rdf-syntax-ns#Property,DataSets/DataSet/Units/Unit/Gathering/NamedAreas/NamedArea/AreaName with NamedAreas/NamedArea/AreaClass= Continent,http://purl.org/dc/terms/Location,,simple
waterBody,Water Body,The name of the water body in which the dcterms:Location occurs.,Recommended best practice is to use a controlled vocabulary such as the Getty Thesaurus of Geographic Names.,`Indian Ocean`; `Baltic Sea`; `Hudson River`; `Lago Nahuel Huapi`,http://www.w3.org/1999/02/22-rdf-syntax-ns#Property,DataSets/DataSet/Units/Unit/Gathering/NamedAreas/NamedArea/AreaName with NamedAreas/NamedArea/AreaClass= Water body,http://purl.org/dc/terms/Location,,simple
islandGroup,Island Group,The name of the island group in which the dcterms:Location occurs.,Recommended best practice is to use a controlled vocabulary such as the Getty Thesaurus of Geographic Names.,`Alexander Archipelago`; `Archipiélago Diego Ramírez`; `Seychelles`,http://www.w3.org/1999/02/22-rdf-syntax-ns#Property,DataSets/DataSet/Units/Unit/Gathering/NamedAreas/NamedArea/AreaName with NamedAreas/NamedArea/AreaClass= Island group,http://purl.org/dc/terms/Location,,simple
island,Island,The name of the island on or near which the dcterms:Location occurs.,Recommended best practice is to use a controlled vocabulary such as the Getty Thesaurus of Geographic Names.,`Nosy Be`; `Bikini Atoll`; `Vancouver`; `Viti Levu`; `Zanzibar`,http://www.w3.org/1999/02/22-rdf-syntax-ns#Property,DataSets/DataSet/Units/Unit/Gathering/NamedAreas/NamedArea/AreaName with NamedAreas/NamedArea/AreaClass= Island,http://purl.org/dc/terms/Location,,simple
country,Country,The name of the country or major administrative unit in which the dcterms:Location occurs.,"Recommended best practice is to use a controlled vocabulary such as the Getty Thesaurus of Geographic Names. Recommended best practice is to leave this field blank if the dcterms:Location spans multiple entities at this administrative level or if the dcterms:Location might be in one or another of multiple possible entities at this level. Multiplicity and uncertainty of the geographic entity can be captured either in the term dwc:higherGeography or in the term dwc:locality, or both.",`Denmark`; `Colombia`; `España`,http://www.w3.org/1999/02/22-rdf-syntax-ns#Property,DataSets/DataSet/Units/Unit/Gathering/Country/Name,http://purl.org/dc/terms/Location,,simple
countryCode,Country Code,The standard code for the country in which the dcterms:Location occurs.,"Recommended best practice is to use an ISO 3166-1-alpha-2 country code. Recommended best practice is to leave this field blank if the dcterms:Location spans multiple entities at this administrative level or if the dcterms:Location might be in one or another of multiple possible entities at this level. Multiplicity and uncertainty of the geographic entity can be captured either in the term dwc:higherGeography or in the term dwc:locality, or both.",`AR`; `SV`,http://www.w3.org/1999/02/22-rdf-syntax-ns#Property,DataSets/DataSet/Units/Unit/Gathering/Country/ISO3166Code,http://purl.org/dc/terms/Location,,simple
stateProvince,First Order Division,"The name of the next smaller administrative region than country (state, province, canton, department, region, etc.) in which the dcterms:Location occurs.","Recommended best practice is to use a controlled vocabulary such as the Getty Thesaurus of Geographic Names. Recommended best practice is to leave this field blank if the dcterms:Location spans multiple entities at this administrative level or if the dcterms:Location might be in one or another of multiple possible entities at this level. Multiplicity and uncertainty of the geographic entity can be captured either in the term dwc:higherGeography or in the term dwc:locality, or both.",`Montana`; `Minas Gerais`; `Córdoba`,http://www.w3.org/1999/02/22-rdf-syntax-ns#Property,DataSets/DataSet/Units/Unit/Gathering/NamedAreas/NamedArea/AreaName with NamedAreas/NamedArea/AreaClass= State or = Province (etc.),http://purl.org/dc/terms/Location,,simple
county,Second Order Division,"The full, unabbreviated name of the next smaller administrative region than stateProvince (county, shire, department, etc.) in which the dcterms:Location occurs.","Recommended best practice is to use a controlled vocabulary such as the Getty Thesaurus of Geographic Names. Recommended best practice is to leave this field blank if the dcterms:Location spans multiple entities at this administrative level or if the dcterms:Location might be in one or another of multiple possible entities at this level. Multiplicity and uncertainty of the geographic entity can be captured either in the term dwc:higherGeography or in the term dwc:locality, or both.",`Missoula`; `Los Lagos`; `Mataró`,http://www.w3.org/1999/02/22-rdf-syntax-ns#Property,DataSets/DataSet/Units/Unit/Gathering/NamedAreas/NamedArea/AreaName with NamedAreas/NamedArea/AreaClass= County,http://purl.org/dc/terms/Location,,simple
municipality,Third Order Division,"The full, unabbreviated name of the next smaller administrative region than county (city, municipality, etc.) in which the dcterms:Location occurs. Do not use this term for a nearby named place that does not contain the actual dcterms:Location.","Recommended best practice is to use a controlled vocabulary such as the Getty Thesaurus of Geographic Names. Recommended best practice is to leave this field blank if the dcterms:Location spans multiple entities at this administrative level or if the dcterms:Location might be in one or another of multiple possible entities at this level. Multiplicity and uncertainty of the geographic entity can be captured either in the term dwc:higherGeography or in the term dwc:locality, or both.",`Holzminden`; `Araçatuba`; `Ga-Segonyana`,http://www.w3.org/1999/02/22-rdf-syntax-ns#Property,DataSets/DataSet/Units/Unit/Gathering/NamedAreas/NamedArea/AreaName,http://purl.org/dc/terms/Location,,simple
locality,Locality,The specific description of the place.,"Less specific geographic information can be provided in other geographic terms (dwc:higherGeography, dwc:continent, dwc:country, dwc:stateProvince, dwc:county, dwc:municipality, dwc:waterBody, dwc:island, dwc:islandGroup). This term may contain information modified from the original to correct perceived errors or standardize the description.","`Bariloche, 25 km NNE via Ruta Nacional 40 (=Ruta 237)`; `Queets Rainforest, Olympic National Park`",http://www.w3.org/1999/02/22-rdf-syntax-ns#Property,DataSets/DataSet/Units/Unit/Gathering/NamedAreas/NamedArea/AreaName,http://purl.org/dc/terms/Location,,simple
minimumElevationInMeters,Minimum Elevation In Meters,"The lower limit of the range of elevation (altitude, usually above sea level), in meters.",,`-100`; `802`,http://www.w3.org/1999/02/22-rdf-syntax-ns#Property,DataSets/DataSet/Units/Unit/Gathering/Altitude/MeasurementOrFactAtomised/LowerValue,http://purl.org/dc/terms/Location,,simple
maximumElevationInMeters,Maximum Elevation In Meters,"The upper limit of the range of elevation (altitude, usually above sea level), in meters.",,`-205`; `1236`,http://www.w3.org/1999/02/22-rdf-syntax-ns#Property,DataSets/DataSet/Units/Unit/Gathering/Altitude/MeasurementOrFactAtomised/UpperValue,http://purl.org/dc/terms/Location,,simple
verticalDatum,Vertical Datum,The vertical datum used as the reference upon which the values in the elevation terms are based.,"Recommended best practice is to use a controlled vocabulary. This term has an equivalent in the dwciri: namespace that allows only an IRI as a value, whereas this term allows for any string literal value.",`EGM84`; `EGM96`; `EGM2008`; `PGM2000A`; `PGM2004`; `PGM2006`; `PGM2007`; `epsg:7030`; `unknown`,http://www.w3.org/1999/02/22-rdf-syntax-ns#Property,not in ABCD,http://purl.org/dc/terms/Location,,simple
minimumDepthInMeters,Minimum Depth In Meters,"The lesser depth of a range of depth below the local surface, in meters.",,`0`; `100`,http://www.w3.org/1999/02/22-rdf-syntax-ns#Property,DataSets/DataSet/Units/Unit/Gathering/Depth/MeasurementOrFactAtomised/LowerValue,http://purl.org/dc/terms/Location,,simple
maximumDepthInMeters,Maximum Depth In Meters,"The greater depth of a range of depth below the local surface, in meters.",,`0`; `200`,http://www.w3.org/1999/02/22-rdf-syntax-ns#Property,DataSets/DataSet/Units/Unit/Gathering/Depth/MeasurementOrFactAtomised/UpperValue,http://purl.org/dc/terms/Location,,simple
minimumDistanceAboveSurfaceInMeters,Minimum Distance Above Surface In Meters,"The lesser distance in a range of distance from a reference surface in the vertical direction, in meters. Use positive values for locations above the surface, negative values for locations below. If depth measures are given, the reference surface is the location given by the depth, otherwise the reference surface is the location given by the elevation.",,"`-1.5` (below the surface); `4.2` (above the surface); For a 1.5 meter sediment core from the bottom of a lake (at depth 20m) at 300m elevation: verbatimElevation: `300m` minimumElevationInMeters: `300`, maximumElevationInMeters: `300`, verbatimDepth: `20m`, minimumDepthInMeters: `20`, maximumDepthInMeters: `20`, minimumDistanceAboveSurfaceInMeters: `0`, maximumDistanceAboveSurfaceInMeters: `-1.5`.",http://www.w3.org/1999/02/22-rdf-syntax-ns#Property,DataSets/DataSet/Units/Unit/Gathering/Height/MeasurementOrFactAtomised/LowerValue,http://purl.org/dc/terms/Location,,simple
maximumDistanceAboveSurfaceInMeters,Maximum Distance Above Surface In Meters,"The greater distance in a range of distance from a reference surface in the vertical direction, in meters. Use positive values for locations above the surface, negative values for locations below. If depth measures are given, the reference surface is the location given by the depth, otherwise the reference surface is the location given by the elevation.",,"`-1.5` (below the surface); `4.2` (above the surface); For a 1.5 meter sediment core from the bottom of a lake (at depth 20m) at 300m elevation: verbatimElevation: `300m` minimumElevationInMeters: `300`, maximumElevationInMeters: `300`, verbatimDepth: `20m`, minimumDepthInMeters: `20`, maximumDepthInMeters: `20`, minimumDistanceAboveSurfaceInMeters: `0`, maximumDistanceAboveSurfaceInMeters: `-1.5`.",http://www.w3.org/1999/02/22-rdf-syntax-ns#Property,DataSets/DataSet/Units/Unit/Gathering/Height/MeasurementOrFactAtomised/UpperValue,http://purl.org/dc/terms/Location,,simple
locationAccordingTo,Location According To,"Information about the source of this dcterms:Location information. Could be a publication (gazetteer), institution, or team of individuals.","This term has an equivalent in the dwciri: namespace that allows only an IRI as a value, whereas this term allows for any string literal value.",`Getty Thesaurus of Geographic Names`; `GADM`,http://www.w3.org/1999/02/22-rdf-syntax-ns#Property,not in ABCD,http://purl.org/dc/terms/Location,,simple
