term_localName,label_en,label_cs,label_de,label_es,label_fr,label_ko,label_nl,label_pt,label_ru,label_zh-Hans,label_zh-Hant,rdfs_comment_en,rdfs_comment_cs,rdfs_comment_de,rdfs_comment_es,rdfs_comment_fr,rdfs_comment_ko,rdfs_comment_nl,rdfs_comment_pt,rdfs_comment_ru,rdfs_comment_zh-Hans,rdfs_comment_zh-Hant,skos_scopeNote_en,skos_scopeNote_cs,skos_scopeNote_de,skos_scopeNote_es,skos_scopeNote_fr,skos_scopeNote_ko,skos_scopeNote_nl,skos_scopeNote_pt,skos_scopeNote_ru,skos_scopeNote_zh-Hans,skos_scopeNote_zh-Hant,dcterms_description_en,dcterms_description_cs,dcterms_description_de,dcterms_description_es,dcterms_description_fr,dcterms_description_ko,dcterms_description_nl,dcterms_description_pt,dcterms_description_ru,dcterms_description_zh-Hans,dcterms_description_zh-Hant,examples_en,examples_cs,examples_de,examples_es,examples_fr,examples_ko,examples_nl,examples_pt,examples_ru,examples_zh-Hans,examples_zh-Hant
City,City or Place Name,Název města nebo místa,,,,,,,,,,Name of the city of a location. This element is at the fourth level of a top-down geographical hierarchy.,"Název města, ve kterém se dané místo nachází. Tento prvek se nachází na čtvrté úrovni geografické hierarchie shora dolů.",,,,,,,,,,"Optionally, the name of a city or place commonly found in gazetteers (such as a mountain or national park) in which the subjects (e. g., species, habitats, or events) were located.","Volitelně název města nebo místa, které se běžně vyskytuje v geografických slovnících (například hora nebo národní park), kde se subjekty (například druhy, stanoviště nebo události) nacházely.",,,,,,,,,,,,,,,,,,,,,,,,,,,,,,,
CountryCode,Country Code,Kód země,,Código del país,Code du pays,,,,Код страны,,国家代码,The ISO code of a country of a location. This element is at the second level of a top-down geographical hierarchy.,ISO kód země nebo místa. Tento prvek se nachází na druhé úrovni geografické hierarchie shora dolů.,,,,,,,,,,"The geographic location of the specific entity or entities documented by the media item, expressed through a constrained vocabulary of countries using 2-letter ISO 3166-1 country code (e. g. ""IT, SI"").","Geografická poloha konkrétního subjektu nebo subjektů dokumentovaných mediálním prvkem, vyjádřená pomocí omezeného slovníku zemí s použitím dvoumístného kódu země podle normy ISO 3166-1 (např. „IT, SI“).",,,,,,,,,,"Accepted exceptions to be used instead of ISO codes are: ""Global"", ""Marine"", ""Europe"", ""N-America"", ""C-America"", ""S-America"", ""Africa"", ""Asia"", ""Oceania"", ATA = ""Antarctica"", XEU = ""European Union"", XAR = ""Arctic"", ""ZZZ"" = ""Unknown country"" (3 letter abbreviations from IPTC codes).","Přijatelné výjimky, které lze použít namísto kódů ISO, jsou: „Global“, „Marine“, „Europe“, „N-America“, „C-America“, „S-America“, „Africa“, „Asia“, „Oceania“, ATA = „Antarctica“, XEU = „European Union“, XAR = „Arctic“, „ZZZ“ = „Unknown country“ (třípísmenné zkratky z kódů IPTC).",,,,,,,,,,,,,,,,,,,,
CountryName,Country Name,Název země,,,,,,,,,,The name of a country of a location. This element is at the second level of a top-down geographical hierarchy.,Název země nebo místa. Tento prvek se nachází na druhé úrovni geografické hierarchie shora dolů.,,,,,,,,,,"This field can be free text, but where possible, the use of http://iptc.org/std/Iptc4xmpExt/2008-02-29/CountryCode is preferred.","Toto pole může být volný text, ale pokud je to možné, je preferováno použití http://iptc.org/std/Iptc4xmpExt/2008-02-29/CountryCode.",,,,,,,,,,,,,,,,,,,,,,,,,,,,,,,
CVterm,Subject Category,Předmět kategorie,,,,,,,,,,A term to describe the content of the image by a value from a Controlled Vocabulary. ,Termín popisující obsah obrázku pomocí hodnoty z řízeného slovníku. ,,,,,,,,,,"Controlled vocabulary of subjects to support broad classification of media items. Terms from various controlled vocabularies may be used. AC-recommended vocabularies are preferred and MAY be unqualified literals (not a full URI). For terms from other vocabularies either a precise URI SHOULD be used, or, as long as all unqualified terms in all vocabularies are unique, metadata SHOULD provide the source vocabularies using the Subject Category Vocabulary term. The value SHOULD be a string, whose text can also be in the form of a URL.  These guidelines on value format are less restrictive than is specified by the IPTC guidelines.","Řízený slovník předmětů na podporu široké klasifikace mediálních položek. Lze použít termíny z různých řízených slovníků. Upřednostňují se slovníky doporučené AC a MŮŽOU být nekvalifikovanými literály (ne úplným URI). U termínů z jiných slovníků by MĚLA být použita přesná URI, nebo, pokud jsou všechny nekvalifikované termíny ve všech slovnících jedinečné, MĚLA by metadata poskytovat zdrojové slovníky pomocí termínu Subject Category Vocabulary (Slovník kategorií předmětů). Hodnota MĚLA by být řetězec, jehož text může mít také formu URL.  Tyto pokyny týkající se formátu hodnoty jsou méně omezující než pokyny IPTC.",,,,,,,,,,"Recommended sets include: the NASA Global Change Master Directory (GCMD; http://gcmd.nasa.gov/), Subject Categories defined in Key to Nature (K2N; http://www.keytonature.eu/wiki/Subject_Category), the BioComplexity Thesaurus; https://www2.usgs.gov/core_science_systems/csas/biocomplexity_thesaurus/, the Description Type GBIF Vocabulary; http://rs.gbif.org/vocabulary/gbif/description_type.xml, the TDWG Species Profile Model; http://rs.tdwg.org/ontology/voc/SPMInfoItems.rdf, the Plinian Core; https://github.com/tdwg/PlinianCore/wiki, the European Environmental Agency GEneral Multilingual Environmental Thesaurus (GEMET; http://www.eionet.europa.eu/gemet), and the Long Term Ecological Research Network Controlled Vocabulary (LTER; http://vocab.lternet.edu/). The vocabulary may include major taxonomic groups (such as ""vertebrates"" or ""fungi"") or ecosystem terms (""savannah"", ""temperate rain forest"", ""forest fires"", ""aquatic vertebrates""). Other formal classifications (published in print or online) such as habitat, fuel, invasive species, agroproductivity, fisheries, migratory species etc. are also suitable.","Doporučené sady zahrnují: NASA Global Change Master Directory (GCMD; http://gcmd.nasa.gov/), předmětové kategorie definované v Key to Nature (K2N; http://www.keytonature.eu/wiki/Subject_Category), BioComplexity Thesaurus; https://www2.usgs.gov/core_science_systems/csas/biocomplexity_thesaurus/, slovník GBIF pro typ popisu; http://rs.gbif.org/vocabulary/gbif/description_type.xml (Klíč k přírodě), TDWG Species Profile Model (Model profilu druhů TDWG); http://rs.tdwg.org/ontology/voc/SPMInfoItems.rdf, Plinian Core (Plinianovo jádro); https://github.com/tdwg/PlinianCore/wiki (Evropská agentura pro životní prostředí), European Environmental Agency GEneral Multilingual Environmental Thesaurus (GEMET; http://www.eionet.europa.eu/gemet) a Long Term Ecological Research Network Controlled Vocabulary (LTER; http://vocab.lternet.edu/). Slovník může zahrnovat hlavní taxonomické skupiny (například „obratlovci“ nebo „houby“) nebo pojmy týkající se ekosystémů („savana“, „mírný deštný prales“, „lesní požáry“, „vodní obratlovci“). Vhodné jsou také jiné formální klasifikace (vydané v tištěné nebo online podobě), jako jsou biotopy, paliva, invazivní druhy, zemědělská produktivita, rybolov, stěhovavé druhy atd.",,,,,,,,,,,,,,,,,,,,
LocationCreated,Location Created,Vytvořená lokalita,,,,,,,,,,The location the content of the item was created ,"Lokalita, kde byl obsah položky vytvořen ",,,,,,,,,,The location at which the media recording instrument was placed when the media was created.,"Místo, kde byl umístěn záznamový přístroj v době vytvoření média.",,,,,,,,,,"The distinction between the location shown and created is often irrelevant, and metadata may be assumed to be referring to location shown. It is recommended that the Location Shown field above always be used when known. However, in the case of position data automatically recorded by the instrument (e. g. EXIF GPS data) Location Created should be used to maintain information accuracy. When one but not both of these locations are present, AC is silent about whether the provided one entails the other. A best practices document for a particular AC implementation might address this.","Rozdíl mezi zobrazenou a vytvořenou lokalitou je často irelevantní a lze předpokládat, že metadata odkazují na zobrazenou lokalitu. Doporučuje se, aby se pole Zobrazená lokalita vždy používalo, pokud je známo. V případě polohových údajů automaticky zaznamenaných přístrojem (např. údaje EXIF GPS) by se však mělo použít pole Vytvořená lokalita, aby byla zachována přesnost informací. Pokud je k dispozici pouze jedna z těchto lokalit, AC neuvádí, zda poskytnutá lokalita zahrnuje i druhou. Tuto otázku může řešit dokument s osvědčenými postupy pro konkrétní implementaci AC.",,,,,,,,,,,,,,,,,,,,
LocationShown,Location Shown,Zobrazená lokkalita,,,,,,,,,,A location the content of the item is about. For photos that is a location shown in the image.,Lokalita které se obsah položky týká. U fotografií se jedná o lokalitu zobrazenou na obrázku.,,,,,,,,,,"The location that is depicted the media content, irrespective of the location at which the resource has been created.","Lokalita, která je zobrazena v mediálním obsahu, bez ohledu na lokalitu, ve které byl zdroj vytvořen.",,,,,,,,,,,,,,,,,,,,,,,,,,,,,,,
ProvinceState,Province or State,Provincie nebo stát,,,,,,,,,,The name of a subregion of a country - a province or state - of a location. This element is at the third level of a top-down geographical hierarchy.,Název subregionu země – provincie nebo státu – dané lokality. Tento prvek se nachází na třetí úrovni geografické hierarchie shora dolů.,,,,,,,,,,"OPTIONALLY, the geographic unit immediately below the country level (individual states in federal countries, provinces, or other administrative units) in which the subject of the media resource (e. g., species, habitats, or events) were located (if such information is available in separate fields).","VOLITELNĚ geografická jednotka bezprostředně pod úrovní země (jednotlivé státy ve federálních zemích, provincie nebo jiné správní jednotky), ve které se nacházel předmět mediálního zdroje (např. druhy, stanoviště nebo události) (pokud jsou tyto informace k dispozici v samostatných polích).",,,,,,,,,,,,,,,,,,,,,,,,,,,,,,,
Sublocation,Sublocation,Podpoloha,,,,,,,,,,Name of a sublocation. This sublocation name could either be the name of a sublocation to a city or the name of a well known location or (natural) monument outside a city. In the sense of a sublocation to a city this element is at the fifth level of a top-down geographical hierarchy.,"Název dílčí lokality. Název dílčí lokality může být buď název dílčí lokality města, nebo název známého místa či (přírodní) památky mimo město. Ve smyslu dílčí lokality města se tento prvek nachází na páté úrovni geografické hierarchie shora dolů.",,,,,,,,,,"Free-form text location details of the location of the subjects, down to the village, forest, or geographic feature etc., below the Iptc4xmpExt:City place name, especially information that could not be found in a gazetteer.",,,,,,,,,,,,,,,,,,,,,,,,,,,,,,,,
WorldRegion,World Region,Světový region,,,,,,,,,,The name of a world region of a location. This element is at the first (topI) level of a topdown geographical hierarchy.,Název světové oblasti dané lokality. Tento prvek se nachází na první (nejvyšší) úrovni geografické hierarchie shora dolů.,,,,,,,,,,"Name of a world region in some high level classification, such as names for continents, waterbodies, or island groups, whichever is most appropriate. The terms preferably are derived from a controlled vocabulary.",,,,,,,,,,,"The equivalent DarwinCore fields here forces primary metadata providers to classify world region terms into separate properties for ""continent"", ""waterbody"", ""islandGroup"". By contrast, the Iptc4xmpExt vocabulary only specifies that a World Region is something at the top of a hierarchy of locations.","Ekvivalentní pole DarwinCore zde nutí primární poskytovatele metadat klasifikovat termíny světových regionů do samostatných vlastností pro „kontinent“, „vodní útvar“ a „skupinu ostrovů“. Naproti tomu slovník Iptc4xmpExt pouze specifikuje, že světový region je něco, co se nachází na vrcholu hierarchie lokalit.",,,,,,,,,,,,,,,,,,,,
