"identifier","context","text"
"creator:label","Label for Creator http://rs.tdwg.org/dwc/terms/creator","Tvůrce"
"creator:rdfs_comment","Comment for Creator http://rs.tdwg.org/dwc/terms/creator","Subjekt, který je primárně odpovědný za vytvoření zdroje."
"creator:dcterms_description","Description for Creator http://rs.tdwg.org/dwc/terms/creator","Upozorňujeme, že tvůrce nemusí být nutně vlastníkem autorských práv. Viz také záznam pro dcterms:creator v dokumentu Audiovisual Core term list (Seznam základních audiovizuálních termínů) a viz DCMI FAQ on DC and DCTERMS Namespaces (Často kladené otázky týkající se jmenných prostorů DC a DCTERMS) https://web.archive.org/web/20171126043657/https://github.com/dcmi/repository/blob/master/mediawiki_wiki/FAQ/DC_and_DCTERMS_Namespaces.md, kde najdete diskusi o důvodech pro použití termínů ve dvou jmenných prostorech. Obvyklou praxí je používat stejný štítek, pokud jsou k dispozici oba. Štítky nemají žádný vliv na vyhledávání informací a jsou pouze doporučením."
"creator:skos_scopeNote","Usage for Creator http://rs.tdwg.org/dwc/terms/creator","Osoba nebo organizace odpovědná za vytvoření mediálního zdroje. Hodnota MŮŽE být jednoduchý text včetně kontaktních informací."
"format:label","Label for Format (literal) http://rs.tdwg.org/dwc/terms/format","Formát (doslovný)"
"format:rdfs_comment","Comment for Format (literal) http://rs.tdwg.org/dwc/terms/format","Formát souboru, fyzické médium nebo rozměry zdroje."
"format:dcterms_description","Description for Format (literal) http://rs.tdwg.org/dwc/terms/format","Tento termín lze použít k popisu offline digitálního obsahu. V případech, kdy poskytnutá URL adresa přístupového bodu služby obsahuje standardní příponu souboru, ze které lze odvodit formát, je přípustné tuto vlastnost nevyplňovat. Viz také záznam pro dcterms:format v dokumentu se seznamem základních audiovizuálních termínů a viz DCMI FAQ o jmenných prostorech DC a DCTERMS, https://web.archive.org/web/20171126043657/https://github.com/dcmi/repository/blob/master/mediawiki_wiki/FAQ/DC_and_DCTERMS_Namespaces.md, kde najdete diskusi o důvodech pro použití termínů ve dvou jmenných prostorech. Nejlepší praxí je používat dcterms:format namísto dc:format, kdykoli je to možné. Obvyklou praxí je používat stejný štítek, pokud jsou k dispozici oba. Štítky nemají žádný vliv na vyhledávání informací a jsou pouze doporučením."
"format:skos_scopeNote","Usage for Format (literal) http://rs.tdwg.org/dwc/terms/format","Řízený řetězec hodnot popisující technický formát zdroje (formát souboru nebo fyzické médium). Řetězec BY MĚL být kontrolovanou hodnotou z Audiovisual Core Controlled Vocabulary pro formát Dublin Core, ačkoli MŮŽE být jakoukoli hodnotou typu média (typ MIME) ze seznamu typů médií IANA (https://www.iana.org/assignments/media-types/media-types.xhtml) nebo jakýmkoli běžně používaným řetězcem přípon souboru. Čitelné informace o řízeném slovníku pro formát jsou k dispozici na adrese http://rs.tdwg.org/ac/doc/format/ ."
"language:label","Label for Language http://rs.tdwg.org/dwc/terms/language","Jazyk"
"language:rdfs_comment","Comment for Language http://rs.tdwg.org/dwc/terms/language","Jazyk zdroje."
"language:dcterms_description","Description for Language http://rs.tdwg.org/dwc/terms/language","Obrázek může obsahovat jazyk, například v podobě překrývajících se popisků. Pokud obrázek zobrazuje přírodní scénu nebo organismus bez jakéhokoli jazyka, je zdroj jazykově neutrální (kód ISO „zxx“). Zdroje s přítomným, ale neznámým jazykem se kódují jako neurčené (kód ISO „und“). Regionální dialekty nebo jiné zvláštní případy by měly být v souladu s kódem ISO639-5 Alpha-3 pro jazykové rodiny a skupiny, http://id.loc.gov/vocabulary/iso639-5.html, pokud je to možné, nebo s osvědčenými postupy IETF pro značky identifikující jazyky, https://tools.ietf.org/html/rfc5646, pokud to není možné. Viz také záznam pro dcterms:language v dokumentu Audiovisual Core term list (Seznam základních audiovizuálních termínů) a viz DCMI FAQ on DC and DCTERMS Namespaces (Často kladené otázky DCMI k jmenným prostorům DC a DCTERMS), https://web.archive.org/web/20171126043657/https://github.com/dcmi/repository/blob/master/mediawiki_wiki/FAQ/DC_and_DCTERMS_Namespaces.md, kde se diskutuje o důvodech pro použití termínů ve dvou jmenných prostorech. Obvyklou praxí je používat stejný štítek, pokud jsou k dispozici oba. Štítky nemají žádný vliv na vyhledávání informací a jsou pouze doporučením."
"language:skos_scopeNote","Usage for Language http://rs.tdwg.org/dwc/terms/language","Jazyk(y) samotného zdroje vyjádřený(é) třípísmenným kódem jazyka podle normy ISO 639-2. Dvoumístné kódy podle normy ISO 639-1 jsou povoleny, ale jejich používání se již nedoporučuje."
"rights:label","Label for Copyright Statement http://rs.tdwg.org/dwc/terms/rights","Prohlášení o autorských právech"
"rights:rdfs_comment","Comment for Copyright Statement http://rs.tdwg.org/dwc/terms/rights","Informace o právech ke zdroji a nad zdrojem."
"rights:dcterms_description","Description for Copyright Statement http://rs.tdwg.org/dwc/terms/rights","Vyjadřuje práva k mediálnímu zdroji, nikoli k textu metadat. V případě nejednoznačnosti má přednost dcterms:rights. Viz také záznam pro dcterms:rights v dokumentu Audiovisual Core Term List (Seznam základních audiovizuálních termínů) a viz DCMI FAQ on DC and DCTERMS Namespaces (Často kladené otázky DCMI k jmenným prostorům DC a DCTERMS), https://web.archive.org/web/20171126043657/https://github.com/dcmi/repository/blob/master/mediawiki_wiki/FAQ/DC_and_DCTERMS_Namespaces.md, kde se diskutuje o důvodech pro použití termínů ve dvou jmenných prostorech. Obvyklou praxí je použít stejný štítek, pokud jsou uvedeny oba. Štítky nemají žádný vliv na vyhledávání informací a jsou pouze doporučením. Příklady: „Copyright XY 2008, všechna práva vyhrazena“, „© 2008 XY Museum“, „Public Domain“, „Copyright unknown“."
"rights:skos_scopeNote","Usage for Copyright Statement http://rs.tdwg.org/dwc/terms/rights","Plný text čitelného prohlášení o autorských právech, jak vyžaduje vnitrostátní právní předpisy držitele autorských práv. U sbírek se to vztahuje na všechny obsažené objekty, pokud samotný objekt nemá jiné prohlášení. Neuvádějte zde pouze jméno držitele (držitelů) autorských práv! Ten patří do seznamu v poli xmpRights:Owner, které BY MĚLO být uvedeno, pokud dc:rights není „Public Domain“ (veřejná doména), což je vhodné pouze v případě, že je známo, že zdroj není chráněn autorským právem. MUSÍ být uvedeno alespoň jedno z polí dcterms:rights a dc:rights, ale pokud je to možné, uvedení obou polí může zvýšit užitečnost metadat. MUSÍ specifikovat stejná práva. "
"source:label","Label for Published Source http://rs.tdwg.org/dwc/terms/source","Zveřejněný zdroj"
"source:rdfs_comment","Comment for Published Source http://rs.tdwg.org/dwc/terms/source","Související zdroj, ze kterého je popsaný zdroj odvozen. "
"source:dcterms_description","Description for Published Source http://rs.tdwg.org/dwc/terms/source","Pokud byl zdroj digitalizován z nedigitálního zdroje nebo byl již dříve publikován v digitální nebo tištěné publikaci, popisuje se zde originál. Neuvádějte zde obecně „související“ publikace. Toto pole obvykle obsahuje volný textový popis. Pokud je k dispozici URI, mělo by být uvedeno v dcterms:source. Může se opakovat, pokud se jedná o montáž obrázků. Informace o dalším původu nad rámec konečného zdroje by měly být uvedeny v atributu derivedFrom. Viz také záznam pro dcterms:source v dokumentu Audiovisual Core term list a viz DCMI FAQ on DC and DCTERMS Namespaces, https://web.archive.org/web/20171126043657/https://github.com/dcmi/repository/blob/master/mediawiki_wiki/FAQ/DC_and_DCTERMS_Namespaces.md, kde se diskutuje o důvodech pro termíny ve dvou jmenných prostorech. Obvyklou praxí je používat stejný štítek, pokud jsou k dispozici oba. Štítky nemají žádný vliv na vyhledávání informací a slouží pouze jako doporučení"
"source:skos_scopeNote","Usage for Published Source http://rs.tdwg.org/dwc/terms/source","Řetězec poskytující identifikovatelný zdroj, ze kterého byly popsané zdroje odvozeny."
"type:label","Label for Type http://rs.tdwg.org/dwc/terms/type","Typ"
"type:rdfs_comment","Comment for Type http://rs.tdwg.org/dwc/terms/type","Povaha nebo druh zdroje."
"type:dcterms_description","Description for Type http://rs.tdwg.org/dwc/terms/type","Pokud je zdroj sbírkou, tento termín neurčuje, jaké typy objektů může obsahovat. Viz také heslo dcterms:type v dokumentu Audiovisual Core term list (Seznam základních termínů pro audiovizuální materiály) a viz DCMI FAQ on DC and DCTERMS Namespaces (Často kladené otázky k DC a DCTERMS Namespaces), https://web.archive.org/web/20171126043657/https://github.com/dcmi/repository/blob/master/mediawiki_wiki/FAQ/DC_and_DCTERMS_Namespaces.md, kde najdete diskusi o důvodech pro použití termínů ve dvou jmenných prostorech. Obvyklou praxí je používat stejný štítek, pokud jsou k dispozici oba. Štítky nemají žádný vliv na vyhledávání informací a jsou pouze doporučením."
"type:skos_scopeNote","Usage for Type http://rs.tdwg.org/dwc/terms/type","Hodnota dc:type BY MĚLA být názvem libovolného termínu ze slovníku DCMI Type Vocabulary, https://www.dublincore.org/specifications/dublin-core/dcmi-terms/#section-7 DOPORUČENÉ názvy termínů pro mediální položky jsou „Collection“, „StillImage“, „Sound“, „MovingImage“, „InteractiveResource“ a „Text“. Kolekce MUSÍ mít hodnotu „Collection“. V souladu s doporučeními DC na adrese http://purl.org/dc/dcmitype/Text by obrázky textu MĚLY mít hodnotu „Text“ pro dc:type. V záznamu Audiovisual Core MUSÍ být uvedena hodnota alespoň jednoho z dc:type a dcterms:type, ale pokud je to možné, uvedení obou hodnot může zvýšit užitečnost metadat. Hodnoty dc:type a dcterms:type BY MĚLY označovat stejný typ, ale v případě nejednoznačnosti má přednost dcterms:type."
