term_localName,label_en,label_cs,label_de,label_es,label_fr,label_ko,label_nl,label_pt,label_ru,label_zh-Hans,label_zh-Hant,rdfs_comment_en,rdfs_comment_cs,rdfs_comment_de,rdfs_comment_es,rdfs_comment_fr,rdfs_comment_ko,rdfs_comment_nl,rdfs_comment_pt,rdfs_comment_ru,rdfs_comment_zh-Hans,rdfs_comment_zh-Hant,dcterms_description_en,dcterms_description_cs,dcterms_description_de,dcterms_description_es,dcterms_description_fr,dcterms_description_ko,dcterms_description_nl,dcterms_description_pt,dcterms_description_ru,dcterms_description_zh-Hans,dcterms_description_zh-Hant,examples_en,examples_cs,examples_de,examples_es,examples_fr,examples_ko,examples_nl,examples_pt,examples_ru,examples_zh-Hans,examples_zh-Hant
creator,Creator,Tvůrce,,,,,,,,,,An entity primarily responsible for making the resource.,"Subjekt, který je primárně odpovědný za vytvoření zdroje.",,,,,,,,,,"Note that the Creator need not be the Copyright Owner. See also the entry for dcterms:creator in the Audiovisual Core term list document and see the DCMI FAQ on DC and DCTERMS Namespaces, https://web.archive.org/web/20171126043657/https://github.com/dcmi/repository/blob/master/mediawiki_wiki/FAQ/DC_and_DCTERMS_Namespaces.md, for discussion of the rationale for terms in two namespaces. Normal practice is to use the same Label if both are provided. Labels have no effect on information discovery and are only suggestions.","Upozorňujeme, že tvůrce nemusí být nutně vlastníkem autorských práv. Viz také záznam pro dcterms:creator v dokumentu Audiovisual Core term list (Seznam základních audiovizuálních termínů) a viz DCMI FAQ on DC and DCTERMS Namespaces (Často kladené otázky týkající se jmenných prostorů DC a DCTERMS) https://web.archive.org/web/20171126043657/https://github.com/dcmi/repository/blob/master/mediawiki_wiki/FAQ/DC_and_DCTERMS_Namespaces.md, kde najdete diskusi o důvodech pro použití termínů ve dvou jmenných prostorech. Obvyklou praxí je používat stejný štítek, pokud jsou k dispozici oba. Štítky nemají žádný vliv na vyhledávání informací a jsou pouze doporučením.",,,,,,,,,,,,,,,,,,,,
format,Format (literal),Formát (doslovný),,,,,,,,,,"The file format, physical medium, or dimensions of the resource.","Formát souboru, fyzické médium nebo rozměry zdroje.",,,,,,,,,,"This term can be used to describe offline digital content. In cases where the provided Service Access Point URL includes a standard file extension from which the format can be inferred, it is permissible to not provide a value for this property. See also the entry for dcterms:format in the Audiovisual Core term list document and see the DCMI FAQ on DC and DCTERMS Namespaces, https://web.archive.org/web/20171126043657/https://github.com/dcmi/repository/blob/master/mediawiki_wiki/FAQ/DC_and_DCTERMS_Namespaces.md, for discussion of the rationale for terms in two namespaces. It is best practice to use dcterms:format instead of dc:format whenever practical. Normal practice is to use the same Label if both are provided. Labels have no effect on information discovery and are only suggestions.","Tento termín lze použít k popisu offline digitálního obsahu. V případech, kdy poskytnutá URL adresa přístupového bodu služby obsahuje standardní příponu souboru, ze které lze odvodit formát, je přípustné tuto vlastnost nevyplňovat. Viz také záznam pro dcterms:format v dokumentu se seznamem základních audiovizuálních termínů a viz DCMI FAQ o jmenných prostorech DC a DCTERMS, https://web.archive.org/web/20171126043657/https://github.com/dcmi/repository/blob/master/mediawiki_wiki/FAQ/DC_and_DCTERMS_Namespaces.md, kde najdete diskusi o důvodech pro použití termínů ve dvou jmenných prostorech. Nejlepší praxí je používat dcterms:format namísto dc:format, kdykoli je to možné. Obvyklou praxí je používat stejný štítek, pokud jsou k dispozici oba. Štítky nemají žádný vliv na vyhledávání informací a jsou pouze doporučením.",,,,,,,,,,,,,,,,,,,,
language,Language,Jazyk,,Idioma,Langue,,,,Язык,,,A language of the resource.,Jazyk zdroje.,,Un idioma del recurso.,Une langue de la ressource.,,,,Язык ресурса.,,,"An image may contain language such as superimposed labels. If an image is of a natural scene or organism, without any language included, the resource is language-neutral (ISO code ""zxx""). Resources with present but unknown language are to be coded as undetermined (ISO code ""und""). Regional dialects or other special cases should conform to the ISO639-5 Alpha-3 Code for Language Families and Groups, http://id.loc.gov/vocabulary/iso639-5.html, where possible or the IETF Best Practices for Tags Identifying Languages, https://tools.ietf.org/html/rfc5646, where not. See also the entry for dcterms:language in the Audiovisual Core term list document and see the DCMI FAQ on DC and DCTERMS Namespaces, https://web.archive.org/web/20171126043657/https://github.com/dcmi/repository/blob/master/mediawiki_wiki/FAQ/DC_and_DCTERMS_Namespaces.md, for discussion of the rationale for terms in two namespaces. Normal practice is to use the same Label if both are provided. Labels have no effect on information discovery and are only suggestions.","Obrázek může obsahovat jazyk, například v podobě překrývajících se popisků. Pokud obrázek zobrazuje přírodní scénu nebo organismus bez jakéhokoli jazyka, je zdroj jazykově neutrální (kód ISO „zxx“). Zdroje s přítomným, ale neznámým jazykem se kódují jako neurčené (kód ISO „und“). Regionální dialekty nebo jiné zvláštní případy by měly být v souladu s kódem ISO639-5 Alpha-3 pro jazykové rodiny a skupiny, http://id.loc.gov/vocabulary/iso639-5.html, pokud je to možné, nebo s osvědčenými postupy IETF pro značky identifikující jazyky, https://tools.ietf.org/html/rfc5646, pokud to není možné. Viz také záznam pro dcterms:language v dokumentu Audiovisual Core term list (Seznam základních audiovizuálních termínů) a viz DCMI FAQ on DC and DCTERMS Namespaces (Často kladené otázky DCMI k jmenným prostorům DC a DCTERMS), https://web.archive.org/web/20171126043657/https://github.com/dcmi/repository/blob/master/mediawiki_wiki/FAQ/DC_and_DCTERMS_Namespaces.md, kde se diskutuje o důvodech pro použití termínů ve dvou jmenných prostorech. Obvyklou praxí je používat stejný štítek, pokud jsou k dispozici oba. Štítky nemají žádný vliv na vyhledávání informací a jsou pouze doporučením.",,,,,,,,,,,,,,,,,,,,
rights,Copyright Statement,Prohlášení o autorských právech,,,,,,,,,,Information about rights held in and over the resource.,Informace o právech ke zdroji a nad zdrojem.,,Información sobre los derechos que se tienen y se retienen sobre el recurso.,Informations sur les droits détenus dans et sur la ressource.,,,,"Сведения о правах, связанных с ресурсом и действующих в отношении него.",,,"This expresses rights over the media resource, not over the metadata text. In case of ambiguity, dcterms:rights prevails. See also the entry for dcterms:rights in the Audiovisual Core Term List document and see the DCMI FAQ on DC and DCTERMS Namespaces, https://web.archive.org/web/20171126043657/https://github.com/dcmi/repository/blob/master/mediawiki_wiki/FAQ/DC_and_DCTERMS_Namespaces.md, for discussion of the rationale for terms in two namespaces. Normal practice is to use the same Label if both are provided. Labels have no effect on information discovery and are only suggestions. Examples: ""Copyright XY 2008, all rights reserved"", ""© 2008 XY Museum"", ""Public Domain."", ""Copyright unknown.""","Vyjadřuje práva k mediálnímu zdroji, nikoli k textu metadat. V případě nejednoznačnosti má přednost dcterms:rights. Viz také záznam pro dcterms:rights v dokumentu Audiovisual Core Term List (Seznam základních audiovizuálních termínů) a viz DCMI FAQ on DC and DCTERMS Namespaces (Často kladené otázky DCMI k jmenným prostorům DC a DCTERMS), https://web.archive.org/web/20171126043657/https://github.com/dcmi/repository/blob/master/mediawiki_wiki/FAQ/DC_and_DCTERMS_Namespaces.md, kde se diskutuje o důvodech pro použití termínů ve dvou jmenných prostorech. Obvyklou praxí je použít stejný štítek, pokud jsou uvedeny oba. Štítky nemají žádný vliv na vyhledávání informací a jsou pouze doporučením. Příklady: „Copyright XY 2008, všechna práva vyhrazena“, „© 2008 XY Museum“, „Public Domain“, „Copyright unknown“.",,,,,,,,,,,,,,,,,,,,
source,Published Source,Zveřejněný zdroj,,,,,,,,,,A related resource from which the described resource is derived. ,"Související zdroj, ze kterého je popsaný zdroj odvozen. ",,,,,,,,,,"If the resource was digitized from a non-digital resource, or was also previously published in a digital or printed publication, this describes the original. Do not put generally ""related"" publications in here. This field normally contains a free-form text description. If a URI is available it should be provided in dcterms:source. Can be repeatable if a montage of images. Information about further provenance beyond the ultimate source should be put in the derivedFrom attribute. See also the entry for dcterms:source in the Audiovisual Core term list document and see the DCMI FAQ on DC and DCTERMS Namespaces, https://web.archive.org/web/20171126043657/https://github.com/dcmi/repository/blob/master/mediawiki_wiki/FAQ/DC_and_DCTERMS_Namespaces.md, for discussion of the rationale for terms in two namespaces. Normal practice is to use the same Label if both are provided. Labels have no effect on information discovery and are only suggestions","Pokud byl zdroj digitalizován z nedigitálního zdroje nebo byl již dříve publikován v digitální nebo tištěné publikaci, popisuje se zde originál. Neuvádějte zde obecně „související“ publikace. Toto pole obvykle obsahuje volný textový popis. Pokud je k dispozici URI, mělo by být uvedeno v dcterms:source. Může se opakovat, pokud se jedná o montáž obrázků. Informace o dalším původu nad rámec konečného zdroje by měly být uvedeny v atributu derivedFrom. Viz také záznam pro dcterms:source v dokumentu Audiovisual Core term list a viz DCMI FAQ on DC and DCTERMS Namespaces, https://web.archive.org/web/20171126043657/https://github.com/dcmi/repository/blob/master/mediawiki_wiki/FAQ/DC_and_DCTERMS_Namespaces.md, kde se diskutuje o důvodech pro termíny ve dvou jmenných prostorech. Obvyklou praxí je používat stejný štítek, pokud jsou k dispozici oba. Štítky nemají žádný vliv na vyhledávání informací a slouží pouze jako doporučení",,,,,,,,,,,,,,,,,,,,
type,Type,Typ,,Tipo,Type,,,,Тип,,,The nature or genre of the resource.,Povaha nebo druh zdroje.,,La naturaleza o género del recurso.,La nature ou le genre de la ressource.,,,,Характер или жанр ресурса.,,,"If the resource is a Collection, this term does not identify what types of objects it may contain. See also the entry for dcterms:type in the Audiovisual Core term list document and see the DCMI FAQ on DC and DCTERMS Namespaces, https://web.archive.org/web/20171126043657/https://github.com/dcmi/repository/blob/master/mediawiki_wiki/FAQ/DC_and_DCTERMS_Namespaces.md, for discussion of the rationale for terms in two namespaces. Normal practice is to use the same Label if both are provided. Labels have no effect on information discovery and are only suggestions.","Pokud je zdroj sbírkou, tento termín neurčuje, jaké typy objektů může obsahovat. Viz také heslo dcterms:type v dokumentu Audiovisual Core term list (Seznam základních termínů pro audiovizuální materiály) a viz DCMI FAQ on DC and DCTERMS Namespaces (Často kladené otázky k DC a DCTERMS Namespaces), https://web.archive.org/web/20171126043657/https://github.com/dcmi/repository/blob/master/mediawiki_wiki/FAQ/DC_and_DCTERMS_Namespaces.md, kde najdete diskusi o důvodech pro použití termínů ve dvou jmenných prostorech. Obvyklou praxí je používat stejný štítek, pokud jsou k dispozici oba. Štítky nemají žádný vliv na vyhledávání informací a jsou pouze doporučením.",,,,,,,,,,,,,,,,,,,,
