document_modified,term_localName,term_isDefinedBy,term_created,term_modified,term_deprecated,replaces_term,replaces1_term,replaces2_term,label,rdfs_comment,dcterms_description,examples,rdf_type,tdwgutility_abcdEquivalence,tdwgutility_organizedInClass,tdwgutility_decision,tdwgutility_usageScope
2025-08-17T14:26:42-05:00,absentTaxa,http://rs.tdwg.org/eco/iri/,2024-03-26,2025-07-10,,,,,Absent Taxa (IRI),A taxon reported absent during the dwc:Event.,Absences can be reported at any taxonomic level. Terms in the ecoiri: namespace are intended to be used in RDF with non-literal objects.,,http://www.w3.org/1999/02/22-rdf-syntax-ns#Property,not in ABCD,http://rs.tdwg.org/dwc/terms/attributes/UseWithIRI,,
2025-08-17T14:26:42-05:00,compilationSourceTypes,http://rs.tdwg.org/eco/iri/,2024-03-26,2025-07-10,,,,,Compilation Source Types (IRI),The type of data source contributing to the compilation reported.,This term is only relevant if the dwc:Event is a compilation in which one or more types of data sources were used. Terms in the ecoiri: namespace are intended to be used in RDF with non-literal objects.,,http://www.w3.org/1999/02/22-rdf-syntax-ns#Property,not in ABCD,http://rs.tdwg.org/dwc/terms/attributes/UseWithIRI,,
2025-08-17T14:26:42-05:00,compilationTypes,http://rs.tdwg.org/eco/iri/,2024-03-26,2025-07-10,,,,,Compilation Types (IRI),"A statement specifying whether data reported are derived from sampling events, ancillary data compiled from other sources, or a combination of both.",This term is only relevant if the dwc:Event is an inventory. Recommended best practice is to use an IRI from a controlled vocabulary. Terms in the ecoiri: namespace are intended to be used in RDF with non-literal objects.,,http://www.w3.org/1999/02/22-rdf-syntax-ns#Property,not in ABCD,http://rs.tdwg.org/dwc/terms/attributes/UseWithIRI,,
2024-03-26T14:27:47-05:00,eventDurationUnit,http://rs.tdwg.org/eco/iri/,2024-03-26,2024-03-26,,,,,Event Duration Unit (IRI),The units associated with the eco:eventDurationValue.,"Recommended best practice is to use an IRI from a controlled vocabulary of SI units, derived units, or other non-SI units accepted for use within the SI.",,http://www.w3.org/1999/02/22-rdf-syntax-ns#Property,not in ABCD,http://rs.tdwg.org/dwc/terms/attributes/UseWithIRI,,
2025-08-17T14:26:42-05:00,excludedDegreeOfEstablishmentScope,http://rs.tdwg.org/eco/iri/,2024-03-26,2025-07-10,,,,,Excluded Degree of Establishment Scope (IRI),The degree of establishment of the dwc:Organisms explicitly excluded from sampling during the dwc:Event.,"Recommended best practice is to use an IRI from the controlled vocabulary designated for use with this term, listed at http://rs.tdwg.org/dwc/doc/doe/. For details, refer to https://doi.org/10.3897/biss.3.38084 . Terms in the ecoiri: namespace are intended to be used in RDF with non-literal objects.",`http://rs.tdwg.org/dwcem/values/e001`; `http://rs.tdwg.org/dwcem/values/e005`,http://www.w3.org/1999/02/22-rdf-syntax-ns#Property,not in ABCD,http://rs.tdwg.org/dwc/terms/attributes/UseWithIRI,,
2025-08-17T14:26:42-05:00,excludedGrowthFormScope,http://rs.tdwg.org/eco/iri/,2024-03-26,2025-07-10,,,,,Excluded Growth Form Scope (IRI),The growth form or habit of the dwc:Organisms explicitly excluded from sampling during the dwc:Event.,Recommended best practice is to use an IRI from a controlled vocabulary. Terms in the ecoiri: namespace are intended to be used in RDF with non-literal objects.,,http://www.w3.org/1999/02/22-rdf-syntax-ns#Property,not in ABCD,http://rs.tdwg.org/dwc/terms/attributes/UseWithIRI,,
2025-08-17T14:26:42-05:00,excludedHabitatScope,http://rs.tdwg.org/eco/iri/,2024-03-26,2025-07-10,,,,,Excluded Habitat Scope (IRI),The habitat explicitly excluded from sampling during the dwc:Event.,Recommended best practice is to use an IRI from a controlled vocabulary. Terms in the ecoiri: namespace are intended to be used in RDF with non-literal objects.,,http://www.w3.org/1999/02/22-rdf-syntax-ns#Property,not in ABCD,http://rs.tdwg.org/dwc/terms/attributes/UseWithIRI,,
2025-08-17T14:26:42-05:00,excludedLifeStageScope,http://rs.tdwg.org/eco/iri/,2024-03-26,2025-07-10,,,,,Excluded Life Stage Scope (IRI),The age class or life stage of the dwc:Organisms explicitly excluded from sampling during the dwc:Event.,This term is defined based on dwciri:lifeStage (http://rs.tdwg.org/dwc/terms/iri/lifeStage). Recommended best practice is to use an IRI from the same controlled vocabulary as for dwciri:lifeStage. Terms in the ecoiri: namespace are intended to be used in RDF with non-literal objects.,,http://www.w3.org/1999/02/22-rdf-syntax-ns#Property,not in ABCD,http://rs.tdwg.org/dwc/terms/attributes/UseWithIRI,,
2025-08-17T14:26:42-05:00,excludedTaxonomicScope,http://rs.tdwg.org/eco/iri/,2024-03-26,2025-07-10,,,,,Excluded Taxonomic Scope (IRI),The taxonomic group explicitly excluded from sampling during the dwc:Event.,"The dwc:Event to which the ecoiri:excludedTaxonomicScope refers could be at any level of hierarchy. In the case of a higher level (parent) dwc:Event, include all the taxonomic groups explicitly excluded from the child dwc:Events that contributed to the parent dwc:Event. Terms in the ecoiri: namespace are intended to be used in RDF with non-literal objects.",,http://www.w3.org/1999/02/22-rdf-syntax-ns#Property,not in ABCD,http://rs.tdwg.org/dwc/terms/attributes/UseWithIRI,,
2024-03-26T14:27:47-05:00,geospatialScopeAreaUnit,http://rs.tdwg.org/eco/iri/,2024-03-26,2024-03-26,,,,,Geospatial Scope Area Unit (IRI),The units associated with eco:geospatialScopeAreaValue,"Recommended best practice is to use an IRI from a controlled vocabulary of SI units, derived units, or other non-SI units accepted for use within the SI.",,http://www.w3.org/1999/02/22-rdf-syntax-ns#Property,not in ABCD,http://rs.tdwg.org/dwc/terms/attributes/UseWithIRI,,
2025-08-17T14:26:42-05:00,inventoryTypes,http://rs.tdwg.org/eco/iri/,2024-03-26,2025-07-10,,,,,Inventory Types (IRI),The type of search process used to conduct the inventory.,This term is only relevant if the dwc:Event represents an inventory. Recommended best practice is to use an IRI from a controlled vocabulary. Terms in the ecoiri: namespace are intended to be used in RDF with non-literal objects.,,http://www.w3.org/1999/02/22-rdf-syntax-ns#Property,not in ABCD,http://rs.tdwg.org/dwc/terms/attributes/UseWithIRI,,
2025-08-17T14:26:42-05:00,materialSampleTypes,http://rs.tdwg.org/eco/iri/,2024-03-26,2025-07-10,,,,,Material Sample Types (IRI),A material sample type collected during the dwc:Event.,Recommended best practice is to use an IRI from a controlled vocabulary. Terms in the ecoiri: namespace are intended to be used in RDF with non-literal objects.,,http://www.w3.org/1999/02/22-rdf-syntax-ns#Property,not in ABCD,http://rs.tdwg.org/dwc/terms/attributes/UseWithIRI,,
2025-08-17T14:26:42-05:00,nonTargetTaxa,http://rs.tdwg.org/eco/iri/,2024-03-26,2025-07-10,,,,,Non-target Taxa (IRI),A taxon reported during the dwc:Event that is outside of the target taxonomic scope (the combination of ecoiri:targetTaxonomicScope and ecoiri:excludedTaxonomicScope).,This term is meant to allow a taxon that is considered outside of the taxonomic scope and yet was reported in the dataset to be shared. This term is relevant only if a target taxonomic scope is declared and eco:hasNonTargetTaxa is ‘true’. Taxonomic scope is based on the combination of ecoiri:targetTaxonomicScope and ecoiri:excludedTaxonomicScope. Non-target taxa (in some disciplines called “bycatch”) can be reported at any taxonomic level. Terms in the ecoiri: namespace are intended to be used in RDF with non-literal objects.,,http://www.w3.org/1999/02/22-rdf-syntax-ns#Property,not in ABCD,http://rs.tdwg.org/dwc/terms/attributes/UseWithIRI,,
2025-08-17T14:26:42-05:00,protocolNames,http://rs.tdwg.org/eco/iri/,2024-03-26,2025-07-10,,,,,Protocol Names (IRI),Categorical descriptive name for the methods used during the dwc:Event.,Recommended best practice is to use an IRI from a controlled vocabulary. Terms in the ecoiri: namespace are intended to be used in RDF with non-literal objects.,,http://www.w3.org/1999/02/22-rdf-syntax-ns#Property,not in ABCD,http://rs.tdwg.org/dwc/terms/attributes/UseWithIRI,,
2025-08-17T14:26:42-05:00,samplingEffortProtocol,http://rs.tdwg.org/eco/iri/,2024-03-26,2025-07-10,,,,,Sampling Effort Protocol (IRI),"A method or protocol used to determine the sampling effort, denoted by an IRI.","This protocol should be associated with the values reported in eco:samplingEffortValue and eco:samplingEffortUnit. This is a specialization of eco:protocolDescriptions focused on effort, distinct from the survey method. The effort relates to the intensity of sampling and therefore can assist in interpreting estimates of completeness. Terms in the ecoiri: namespace are intended to be used in RDF with non-literal objects.",,http://www.w3.org/1999/02/22-rdf-syntax-ns#Property,not in ABCD,http://rs.tdwg.org/dwc/terms/attributes/UseWithIRI,,
2024-03-26T14:27:47-05:00,samplingEffortUnit,http://rs.tdwg.org/eco/iri/,2024-03-26,2024-03-26,,,,,Sampling Effort Unit (IRI),The units associated with the eco:samplingEffortValue.,"Recommended best practice is to use an IRI from a controlled vocabulary of SI units, derived units, or other non-SI units accepted for use within the SI.",,http://www.w3.org/1999/02/22-rdf-syntax-ns#Property,not in ABCD,http://rs.tdwg.org/dwc/terms/attributes/UseWithIRI,,
2025-08-17T14:26:42-05:00,samplingPerformedBy,http://rs.tdwg.org/eco/iri/,2024-03-26,2025-07-10,,,,,Sampling Performed By (IRI),"A person, group, or organization responsible for recording the dwc:Event.","The sampling dwc:Event could be at any level of hierarchy. In the case of a higher level (parent) dwc:Event, include all the organizations or people involved in the child dwc:Events that contributed to the parent dwc:Event. Terms in the ecoiri: namespace are intended to be used in RDF with non-literal objects.",,http://www.w3.org/1999/02/22-rdf-syntax-ns#Property,not in ABCD,http://rs.tdwg.org/dwc/terms/attributes/UseWithIRI,,
2025-08-17T14:26:42-05:00,targetDegreeOfEstablishmentScope,http://rs.tdwg.org/eco/iri/,2024-03-26,2025-07-10,,,,,Target Degree of Establishment Scope (IRI),The degree of establishment of the dwc:Organisms targeted for sampling during the dwc:Event.,"Recommended best practice is to use an IRI from the controlled vocabulary designated for use with this term, listed at http://rs.tdwg.org/dwc/doc/doe/. For details, refer to https://doi.org/10.3897/biss.3.38084 . Terms in the ecoiri: namespace are intended to be used in RDF with non-literal objects.",`http://rs.tdwg.org/dwcem/values/e001`; `http://rs.tdwg.org/dwcem/values/e005`,http://www.w3.org/1999/02/22-rdf-syntax-ns#Property,not in ABCD,http://rs.tdwg.org/dwc/terms/attributes/UseWithIRI,,
2025-08-17T14:26:42-05:00,targetGrowthFormScope,http://rs.tdwg.org/eco/iri/,2024-03-26,2025-07-10,,,,,Target Growth Form Scope (IRI),The growth form or habit of the dwc:Organisms targeted for sampling during the dwc:Event.,Recommended best practice is to use an IRI from a controlled vocabulary. Terms in the ecoiri: namespace are intended to be used in RDF with non-literal objects.,,http://www.w3.org/1999/02/22-rdf-syntax-ns#Property,not in ABCD,http://rs.tdwg.org/dwc/terms/attributes/UseWithIRI,,
2025-08-17T14:26:42-05:00,targetHabitatScope,http://rs.tdwg.org/eco/iri/,2024-03-26,2025-07-10,,,,,Target Habitat Scope (IRI),The habitat targeted for sampling during the dwc:Event.,Recommended best practice is to use an IRI from a controlled vocabulary. Terms in the ecoiri: namespace are intended to be used in RDF with non-literal objects.,,http://www.w3.org/1999/02/22-rdf-syntax-ns#Property,not in ABCD,http://rs.tdwg.org/dwc/terms/attributes/UseWithIRI,,
2025-08-17T14:26:42-05:00,targetLifeStageScope,http://rs.tdwg.org/eco/iri/,2024-03-26,2025-07-10,,,,,Target Life Stage Scope (IRI),The age class or life stage of the dwc:Organisms targeted for sampling during the dwc:Event.,This term is defined based on dwciri:lifeStage (http://rs.tdwg.org/dwc/terms/iri/lifeStage). Recommended best practice is to use an IRI from the same controlled vocabulary as for dwciri:lifeStage. Terms in the ecoiri: namespace are intended to be used in RDF with non-literal objects.,,http://www.w3.org/1999/02/22-rdf-syntax-ns#Property,not in ABCD,http://rs.tdwg.org/dwc/terms/attributes/UseWithIRI,,
2025-08-17T14:26:42-05:00,targetTaxonomicScope,http://rs.tdwg.org/eco/iri/,2024-03-26,2025-07-10,,,,,Target Taxonomic Scope (IRI),The taxonomic group targeted for sampling during the dwc:Event.,"The dwc:Event to which the ecoiri:targetTaxonomicScope refers could be at any level of hierarchy. In the case of a higher level (parent) dwc:Event, include all taxonomic groups surveyed in the child dwc:Events that contributed to the parent dwc:Event. Terms in the ecoiri: namespace are intended to be used in RDF with non-literal objects.",,http://www.w3.org/1999/02/22-rdf-syntax-ns#Property,not in ABCD,http://rs.tdwg.org/dwc/terms/attributes/UseWithIRI,,
2025-08-17T14:26:42-05:00,taxonCompletenessProtocols,http://rs.tdwg.org/eco/iri/,2024-03-26,2025-07-10,,,,,Taxon Completeness Protocols (IRI),"A method or protocol used to determine ecoiri:taxonCompletenessReported, denoted by an IRI.",This term allows users to determine how comprehensively an area has been sampled. Terms in the ecoiri: namespace are intended to be used in RDF with non-literal objects.,,http://www.w3.org/1999/02/22-rdf-syntax-ns#Property,not in ABCD,http://rs.tdwg.org/dwc/terms/attributes/UseWithIRI,,
2025-08-17T14:26:42-05:00,taxonCompletenessReported,http://rs.tdwg.org/eco/iri/,2024-03-26,2025-07-10,,,,,Taxon Completeness Reported (IRI),Statement about whether the taxonomic completeness of the dwc:Event was assessed.,"This term is meant to alert users that the inventory was conducted in such a way that all of the target taxa (the combination of ecoiri:targetTaxonomicScope and ecoiri:excludedTaxonomicScope) should have been detectable if they were present during the dwc:Event. This term can provide data users with a qualitative measure of how comprehensively an area has been surveyed, which assists in interpreting species populations, areas of occupancy, inferring species absences, etc. This term is only relevant if the dwc:Event used restricted search or open search methods. If taxonomic completeness was assessed, the methods used or an explanation of the basis of the completeness should covered by ecoiri:taxonCompletenessProtocols. Recommended best practice is to use an IRI from the controlled vocabulary designated for use with this term, listed at http://rs.tdwg.org/dwc/doc/tcr/. Terms in the ecoiri: namespace are intended to be used in RDF with non-literal objects.",`http://rs.tdwg.org/ecotcr/values/tcr01`; `http://rs.tdwg.org/ecotcr/values/tcr01`,http://www.w3.org/1999/02/22-rdf-syntax-ns#Property,not in ABCD,http://rs.tdwg.org/dwc/terms/attributes/UseWithIRI,,
2024-03-26T14:27:47-05:00,totalAreaSampledUnit,http://rs.tdwg.org/eco/iri/,2024-03-26,2024-03-26,,,,,Total Area Sampled Unit (IRI),The units associated with eco:totalAreaSampledValue,"Recommended best practice is to use an IRI from a controlled vocabulary of SI units, derived units, or other non-SI units accepted for use within the SI.",,http://www.w3.org/1999/02/22-rdf-syntax-ns#Property,not in ABCD,http://rs.tdwg.org/dwc/terms/attributes/UseWithIRI,,
