term_localName,label,rdfs_comment,dcterms_description,examples,rdf_type,tdwgutility_abcdEquivalence,tdwgutility_organizedInClass,tdwgutility_decision,tdwgutility_usageScope
subgenus,Subgenus,The full scientific name of the subgenus in which the taxon is classified.,A value for this term should be a complete subgenus name as required by the appropriate nomenclatural code.,`Abacetus (Parastygis)`; `Dicranum subgen. Orthodicranum`,http://www.w3.org/1999/02/22-rdf-syntax-ns#Property,not in ABCD,http://rs.tdwg.org/dwc/terms/Taxon,,simple
feedbackURL,Feedback URL,A uniform resource locator (URL) that points to a webpage on which a form may be submitted to gather feedback about the record.,Recommended best practice is to optionally include query strings that act to pre-populate web page form elements and communicate the context.,`https://example.com/new?title=New+issue&body=This+comment+is+about+CAN12345`,http://www.w3.org/1999/02/22-rdf-syntax-ns#Property,not in ABCD,http://rs.tdwg.org/dwc/terms/,,simple
typifiedName,Typified Name,A scientific name that is based on a type specimen.,Recommended best practice is also to indicate the dwc:typeStatus of the specimen.,`Polysiphonia amphibolis Womersley`,http://www.w3.org/1999/02/22-rdf-syntax-ns#Property,DataSets/DataSet/Units/Unit/SpecimenUnit/NomenclaturalTypeDesignations/NomenclaturalTypeDesignation/TypifiedName,http://rs.tdwg.org/dwc/terms/Identification,,simple
fundingAttributionID,Funding Attribution ID,A list (concatenated and separated) of the globally unique identifiers for the funding organizations or agencies that supported the project.,"Provide a unique identifier for the funding body, such as an identifier used in governmental or international databases. If no official identifier exists, use a persistent and unique identifier within your organization or dataset. The recommended best practice is to separate the values in a list with space vertical bar space ( | ).",`https://ror.org/00epmv149`; `https://ror.org/00epmv149 | https://ror.org/04jnzhb65`; `https://www.wikidata.org/wiki/Q13102615`,http://www.w3.org/1999/02/22-rdf-syntax-ns#Property,not in ABCD,http://rs.tdwg.org/dwc/terms/Event,,simple
projectID,Project ID,A list (concatenated and separated) of identifiers for projects that contributed to a dwc:Event.,"A projectID may be shared in multiple distinct datasets. The nature of the association can be described in the metadata project description element. This term should be used to provide a globally unique identifier (GUID) for a project, if available. This could be a DOI, URI, or any other persistent identifier that ensures a project can be uniquely distinguished from others. The recommended best practice is to separate the values in a list with space vertical bar space ( | ).",`RCN276730`; `RCN276730 | Artsproject_7-24`; `OC202405`; `https://arvenetternansen.com/`; `https://doi.org/10.3030/101180559`; `https://doi.org/10.26259/3b15eca7`,http://www.w3.org/1999/02/22-rdf-syntax-ns#Property,DataSets/DataSet/Units/Unit/Gathering/Project,http://rs.tdwg.org/dwc/terms/Event,,simple
projectTitle,Project Title,A list (concatenated and separated) of titles or names for projects that contributed to a dwc:Event.,Use this term to provide the official name or title of a project as it is commonly known and cited. Avoid abbreviations unless they are widely understood. The recommended best practice is to separate the values in a list with space vertical bar space ( | ).,`The Nansen Legacy`; `Scalidophora i Noreg`; `Arctic Deep`,http://www.w3.org/1999/02/22-rdf-syntax-ns#Property,DataSets/DataSet/Units/Unit/Gathering/Project/ProjectTitle,http://rs.tdwg.org/dwc/terms/Event,,simple
preparations,Preparations,A list (concatenated and separated) of preparations and preservation methods for a dwc:MaterialEntity.,"Recommended best practice is to separate the values in a list with space vertical bar space ( | ). This term has an equivalent in the dwciri: namespace that allows only an IRI as a value, whereas this term allows for any string literal value.",`fossil`; `cast`; `photograph`; `DNA extract`; `skin | skull | skeleton`; `whole animal (EtOH) | tissue (EDTA)`,http://www.w3.org/1999/02/22-rdf-syntax-ns#Property,DataSets/DataSet/Units/Unit/SpecimenUnit/Preparations/PreparationsText,http://rs.tdwg.org/dwc/terms/MaterialEntity,,simple
institutionID,Institution ID,An identifier for the institution having custody of the object(s) or information referred to in the record.,"For physical specimens, the recommended best practice is to use a globally unique and resolvable identifier from a collections registry such as the Research Organization Registry (ROR) or the Global GBIF Registry of Scientific Collections (https://scientific-collections.gbif.org/)",`https://ror.org/015hz7p22`; `http://grscicoll.org/institution/museum-southwestern-biology`; `https://www.gbif.org/grscicoll/institution/e3d4dcc4-81e2-444c-8a5c-41d1044b5381`,http://www.w3.org/1999/02/22-rdf-syntax-ns#Property,DataSets/DataSet/Units/Unit/SourceInstitutionID,http://rs.tdwg.org/dwc/terms/,,simple
collectionID,Collection ID,An identifier for the collection or dataset from which the record was derived.,"For physical specimens, the recommended best practice is to use a globally unique and resolvable identifier from a collections registry such as the Global Registry of Scientific Collections (https://scientific-collections.gbif.org/).",`https://scientific-collections.gbif.org/collection/fbd3ed74-5a21-4e01-b86a-33d36f032d9c`,http://www.w3.org/1999/02/22-rdf-syntax-ns#Property,DataSets/DataSet/Units/Unit/SourceID,http://rs.tdwg.org/dwc/terms/,,simple
latestEonOrHighestEonothem,Latest Eon Or Highest Eonothem,"The full name of the latest possible geochronologic eon or highest chrono-stratigraphic eonothem or the informal name (""Precambrian"") attributable to the stratigraphic horizon from which the dwc:MaterialEntity was collected.",,`Phanerozoic`; `Proterozoic`,http://www.w3.org/1999/02/22-rdf-syntax-ns#Property,not in ABCD,http://rs.tdwg.org/dwc/terms/GeologicalContext,,simple
lithostratigraphicTerms,Lithostratigraphic Terms,The combination of all lithostratigraphic names for the rock from which the dwc:MaterialEntity was collected.,,`Pleistocene-Weichselien`,http://www.w3.org/1999/02/22-rdf-syntax-ns#Property,DataSets/DataSet/Units/Unit/Gathering/Stratigraphy/LithostratigraphicTerms,http://rs.tdwg.org/dwc/terms/GeologicalContext,,simple
identifiedBy,Identified By,"A list (concatenated and separated) of names of people, groups, or organizations who assigned the dwc:Taxon to the subject.","When used in the context of an Event (such as in the Humboldt Extension), the subject consists of all of the dwc:Organisms related to the Event. Recommended best practice is to separate the values in a list with space vertical bar space ( | ). This term has an equivalent in the dwciri: namespace that allows only an IRI as a value, whereas this term allows for any string literal value.",`James L. Patton`| `Theodore Pappenfuss | Robert Macey`,http://www.w3.org/1999/02/22-rdf-syntax-ns#Property,DataSets/DataSet/Units/Unit/Identifications/Identification/Identifiers/IdentifiersText,http://rs.tdwg.org/dwc/terms/Identification,,simple
georeferenceRemarks,Georeference Remarks,"Comments or notes about the spatial description determination, explaining assumptions made in addition or opposition to the those formalized in the method referred to in dwc:georeferenceProtocol.",,`Assumed distance by road (Hwy. 101)`,http://www.w3.org/1999/02/22-rdf-syntax-ns#Property,DataSets/DataSet/Units/Unit/Gathering/SiteCoordinateSets/SiteCoordinates/GeoreferenceRemarks,http://purl.org/dc/terms/Location,,simple
acceptedNameUsage,Accepted Name Usage,"The full name, with authorship and date information if known, of the currently valid (zoological) or accepted (botanical) dwc:Taxon.","The full scientific name, with authorship and date information if known, of the accepted (botanical) or valid (zoological) name in cases where the provided dwc:scientificName is considered by the reference indicated in the dwc:nameAccordingTo property, or of the content provider, to be a synonym or misapplied name. When applied to a dwc:Organism or dwc:Occurrence, this term should be used in cases where a content provider regards the provided dwc:scientificName to be inconsistent with the taxonomic perspective of the content provider. For example, there are many discrepancies within specimen collections and observation datasets between the recorded name (e.g., the most recent identification from an expert who examined a specimen, or a field identification for an observed dwc:Organism), and the name asserted by the content provider to be taxonomically accepted.",`Tamias minimus` (valid name for `Eutamias minimus`),http://www.w3.org/1999/02/22-rdf-syntax-ns#Property,not in ABCD,http://rs.tdwg.org/dwc/terms/Taxon,,simple
geodeticDatum,Geodetic Datum,"The ellipsoid, geodetic datum, or spatial reference system (SRS) upon which the geographic coordinates given in dwc:decimalLatitude and dwc:decimalLongitude are based.","Recommended best practice is to use the EPSG code of the SRS, if known. Otherwise use a controlled vocabulary for the name or code of the geodetic datum, if known. Otherwise use a controlled vocabulary for the name or code of the ellipsoid, if known. If none of these is known, use the value `not recorded`. This term has an equivalent in the dwciri: namespace that allows only an IRI as a value, whereas this term allows for a string literal value.",`EPSG:4326`; `WGS84`; `NAD27`; `Campo Inchauspe`; `European 1950`; `Clarke 1866`; `not recorded`,http://www.w3.org/1999/02/22-rdf-syntax-ns#Property,DataSets/DataSet/Units/Unit/Gathering/SiteCoordinateSets/SiteCoordinates/CoordinatesLatLon/SpatialDatum,http://purl.org/dc/terms/Location,,simple
verbatimSRS,Verbatim SRS,"The ellipsoid, geodetic datum, or spatial reference system (SRS) upon which coordinates given in dwc:verbatimLatitude and dwc:verbatimLongitude, or dwc:verbatimCoordinates are based.","Recommended best practice is to use the EPSG code of the SRS, if known. Otherwise use a controlled vocabulary for the name or code of the geodetic datum, if known. Otherwise use a controlled vocabulary for the name or code of the ellipsoid, if known. If none of these is known, use the value `not recorded`. This term has an equivalent in the dwciri: namespace that allows only an IRI as a value, whereas this term allows for any string literal value.",`EPSG:4326`; `WGS84`; `NAD27`; `Campo Inchauspe`; `European 1950`; `Clarke 1866`; `not recorded`,http://www.w3.org/1999/02/22-rdf-syntax-ns#Property,not in ABCD,http://purl.org/dc/terms/Location,,simple
verticalDatum,Vertical Datum,The vertical datum used as the reference upon which the values in the elevation terms are based.,"Recommended best practice is to use a controlled vocabulary. This term has an equivalent in the dwciri: namespace that allows only an IRI as a value, whereas this term allows for any string literal value.",`EGM84`; `EGM96`; `EGM2008`;`PGM2000A`; `PGM2004`; `PGM2006`; `PGM2007`; `EPSG:7030`; `not recorded`,http://www.w3.org/1999/02/22-rdf-syntax-ns#Property,not in ABCD,http://purl.org/dc/terms/Location,,simple
footprintSRS,Footprint SRS,"The ellipsoid, geodetic datum, or spatial reference system (SRS) upon which the geometry given in dwc:footprintWKT is based.","Recommended best practice is to use the EPSG code of the SRS, if known. Otherwise use a controlled vocabulary for the name or code of the geodetic datum, if known. Otherwise use a controlled vocabulary for the name or code of the ellipsoid, if known. If none of these is known, use the value unknown. It is also permitted to provide the SRS in Well-Known-Text, especially if no EPSG code provides the necessary values for the attributes of the SRS. Do not use this term to describe the SRS of the dwc:decimalLatitude and dwc:decimalLongitude, nor of any verbatim coordinates - use the dwc:geodeticDatum and dwc:verbatimSRS instead. This term has an equivalent in the dwciri: namespace that allows only an IRI as a value, whereas this term allows for any string literal value.","`EPSG:4326`; `GEOGCS[""GCS_WGS_1984"", DATUM[""D_WGS_1984"", SPHEROID[""WGS_1984"",6378137,298.257223563]], PRIMEM[""Greenwich"",0], UNIT[""Degree"",0.0174532925199433]]` (WKT for the standard WGS84 Spatial Reference System EPSG:4326); `not recorded`",http://www.w3.org/1999/02/22-rdf-syntax-ns#Property,not in ABCD,http://purl.org/dc/terms/Location,,simple
digitalSpecimenID,Digital Specimen Identifier,An identifier for a particular instance of a Digital Specimen.,A Digital Specimen is defined in https://doi.org/10.3897/rio.7.e67379. A dwc:digitalSpecimenID is intended to uniquely and persistently identify a Digital Specimen. Recommended best practice is to use a DOI with machine readable metadata in the DOI record that uses a community agreed metadata profile (also known as FDO profile) for a Digital Specimen. For an example see: https://doi.org/10.3535/N75-CR4-0SM?noredirect. The identifier is for a digital information artifact (the Digital Specimen) as opposed to an identifier for a specific instance of a dwc:MaterialEntity.,`https://doi.org/10.3535/M42-Z4P-DRD`; `https://doi.org/10.3535/M42-Z4P-DRD?urlappend=/1'; `https://doi.org/10.3535/M42-Z4P-DRD?locatt=/1`;`doi:10.3535/M42-Z4P-DRD`,http://www.w3.org/1999/02/22-rdf-syntax-ns#Property,Note: /DataSets/DataSet/Units/Unit/UnitGUID could be used. A new term /DataSets/DataSet/Units/Unit/SpecimenUnit/digitalSpecimenID would make it distinguishable from URIs that identify the physical object or catalogue record.,http://rs.tdwg.org/dwc/terms/MaterialEntity,,simple
causeOfDeath,Cause Of Death,An indication of the known or suspected cause of death of a dwc:Organism.,"The cause may be due to natural causes (e.g., disease, predation), human-related activities (e.g., roadkill, pollution), or other environmental factors (e.g., extreme weather events).",`trap`; `poison`; `starvation`; `drowning`; `shooting`; `old age`; `vehicle collision`; `disease`; `herbicide`; `burning`; `infanticide`,http://www.w3.org/1999/02/22-rdf-syntax-ns#Property,not in ABCD,http://rs.tdwg.org/dwc/terms/Organism,,simple
countryCode,Country Code,The standard code for the country in which the dcterms:Location occurs.,"Recommended best practice is to use an ISO 3166-1-alpha-2 country code , or 'ZZ' (for an unknown location or a location unassignable to a single country code), or 'XZ' (for the high seas beyond national jurisdictions).",`AR`; `SV`; `XZ`; `ZZ`,http://www.w3.org/1999/02/22-rdf-syntax-ns#Property,DataSets/DataSet/Units/Unit/Gathering/Country/ISO3166Code,http://purl.org/dc/terms/Location,,simple
verbatimMeasurementType,Verbatim Measurement Type,A string representing the type of measurement or fact as it appeared in the original record.,"This term is meant to allow the capture of an unaltered original name for a measurement or fact type. This term is meant to be used in addition to dwc:measurementType, not instead of it.",`water_temp`; `Fish biomass`; `sampling net mesh size`,http://www.w3.org/1999/02/22-rdf-syntax-ns#Property,not in ABCD,http://rs.tdwg.org/dwc/terms/MeasurementOrFact,,extension
materialEntityType,Material Entity Type,A category that best matches the nature of a dwc:MaterialEntity.,"A more generic classification of a dwc:MaterialEntity than dwc:preparations. Recommended best practice is to use a controlled vocabulary. This term has an equivalent in the dwciri: namespace that allows only an IRI as a value, whereas this term allows for any string literal value.",`Macro-object`; `Micro-object`; `Oversized object`; `Cut/polished gemstone`; `Compound Specimen`; `Core`; `Mixed Materials`; `Environmental sample`; `Microscope slide`; `Spore print`; `Macrofossil`; `Mesofossil`; `Microfossil`; `Pinned object/specimen`; `Taxidermy mount`; `Blood sampling cards`; `Oversized fossil`; `Anthropogenic Artifact`,http://www.w3.org/1999/02/22-rdf-syntax-ns#Property,skos:closeMatch to /DataSets/DataSet/Units/Unit/KindOfUnit. ABCD structural considerations prevent an exactMatch.,http://rs.tdwg.org/dwc/terms/MaterialEntity,,simple
identificationReferences,Identification References,"A list (concatenated and separated) of references (publication, global unique identifier, URI) used in the dwc:Identification.","When used in the context of an Event (such as in the Humboldt Extension), the subject consists of all of the dwc:Organisms related to the Event. Recommended best practice is to separate the values in a list with space vertical bar space ( | ).","`Aves del Noroeste Patagonico. Christie et al. 2004.`; `Stebbins, R. Field Guide to Western Reptiles and Amphibians. 3rd Edition. 2003. | Irschick, D.J. and Shaffer, H.B. (1997). The polytypic species revisited: Morphological differentiation among tiger salamanders (Ambystoma tigrinum) (Amphibia: Caudata). Herpetologica, 53(1), 30-49.`",http://www.w3.org/1999/02/22-rdf-syntax-ns#Property,DataSets/DataSet/Units/Unit/Identifications/Identification/References,http://rs.tdwg.org/dwc/terms/Identification,,simple
eventDate,Event Date,"The date-time or interval during which a dwc:Event occurred. For occurrences, this is the date-time when the dwc:Event was recorded. Not suitable for a time in a geological context.",Recommended best practice is to use a date that conforms to ISO 8601-1:2019.,`1963-03-08T14:07-06:00` (8 Mar 1963 at or after 2:07pm and before 2:08pm in the time zone six hours earlier than UTC); `2009-02-20T08:40Z` (20 February 2009 at or after 8:40am and before 8:41 UTC); `2018-08-29T15:19` (29 August 2018 at or after 3:19pm and before 3:20pm local time); `1809-02-12` (within the day 12 February 1809); `1906-06` (in the month of June 1906); `1971` (in the year 1971); `2007-03-01T13:00:00Z/2008-05-11T15:30:00Z` (some time within the interval beginning 1 March 2007 at 1pm UTC and before 11 May 2008 at 3:30pm UTC); `1900/1909 (some time within the interval between the beginning of the year 1900 and before the year 1909); `2007-11-13/15` (some time in the interval between the beginning of 13 November 2007 and before 15 November 2007),http://www.w3.org/1999/02/22-rdf-syntax-ns#Property,accessible from DataSets/DataSet/Units/Unit/Gathering/ISODateTimeBegin and DataSets/DataSet/Units/Unit/Gathering/ISODateTimeEnd,http://rs.tdwg.org/dwc/terms/Event,,simple
eventTime,Event Time,The time or interval during which a dwc:Event occurred.,Recommended best practice is to use a time of day that conforms to ISO 8601-1:2019.,`14:07-06:00` (at or after 2:07pm and before 2:08pm in the time zone six hours earlier than UTC); `08:40:21Z` (at or after 8:40:21am and before 8:41:22am UTC); `13:00:00Z/15:30:00Z` (at or after 1pm and before 3:30pm UTC),http://www.w3.org/1999/02/22-rdf-syntax-ns#Property,accessible from DataSets/DataSet/Units/Unit/Gathering/ISODateTimeBegin and DataSets/DataSet/Units/Unit/Gathering/ISODateTimeEnd,http://rs.tdwg.org/dwc/terms/Event,,simple
georeferencedDate,Georeferenced Date,The date on which the dcterms:Location was georeferenced.,Recommended best practice is to use a date that conforms to ISO 8601-1:2019.,`1963-03-08T14:07-06:00` (8 Mar 1963 at or after 2:07pm and before 2:08pm in the time zone six hours earlier than UTC); `2009-02-20T08:40Z` (20 February 2009 at or after 8:40am and before 8:41 UTC); `2018-08-29T15:19` (29 August 2018 at or after 3:19pm and before 3:20pm local time); `1809-02-12` (within the day 12 February 1809); `1906-06` (in the month of June 1906); `1971` (in the year 1971); `2007-03-01T13:00:00Z/2008-05-11T15:30:00Z` (some time within the interval beginning 1 March 2007 at 1pm UTC and before 11 May 2008 at 3:30pm UTC); `1900/1909 (some time within the interval between the beginning of the year 1900 and before the year 1909); `2007-11-13/15` (some time in the interval between the beginning of 13 November 2007 and before 15 November 2007),http://www.w3.org/1999/02/22-rdf-syntax-ns#Property,not in ABCD,http://purl.org/dc/terms/Location,,simple
dateIdentified,Date Identified,The date on which the subject was determined as representing the dwc:Taxon.,Recommended best practice is to use a date that conforms to ISO 8601-1:2019.,`1963-03-08T14:07-06:00` (8 Mar 1963 at or after 2:07pm and before 2:08pm in the time zone six hours earlier than UTC); `2009-02-20T08:40Z` (20 February 2009 at or after 8:40am and before 8:41 UTC); `2018-08-29T15:19` (29 August 2018 at or after 3:19pm and before 3:20pm local time); `1809-02-12` (within the day 12 February 1809); `1906-06` (in the month of June 1906); `1971` (in the year 1971); `2007-03-01T13:00:00Z/2008-05-11T15:30:00Z` (some time within the interval beginning 1 March 2007 at 1pm UTC and before 11 May 2008 at 3:30pm UTC); `1900/1909 (some time within the interval between the beginning of the year 1900 and before the year 1909); `2007-11-13/15` (some time in the interval between the beginning of 13 November 2007 and before 15 November 2007),http://www.w3.org/1999/02/22-rdf-syntax-ns#Property,DataSets/DataSet/Units/Unit/Identifications/Identification/Date/DateText,http://rs.tdwg.org/dwc/terms/Identification,,simple
measurementDeterminedDate,Measurement Determined Date,The date on which the dwc:MeasurementOrFact was made.,Recommended best practice is to use a date that conforms to ISO 8601-1:2019.,`1963-03-08T14:07-06:00` (8 Mar 1963 at or after 2:07pm and before 2:08pm in the time zone six hours earlier than UTC); `2009-02-20T08:40Z` (20 February 2009 at or after 8:40am and before 8:41 UTC); `2018-08-29T15:19` (29 August 2018 at or after 3:19pm and before 3:20pm local time); `1809-02-12` (within the day 12 February 1809); `1906-06` (in the month of June 1906); `1971` (in the year 1971); `2007-03-01T13:00:00Z/2008-05-11T15:30:00Z` (some time within the interval beginning 1 March 2007 at 1pm UTC and before 11 May 2008 at 3:30pm UTC); `1900/1909 (some time within the interval between the beginning of the year 1900 and before the year 1909); `2007-11-13/15` (some time in the interval between the beginning of 13 November 2007 and before 15 November 2007),http://www.w3.org/1999/02/22-rdf-syntax-ns#Property,DataSets/DataSet/Units/Unit/MeasurementsOrFacts/MeasurementOrFact/MeasurementOrFactAtomised/MeasurementDateTime or DataSets/DataSet/Units/Unit/Gathering/Altitude/MeasurementOrFactAtomised/MeasurementDateTime or DataSets/DataSet/Units/Unit/Gathering/Depth/MeasurementOrFactAtomised/MeasurementDateTime or DataSets/DataSet/Units/Unit/Gathering/Height/MeasurementOrFactAtomised/MeasurementDateTime or DataSets/DataSet/Units/Unit/Gathering/SiteMeasurementsOrFacts/SiteMeasurementOrFact/MeasurementOrFactAtomised/MeasurementDateTime or DataSets/DataSet/Units/Unit/Gathering/Biotope/MeasurementsOrFacts/MeasurementOrFactAtomised/MeasurementDateTime,http://rs.tdwg.org/dwc/terms/MeasurementOrFact,,extension
relationshipEstablishedDate,Relationship Established Date,The date-time on which the relationship between the two resources was established.,Recommended best practice is to use a date that conforms to ISO 8601-1:2019.,`1963-03-08T14:07-06:00` (8 Mar 1963 at or after 2:07pm and before 2:08pm in the time zone six hours earlier than UTC); `2009-02-20T08:40Z` (20 February 2009 at or after 8:40am and before 8:41 UTC); `2018-08-29T15:19` (29 August 2018 at or after 3:19pm and before 3:20pm local time); `1809-02-12` (within the day 12 February 1809); `1906-06` (in the month of June 1906); `1971` (in the year 1971); `2007-03-01T13:00:00Z/2008-05-11T15:30:00Z` (some time within the interval beginning 1 March 2007 at 1pm UTC and before 11 May 2008 at 3:30pm UTC); `1900/1909 (some time within the interval between the beginning of the year 1900 and before the year 1909); `2007-11-13/15` (some time in the interval between the beginning of 13 November 2007 and before 15 November 2007),http://www.w3.org/1999/02/22-rdf-syntax-ns#Property,not in ABCD,http://rs.tdwg.org/dwc/terms/ResourceRelationship,,extension
discipline,Discipline,The primary branch or branches of knowledge represented by the record.,"This term can be used to classify records according to branches of knowledge. Recommended best practice is to use a controlled vocabulary and to separate the values in a list with space vertical bar space ( | ).This term has an equivalent in the dwciri: namespace that allows only an IRI as a value, whereas this term allows for any string literal value.  It is also recommended to use this field to describe specimenType in MIDS.",`Botany`; `Botany | Virology | Taxonomy`,http://www.w3.org/1999/02/22-rdf-syntax-ns#Property,not in ABCD,http://rs.tdwg.org/dwc/terms/,,simple