term_localName,label,rdfs_comment,dcterms_description,examples,rdf_type,tdwgutility_abcdEquivalence,tdwgutility_organizedInClass,tdwgutility_decision,tdwgutility_usageScope
fundingAttribution,Funding Attribution (IRI),An organization or agency that provided funding for a project.,Terms in the dwciri namespace are intended to be used in RDF with non-literal objects.,,http://www.w3.org/1999/02/22-rdf-syntax-ns#Property,not in ABCD,http://rs.tdwg.org/dwc/terms/attributes/UseWithIRI,,
identifiedBy,Identified By (IRI),"A person, group, or organization who assigned the dwc:Taxon to the subject.","When used in the context of an Event (such as in the Humboldt Extension), the subject consists of all of the dwc:Organisms related to the Event. Terms in the dwciri namespace are intended to be used in RDF with non-literal objects.",,http://www.w3.org/1999/02/22-rdf-syntax-ns#Property,not in ABCD,http://rs.tdwg.org/dwc/terms/attributes/UseWithIRI,,
geodeticDatum,Geodetic Datum (IRI),"The ellipsoid, geodetic datum, or spatial reference system (SRS) upon which the geographic coordinates given in dwc:decimalLatitude and dwc:decimalLongitude are based.","Recommended best practice is to use an IRI for the EPSG code of the SRS, if known. Otherwise use a controlled vocabulary for the name or code of the geodetic datum, if known. Otherwise use a controlled vocabulary for the name or code of the ellipsoid, if known. If none of these is known, use an IRI corresponding to the value `not recorded`.",,http://www.w3.org/1999/02/22-rdf-syntax-ns#Property,not in ABCD,http://rs.tdwg.org/dwc/terms/attributes/UseWithIRI,,
verbatimSRS,Verbatim SRS (IRI),"The ellipsoid, geodetic datum, or spatial reference system (SRS) upon which coordinates given in dwc:verbatimLatitude and dwc:verbatimLongitude, or dwc:verbatimCoordinates are based.","Recommended best practice is to use an IRI for the EPSG code of the SRS, if known. Otherwise use a controlled vocabulary IRI for the name or code of the geodetic datum, if known. Otherwise use a controlled vocabulary IRI for the name or code of the ellipsoid, if known. Otherwise use an IRI for the value corresponding to `not recorded`.",,http://www.w3.org/1999/02/22-rdf-syntax-ns#Property,not in ABCD,http://rs.tdwg.org/dwc/terms/attributes/UseWithIRI,,
footprintSRS,Footprint SRS (IRI),"The ellipsoid, geodetic datum, or spatial reference system (SRS) upon which the geometry given in dwc:footprintWKT is based.","Recommended best practice is to use an IRI for the EPSG code of the SRS, if known. Otherwise use a controlled vocabulary IRI for the name or code of the geodetic datum, if known. Otherwise use a controlled vocabulary IRI for the name or code of the ellipsoid, if known. Otherwise use an IRI for the value corresponding to `not recorded`.",,http://www.w3.org/1999/02/22-rdf-syntax-ns#Property,not in ABCD,http://rs.tdwg.org/dwc/terms/attributes/UseWithIRI,,
toDigitalSpecimen,To Digital Specimen,"Use to link a dwc:Identification instance subject to a taxonomic entity such as a taxon, taxon concept, or taxon name use.",Use to link a dwc:MaterialEntity instance subject to a Digital Specimem entity.,,http://www.w3.org/1999/02/22-rdf-syntax-ns#Property,not in ABCD,http://rs.tdwg.org/dwc/terms/attributes/UseWithIRI,,
discipline,Discipline (IRI),The primary branch or branches of knowledge represented by the record.,This term can be used to classify records according to branches of knowledge. Recommended best practice is to use a controlled vocabulary. Terms in the dwciri namespace are intended to be used in RDF with non-literal objects.,,http://www.w3.org/1999/02/22-rdf-syntax-ns#Property,not in ABCD,http://rs.tdwg.org/dwc/terms/attributes/UseWithIRI,,
