document_modified,vocabulary,vocabulary_deprecated,vocabulary_localName,label,description,vocabulary_created,vocabulary_modified,dc_creator,dcterms_license
2021-03-29T15:00:37-05:00,http://rs.tdwg.org/dwc/,,dwc/,Darwin Core basic vocabulary,This vocabulary contains Darwin Core terms suitable for use with both literal and IRI values,2008-11-19,2021-03-29,TDWG Darwin Core and RDF/OWL Task Groups,http://creativecommons.org/licenses/by/4.0/
2021-02-01T12:41:02-05:00,http://rs.tdwg.org/ac/,,ac/,Audubon Core basic vocabulary,This vocabulary contains all Audubon Core terms,2013-10-28,2021-02-01,TDWG Multimedia Resources Task Group,http://creativecommons.org/licenses/by/4.0/
2020-10-17T11:12:02-04:00,http://rs.tdwg.org/dwcem/,,dwcem/,establishmentMeans controlled vocabulary,Controlled vocabulary for the Darwin Core term establishmentMeans,2020-10-13,2020-10-13,TDWG Darwin Core Maintenance Group,http://creativecommons.org/licenses/by/4.0/
2020-10-18T01:18:25-04:00,http://rs.tdwg.org/dwcdoe/,,dwcdoe/,degreeOfEstablishment controlled vocabulary,Controlled vocabulary for the Darwin Core term degreeOfEstablishment,2020-10-13,2020-10-13,TDWG Darwin Core Maintenance Group,http://creativecommons.org/licenses/by/4.0/
2020-10-28T22:08:16-04:00,http://rs.tdwg.org/dwcpw/,,dwcpw/,pathway controlled vocabulary,Controlled vocabulary for the Darwin Core term pathway,2020-10-13,2020-10-28,TDWG Darwin Core Maintenance Group,http://creativecommons.org/licenses/by/4.0/
2020-10-18T16:59:25-04:00,http://rs.tdwg.org/acvariant/,,acvariant/,variant controlled vocabulary,Controlled vocabulary for the Audubon Core term variant,2020-10-13,2020-10-13,TDWG Audubon Core Maintenance Group,http://creativecommons.org/licenses/by/4.0/
2020-10-18T17:31:46-04:00,http://rs.tdwg.org/format/,,format/,format controlled vocabulary,Controlled vocabulary for the Dublin Core term format,2020-10-13,2020-10-13,TDWG Audubon Core Maintenance Group,http://creativecommons.org/licenses/by/4.0/
2020-10-18T19:35:49-04:00,http://rs.tdwg.org/acsubtype/,,acsubtype/,subtype controlled vocabulary,Controlled vocabulary for the Audubon Core term subtype,2020-10-13,2020-10-13,TDWG Audubon Core Maintenance Group,http://creativecommons.org/licenses/by/4.0/
