term_localName,label,rdfs_comment,skos_scopeNote,dcterms_description,examples,rdf_type,tdwgutility_organizedInClass,tdwgutility_decision,tdwgutility_layer,tdwgutility_required,tdwgutility_repeatable
serviceExpectation,Service Expectation,A term that describes what service expectations users may have of the ac:accessURI.,,"Recommended terms include online (denotes that the URL is expected to deliver the resource), authenticate (denotes that the URL delivers a login or other authentication interface requiring completion before delivery of the resource) published(non digital) (denotes that the URL is the identifier of a non-digital published work, for example a doi.) Communities should develop their own controlled vocabularies for Service Expectations.",,http://www.w3.org/1999/02/22-rdf-syntax-ns#Property,http://rs.tdwg.org/ac/terms/ServiceAccessPoint,,,No,No
commenter,Commenter,A URI denoting a person who created a comment.,Implementers and communities of practice MAY produce restrictions or recommendations on the choice of vocabularies.,"See also Reviewer Comments for the distinction between Comments and Reviewer Comments. See also the entry for ac:commenterLiteral and the section Namespaces, Prefixes and Term Names in the Audiovisual Core Term List document for discussion of the rationale for separate terms taking URI values from those taking Literal values where both are possible. Normal practice is to use the same Label if both are provided. Labels have no effect on information discovery and are only suggestions.",,http://www.w3.org/1999/02/22-rdf-syntax-ns#Property,http://rs.tdwg.org/dwc/terms/attributes/Management,,,No,No
commenterLiteral,Commenter,"The name of a person who created a comment, or the literal ""anonymous"" (= anonymously commented).",,"See also Reviewer Comments for the distinction between Comments and Reviewer Comments. See also the entry for ac:commenter and the section Namespaces, Prefixes and Term Names in the Audiovisual Core Term List document for discussion of the rationale for separate terms taking URI values from those taking Literal values where both are possible. Normal practice is to use the same Label if both are provided. Labels have no effect on information discovery and are only suggestions.",,http://www.w3.org/1999/02/22-rdf-syntax-ns#Property,http://rs.tdwg.org/dwc/terms/attributes/Management,,,No,No
hasServiceAccessPoint,Service Access Point,"In a chosen serialization (RDF, XML Schema, etc.) the potentially multiple service access points (e.g., for different resolutions of an image) might be provided in a referenced or in a nested object. This property identifies one such access point. That is, each of potentially multiple values of hasServiceAccessPoint identifies a set of representation-dependent metadata using the properties defined under the Service Access Point Vocabulary section of the Audiovisual Core Term List document.",,"Some serializations may flatten the model of service-access points by (a) dropping ac:hasServiceAccessPoint, ac:variant and ac:variantLiteral, (b) repeating properties from the Service Access Point Vocabulary and prefixing them with values of ac:variantLiteral. If such a flat serialization is necessary for services, we recommend to select from among term names of the form ""AB"" where ""A"" is one of thumbnail, trailer, lowerQuality, mediumQuality, goodQuality, bestQuality, offline and ""B"" is one of AccessURI, Format, Extent, FurtherInformationURL, LicensingException, ServiceExpectation (example: thumbnailAccessURI). Implementers in specific constraint languages such as XML Schema or RDF may wish to make Access URI and perhaps dcterms:format mandatory on instances of the service access point.",,http://www.w3.org/1999/02/22-rdf-syntax-ns#Property,http://rs.tdwg.org/dwc/terms/attributes/Management,,,No,Yes
metadataCreator,Metadata Creator,A URI representing a person or organization originally creating the resource metadata record.,,"See also the entry for ac:metadataCreatorLiteral and the section Namespaces, Prefixes and Term Names in the Audiovisual Core Term List document for discussion of the rationale for separate terms taking URI values from those taking Literal values where both are possible. Normal practice is to use the same Label if both are provided. Labels have no effect on information discovery and are only suggestions.",,http://www.w3.org/1999/02/22-rdf-syntax-ns#Property,http://purl.org/dc/terms/Agent,,,No,Yes
metadataCreatorLiteral,Metadata Creator,Name of the person or organization originally creating the resource metadata record.,,"See also the entry for ac:metadataCreator and the section Namespaces, Prefixes and Term Names in the Audiovisual Core Term List document for discussion of the rationale for separate terms taking URI values from those taking Literal values where both are possible. Normal practice is to use the same Label if both are provided. Labels have no effect on information discovery and are only suggestions.",,http://www.w3.org/1999/02/22-rdf-syntax-ns#Property,http://purl.org/dc/terms/Agent,,,No,Yes
metadataLanguage,Metadata Language,"The URI of the language of description and other metadata (but not necessarily of the image itself) , from the ISO639-2 list of URIs for ISO 3-letter language codes, http://id.loc.gov/vocabulary/iso639-2.","At least one of ac:metadataLanguage and ac:metadataLanguageLiteral MUST be supplied but, when feasible, supplying both might make the metadata more widely useful. They must specify the same language. In case of ambiguity, ac:metadataLanguage prevails.","This is NOT dcterms:language, which is about the resource, not the metadata. Metadata Language is deliberately single-valued, imposing on unstructured serializations a requirement that multi-lingual metadata be represented as separate, complete, metadata records. Audiovisual Core requires that each record also contains the language-neutral terms. In the absence of this requirement, metadata consumers would need to know which terms are language-neutral and merge these terms from all provided metadataLanguages into a single record. Metadata consumers may re-combine the information based on the dcterms:identifier that identifies the multimedia resource. Nothing in this document would, however, prevent an implementer, e. g. of an XML-Schema representation, from providing a fully hierarchical schema in which language neutral terms occur only a single time, and only the language-specific terms are repeated in a way that unambigously relates them to a metadata language. In RDF it may be a simple repetition of plain literals associated with a language (e.g., xml:lang attribute in RDF/XML). The language attribute would then be required in Audiovisual Core and would replace ac:metadataLanguage.",,http://www.w3.org/1999/02/22-rdf-syntax-ns#Property,http://rs.tdwg.org/dwc/terms/attributes/Management,,,Yes,No
metadataLanguageLiteral,Metadata Language,Language of description and other metadata (but not necessarily of the image itself) represented as an ISO639-2 three letter language code.,"ISO639-1 two-letter codes are permitted but deprecated. At least one of ac:metadataLanguage and ac:metadataLanguageLiteral MUST be supplied but, when feasible, supplying both might make the metadata more widely useful. They MUST specify the same language. In case of ambiguity, ac:metadataLanguage prevails. ","This is NOT dc:language, which is about the resource, not the metadata. Metadata Language is deliberately single-valued, imposing on unstructured serializations a requirement that multi-lingual metadata be represented as separate, complete, metadata records. Audiovisual Core requires that each record also contains the language-neutral terms. In the absence of this requirement, metadata consumers would need to know which terms are language-neutral and merge these terms from all provided metadataLanguages into a single record. Metadata consumers may re-combine the information based on the dcterms:identifier that identifies the multimedia resource. Nothing in this document would, however, prevent an implementer, e. g. of an XML-Schema representation, from providing a fully hierarchical schema in which language neutral terms occur only a single time, and only the language-specific terms are repeated in a way that unambigously relates them to a metadata language. In RDF it may be a simple repetition of plain literals associated with a language (e.g., xml:lang attribute in RDF/XML). The language attribute would then be required in Audiovisual Core and would replace ac:metadataLanguage.",,http://www.w3.org/1999/02/22-rdf-syntax-ns#Property,http://rs.tdwg.org/dwc/terms/attributes/Management,,,Yes,No
metadataProvider,Metadata Provider,URI of person or organization originally responsible for providing the resource metadata record.,,"Media resources and their metadata may be served from different institutions, e. g. in the case of aggregators adding user annotations, taxon identifications, or ratings. Compare Provider. See also the entry for ac:metadataProviderLiteral and the section Namespaces, Prefixes and Term Names in the Audiovisual Core Term List document for discussion of the rationale for separate terms taking URI values from those taking Literal values where both are possible. Normal practice is to use the same Label if both are provided. Labels have no effect on information discovery and are only suggestions.",,http://www.w3.org/1999/02/22-rdf-syntax-ns#Property,http://purl.org/dc/terms/Agent,,,No,Yes
provider,Provider,URI for person or organization responsible for presenting the media resource.,"If no separate Metadata Provider is given, this also attributes the metadata.","Media resources and their metadata may be served from different institutions, e. g. in the case of aggregators adding user annotations, taxon identifications, or ratings. See also the entry for ac:providerLiteral and the section Namespaces, Prefixes and Term Names in the Audiovisual Core Term List document for discussion of the rationale for separate terms taking URI values from those taking Literal values where both are possible. Normal practice is to use the same Label if both are provided. Labels have no effect on information discovery and are only suggestions.",,http://www.w3.org/1999/02/22-rdf-syntax-ns#Property,http://purl.org/dc/terms/Agent,,,No,No
providerLiteral,Provider,Name of the person or organization responsible for presenting the media resource.,"If no separate Metadata Provider is given, this also attributes the metadata.","Media resources and their metadata may be served from different institutions, e. g. in the case of aggregators adding user annotations, taxon identifications, or ratings. See also the entry for ac:provider and the section Namespaces, Prefixes and Term Names in the Audiovisual Core Term List document for discussion of the rationale for separate terms taking URI values from those taking Literal values where both are possible. Normal practice is to use the same Label if both are provided. Labels have no effect on information discovery and are only suggestions.",,http://www.w3.org/1999/02/22-rdf-syntax-ns#Property,http://purl.org/dc/terms/Agent,,,No,No
reviewer,Reviewer,URI for a reviewer.,"If present, then resource is peer-reviewed, even if Reviewer Comments is absent or empty. Its presence tells whether an expert in the subject featured in the media has reviewed the media item or collection and approved its metadata description; MUST display a name or the literal ""anonymous"" (= anonymously reviewed).","Provider is asserting they accept this review as competent. See also ac:reviewerLiteral and the section Namespaces, Prefixes and Term Names in the Audiovisual Core Term List document for discussion of the rationale for separate terms taking URI values from those taking Literal values where both are possible. Normal practice is to use the same Label if both are provided. Labels have no effect on information discovery and are only suggestions.",,http://www.w3.org/1999/02/22-rdf-syntax-ns#Property,http://rs.tdwg.org/dwc/terms/attributes/Management,,,No,Yes
reviewerLiteral,Reviewer,String providing the name of a reviewer.,"If present, then resource is peer-reviewed, even if Reviewer Comments is absent or empty. Its presence tells whether an expert in the subject featured in the media has reviewed the media item or collection and approved its metadata description; MUST display a name or the literal ""anonymous"" (= anonymously reviewed).","Provider is asserting they accept this review as competent. See also ac:reviewer and the section Namespaces, Prefixes and Term Names in the Audiovisual Core Term List document for discussion of the rationale for separate terms taking URI values from those taking Literal values where both are possible. Normal practice is to use the same Label if both are provided. Labels have no effect on information discovery and are only suggestions.",,http://www.w3.org/1999/02/22-rdf-syntax-ns#Property,http://rs.tdwg.org/dwc/terms/attributes/Management,,,No,Yes
subjectOrientation,Subject Orientation,"Specific orientation (= direction, view angle) of the subject represented in the media resource with respect to the acquisition device, denoted by an IRI.","Values SHOULD be selected from the Controlled Vocabulary for Audiovisual Core subjectOrientation. In text-based systems such as tables, IRI values MUST be in unabbreviated form.",,,http://www.w3.org/1999/02/22-rdf-syntax-ns#Property,http://rs.tdwg.org/dwc/terms/attributes/TaxonomicCoverage,,,No,No
subjectPart,Subject Part,"The portion or product of organism morphology, behaviour, environment, etc. that is either predominantly shown or particularly well exemplified by the media resource, denoted by an IRI.","Values SHOULD be selected from the Controlled Vocabulary for Audiovisual Core subjectPart. In text-based systems such as tables, IRI values MUST be in unabbreviated form.",,,http://www.w3.org/1999/02/22-rdf-syntax-ns#Property,http://rs.tdwg.org/dwc/terms/attributes/TaxonomicCoverage,,,No,No
subtype,Subtype (IRI),"A class, represented by an IRI, that provides for more specialization of the media item type than dcterms:type.","The subtype term MUST NOT be applied to Collection objects. However, the Description term in the Content Coverage Vocabulary might add further description to a Collection object. IRI values SHOULD be selected from the Controlled Vocabulary for Audiovisual Core subtype. Human-readable information about the Controlled Vocabulary for subtype is at http://rs.tdwg.org/ac/doc/subtype/ . In text-based systems such as tables, IRI values MUST be in unabbreviated form. When an appropriate subtype is not available in the Audiovisual Core controlled vocabulary, a term IRI that is not in a TDWG namespace MAY be used. Conforming applications MAY choose to ignore controlled values not issued by Audiovisual Core.",See ac:subtypeLiteral for usage with strings.,,http://www.w3.org/1999/02/22-rdf-syntax-ns#Property,http://rs.tdwg.org/dwc/terms/attributes/Management,,,No,Yes
subtypeLiteral,Subtype (literal),"A class, represented by a controlled value string, that provides for more specialization of the media item type than dc:type.","The subtypeLiteral term MUST NOT be applied to Collection objects. However, the Description term in the Content Coverage Vocabulary might add further description to a Collection object. Controlled string values SHOULD be selected from the Controlled Vocabulary for Audiovisual Core subtype. Human-readable information about the Controlled Vocabulary for subtype is at http://rs.tdwg.org/ac/doc/subtype/ . It is best practice to use ac:subtype instead of ac:subytpeLiteral whenever practical.",,,http://www.w3.org/1999/02/22-rdf-syntax-ns#Property,http://rs.tdwg.org/dwc/terms/attributes/Management,,,No,Yes
variant,Variant (IRI),"The category describing this Service Access Point variant, denoted by an IRI.","Values SHOULD be selected from the Controlled Vocabulary for Audiovisual Core variant. Human-readable information about the Controlled Vocabulary for variant is at http://rs.tdwg.org/ac/doc/variant/ . In text-based systems such as tables, IRI values MUST be in unabbreviated form.",,,http://www.w3.org/1999/02/22-rdf-syntax-ns#Property,http://rs.tdwg.org/ac/terms/ServiceAccessPoint,,,No,Yes
variantLiteral,Variant (literal),"The category describing this Service Access Point variant, denoted by a controlled value string.",Values SHOULD be selected from the Controlled Vocabulary for Audiovisual Core variant. Human-readable information about the Controlled Vocabulary for variant is at http://rs.tdwg.org/ac/doc/variant/ . It is best practice to use ac:variant instead of ac:variantLiteral whenever practical.,,,http://www.w3.org/1999/02/22-rdf-syntax-ns#Property,http://rs.tdwg.org/ac/terms/ServiceAccessPoint,,,No,Yes
subjectOrientationLiteral,Subject Orientation (literal),"Specific orientation (= direction, view angle) of the subject represented in the media resource with respect to the acquisition device, denoted by a controlled value string.",Values SHOULD be selected from the Controlled Vocabulary for Audiovisual Core subjectOrientation. It is best practice to use ac:subjectOrientation instead of ac:subjectOrientationLiteral whenever practical.,,,http://www.w3.org/1999/02/22-rdf-syntax-ns#Property,http://rs.tdwg.org/dwc/terms/attributes/TaxonomicCoverage,,,No,No
subjectPartLiteral,Subject Part (literal),"The portion or product of organism morphology, behaviour, environment, etc. that is either predominantly shown or particularly well exemplified by the media resource, denoted by a controlled value string.",Values SHOULD be selected from the Controlled Vocabulary for Audiovisual Core subjectPart. It is best practice to use ac:subjectPart instead of ac:subjectPartLiteral whenever practical.,,,http://www.w3.org/1999/02/22-rdf-syntax-ns#Property,http://rs.tdwg.org/dwc/terms/attributes/TaxonomicCoverage,,,No,No
