term_localName,tdwgutility_organizedInClass,label_en,label_cs,label_de,label_es,label_fr,label_ko,label_nl,label_ru,label_zh-Hans,label_zh-Hant,definition_en,definition_cs,definition_de,definition_es,definition_fr,definition_ko,definition_nl,definition_ru,definition_zh-Hans,definition_zh-Hant,usage_en,usage_cs,usage_de,usage_es,usage_fr,usage_ko,usage_nl,usage_ru,usage_zh-Hans,usage_zh-Hant,notes_en,notes_cs,notes_de,notes_es,notes_fr,notes_ko,notes_nl,notes_ru,notes_zh-Hans,notes_zh-Hant,examples_en,examples_cs,examples_de,examples_es,examples_fr,examples_ko,examples_nl,examples_ru,examples_zh-Hans,examples_zh-Hant
Address,http://rs.tdwg.org/dwc/terms/attributes/Address,Address,,,,,,,,,,A physical address for an organisational unit or person.,,,,,,,,,,,,,,,,,,,,,,,,,,,,,,,,,,,,,,,
ChronometricAge,http://rs.tdwg.org/dwc/terms/attributes/ChronometricAge,Chronometric Age,,,,,,,,,,The age of a specimen or related materials that is generated from a dating assay.,,,,,,,,,,,,,,,,,,,,"To represent a single age, enter the same value in both earliestChronometricAge and latestChronometricAge. Leaving one or both of these fields blank indicates that the value is unknown, has yet to be recorded or is not applicable to the material being described. We recommend that you do not use this class to indicate chronostratigraphy: it is intended to be used to reflect a chronometric age or range of ages determined via one or more named analytical protocols, methods or techniques.",,,,,,,,,,,,,,,,,,,
CollectionStatusHistory,http://rs.tdwg.org/dwc/terms/attributes/CollectionStatusHistory,Collection Status History,,,,,,,,,,A record of current and past statuses of the object group and the reason for status changes.,,,,,,,,,,,,,,,,,,,,"Use this class to record the history of and reason for changes in the status of the described collection. Types of status described by this class may, for example, include ownership, management, accessibility or accrual policy over time. Dates reflecting the start and end of the status described by this class should be recorded using an instance of TemporalCoverage. If temporalCoverageEndDateTime is empty, the status should be inferred to be the current status of the collection.",,,,,,,,,,,,,,,,,,,
ContactDetail,http://rs.tdwg.org/dwc/terms/attributes/ContactDetail,Contact Detail,,,,,,,,,,Details of a method by which an entity such as a Person or OrganisationalUnit may be contacted.,,,,,,,,,,,,,,,,,,,,"The Address class should be used to store physical or postal addresses. For all other types of contact details, this class should be used.",,,,,,,,,,,,,,,,,,,
EcologicalContext,http://rs.tdwg.org/dwc/terms/attributes/EcologicalContext,Ecological Context,,,,,,,,,,"The ecological and/or biogeographic classification of the region from which objects associated with the ObjectGroup were collected, or where an Event took place.",,,,,,,,,,,,,,,,,,,,"There is some conceptual overlap with the GeographicContext class with respect to geographic locations. This class should be used for biogeographic and ecological concepts, whereas for physical, political and administrative geographic locations, the GeographicContext class is more appropriate. Specific information about the habitat and ecological conditions that applied at the time that an event took place should be recorded in the `habitat` property of the Event class.",,,,,,,,,,,,,,,,,,,
Event,http://rs.tdwg.org/dwc/terms/attributes/Event,Event,,,,,,,,,,An action that occurs at some location during some time.,,,,,,,,,,,,,,,,,,,,Derived from dwc Class event (http://rs.tdwg.org/dwc/terms/version/Event-2018-09-06). This class has been defined under the ltc namespace because it only has a subset of the properties of DwC:Event. All ltc:Event properties are borrowed from and reference the dwc namespace. Examples of an Event include: A specimen collection process. A camera trap image capture. A marine trawl.,,,,,,,,,,,,,,,,,,,
GeographicContext,http://rs.tdwg.org/dwc/terms/attributes/GeographicContext,Geographic Context,,,,,,,,,,"The geographic location from which objects associated with the ObjectGroup were collected, or where an Event took place.",,,,,,,,,,,,,,,,,,,,,,,,,,,,,,,,,,,,,,,
GeologicalContext,http://rs.tdwg.org/dwc/terms/attributes/GeologicalContext,Geological Context,,,,,,,,,,"Geological information, such as stratigraphy, that qualifies a region or place.",,,,,,,,,,,,,,,,,,,,,,,,,,,,,,,,,,,,,,,
Identifier,http://rs.tdwg.org/dwc/terms/attributes/Identifier,Identifier,,,,,,,,,,"A numeric, textual value, or reference such as an IRI, that can be used to uniquely identify the object to which it is attached.",,,,,,,,,,,,,,,,,,,,"Use this class to document stable identifiers that describe the collections and associated entities being represented in the collection description. For example, person identifiers, taxon identifiers, institution identifiers, organisational unit identifiers, gazetteer identifiers. Identifiers represented by this class may be globally unique, or unique within a given context.",,,,,,,,,,,,,,,,,,,
LatimerCoreScheme,http://rs.tdwg.org/dwc/terms/attributes/LatimerCoreScheme,Latimer Core Scheme,,,,,,,,,,"A grouping of multiple ObjectGroups for a particular use case, purpose or implementation.",,,,,,,,,,,,,,,,,,,,"Where the same objects within the same collection might be described by more than one ObjectGroup for different purposes (for examples, a 'Darwin Fossil Mammals' collection description might overlap with a 'Offsite Palaeontology' collection description), this class can be used to distinguish between them and avoid double-counting of metrics in queries against the data.",,,,,,,,,,,,,,,,,,,
MeasurementOrFact,http://rs.tdwg.org/dwc/terms/attributes/MeasurementOrFact,Measurement or Fact,,,,,,,,,,"A measurement of or fact about a class within the standard, or a relationship between the ObjectGroup and an associated class.",,,,,,,,,,,,,,,,,,,,"This class can be used to apply measurements, facts or narratives to the ObjectGroup as a whole, or used to qualify the relationship between the ObjectGroup and an associated attribute. For example, an ObjectGroup may contain 100 objects, of which 40 are from Europe and 60 from Africa. In this example, one MeasurementOrFact (count of 100) would be attached to the ObjectGroup, and one to each of the two relationships between the ObjectGroup and GeographicContext (Europe: count of 40, Africa: count of 60).",,,,,,,,,,,,,,,,,,,
ObjectClassification,http://rs.tdwg.org/dwc/terms/attributes/ObjectClassification,Object Classification,,,,,,,,,,"An informal classification of the type of objects within the ObjectGroup, using a hierarchical structure.",,,,,,,,,,,,,,,,,,,,"This class is used to categorise the ObjectGroup according to an informal, self-referential hierarchy. For example, this can be used to create a hierarchy encompassing biological, geological and anthropological collections, where a single formal taxonomy isn't appropriate.",,,,,,,,,,,,,,,,,,,
ObjectGroup,http://rs.tdwg.org/dwc/terms/attributes/ObjectGroup,Object Group,,,,,,,,,,An intentionally grouped set of objects with one or more common characteristics.,,,,,,,,,,,,,,,,,,,,,,,,,,,,,,,,,,,,,,,
OrganisationalUnit,http://rs.tdwg.org/dwc/terms/attributes/OrganisationalUnit,Organisational Unit,,,,,,,,,,"A unit within an organisational hierarchy which may be at, above or below the institutional level.",,,,,,,,,,,,,,,,,,,,"This class can represent any level of organisational unit, incorporating institutions (e.g. a museum), higher units (e.g. a university to which a museum belongs) and more detailed structures (e.g the departments and divisions within a museum). It can be used to arrange these different units at different levels into a hierarchical structure. This class combines aspects of both class org:Organization (https://www.w3.org/TR/2014/REC-vocab-org-20140116/#org:Organization) and class org:OrganizationalUnit (https://www.w3.org/TR/2014/REC-vocab-org-20140116/#org:OrganizationalUnit) from the W3C Organization Ontology ORG (https://www.w3.org/TR/2014/REC-vocab-org-20140116/#overview-of-ontology). Recommended best practice is to associate a unique, persistent organisational identifier (PID) with each created organisational unit. This will allow an unambiguous and continual identification of the unit, as well as the creation of organisational hierarchies. Existing providers of PIDs for organisations are, e.g. https://grid.ac/ and https://ror.org/. The provision of organisational PIDs might be extended to intra-organisational units in the future. Properties of Class: Identifier can be used to add identifier information for organisational units.",,,,,,,,,,,,,,,,,,,
Person,http://rs.tdwg.org/dwc/terms/attributes/Person,Person,,,,,,,,,,"A person (alive, dead, undead, or fictional).",,,,,,,,,,A person (alive or dead).,,,,,,,,,,"This concept should map to the Schema.org Person class (https://schema.org/Person), and the prov:Person class (http://www.w3.org/ns/prov#Person) in the PROV ontology. In the latter, it is a subclass of prov:Agent, which through which it can map to the RDA recommendations on attribution (http://dx.doi.org/10.15497/RDA00029). The definition is appropriated from the Schema.org class.",,,,,,,,,,,,,,,,,,,
PersonRole,http://rs.tdwg.org/dwc/terms/attributes/PersonRole,Person Role,,,,,,,,,,A qualified association between a Person or OrganisationalUnit and an entity such as an ObjectGroup or MeasurementOrFact that enables the relationship to be contextualised with a specific role and time period.,,,,,,,,,,,,,,,,,,,,"This class is aligned with the prov:qualifiedAttribution property (http://www.w3.org/ns/prov#qualifiedAttribution). It should be used instead of the Activity and PersonActivity classes to link a Person or OrganisationalUnit to an entity in situations where an activity is not know or is irrelevant, for example for describing a person's role within an organisation. It is not mandatory to link to either a Person or a Role in this class, to support use cases where a role is known but the person who fulfilled it is not, and where a person is known to have been involved but the context is not. However, it's expected that at least one of the hasPerson and hasRole properties is populated.",,,,,,,,,,,,,,,,,,,
RecordLevel,http://rs.tdwg.org/dwc/terms/attributes/RecordLevel,Record Level,,,,,,,,,,The machine-actionable information profile for the collection description digital object.,,,,,,,,,,,,,,,,,,,,Linked to the RDA PID Kernel recommendation (https://www.rd-alliance.org/system/files/RDA%20Recommendation%20on%20PID%20Kernel%20Information_final.pdf),,,,,,,,,,,,,,,,,,,
Reference,http://rs.tdwg.org/dwc/terms/attributes/Reference,Reference,,,,,,,,,,A reference to external resources and information related to the class.,,,,,,,,,,,,,,,,,,,,"In Latimer Core, this class can be used to store references to publications, policies, datasets and other online resources such as websites, related to classes within the standard.",,,,,,,,,,,,,,,,,,,
ResourceRelationship,http://rs.tdwg.org/dwc/terms/attributes/ResourceRelationship,Resource Relationship,,,,,,,,,,"A relationship of one rdfs:Resource (http://www.w3.org/2000/01/rdf-schema#Resource) to another, or to a simple named concept.",,,,,,,,,,,,,,,,,,,,"Resources can be thought of as identifiable records or instances of classes and may include, but need not be limited to instances of ltc:ObjectGroup, ltc:OrganisationalUnit, ltc:Taxon, ltc:Event, ltc:GeographicContext, ltc:GeologicalContext, ltc:EcologicalContext, or ltc:ObjectClassification. In the context of Latimer Core, the main purposes of this class are 1. to define different semantic and hierarchical relationships between ObjectGroups, and 2. to support quantified and annotated relationships between ObjectGroups and other LtC classes (such as ltc:Taxon and ltc:GeographicContext) and properties (such as ltc:discipline and ltc:objectType) that describe the contents of the ObjectGroup, using the hasMeasurementOrFact property.",,,,,,,,,,,,,,,,,,,
Role,http://rs.tdwg.org/dwc/terms/attributes/Role,Role,,,,,,,,,,The function of a Person with respect to an activity or entity.,,,,,,,,,,,,,,,,,,,,"While this class contains no mandatory properties, it's recommended that at least one of the roleName and hasIdentifier properties are used to specify the intended role. Where appropriate, the use of controlled vocabularies such as the CRediT contributor roles taxonomy (https://credit.niso.org) is encouraged.",,,,,,,,,,,,,,,,,,,
SchemeMeasurementOrFact,http://rs.tdwg.org/dwc/terms/attributes/SchemeMeasurementOrFact,Scheme Measurement Or Fact,,,,,,,,,,"A type of measurement or fact used by the LatimerCoreScheme, and the rules relating to its application.",,,,,,,,,,,,,,,,,,,,"This class can be used to specify the qualitative and quantitative metrics that will be included in the LatimerCoreScheme using the MeasurementOrFact class, and dictate whether each will be mandatory and/or repeatable. This information can be used by software and queries to constrain and validate the Latimer Core dataset, and determine how and whether metrics can be aggregated and reported. The schemeMeasurementType property should correspond to the measurementType property of the MeasurementOrFact class in order to make the relevant association between the scheme definition and the stored data.",,,,,,,,,,,,,,,,,,,
SchemeTerm,http://rs.tdwg.org/dwc/terms/attributes/SchemeTerm,Scheme Term,,,,,,,,,,A Latimer Core term used by the LatimerCoreScheme and the rules relating to its application.,,,,,,,,,,,,,,,,,,,,"This class can be used to define which of the terms (classes and/or properties) within the standard (e.g. GeographicContext, Taxon, preservationMethod) are expected to be used within the scheme, and specify whether they're mandatory and/or repeatable. This information can be used by software and queries to validate the data and understand the rules by which metrics can be reported against the specified term.",,,,,,,,,,,,,,,,,,,
StorageLocation,http://rs.tdwg.org/dwc/terms/attributes/StorageLocation,Storage Location,,,,,,,,,,"A physical location (such as a building, room, cabinet or drawer) within the holding institution where objects associated with the collection description are stored or exhibited.",,,,,,,,,,,,,,,,,,,,,,,,,,,,,,,,,,,,,,,
Taxon,http://rs.tdwg.org/dwc/terms/attributes/Taxon,Taxon,,,,,,,,,,A group of organisms (sensu http://purl.obolibrary.org/obo/OBI_0100026) considered by taxonomists to form a homogeneous unit.,,,,,,,,,,,,,,,,,,,,,,,,,,,,,,,,,,,,,,,
TemporalCoverage,http://rs.tdwg.org/dwc/terms/attributes/TemporalCoverage,Temporal Coverage,,,,,,,,,,"The time period during which the related event, activity or status was occurring.",,,,,,,,,,"To represent an ongoing period of time, temporalCoverageStartDateTime should be populated and temporalCoverageEndDateTime left blank. To represent a single period in time, temporalCoverageStartDateTime and temporalCoverageEndDateTime should hold the same value.",,,,,,,,,,"This class can be used to reflect the period of time in which specified activities, events and states occurred. Examples might include the time range of the `Event` in which the objects were collected, the period during a `CollectionStatusHistory` over which the collection was actively growing, or the span of time someone was working in a particular `PersonRole`. If the time period you are trying to describe is better described by a categorical label rather than a date, `GeologicalContext`, `ChronometricAge` or `ObjectGroup.period` may be more suitable. ",,,,,,,,,,,,,,,,,,,
addressType,http://rs.tdwg.org/dwc/terms/attributes/Address,Address Type,,,,,,,,,,"A person or organization can have different addresses, for different purposes. For example, a postal address, a loan address, an address for visits and so on. This property is used to specify the kind of address.",,,,,,,,,,,,,,,,,,,,,,,,,,,,,,,,,,,,,,,
hasIdentifier,http://rs.tdwg.org/dwc/terms/attributes/Address,Has Identifier,,,,,,,,,,This property refers to one or more related instances of the Identifier class.,,,,,,,,,,,,,,,,,,,,,,,,,,,,,,,,,,,,,,,
hasIdentifier,http://rs.tdwg.org/dwc/terms/attributes/ChronometricAge,Has Identifier,,,,,,,,,,This property refers to one or more related instances of the Identifier class.,,,,,,,,,,,,,,,,,,,,,,,,,,,,,,,,,,,,,,,
hasMeasurementOrFact,http://rs.tdwg.org/dwc/terms/attributes/ChronometricAge,Has Measurement Or Fact,,,,,,,,,,This property refers to one or more related instances of the MeasurementOrFact class.,,,,,,,,,,,,,,,,,,,,,,,,,,,,,,,,,,,,,,,
hasReference,http://rs.tdwg.org/dwc/terms/attributes/ChronometricAge,Has Reference,,,,,,,,,,This property refers to one or more related instances of the Reference class.,,,,,,,,,,,,,,,,,,,,,,,,,,,,,,,,,,,,,,,
hasIdentifier,http://rs.tdwg.org/dwc/terms/attributes/CollectionStatusHistory,Has Identifier,,,,,,,,,,This property refers to one or more related instances of the Identifier class.,,,,,,,,,,,,,,,,,,,,,,,,,,,,,,,,,,,,,,,
hasMeasurementOrFact,http://rs.tdwg.org/dwc/terms/attributes/CollectionStatusHistory,Has Measurement Or Fact,,,,,,,,,,This property refers to one or more related instances of the MeasurementOrFact class.,,,,,,,,,,,,,,,,,,,,,,,,,,,,,,,,,,,,,,,
hasReference,http://rs.tdwg.org/dwc/terms/attributes/CollectionStatusHistory,Has Reference,,,,,,,,,,This property refers to one or more related instances of the Reference class.,,,,,,,,,,,,,,,,,,,,,,,,,,,,,,,,,,,,,,,
hasTemporalCoverage,http://rs.tdwg.org/dwc/terms/attributes/CollectionStatusHistory,Has Temporal Coverage,,,,,,,,,,This property refers to one or more related instances of the TemporalCoverage class.,,,,,,,,,,,,,,,,,,,,,,,,,,,,,,,,,,,,,,,
status,http://rs.tdwg.org/dwc/terms/attributes/CollectionStatusHistory,Status,,,,,,,,,,The development status of the collection during a specified period.,,,,,,,,,,,,,,,,,,,,The values/vocabularies for a status are predicated by the statusType. The in the examples mentioned terms are a cumulative list of terms associated with several different statusTypes.,,,,,,,,,,,,,,,,,,,
statusChangeReason,http://rs.tdwg.org/dwc/terms/attributes/CollectionStatusHistory,Status Change Reason,,,,,,,,,,An explanation of why the collection transitioned to the value set in the status property.,,,,,,,,,,,,,,,,,,,,statusChangeReason should be aligned with the value of statusType.,,,,,,,,,,,,,,,,,,,
statusType,http://rs.tdwg.org/dwc/terms/attributes/CollectionStatusHistory,Status Type,,,,,,,,,,A top-level classification of the different categories of status that can be applied to the collection.,,,,,,,,,,,,,,,,,,,,statusType forms the top level of a two-level hierarchy with the status property. Recommended best practice is to use a controlled vocabulary.,,,,,,,,,,,,,,,,,,,
contactDetailCategory,http://rs.tdwg.org/dwc/terms/attributes/ContactDetail,Contact Detail Category,,,,,,,,,,The method of contact to which the contact detail applies.,,,,,,,,,,,,,,,,,,,,Recommended practice is to use a controlled vocabulary.,,,,,,,,,,,,,,,,,,,
contactDetailFunction,http://rs.tdwg.org/dwc/terms/attributes/ContactDetail,Contact Detail Function,,,,,,,,,,A brief label describing the nature of the enquiry or enquiries that are appropriate to direct to the contact detail.,,,,,,,,,,,,,,,,,,,,,,,,,,,,,,,,,,,,,,,
contactDetailValue,http://rs.tdwg.org/dwc/terms/attributes/ContactDetail,Contact Detail Value,,,,,,,,,,"The value of the contact detail, such as the phone number or email address.",,,,,,,,,,,,,,,,,,,,,,,,,,,,,,,,,,,,,,,
hasIdentifier,http://rs.tdwg.org/dwc/terms/attributes/ContactDetail,Has Identifier,,,,,,,,,,This property refers to one or more related instances of the Identifier class.,,,,,,,,,,,,,,,,,,,,,,,,,,,,,,,,,,,,,,,
biogeographicRealm,http://rs.tdwg.org/dwc/terms/attributes/EcologicalContext,Biogeographic Realm,,,,,,,,,,"The broadest biogeographic division of Earth's land and marine surface, based on distributional patterns of terrestrial and marine organisms.",,,,,,,,,,,,,,,,,,,,"This term may commonly be used in a biogeographic hierarchy above marineProvince (marine only), ecoregion and ecosystem. It is recommended to use controlled vocabularies such as those adopted by the World Wildlife Fund (WWF) / Global 200 (Olson et at. 1998). ",,,,,,,,,,,,,,,,,,,
biome,http://rs.tdwg.org/dwc/terms/attributes/EcologicalContext,Biome,,,,,,,,,,A biogeographical unit consisting of a biological community that has formed in response to the physical environment in which they are found and a shared regional climate.,,,,,,,,,,,,,,,,,,,,"This property can be used to record terrestrial, freshwater and marine biomes. It is recommended to use controlled vocabularies such as those adopted by the World Wildlife Fund (WWF) / Global 200 (Olson et at. 1998). ",,,,,,,,,,,,,,,,,,,
biomeType,http://rs.tdwg.org/dwc/terms/attributes/EcologicalContext,Biome Type,,,,,,,,,,A top level classification of the type of biome from which objects were collected or where an event took place.,,,,,,,,,,,,,,,,,,,,"The biomeType is positioned at a level between the biosphere (the global sum of all ecosystems on Earth) and the more detailed terrestrial, marine and freshwater biomes. The latter should be recorded using the EcologicalContext.biome property.",,,,,,,,,,,,,,,,,,,
bioregion,http://rs.tdwg.org/dwc/terms/attributes/EcologicalContext,Bioregion,,,,,,,,,,"An ecologically and geographically defined area that is smaller than a biogeographic realm, but larger than an ecoregion or an ecosystem.",,,,,,,,,,,,,,,,,,,,"This is analagous with the marine province concept for marine regions. It is recommended to use controlled vocabularies such as those adopted by the World Wildlife Fund (WWF) / Global 200 (Olson et at. 1998), from which this concept originated. ",,,,,,,,,,,,,,,,,,,
ecoregion,http://rs.tdwg.org/dwc/terms/attributes/EcologicalContext,Ecoregion,,,,,,,,,,"An ecologically and geographically defined area that is smaller than a bioregion, which in turn is smaller than a biogeographic realm. Ecoregions cover relatively large areas of land or water, and contain characteristic, geographically distinct assemblages of natural communities and species.",,,,,,,,,,,,,,,,,,,,It is recommended to use controlled vocabularies such as those adopted by the World Wildlife Fund (WWF) / Global 200 (Olson et at. 1998).,,,,,,,,,,,,,,,,,,,
ecosystem,http://rs.tdwg.org/dwc/terms/attributes/EcologicalContext,Ecosystem,,,,,,,,,,"A specific kind of ecological classification that considers all four elements of the definition of ecosystems: a biotic component, an abiotic complex, the interactions between and within them, and the physical space that they occupy.",,,,,,,,,,,,,,,,,,,,,,,,,,,,,,,,,,,,,,,
habitat,http://rs.tdwg.org/dwc/terms/attributes/EcologicalContext,Habitat,,,,,,,,,,A description of the type of environment in which an organism lives.,,,,,,,,,,,,,,,,,,,,,,,,,,,,,,,,,,,,,,,
hasIdentifier,http://rs.tdwg.org/dwc/terms/attributes/EcologicalContext,Has Identifier,,,,,,,,,,This property refers to one or more related instances of the Identifier class.,,,,,,,,,,,,,,,,,,,,,,,,,,,,,,,,,,,,,,,
hasMeasurementOrFact,http://rs.tdwg.org/dwc/terms/attributes/EcologicalContext,Has Measurement Or Fact,,,,,,,,,,This property refers to one or more related instances of the MeasurementOrFact class.,,,,,,,,,,,,,,,,,,,,,,,,,,,,,,,,,,,,,,,
hasReference,http://rs.tdwg.org/dwc/terms/attributes/EcologicalContext,Has Reference,,,,,,,,,,This property refers to one or more related instances of the Reference class.,,,,,,,,,,,,,,,,,,,,,,,,,,,,,,,,,,,,,,,
eventName,http://rs.tdwg.org/dwc/terms/attributes/Event,Event Name,,,,,,,,,,The name commonly used to identify or refer to the event.,,,,,,,,,,,,,,,,,,,,,,,,,,,,,,,,,,,,,,,
hasEcologicalContext,http://rs.tdwg.org/dwc/terms/attributes/Event,Has Ecological Context,,,,,,,,,,This property refers to one or more related instances of the EcologicalContext class.,,,,,,,,,,,,,,,,,,,,,,,,,,,,,,,,,,,,,,,
hasGeographicContext,http://rs.tdwg.org/dwc/terms/attributes/Event,Has Geographic Context,,,,,,,,,,This property refers to one or more related instances of the GeographicContext class.,,,,,,,,,,,,,,,,,,,,,,,,,,,,,,,,,,,,,,,
hasIdentifier,http://rs.tdwg.org/dwc/terms/attributes/Event,Has Identifier,,,,,,,,,,This property refers to one or more related instances of the Identifier class.,,,,,,,,,,,,,,,,,,,,,,,,,,,,,,,,,,,,,,,
hasMeasurementOrFact,http://rs.tdwg.org/dwc/terms/attributes/Event,Has Measurement Or Fact,,,,,,,,,,This property refers to one or more related instances of the MeasurementOrFact class.,,,,,,,,,,,,,,,,,,,,,,,,,,,,,,,,,,,,,,,
hasParentEvent,http://rs.tdwg.org/dwc/terms/attributes/Event,Has Parent Event,,,,,,,,,,This property refers to one or more related parent instances of the Event class.,,,,,,,,,,This term should only contain Events that can be considered to be a parent of the current instance.,,,,,,,,,,,,,,,,,,,,,,,,,,,,,
hasPersonRole,http://rs.tdwg.org/dwc/terms/attributes/Event,Has Person Role,,,,,,,,,,This property refers to one or more related instances of the PersonRole class.,,,,,,,,,,,,,,,,,,,,,,,,,,,,,,,,,,,,,,,
hasReference,http://rs.tdwg.org/dwc/terms/attributes/Event,Has Reference,,,,,,,,,,This property refers to one or more related instances of the Reference class.,,,,,,,,,,,,,,,,,,,,,,,,,,,,,,,,,,,,,,,
hasTemporalCoverage,http://rs.tdwg.org/dwc/terms/attributes/Event,Has Temporal Coverage,,,,,,,,,,This property refers to one or more related instances of the TemporalCoverage class.,,,,,,,,,,,,,,,,,,,,,,,,,,,,,,,,,,,,,,,
hasIdentifier,http://rs.tdwg.org/dwc/terms/attributes/GeographicContext,Has Identifier,,,,,,,,,,This property refers to one or more related instances of the Identifier class.,,,,,,,,,,,,,,,,,,,,,,,,,,,,,,,,,,,,,,,
