"identifier","context","text"
"objectClassificationName:notes","Notes for Object Classification Name http://rs.tdwg.org/dwc/terms/objectClassificationName","Nom déterminé par l'utilisateur pour classer sa collection. Ce nom, qui exprime une classification attribuée, peut faire partie d'une hiérarchie qui s'autoréférence."
"alternativeCollectionName:label","Label for Alternative Collection Name http://rs.tdwg.org/dwc/terms/alternativeCollectionName","Nom Alternatif de la Collection"
"alternativeCollectionName:definition","Definition for Alternative Collection Name http://rs.tdwg.org/dwc/terms/alternativeCollectionName","Un ou plusieurs titres courts différents de celui indiqué dans ObjectGroup.collectionName, utilisés pour résumer les objets de collection contenus dans l'ObjectGroup."
"baseTypeOfObjectGroup:label","Label for Base Type Of Object Group http://rs.tdwg.org/dwc/terms/baseTypeOfObjectGroup","Type de Base du Groupe d'Objets"
"baseTypeOfObjectGroup:definition","Definition for Base Type Of Object Group http://rs.tdwg.org/dwc/terms/baseTypeOfObjectGroup","Termes de haut niveau décrivant la nature générale des objets de l'ObjectGroup."
"baseTypeOfObjectGroup:notes","Notes for Base Type Of Object Group http://rs.tdwg.org/dwc/terms/baseTypeOfObjectGroup","Pour les collections d'histoire naturelle, baseTypeOfObjectGroup décrit les types d'entités matérielles et peut limiter les valeurs disponibles dans objectType. Note pour les ObjectGroups dont baseTypeOfObjectGroup est « InformationArtefact » : les propriétés « type » suivantes peuvent inclure des termes hiérarchiques issus du Audubon Core/Dublin Core - par exemple dc:type (http://purl.org/dc/elements/1.1/type), ac:subtype / ac:subtypeLiteral (http://rs.tdwg.org/ac/terms/subtypeLiteral), ou (proposé) ac:3DResourceType."
"collectionManagementSystem:label","Label for Collection Management System http://rs.tdwg.org/dwc/terms/collectionManagementSystem","Système de Gestion de la Collection"
"collectionManagementSystem:definition","Definition for Collection Management System http://rs.tdwg.org/dwc/terms/collectionManagementSystem","Le système de gestion des collections utilisé pour détenir et gérer les données primaires des objets contenus dans l'ObjectGroup."
"collectionManagementSystem:notes","Notes for Collection Management System http://rs.tdwg.org/dwc/terms/collectionManagementSystem","Ceci doit refléter le système ou la base de données dans lequel les enregistrements au niveau de l'objet se trouvent, plutôt que la source des données de la description de la collection."
"collectionName:label","Label for Collection Name http://rs.tdwg.org/dwc/terms/collectionName","Nom de la Collection"
"collectionName:definition","Definition for Collection Name http://rs.tdwg.org/dwc/terms/collectionName","Un titre court qui résume les objets de la collection contenus dans l'ObjectGroup."
"conditionsOfAccess:label","Label for Conditions of Access http://rs.tdwg.org/dwc/terms/conditionsOfAccess","Conditions d'Accès"
"conditionsOfAccess:definition","Definition for Conditions of Access http://rs.tdwg.org/dwc/terms/conditionsOfAccess","Les informations sur les personnes autorisées à accéder à la collection concernée ou l'indication du niveau de sécurité associé à cette collection."
"conditionsOfAccess:notes","Notes for Conditions of Access http://rs.tdwg.org/dwc/terms/conditionsOfAccess","Si elle est disponible, il devrait s'agir d'une URL vers une page de règlement stable. Par exemple, https://www.fieldmuseum.org/science/research/area/fossils-meteorites/fossils-meteorites-policies."
"description:label","Label for Description http://rs.tdwg.org/dwc/terms/description","Description"
"description:definition","Definition for Description http://rs.tdwg.org/dwc/terms/description","Une description ou un récit en texte libre sur la collection."
"description:notes","Notes for Description http://rs.tdwg.org/dwc/terms/description","Ce champ sert à enregistrer des informations sur la collection dans un style narratif lisible par un humain, afin de présenter les principales caractéristiques de la collection à une personne qui n'en est pas familière. Il peut s'agir d'informations supplémentaires ou d'une reformulation d'informations contenues ailleurs dans la fiche de description de la collection - par exemple, pour des descriptions et des récits plus spécifiques et catégorisés, il convient d'utiliser la classe MeasurementOrFact."
"discipline:label","Label for Discipline http://rs.tdwg.org/dwc/terms/discipline","Discipline"
"discipline:definition","Definition for Discipline http://rs.tdwg.org/dwc/terms/discipline","Une classification de haut niveau de la discipline scientifique à laquelle les objets de la collection appartiennent ou sont liés."
"discipline:notes","Notes for Discipline http://rs.tdwg.org/dwc/terms/discipline","Il est recommandé d'utiliser un vocabulaire contrôlé qui soit également commun à d'autres collections, objets et standards d'occurrence. Une liste suggérée est disponible à https://confluence.egi.eu/display/EGIG/Scientific+Disciplines"
"hasChronometricAge:label","Label for Has Chronometric Age http://rs.tdwg.org/dwc/terms/hasChronometricAge","A pour Âge Chronométrique"
"hasChronometricAge:definition","Definition for Has Chronometric Age http://rs.tdwg.org/dwc/terms/hasChronometricAge","Cette propriété fait référence à une ou plusieurs instances associées de la classe ChronometricAge."
"hasCollectionStatusHistory:label","Label for Has Collection Status History http://rs.tdwg.org/dwc/terms/hasCollectionStatusHistory","A pour Historique des Statuts de Collection"
"hasCollectionStatusHistory:definition","Definition for Has Collection Status History http://rs.tdwg.org/dwc/terms/hasCollectionStatusHistory","Cette propriété fait référence à une ou plusieurs instances associées de la classe CollectionStatusHistory."
"hasEcologicalContext:label","Label for Has Ecological Context http://rs.tdwg.org/dwc/terms/hasEcologicalContext","A pour Contexte Écologique"
"hasEcologicalContext:definition","Definition for Has Ecological Context http://rs.tdwg.org/dwc/terms/hasEcologicalContext","Cette propriété fait référence à une ou plusieurs instances associées de la classe EcologicalContext."
"hasEvent:label","Label for Has Event http://rs.tdwg.org/dwc/terms/hasEvent","A pour Événement"
"hasEvent:definition","Definition for Has Event http://rs.tdwg.org/dwc/terms/hasEvent","Cette propriété fait référence à une ou plusieurs instances associées de la classe Event."
"hasGeographicContext:label","Label for Has Geographic Context http://rs.tdwg.org/dwc/terms/hasGeographicContext","A pour Contexte Géographique"
"hasGeographicContext:definition","Definition for Has Geographic Context http://rs.tdwg.org/dwc/terms/hasGeographicContext","Cette propriété fait référence à une ou plusieurs instances associées de la classe GeographicContext."
"hasGeologicalContext:label","Label for Has Geological Context http://rs.tdwg.org/dwc/terms/hasGeologicalContext","A pour Contexte Géologique"
"hasGeologicalContext:definition","Definition for Has Geological Context http://rs.tdwg.org/dwc/terms/hasGeologicalContext","Cette propriété fait référence à une ou plusieurs instances associées de la classe GeologicalContext."
"hasIdentifier:label","Label for Has Identifier http://rs.tdwg.org/dwc/terms/hasIdentifier","A pour Identifiant"
"hasIdentifier:definition","Definition for Has Identifier http://rs.tdwg.org/dwc/terms/hasIdentifier","Cette propriété fait référence à une ou plusieurs instances associées de la classe Identifier."
"hasMeasurementOrFact:label","Label for Has Measurement Or Fact http://rs.tdwg.org/dwc/terms/hasMeasurementOrFact","A pour Mesure ou Fait"
"hasMeasurementOrFact:definition","Definition for Has Measurement Or Fact http://rs.tdwg.org/dwc/terms/hasMeasurementOrFact","Cette propriété fait référence à une ou plusieurs instances associées de la classe MeasurementOrFact."
"hasObjectClassification:label","Label for Has Object Classification http://rs.tdwg.org/dwc/terms/hasObjectClassification","A pour Classification de l'Objet"
"hasObjectClassification:definition","Definition for Has Object Classification http://rs.tdwg.org/dwc/terms/hasObjectClassification","Cette propriété fait référence à une ou plusieurs instances associées de la classe ObjectClassification."
"hasOrganisationalUnit:label","Label for Has Organisational Unit http://rs.tdwg.org/dwc/terms/hasOrganisationalUnit","A pour entité organisationnelle"
"hasOrganisationalUnit:definition","Definition for Has Organisational Unit http://rs.tdwg.org/dwc/terms/hasOrganisationalUnit","Cette propriété fait référence à une ou plusieurs instances associées de la classe OrganisationalUnit."
"hasPersonRole:label","Label for Has Person Role http://rs.tdwg.org/dwc/terms/hasPersonRole","A pour Rôle d'une Personne"
"hasPersonRole:definition","Definition for Has Person Role http://rs.tdwg.org/dwc/terms/hasPersonRole","Cette propriété fait référence à une ou plusieurs instances associées de la classe PersonRole."
"hasReference:label","Label for Has Reference http://rs.tdwg.org/dwc/terms/hasReference","A pour Référence"
"hasReference:definition","Definition for Has Reference http://rs.tdwg.org/dwc/terms/hasReference","Cette propriété fait référence à une ou plusieurs instances associées de la classe Reference."
"hasResourceRelationship:label","Label for Has Resource Relationship http://rs.tdwg.org/dwc/terms/hasResourceRelationship","A pour Relation entre les Ressources"
"hasResourceRelationship:definition","Definition for Has Resource Relationship http://rs.tdwg.org/dwc/terms/hasResourceRelationship","Cette propriété fait référence à une ou plusieurs instances associées de la classe ResourceRelationship."
"hasStorageLocation:label","Label for Has Storage Location http://rs.tdwg.org/dwc/terms/hasStorageLocation","A pour Lieu de Stockage"
"hasStorageLocation:definition","Definition for Has Storage Location http://rs.tdwg.org/dwc/terms/hasStorageLocation","Cette propriété fait référence à une ou plusieurs instances associées de la classe StorageLocation."
"hasTaxon:label","Label for Has Taxon http://rs.tdwg.org/dwc/terms/hasTaxon","A pour Taxon"
"hasTaxon:definition","Definition for Has Taxon http://rs.tdwg.org/dwc/terms/hasTaxon","Cette propriété fait référence à une ou plusieurs instances associées de la classe Taxon."
"isCurrentCollection:label","Label for Is Current Collection http://rs.tdwg.org/dwc/terms/isCurrentCollection","Est la Collection Actuelle"
"isCurrentCollection:definition","Definition for Is Current Collection http://rs.tdwg.org/dwc/terms/isCurrentCollection","Un indicateur permettant de savoir si la collection existe toujours en tant qu'entité distincte."
"isCurrentCollection:notes","Notes for Is Current Collection http://rs.tdwg.org/dwc/terms/isCurrentCollection","Cette valeur indique si l'enregistrement décrit l'intégralité d'une collection historique connue. Si seule une partie de la collection est présente, la valeur doit être « false »."
"isKnownToContainTypes:label","Label for Is Known To Contain Types http://rs.tdwg.org/dwc/terms/isKnownToContainTypes","Est réputée contenir des types"
"isKnownToContainTypes:definition","Definition for Is Known To Contain Types http://rs.tdwg.org/dwc/terms/isKnownToContainTypes","Propriété de signalement pour indiquer que la collection est réputée inclure des spécimens types."
"isKnownToContainTypes:notes","Notes for Is Known To Contain Types http://rs.tdwg.org/dwc/terms/isKnownToContainTypes","`true` - cette collection contient des types ; `false` - cette collection ne contient pas de types"
"material:label","Label for Material http://rs.tdwg.org/dwc/terms/material","Matériel"
"material:examples","Examples for Material http://rs.tdwg.org/dwc/terms/material","`Corps biologique`, `Matériau de l'organisme (cp. objectType = `Produit de l'organisme`) `, `Cellules viables`, `Protéines`, `ARN`, `ADN`, etc."
"material:definition","Definition for Material http://rs.tdwg.org/dwc/terms/material","Material désigne la ou les substance(s) brute(s) à partir de laquelle ou desquelles l'objet est formé, en totalité ou en partie."
"material:notes","Notes for Material http://rs.tdwg.org/dwc/terms/material","Cette définition correspond à peu près au concept E57 « material » du CIDOC CRM : https://cidoc-crm.org/Entity/E57-Material/version-7.1.1. L'objet ou l'artefact peut contenir des éléments biologiques, par exemple des bijoux en ambre renfermant des insectes ou des manteaux en plumes d'oiseaux. Ce champs ne doit pas être utilisé pour des identifications taxonomiques."
"objectType:label","Label for Object Type http://rs.tdwg.org/dwc/terms/objectType","Type d'objet"
"objectType:examples","Examples for Object Type http://rs.tdwg.org/dwc/terms/objectType","si baseTypeOfObjectGroup = `MaterialEntity` : `Spécimen`, `Tissu`, `Culture`, `Bibliothèque HTS`, `Lysat`, `Echantillon environnemental`, `Extraction/préservation d'ADN/ARN`, `Lame de microscope`, `Empreinte de spores`, `Macrofossile`, `Mésofossile`, `Microfossile`, `Fossile surdimensionné` ; si typeOfObjectGroup = `Non-biological` : `Macro-objet`, `Micro-objet`, `Objet surdimensionné`, `Pierre précieuse taillée/polie`, `Core`, `Fluide`, `Matière/objet dangereux`, `Mélange` ; si baseTypeOfjectGroup = `InformationArtefact` : `Texte`, `Audio`, `Visuel`"
"objectType:definition","Definition for Object Type http://rs.tdwg.org/dwc/terms/objectType","Termes de haut niveau pour la classification des objets conservés."
"objectType:usage","Usage for Object Type http://rs.tdwg.org/dwc/terms/objectType","Une classification plus générique des éléments de la collection que celle décrite dans preparationType."
"objectType:notes","Notes for Object Type http://rs.tdwg.org/dwc/terms/objectType","Attributs pratiques permettant de classer les objets conservés. Il faut s'attendre à trouver ces types d'objets lorsque l'on accède leur lieu de stockage. Ce champs ne doit pas être utilisé pour classer les objets par taxon. La meilleure façon de le faire est d'utiliser la classe Taxon (taxonomie scientifique et noms vernaculaires) ou la classe ObjectClassification (classification informelle)."
"period:label","Label for Period http://rs.tdwg.org/dwc/terms/period","Période"
"period:definition","Definition for Period http://rs.tdwg.org/dwc/terms/period","Utilisé pour décrire les périodes préhistoriques ou historiques."
"period:usage","Usage for Period http://rs.tdwg.org/dwc/terms/period","Utilisé pour décrire la période préhistorique ou historique d'où sont issus les objets de la collection."
"period:notes","Notes for Period http://rs.tdwg.org/dwc/terms/period","Souvent utilisée pour décrire des périodes préhistoriques ou historiques. Elle décrit aussi des unités géopolitiques et des activités de peuplement humains qui sont considérées comme des cas particuliers de Period. Cependant, il n'y a pas d'hypothèses sur l'échelle des phénomènes associés. En particulier, tous les événements sont considérés comme des processus synthétiques constitués de phénomènes cohérents. Cette propriété correspond à la classe Period du modèle conceptuel de référence CIDOC-CRM (http://www.cidoc-crm.org/Entity/e4-period/version-7.1.1)."
"preparationType:label","Label for Preparation Type http://rs.tdwg.org/dwc/terms/preparationType","Type de Préparation"
"preparationType:examples","Examples for Preparation Type http://rs.tdwg.org/dwc/terms/preparationType","si objectType = `Spécimen` ou `Partie d'entité` : `Ossature`, `Oeuf`, `Pollen`, `Muscle`, `Feuille`, `Sang`, `Peau`, `Coquille`, `Bois`, . ... ; si typeObjectGroup = `fabriqué par l'Homme` : `Bol`, `Tissu`, ... ; si typeObjectGroup = `numérique` : `txt`, `jpg`, `mp4`, ... ; etc"
"preparationType:definition","Definition for Preparation Type http://rs.tdwg.org/dwc/terms/preparationType","Un terme utilisé pour classer ou décrire un objet qui indique les actions qui ont été effectuées sur ce dernier et/ou les processus auxquels il a été soumis pour le préparer à une utilisation ou à une étude scientifique."
"preparationType:usage","Usage for Preparation Type http://rs.tdwg.org/dwc/terms/preparationType","Une classification plus spécifique des éléments de la collection que celle indiquée dans objectType."
"preparationType:notes","Notes for Preparation Type http://rs.tdwg.org/dwc/terms/preparationType","Ces attributs identifient généralement les parties ou les états qui sont le résultat du processus de préparation qui a produit l'objet conservé. Il peut s'agir de la même chose que PreservationMethod (par exemple Os), mais ce n'est pas forcément le cas. Pour les collections culturelles, des termes tels que « bol », « textile » sont appropriés à ce niveau. Ce niveau ne doit pas être utilisé pour classer les objets par taxon. La meilleure façon de le faire est d'utiliser la classe Taxon (taxonomie scientifique et noms vernaculaires) ou la classe ObjectClassification (classification informelles)."
"preservationMethod:label","Label for Preservation Method http://rs.tdwg.org/dwc/terms/preservationMethod","Méthode de Conservation"
"preservationMethod:examples","Examples for Preservation Method http://rs.tdwg.org/dwc/terms/preservationMethod","`séché`, `séché_pressé`, `séché_épinglé`, `assemblage séché`, `séché - non assemblé`, `séché conservé`, `emballé`, `boîte à glissière`, `squelettisé`, `Tanné`, `Monté`, `Montage de diapositives`, `Encastré`, `Gomme_arabique`, `Cartes de prélèvement sanguin (biomédical)`, `Conservé en fluide`, `Alcool, formaldéhyde`, `Glycérine`, `EDTA`, `Congelé / cryoconservé`, `Cryopréservé / congelé - 80C`, `réfrigéré`, `séché par congélation`, `Enrobage de surface`, `Bouton SEM`, `Stase`, `Culture cellulaire`, `Culture axénique`, `Cellules viables`, `Atmosphère contrôlée`, `Conditions climatiques contrôlées`, `Conditions non climatiques contrôlées`, `Non-traitement`, etc."
"preservationMethod:definition","Definition for Preservation Method http://rs.tdwg.org/dwc/terms/preservationMethod","Un terme utilisé pour classer ou décrire un objet qui indique l'action, la mesure ou le processus principal ou le plus récent qui a été utilisé pour conserver les objets de la collection en vue d'un stockage à long terme."
"preservationMethod:usage","Usage for Preservation Method http://rs.tdwg.org/dwc/terms/preservationMethod","Dans le cadre d'une description de collection, preservationType doit être utilisé pour décrire la collection dans son ensemble"
"preservationMethod:notes","Notes for Preservation Method http://rs.tdwg.org/dwc/terms/preservationMethod","La méthode de conservation décrit généralement l'état final de stockage. Elle n'est pas destinée à être utilisée pour le procédé de fossilisation. Utiliser preservationMode pour cela. Ce champ est destiné à être utilisé lorsqu'une collection a une méthode de préservation unique ou prédominante. Le vocabulaire Arctos PART_PRESERVATION (https://arctos.database.museum/info/ctDocumentation.cfm?table=CTPART_PRESERVATION) est recommandé. Pour les feuilles d'herbier, utilisez « dried_pressed ». Si une collection d'alcool utilise des pourcentages variables, utilisez « alcohol »."
"preservationMode:label","Label for Preservation Mode http://rs.tdwg.org/dwc/terms/preservationMode","Mode de Conservation"
"preservationMode:definition","Definition for Preservation Mode http://rs.tdwg.org/dwc/terms/preservationMode","Le moyen par lequel un spécimen paléontologique a été préservé ou créé, par exemple un corps, un moulage, un moule, une trace fossile, des parties molles minéralisées, etc."
"preservationMode:usage","Usage for Preservation Mode http://rs.tdwg.org/dwc/terms/preservationMode","Sert à décrire le mode de préservation d'une collection dans son ensemble (par exemple, une collection d'ambre)."
"preservationMode:notes","Notes for Preservation Mode http://rs.tdwg.org/dwc/terms/preservationMode","Cette propriété ne doit être utilisée qu'en association avec des ObjectGroups contenant du matériel paléontologique. Elle est alignée sur le concept de preservationMode dans ABCD(EFG) (https://efg.geocase.eu/documentation/html/efg.html#element_PreservationMode_Link03032878)."
"typeOfObjectGroup:label","Label for Type Of Object Group http://rs.tdwg.org/dwc/terms/typeOfObjectGroup","Type de Groupe d'Objets"
"typeOfObjectGroup:examples","Examples for Type Of Object Group http://rs.tdwg.org/dwc/terms/typeOfObjectGroup","si baseTypeOfObjectGroup = `MaterialEntity` : `Vivant`, `Préservé`, `Fossilisé`, `Non-biologique`, `Fabriqué par l'Homme` ; si baseTypeOfObjectGroup = `InformationArtefact` : `Numérique`, `Physique`"
"typeOfObjectGroup:definition","Definition for Type Of Object Group http://rs.tdwg.org/dwc/terms/typeOfObjectGroup","Informations supplémentaires décrivant le(s) objet(s) de la collection."
"typeOfObjectGroup:notes","Notes for Type Of Object Group http://rs.tdwg.org/dwc/terms/typeOfObjectGroup","Informations de haut niveau qui permettent aux utilisateurs de trouver le groupe et/ou son (ses) objet(s) lorsqu'ils effectuent des recherches sur le web à l'aide d'attributs fréquemment utilisés. La pratique optimale recommandée est d'utiliser un vocabulaire contrôlé. Des termes tels que sol, pollen, fèces, muscle ou ADN génomique, sont actuellement placés dans preparationType."
"hasAddress:label","Label for Has Address http://rs.tdwg.org/dwc/terms/hasAddress","A pour Adresse"
"hasAddress:definition","Definition for Has Address http://rs.tdwg.org/dwc/terms/hasAddress","Cette propriété fait référence à une ou plusieurs instances associées de la classe Adress."
"hasContactDetail:label","Label for Has Contact Detail http://rs.tdwg.org/dwc/terms/hasContactDetail","A pour Coordonnées"
"hasContactDetail:definition","Definition for Has Contact Detail http://rs.tdwg.org/dwc/terms/hasContactDetail","Cette propriété fait référence à une ou plusieurs instances associées de la classe ContactDetail."
"hasIdentifier:label","Label for Has Identifier http://rs.tdwg.org/dwc/terms/hasIdentifier","A pour Identifiant"
"hasIdentifier:definition","Definition for Has Identifier http://rs.tdwg.org/dwc/terms/hasIdentifier","Cette propriété fait référence à une ou plusieurs instances associées de la classe Identifier."
"hasMeasurementOrFact:label","Label for Has Measurement Or Fact http://rs.tdwg.org/dwc/terms/hasMeasurementOrFact","A pour Mesure ou Fait"
"hasMeasurementOrFact:definition","Definition for Has Measurement Or Fact http://rs.tdwg.org/dwc/terms/hasMeasurementOrFact","Cette propriété fait référence à une ou plusieurs instances associées de la classe MeasurementOrFact."
"hasParentOrganisationalUnit:label","Label for Has Parent Organisational Unit http://rs.tdwg.org/dwc/terms/hasParentOrganisationalUnit","A pour Entité Organisationnelle Mère"
"hasParentOrganisationalUnit:definition","Definition for Has Parent Organisational Unit http://rs.tdwg.org/dwc/terms/hasParentOrganisationalUnit","Cette propriété fait référence à une ou plusieurs instances parentales de la classe OrganisationalUnit."
"hasPersonRole:label","Label for Has Person Role http://rs.tdwg.org/dwc/terms/hasPersonRole","A pour Rôle"
"hasPersonRole:definition","Definition for Has Person Role http://rs.tdwg.org/dwc/terms/hasPersonRole","Cette propriété fait référence à une ou plusieurs instances associées de la classe PersonRole."
"hasReference:label","Label for Has Reference http://rs.tdwg.org/dwc/terms/hasReference","A pour Référence"
"hasReference:definition","Definition for Has Reference http://rs.tdwg.org/dwc/terms/hasReference","Cette propriété fait référence à une ou plusieurs instances associées de la classe Reference."
"organisationalUnitName:label","Label for Organisational Unit Name http://rs.tdwg.org/dwc/terms/organisationalUnitName","Nom de l'Entité Organisationnelle"
"organisationalUnitName:definition","Definition for Organisational Unit Name http://rs.tdwg.org/dwc/terms/organisationalUnitName","Nom officiel de l'entité organisationnelle dans sa langue d'origine."
"organisationalUnitName:notes","Notes for Organisational Unit Name http://rs.tdwg.org/dwc/terms/organisationalUnitName","Répétable lorsqu'il y a plus d'une langue officielle locale requise, par exemple pour les institutions belges dont le nom officiel existe en français, en néerlandais, en allemand et en anglais. Voir « A Collection of Crosswalks from Fifteen Research Data Schemas to Schema.org » (https://www.rd-alliance.org/group/research-metadata-schemas-wg/outcomes/collection-crosswalks-fifteen-research-data-schemas) de RDA pour les passerelles pour les propriétés ayant la fonction de Nom, Titre, etc. Tenir compte de la note au niveau de la classe (Class:OrganisationalUnit) concernant l'association d'un identifiant en supplément d'un nom à l'entité organisationnelle."
"organisationalUnitType:label","Label for Organisational Unit Type http://rs.tdwg.org/dwc/terms/organisationalUnitType","Type d'Entité Organisationnelle"
"organisationalUnitType:examples","Examples for Organisational Unit Type http://rs.tdwg.org/dwc/terms/organisationalUnitType","`Département` (groupe de personnes reconnu par une organisation comme formant un groupe cohérent, désigné par l'organisation comme un département), `Division` (groupe de personnes reconnu par une organisation comme formant un groupe cohérent, désigné par l'organisation comme une division)"
