"identifier","context","text"
"measurementDerivation:http~//rs.tdwg.org/dwc/terms/attributes/MeasurementOrFact:definition","Definition for Measurement Derivation (tdwgutility_organizedInClass: http://rs.tdwg.org/dwc/terms/attributes/MeasurementOrFact) http://rs.tdwg.org/dwc/terms/measurementDerivation","Un indicateur permettant de savoir si la mesure, le fait, la caractéristique ou l'assertion appliquée à la collection a été dérivée des chiffres déclarés ou agrégée/calculée à partir de données sous-jacentes."
"measurementDerivation:http~//rs.tdwg.org/dwc/terms/attributes/MeasurementOrFact:notes","Notes for Measurement Derivation (tdwgutility_organizedInClass: http://rs.tdwg.org/dwc/terms/attributes/MeasurementOrFact) http://rs.tdwg.org/dwc/terms/measurementDerivation","S'il existe des informations plus précises sur la méthode de calcul d'une mesure ou d'un fait, elles doivent être saisies à l'aide de la propriété measurementMethod."
"measurementFactText:http~//rs.tdwg.org/dwc/terms/attributes/MeasurementOrFact:label","Label for Fact or Narrative Text (tdwgutility_organizedInClass: http://rs.tdwg.org/dwc/terms/attributes/MeasurementOrFact) http://rs.tdwg.org/dwc/terms/measurementFactText","Faits ou Texte Narratif"
"measurementFactText:http~//rs.tdwg.org/dwc/terms/attributes/MeasurementOrFact:definition","Definition for Fact or Narrative Text (tdwgutility_organizedInClass: http://rs.tdwg.org/dwc/terms/attributes/MeasurementOrFact) http://rs.tdwg.org/dwc/terms/measurementFactText","La valeur du fait qualitatif, de la caractéristique ou de l'affirmation concernant la collection."
"measurementFactText:http~//rs.tdwg.org/dwc/terms/attributes/MeasurementOrFact:notes","Notes for Fact or Narrative Text (tdwgutility_organizedInClass: http://rs.tdwg.org/dwc/terms/attributes/MeasurementOrFact) http://rs.tdwg.org/dwc/terms/measurementFactText","Cette propriété doit également être utilisée pour stocker des informations textuelles sur la collection dans un contexte particulier, telles que des récits ou des commentaires sur l'état d'avancement de la numérisation."
"hasIdentifier:http~//rs.tdwg.org/dwc/terms/attributes/ObjectClassification:label","Label for Has Identifier (tdwgutility_organizedInClass: http://rs.tdwg.org/dwc/terms/attributes/ObjectClassification) http://rs.tdwg.org/dwc/terms/hasIdentifier","A pour Identifiant"
"hasIdentifier:http~//rs.tdwg.org/dwc/terms/attributes/ObjectClassification:definition","Definition for Has Identifier (tdwgutility_organizedInClass: http://rs.tdwg.org/dwc/terms/attributes/ObjectClassification) http://rs.tdwg.org/dwc/terms/hasIdentifier","Cette propriété fait référence à une ou plusieurs instances associées de la classe Identifier."
"hasMeasurementOrFact:http~//rs.tdwg.org/dwc/terms/attributes/ObjectClassification:label","Label for Has Measurement Or Fact (tdwgutility_organizedInClass: http://rs.tdwg.org/dwc/terms/attributes/ObjectClassification) http://rs.tdwg.org/dwc/terms/hasMeasurementOrFact","A pour Mesure ou Fait"
"hasMeasurementOrFact:http~//rs.tdwg.org/dwc/terms/attributes/ObjectClassification:definition","Definition for Has Measurement Or Fact (tdwgutility_organizedInClass: http://rs.tdwg.org/dwc/terms/attributes/ObjectClassification) http://rs.tdwg.org/dwc/terms/hasMeasurementOrFact","Cette propriété fait référence à une ou plusieurs instances associées de la classe MeasurementOrFact."
"hasParentObjectClassification:http~//rs.tdwg.org/dwc/terms/attributes/ObjectClassification:label","Label for Has Parent Object Classification (tdwgutility_organizedInClass: http://rs.tdwg.org/dwc/terms/attributes/ObjectClassification) http://rs.tdwg.org/dwc/terms/hasParentObjectClassification","A pour Parent dans la Classification de l'Objet"
"hasParentObjectClassification:http~//rs.tdwg.org/dwc/terms/attributes/ObjectClassification:definition","Definition for Has Parent Object Classification (tdwgutility_organizedInClass: http://rs.tdwg.org/dwc/terms/attributes/ObjectClassification) http://rs.tdwg.org/dwc/terms/hasParentObjectClassification","Cette propriété fait référence à une ou plusieurs instances parentales de la classe ObjectClassification."
"hasReference:http~//rs.tdwg.org/dwc/terms/attributes/ObjectClassification:label","Label for Has Reference (tdwgutility_organizedInClass: http://rs.tdwg.org/dwc/terms/attributes/ObjectClassification) http://rs.tdwg.org/dwc/terms/hasReference","A pour Référence"
"hasReference:http~//rs.tdwg.org/dwc/terms/attributes/ObjectClassification:definition","Definition for Has Reference (tdwgutility_organizedInClass: http://rs.tdwg.org/dwc/terms/attributes/ObjectClassification) http://rs.tdwg.org/dwc/terms/hasReference","Cette propriété fait référence à une ou plusieurs instances associées de la classe Reference."
"isTopParent:http~//rs.tdwg.org/dwc/terms/attributes/ObjectClassification:label","Label for Is Top Parent (tdwgutility_organizedInClass: http://rs.tdwg.org/dwc/terms/attributes/ObjectClassification) http://rs.tdwg.org/dwc/terms/isTopParent","Est le Parent le plus Inclusif"
"isTopParent:http~//rs.tdwg.org/dwc/terms/attributes/ObjectClassification:definition","Definition for Is Top Parent (tdwgutility_organizedInClass: http://rs.tdwg.org/dwc/terms/attributes/ObjectClassification) http://rs.tdwg.org/dwc/terms/isTopParent","Un indicateur qui signale que l'instance actuelle de ObjectClassification se trouve au sommet de la hiérarchie représentée par plusieurs instances imbriquées de la classe."
"isTopParent:http~//rs.tdwg.org/dwc/terms/attributes/ObjectClassification:usage","Usage for Is Top Parent (tdwgutility_organizedInClass: http://rs.tdwg.org/dwc/terms/attributes/ObjectClassification) http://rs.tdwg.org/dwc/terms/isTopParent","Si ce terme est utilisé, il doit être mis à `true` dans l'instance d'ObjectClassification qui représente le plus haut niveau d'une hiérarchie et à `false` dans les autres. Si la direction de la hiérarchie est évidente ou si elle n'est pas significative, ce terme ne doit pas être renseigné. "
"objectClassificationLevel:http~//rs.tdwg.org/dwc/terms/attributes/ObjectClassification:label","Label for Object Classification Level (tdwgutility_organizedInClass: http://rs.tdwg.org/dwc/terms/attributes/ObjectClassification) http://rs.tdwg.org/dwc/terms/objectClassificationLevel","Niveau de Classification de l'Objet"
"objectClassificationLevel:http~//rs.tdwg.org/dwc/terms/attributes/ObjectClassification:definition","Definition for Object Classification Level (tdwgutility_organizedInClass: http://rs.tdwg.org/dwc/terms/attributes/ObjectClassification) http://rs.tdwg.org/dwc/terms/objectClassificationLevel","Le niveau de l'ObjectClassification dans la hiérarchie."
"objectClassificationLevel:http~//rs.tdwg.org/dwc/terms/attributes/ObjectClassification:notes","Notes for Object Classification Level (tdwgutility_organizedInClass: http://rs.tdwg.org/dwc/terms/attributes/ObjectClassification) http://rs.tdwg.org/dwc/terms/objectClassificationLevel","Il incombe à l'utilisateur de nommer les niveaux correspondant au système de classification hiérarchique qu'il est en train de définir."
"objectClassificationName:http~//rs.tdwg.org/dwc/terms/attributes/ObjectClassification:label","Label for Object Classification Name (tdwgutility_organizedInClass: http://rs.tdwg.org/dwc/terms/attributes/ObjectClassification) http://rs.tdwg.org/dwc/terms/objectClassificationName","Nom de la Classification de l'Objet"
"objectClassificationName:http~//rs.tdwg.org/dwc/terms/attributes/ObjectClassification:definition","Definition for Object Classification Name (tdwgutility_organizedInClass: http://rs.tdwg.org/dwc/terms/attributes/ObjectClassification) http://rs.tdwg.org/dwc/terms/objectClassificationName","Titre bref décrivant cet objetClassification en tant que classe, unité ou groupe."
"objectClassificationName:http~//rs.tdwg.org/dwc/terms/attributes/ObjectClassification:notes","Notes for Object Classification Name (tdwgutility_organizedInClass: http://rs.tdwg.org/dwc/terms/attributes/ObjectClassification) http://rs.tdwg.org/dwc/terms/objectClassificationName","Nom déterminé par l'utilisateur pour classer sa collection. Ce nom, qui exprime une classification attribuée, peut faire partie d'une hiérarchie qui s'autoréférence."
"alternativeCollectionName:http~//rs.tdwg.org/dwc/terms/attributes/ObjectGroup:label","Label for Alternative Collection Name (tdwgutility_organizedInClass: http://rs.tdwg.org/dwc/terms/attributes/ObjectGroup) http://rs.tdwg.org/dwc/terms/alternativeCollectionName","Nom Alternatif de la Collection"
"alternativeCollectionName:http~//rs.tdwg.org/dwc/terms/attributes/ObjectGroup:definition","Definition for Alternative Collection Name (tdwgutility_organizedInClass: http://rs.tdwg.org/dwc/terms/attributes/ObjectGroup) http://rs.tdwg.org/dwc/terms/alternativeCollectionName","Un ou plusieurs titres courts différents de celui indiqué dans ObjectGroup.collectionName, utilisés pour résumer les objets de collection contenus dans l'ObjectGroup."
"baseTypeOfObjectGroup:http~//rs.tdwg.org/dwc/terms/attributes/ObjectGroup:label","Label for Base Type Of Object Group (tdwgutility_organizedInClass: http://rs.tdwg.org/dwc/terms/attributes/ObjectGroup) http://rs.tdwg.org/dwc/terms/baseTypeOfObjectGroup","Type de Base du Groupe d'Objets"
"baseTypeOfObjectGroup:http~//rs.tdwg.org/dwc/terms/attributes/ObjectGroup:definition","Definition for Base Type Of Object Group (tdwgutility_organizedInClass: http://rs.tdwg.org/dwc/terms/attributes/ObjectGroup) http://rs.tdwg.org/dwc/terms/baseTypeOfObjectGroup","Termes de haut niveau décrivant la nature générale des objets de l'ObjectGroup."
"baseTypeOfObjectGroup:http~//rs.tdwg.org/dwc/terms/attributes/ObjectGroup:notes","Notes for Base Type Of Object Group (tdwgutility_organizedInClass: http://rs.tdwg.org/dwc/terms/attributes/ObjectGroup) http://rs.tdwg.org/dwc/terms/baseTypeOfObjectGroup","Pour les collections d'histoire naturelle, baseTypeOfObjectGroup décrit les types d'entités matérielles et peut limiter les valeurs disponibles dans objectType. Note pour les ObjectGroups dont baseTypeOfObjectGroup est « InformationArtefact » : les propriétés « type » suivantes peuvent inclure des termes hiérarchiques issus du Audubon Core/Dublin Core - par exemple dc:type (http://purl.org/dc/elements/1.1/type), ac:subtype / ac:subtypeLiteral (http://rs.tdwg.org/ac/terms/subtypeLiteral), ou (proposé) ac:3DResourceType."
"collectionManagementSystem:http~//rs.tdwg.org/dwc/terms/attributes/ObjectGroup:label","Label for Collection Management System (tdwgutility_organizedInClass: http://rs.tdwg.org/dwc/terms/attributes/ObjectGroup) http://rs.tdwg.org/dwc/terms/collectionManagementSystem","Système de Gestion de la Collection"
"collectionManagementSystem:http~//rs.tdwg.org/dwc/terms/attributes/ObjectGroup:definition","Definition for Collection Management System (tdwgutility_organizedInClass: http://rs.tdwg.org/dwc/terms/attributes/ObjectGroup) http://rs.tdwg.org/dwc/terms/collectionManagementSystem","Le système de gestion des collections utilisé pour détenir et gérer les données primaires des objets contenus dans l'ObjectGroup."
"collectionManagementSystem:http~//rs.tdwg.org/dwc/terms/attributes/ObjectGroup:notes","Notes for Collection Management System (tdwgutility_organizedInClass: http://rs.tdwg.org/dwc/terms/attributes/ObjectGroup) http://rs.tdwg.org/dwc/terms/collectionManagementSystem","Ceci doit refléter le système ou la base de données dans lequel les enregistrements au niveau de l'objet se trouvent, plutôt que la source des données de la description de la collection."
"collectionName:http~//rs.tdwg.org/dwc/terms/attributes/ObjectGroup:label","Label for Collection Name (tdwgutility_organizedInClass: http://rs.tdwg.org/dwc/terms/attributes/ObjectGroup) http://rs.tdwg.org/dwc/terms/collectionName","Nom de la Collection"
"collectionName:http~//rs.tdwg.org/dwc/terms/attributes/ObjectGroup:definition","Definition for Collection Name (tdwgutility_organizedInClass: http://rs.tdwg.org/dwc/terms/attributes/ObjectGroup) http://rs.tdwg.org/dwc/terms/collectionName","Un titre court qui résume les objets de la collection contenus dans l'ObjectGroup."
"conditionsOfAccess:http~//rs.tdwg.org/dwc/terms/attributes/ObjectGroup:label","Label for Conditions of Access (tdwgutility_organizedInClass: http://rs.tdwg.org/dwc/terms/attributes/ObjectGroup) http://rs.tdwg.org/dwc/terms/conditionsOfAccess","Conditions d'Accès"
"conditionsOfAccess:http~//rs.tdwg.org/dwc/terms/attributes/ObjectGroup:definition","Definition for Conditions of Access (tdwgutility_organizedInClass: http://rs.tdwg.org/dwc/terms/attributes/ObjectGroup) http://rs.tdwg.org/dwc/terms/conditionsOfAccess","Les informations sur les personnes autorisées à accéder à la collection concernée ou l'indication du niveau de sécurité associé à cette collection."
"conditionsOfAccess:http~//rs.tdwg.org/dwc/terms/attributes/ObjectGroup:notes","Notes for Conditions of Access (tdwgutility_organizedInClass: http://rs.tdwg.org/dwc/terms/attributes/ObjectGroup) http://rs.tdwg.org/dwc/terms/conditionsOfAccess","Si elle est disponible, il devrait s'agir d'une URL vers une page de règlement stable. Par exemple, https://www.fieldmuseum.org/science/research/area/fossils-meteorites/fossils-meteorites-policies."
"description:http~//rs.tdwg.org/dwc/terms/attributes/ObjectGroup:label","Label for Description (tdwgutility_organizedInClass: http://rs.tdwg.org/dwc/terms/attributes/ObjectGroup) http://rs.tdwg.org/dwc/terms/description","Description"
"description:http~//rs.tdwg.org/dwc/terms/attributes/ObjectGroup:definition","Definition for Description (tdwgutility_organizedInClass: http://rs.tdwg.org/dwc/terms/attributes/ObjectGroup) http://rs.tdwg.org/dwc/terms/description","Une description ou un récit en texte libre sur la collection."
"description:http~//rs.tdwg.org/dwc/terms/attributes/ObjectGroup:notes","Notes for Description (tdwgutility_organizedInClass: http://rs.tdwg.org/dwc/terms/attributes/ObjectGroup) http://rs.tdwg.org/dwc/terms/description","Ce champ sert à enregistrer des informations sur la collection dans un style narratif lisible par un humain, afin de présenter les principales caractéristiques de la collection à une personne qui n'en est pas familière. Il peut s'agir d'informations supplémentaires ou d'une reformulation d'informations contenues ailleurs dans la fiche de description de la collection - par exemple, pour des descriptions et des récits plus spécifiques et catégorisés, il convient d'utiliser la classe MeasurementOrFact."
"discipline:http~//rs.tdwg.org/dwc/terms/attributes/ObjectGroup:label","Label for Discipline (tdwgutility_organizedInClass: http://rs.tdwg.org/dwc/terms/attributes/ObjectGroup) http://rs.tdwg.org/dwc/terms/discipline","Discipline"
"discipline:http~//rs.tdwg.org/dwc/terms/attributes/ObjectGroup:definition","Definition for Discipline (tdwgutility_organizedInClass: http://rs.tdwg.org/dwc/terms/attributes/ObjectGroup) http://rs.tdwg.org/dwc/terms/discipline","Une classification de haut niveau de la discipline scientifique à laquelle les objets de la collection appartiennent ou sont liés."
"discipline:http~//rs.tdwg.org/dwc/terms/attributes/ObjectGroup:notes","Notes for Discipline (tdwgutility_organizedInClass: http://rs.tdwg.org/dwc/terms/attributes/ObjectGroup) http://rs.tdwg.org/dwc/terms/discipline","Il est recommandé d'utiliser un vocabulaire contrôlé qui soit également commun à d'autres collections, objets et standards d'occurrence. Une liste suggérée est disponible à https://confluence.egi.eu/display/EGIG/Scientific+Disciplines"
"hasChronometricAge:http~//rs.tdwg.org/dwc/terms/attributes/ObjectGroup:label","Label for Has Chronometric Age (tdwgutility_organizedInClass: http://rs.tdwg.org/dwc/terms/attributes/ObjectGroup) http://rs.tdwg.org/dwc/terms/hasChronometricAge","A pour Âge Chronométrique"
"hasChronometricAge:http~//rs.tdwg.org/dwc/terms/attributes/ObjectGroup:definition","Definition for Has Chronometric Age (tdwgutility_organizedInClass: http://rs.tdwg.org/dwc/terms/attributes/ObjectGroup) http://rs.tdwg.org/dwc/terms/hasChronometricAge","Cette propriété fait référence à une ou plusieurs instances associées de la classe ChronometricAge."
"hasCollectionStatusHistory:http~//rs.tdwg.org/dwc/terms/attributes/ObjectGroup:label","Label for Has Collection Status History (tdwgutility_organizedInClass: http://rs.tdwg.org/dwc/terms/attributes/ObjectGroup) http://rs.tdwg.org/dwc/terms/hasCollectionStatusHistory","A pour Historique des Statuts de Collection"
"hasCollectionStatusHistory:http~//rs.tdwg.org/dwc/terms/attributes/ObjectGroup:definition","Definition for Has Collection Status History (tdwgutility_organizedInClass: http://rs.tdwg.org/dwc/terms/attributes/ObjectGroup) http://rs.tdwg.org/dwc/terms/hasCollectionStatusHistory","Cette propriété fait référence à une ou plusieurs instances associées de la classe CollectionStatusHistory."
"hasEcologicalContext:http~//rs.tdwg.org/dwc/terms/attributes/ObjectGroup:label","Label for Has Ecological Context (tdwgutility_organizedInClass: http://rs.tdwg.org/dwc/terms/attributes/ObjectGroup) http://rs.tdwg.org/dwc/terms/hasEcologicalContext","A pour Contexte Écologique"
"hasEcologicalContext:http~//rs.tdwg.org/dwc/terms/attributes/ObjectGroup:definition","Definition for Has Ecological Context (tdwgutility_organizedInClass: http://rs.tdwg.org/dwc/terms/attributes/ObjectGroup) http://rs.tdwg.org/dwc/terms/hasEcologicalContext","Cette propriété fait référence à une ou plusieurs instances associées de la classe EcologicalContext."
"hasEvent:http~//rs.tdwg.org/dwc/terms/attributes/ObjectGroup:label","Label for Has Event (tdwgutility_organizedInClass: http://rs.tdwg.org/dwc/terms/attributes/ObjectGroup) http://rs.tdwg.org/dwc/terms/hasEvent","A pour Événement"
"hasEvent:http~//rs.tdwg.org/dwc/terms/attributes/ObjectGroup:definition","Definition for Has Event (tdwgutility_organizedInClass: http://rs.tdwg.org/dwc/terms/attributes/ObjectGroup) http://rs.tdwg.org/dwc/terms/hasEvent","Cette propriété fait référence à une ou plusieurs instances associées de la classe Event."
"hasGeographicContext:http~//rs.tdwg.org/dwc/terms/attributes/ObjectGroup:label","Label for Has Geographic Context (tdwgutility_organizedInClass: http://rs.tdwg.org/dwc/terms/attributes/ObjectGroup) http://rs.tdwg.org/dwc/terms/hasGeographicContext","A pour Contexte Géographique"
"hasGeographicContext:http~//rs.tdwg.org/dwc/terms/attributes/ObjectGroup:definition","Definition for Has Geographic Context (tdwgutility_organizedInClass: http://rs.tdwg.org/dwc/terms/attributes/ObjectGroup) http://rs.tdwg.org/dwc/terms/hasGeographicContext","Cette propriété fait référence à une ou plusieurs instances associées de la classe GeographicContext."
"hasGeologicalContext:http~//rs.tdwg.org/dwc/terms/attributes/ObjectGroup:label","Label for Has Geological Context (tdwgutility_organizedInClass: http://rs.tdwg.org/dwc/terms/attributes/ObjectGroup) http://rs.tdwg.org/dwc/terms/hasGeologicalContext","A pour Contexte Géologique"
"hasGeologicalContext:http~//rs.tdwg.org/dwc/terms/attributes/ObjectGroup:definition","Definition for Has Geological Context (tdwgutility_organizedInClass: http://rs.tdwg.org/dwc/terms/attributes/ObjectGroup) http://rs.tdwg.org/dwc/terms/hasGeologicalContext","Cette propriété fait référence à une ou plusieurs instances associées de la classe GeologicalContext."
"hasIdentifier:http~//rs.tdwg.org/dwc/terms/attributes/ObjectGroup:label","Label for Has Identifier (tdwgutility_organizedInClass: http://rs.tdwg.org/dwc/terms/attributes/ObjectGroup) http://rs.tdwg.org/dwc/terms/hasIdentifier","A pour Identifiant"
"hasIdentifier:http~//rs.tdwg.org/dwc/terms/attributes/ObjectGroup:definition","Definition for Has Identifier (tdwgutility_organizedInClass: http://rs.tdwg.org/dwc/terms/attributes/ObjectGroup) http://rs.tdwg.org/dwc/terms/hasIdentifier","Cette propriété fait référence à une ou plusieurs instances associées de la classe Identifier."
"hasMeasurementOrFact:http~//rs.tdwg.org/dwc/terms/attributes/ObjectGroup:label","Label for Has Measurement Or Fact (tdwgutility_organizedInClass: http://rs.tdwg.org/dwc/terms/attributes/ObjectGroup) http://rs.tdwg.org/dwc/terms/hasMeasurementOrFact","A pour Mesure ou Fait"
"hasMeasurementOrFact:http~//rs.tdwg.org/dwc/terms/attributes/ObjectGroup:definition","Definition for Has Measurement Or Fact (tdwgutility_organizedInClass: http://rs.tdwg.org/dwc/terms/attributes/ObjectGroup) http://rs.tdwg.org/dwc/terms/hasMeasurementOrFact","Cette propriété fait référence à une ou plusieurs instances associées de la classe MeasurementOrFact."
"hasObjectClassification:http~//rs.tdwg.org/dwc/terms/attributes/ObjectGroup:label","Label for Has Object Classification (tdwgutility_organizedInClass: http://rs.tdwg.org/dwc/terms/attributes/ObjectGroup) http://rs.tdwg.org/dwc/terms/hasObjectClassification","A pour Classification de l'Objet"
"hasObjectClassification:http~//rs.tdwg.org/dwc/terms/attributes/ObjectGroup:definition","Definition for Has Object Classification (tdwgutility_organizedInClass: http://rs.tdwg.org/dwc/terms/attributes/ObjectGroup) http://rs.tdwg.org/dwc/terms/hasObjectClassification","Cette propriété fait référence à une ou plusieurs instances associées de la classe ObjectClassification."
"hasOrganisationalUnit:http~//rs.tdwg.org/dwc/terms/attributes/ObjectGroup:label","Label for Has Organisational Unit (tdwgutility_organizedInClass: http://rs.tdwg.org/dwc/terms/attributes/ObjectGroup) http://rs.tdwg.org/dwc/terms/hasOrganisationalUnit","A pour entité organisationnelle"
"hasOrganisationalUnit:http~//rs.tdwg.org/dwc/terms/attributes/ObjectGroup:definition","Definition for Has Organisational Unit (tdwgutility_organizedInClass: http://rs.tdwg.org/dwc/terms/attributes/ObjectGroup) http://rs.tdwg.org/dwc/terms/hasOrganisationalUnit","Cette propriété fait référence à une ou plusieurs instances associées de la classe OrganisationalUnit."
"hasPersonRole:http~//rs.tdwg.org/dwc/terms/attributes/ObjectGroup:label","Label for Has Person Role (tdwgutility_organizedInClass: http://rs.tdwg.org/dwc/terms/attributes/ObjectGroup) http://rs.tdwg.org/dwc/terms/hasPersonRole","A pour Rôle d'une Personne"
"hasPersonRole:http~//rs.tdwg.org/dwc/terms/attributes/ObjectGroup:definition","Definition for Has Person Role (tdwgutility_organizedInClass: http://rs.tdwg.org/dwc/terms/attributes/ObjectGroup) http://rs.tdwg.org/dwc/terms/hasPersonRole","Cette propriété fait référence à une ou plusieurs instances associées de la classe PersonRole."
"hasReference:http~//rs.tdwg.org/dwc/terms/attributes/ObjectGroup:label","Label for Has Reference (tdwgutility_organizedInClass: http://rs.tdwg.org/dwc/terms/attributes/ObjectGroup) http://rs.tdwg.org/dwc/terms/hasReference","A pour Référence"
"hasReference:http~//rs.tdwg.org/dwc/terms/attributes/ObjectGroup:definition","Definition for Has Reference (tdwgutility_organizedInClass: http://rs.tdwg.org/dwc/terms/attributes/ObjectGroup) http://rs.tdwg.org/dwc/terms/hasReference","Cette propriété fait référence à une ou plusieurs instances associées de la classe Reference."
"hasResourceRelationship:http~//rs.tdwg.org/dwc/terms/attributes/ObjectGroup:label","Label for Has Resource Relationship (tdwgutility_organizedInClass: http://rs.tdwg.org/dwc/terms/attributes/ObjectGroup) http://rs.tdwg.org/dwc/terms/hasResourceRelationship","A pour Relation entre les Ressources"
"hasResourceRelationship:http~//rs.tdwg.org/dwc/terms/attributes/ObjectGroup:definition","Definition for Has Resource Relationship (tdwgutility_organizedInClass: http://rs.tdwg.org/dwc/terms/attributes/ObjectGroup) http://rs.tdwg.org/dwc/terms/hasResourceRelationship","Cette propriété fait référence à une ou plusieurs instances associées de la classe ResourceRelationship."
"hasStorageLocation:http~//rs.tdwg.org/dwc/terms/attributes/ObjectGroup:label","Label for Has Storage Location (tdwgutility_organizedInClass: http://rs.tdwg.org/dwc/terms/attributes/ObjectGroup) http://rs.tdwg.org/dwc/terms/hasStorageLocation","A pour Lieu de Stockage"
"hasStorageLocation:http~//rs.tdwg.org/dwc/terms/attributes/ObjectGroup:definition","Definition for Has Storage Location (tdwgutility_organizedInClass: http://rs.tdwg.org/dwc/terms/attributes/ObjectGroup) http://rs.tdwg.org/dwc/terms/hasStorageLocation","Cette propriété fait référence à une ou plusieurs instances associées de la classe StorageLocation."
"hasTaxon:http~//rs.tdwg.org/dwc/terms/attributes/ObjectGroup:label","Label for Has Taxon (tdwgutility_organizedInClass: http://rs.tdwg.org/dwc/terms/attributes/ObjectGroup) http://rs.tdwg.org/dwc/terms/hasTaxon","A pour Taxon"
"hasTaxon:http~//rs.tdwg.org/dwc/terms/attributes/ObjectGroup:definition","Definition for Has Taxon (tdwgutility_organizedInClass: http://rs.tdwg.org/dwc/terms/attributes/ObjectGroup) http://rs.tdwg.org/dwc/terms/hasTaxon","Cette propriété fait référence à une ou plusieurs instances associées de la classe Taxon."
"isCurrentCollection:http~//rs.tdwg.org/dwc/terms/attributes/ObjectGroup:label","Label for Is Current Collection (tdwgutility_organizedInClass: http://rs.tdwg.org/dwc/terms/attributes/ObjectGroup) http://rs.tdwg.org/dwc/terms/isCurrentCollection","Est la Collection Actuelle"
"isCurrentCollection:http~//rs.tdwg.org/dwc/terms/attributes/ObjectGroup:definition","Definition for Is Current Collection (tdwgutility_organizedInClass: http://rs.tdwg.org/dwc/terms/attributes/ObjectGroup) http://rs.tdwg.org/dwc/terms/isCurrentCollection","Un indicateur permettant de savoir si la collection existe toujours en tant qu'entité distincte."
