"identifier","context","text"
"contactDetailCategory:definition","Definition for Contact Detail Category http://rs.tdwg.org/dwc/terms/contactDetailCategory","La méthode de contact à laquelle se rapporte la coordonnée."
"contactDetailCategory:notes","Notes for Contact Detail Category http://rs.tdwg.org/dwc/terms/contactDetailCategory","La pratique optimale recommandée est d'utiliser un vocabulaire contrôlé."
"contactDetailFunction:label","Label for Contact Detail Function http://rs.tdwg.org/dwc/terms/contactDetailFunction","Rôle des Coordonnées de Contact"
"contactDetailFunction:definition","Definition for Contact Detail Function http://rs.tdwg.org/dwc/terms/contactDetailFunction","Une brève indication de la nature de la demande ou des demandes qu'il convient d'adresser à la personne de contact."
"contactDetailValue:label","Label for Contact Detail Value http://rs.tdwg.org/dwc/terms/contactDetailValue","Valeur des Coordonnées de Contact"
"contactDetailValue:definition","Definition for Contact Detail Value http://rs.tdwg.org/dwc/terms/contactDetailValue","La valeur des coordonnées du contact, comme le numéro de téléphone ou l'adresse électronique."
"hasIdentifier:label","Label for Has Identifier http://rs.tdwg.org/dwc/terms/hasIdentifier","A pour Identifiant"
"hasIdentifier:definition","Definition for Has Identifier http://rs.tdwg.org/dwc/terms/hasIdentifier","Cette propriété fait référence à une ou plusieurs instances associées de la classe Identifier."
"biogeographicRealm:label","Label for Biogeographic Realm http://rs.tdwg.org/dwc/terms/biogeographicRealm","Écozone"
"biogeographicRealm:definition","Definition for Biogeographic Realm http://rs.tdwg.org/dwc/terms/biogeographicRealm","La division biogéographique la plus vaste de la surface terrestre et marine de la Terre, basée sur les schémas de répartition des organismes terrestres et marins."
"biogeographicRealm:notes","Notes for Biogeographic Realm http://rs.tdwg.org/dwc/terms/biogeographicRealm","Ce terme peut être couramment utilisé dans une hiérarchie biogéographique au-dessus de marineProvince (marin uniquement), écorégion et écosystème. Il est recommandé d'utiliser des vocabulaires contrôlés tels que ceux adoptés par le World Wildlife Fund (WWF) / Global 200 (Olson et al. 1998). "
"biome:label","Label for Biome http://rs.tdwg.org/dwc/terms/biome","Biome"
"biome:definition","Definition for Biome http://rs.tdwg.org/dwc/terms/biome","Unité biogéographique composée d'une communauté biologique qui s'est formée en réponse à l'environnement physique dans lequel elle se trouve et à un climat régional commun."
"biome:notes","Notes for Biome http://rs.tdwg.org/dwc/terms/biome","Cette propriété peut être utilisée pour identifier les biomes terrestres, d'eau douce et marins. Il est recommandé d'utiliser des vocabulaires contrôlés tels que ceux adoptés par le World Wildlife Fund (WWF) / Global 200 (Olson et al. 1998). "
"biomeType:label","Label for Biome Type http://rs.tdwg.org/dwc/terms/biomeType","Type de Biome"
"biomeType:definition","Definition for Biome Type http://rs.tdwg.org/dwc/terms/biomeType","Une classification de haut niveau du type de biome dans lequel des objets ont été collectés ou dans lequel un événement a eu lieu."
"biomeType:notes","Notes for Biome Type http://rs.tdwg.org/dwc/terms/biomeType","Le biomeType se situe à un niveau intermédiaire entre la biosphère (la somme globale de tous les écosystèmes de la Terre) et les biomes plus détaillés au niveau terrestres, marins et dulçaquicoles. Ces derniers doivent être répertoriés à l'aide de la propriété EcologicalContext.biome."
"bioregion:label","Label for Bioregion http://rs.tdwg.org/dwc/terms/bioregion","Biorégion"
"bioregion:definition","Definition for Bioregion http://rs.tdwg.org/dwc/terms/bioregion","Une zone écologiquement et géographiquement définie qui est plus petite qu'une écozone, mais plus grande qu'une écorégion ou un écosystème."
"bioregion:notes","Notes for Bioregion http://rs.tdwg.org/dwc/terms/bioregion","Ce concept est analogue à celui des provinces marines pour les régions marines. Il est recommandé d'utiliser des vocabulaires contrôlés tels que ceux adoptés par le World Wildlife Fund (WWF) / Global 200 (Olson et al. 1998), à l'origine de ce concept. "
"ecoregion:label","Label for Ecoregion http://rs.tdwg.org/dwc/terms/ecoregion","Écorégion"
"ecoregion:definition","Definition for Ecoregion http://rs.tdwg.org/dwc/terms/ecoregion","Une zone écologiquement et géographiquement définie qui est plus petite qu'une biorégion, elle-même plus petite qu'un domaine biogéographique. Les écorégions couvrent des zones relativement vastes de terre ou d'eau et contiennent des assemblages caractéristiques et géographiquement distincts de communautés et d'espèces."
"ecoregion:notes","Notes for Ecoregion http://rs.tdwg.org/dwc/terms/ecoregion","Il est recommandé d'utiliser des vocabulaires contrôlés tels que ceux adoptés par le World Wildlife Fund (WWF) / Global 200 (Olson et al. 1998)."
"ecosystem:label","Label for Ecosystem http://rs.tdwg.org/dwc/terms/ecosystem","Écosystème"
"ecosystem:definition","Definition for Ecosystem http://rs.tdwg.org/dwc/terms/ecosystem","Un mode spécifique de classification écologique qui prend en compte les quatre éléments de la définition des écosystèmes : une composante biotique, un complexe abiotique, les interactions entre eux et au sein de ceux-ci, et l'espace physique qu'ils occupent."
"habitat:label","Label for Habitat http://rs.tdwg.org/dwc/terms/habitat","Habitat"
"habitat:definition","Definition for Habitat http://rs.tdwg.org/dwc/terms/habitat","Une description du type d'environnement dans lequel vit un organisme."
"hasIdentifier:label","Label for Has Identifier http://rs.tdwg.org/dwc/terms/hasIdentifier","A pour Identifiant"
"hasIdentifier:definition","Definition for Has Identifier http://rs.tdwg.org/dwc/terms/hasIdentifier","Cette propriété fait référence à une ou plusieurs instances associées de la classe Identifier."
"hasMeasurementOrFact:label","Label for Has Measurement Or Fact http://rs.tdwg.org/dwc/terms/hasMeasurementOrFact","A pour Mesure ou Fait"
"hasMeasurementOrFact:definition","Definition for Has Measurement Or Fact http://rs.tdwg.org/dwc/terms/hasMeasurementOrFact","Cette propriété fait référence à une ou plusieurs instances associées de la classe MeasurementOrFact."
"hasReference:label","Label for Has Reference http://rs.tdwg.org/dwc/terms/hasReference","A pour Référence"
"hasReference:definition","Definition for Has Reference http://rs.tdwg.org/dwc/terms/hasReference","Cette propriété fait référence à une ou plusieurs instances associées de la classe Reference."
"eventName:label","Label for Event Name http://rs.tdwg.org/dwc/terms/eventName","Intitulé de l'événement"
"eventName:definition","Definition for Event Name http://rs.tdwg.org/dwc/terms/eventName","La dénomination communément utilisée pour identifier l'événement ou s'y référer."
"hasEcologicalContext:label","Label for Has Ecological Context http://rs.tdwg.org/dwc/terms/hasEcologicalContext","A pour Contexte Écologique"
"hasEcologicalContext:definition","Definition for Has Ecological Context http://rs.tdwg.org/dwc/terms/hasEcologicalContext","Cette propriété fait référence à une ou plusieurs instances associées de la classe EcologicalContext."
"hasGeographicContext:label","Label for Has Geographic Context http://rs.tdwg.org/dwc/terms/hasGeographicContext","A pour Contexte Géographique"
"hasGeographicContext:definition","Definition for Has Geographic Context http://rs.tdwg.org/dwc/terms/hasGeographicContext","Cette propriété fait référence à une ou plusieurs instances associées de la classe GeographicContext."
"hasIdentifier:label","Label for Has Identifier http://rs.tdwg.org/dwc/terms/hasIdentifier","A pour Identifiant"
"hasIdentifier:definition","Definition for Has Identifier http://rs.tdwg.org/dwc/terms/hasIdentifier","Cette propriété fait référence à une ou plusieurs instances associées de la classe Identifier."
"hasMeasurementOrFact:label","Label for Has Measurement Or Fact http://rs.tdwg.org/dwc/terms/hasMeasurementOrFact","A pour Mesure ou Fait"
"hasMeasurementOrFact:definition","Definition for Has Measurement Or Fact http://rs.tdwg.org/dwc/terms/hasMeasurementOrFact","Cette propriété fait référence à une ou plusieurs instances associées de la classe MeasurementOrFact."
"hasParentEvent:label","Label for Has Parent Event http://rs.tdwg.org/dwc/terms/hasParentEvent","A pour Événement Père"
"hasParentEvent:definition","Definition for Has Parent Event http://rs.tdwg.org/dwc/terms/hasParentEvent","Cette propriété fait référence à une ou plusieurs instances parentales de la classe Event."
"hasParentEvent:usage","Usage for Has Parent Event http://rs.tdwg.org/dwc/terms/hasParentEvent","Ce terme ne doit contenir que les Events qui peuvent être considérés comme des parents de l'instance considérée."
"hasPersonRole:label","Label for Has Person Role http://rs.tdwg.org/dwc/terms/hasPersonRole","A pour Rôle d'une Personne"
"hasPersonRole:definition","Definition for Has Person Role http://rs.tdwg.org/dwc/terms/hasPersonRole","Cette propriété fait référence à une ou plusieurs instances associées de la classe PersonRole."
"hasReference:label","Label for Has Reference http://rs.tdwg.org/dwc/terms/hasReference","A pour Référence"
"hasReference:definition","Definition for Has Reference http://rs.tdwg.org/dwc/terms/hasReference","Cette propriété fait référence à une ou plusieurs instances associées de la classe Reference."
"hasTemporalCoverage:label","Label for Has Temporal Coverage http://rs.tdwg.org/dwc/terms/hasTemporalCoverage","A pour Couverture Temporelle"
"hasTemporalCoverage:definition","Definition for Has Temporal Coverage http://rs.tdwg.org/dwc/terms/hasTemporalCoverage","Cette propriété fait référence à une ou plusieurs instances associées de la classe TemporalCoverage."
"hasIdentifier:label","Label for Has Identifier http://rs.tdwg.org/dwc/terms/hasIdentifier","A pour Identifiant"
"hasIdentifier:definition","Definition for Has Identifier http://rs.tdwg.org/dwc/terms/hasIdentifier","Cette propriété fait référence à une ou plusieurs instances associées de la classe Identifier."
"hasMeasurementOrFact:label","Label for Has Measurement Or Fact http://rs.tdwg.org/dwc/terms/hasMeasurementOrFact","A pour Mesure ou Fait"
"hasMeasurementOrFact:definition","Definition for Has Measurement Or Fact http://rs.tdwg.org/dwc/terms/hasMeasurementOrFact","Cette propriété fait référence à une ou plusieurs instances associées de la classe MeasurementOrFact."
"hasReference:label","Label for Has Reference http://rs.tdwg.org/dwc/terms/hasReference","A pour Référence"
"hasReference:definition","Definition for Has Reference http://rs.tdwg.org/dwc/terms/hasReference","Cette propriété fait référence à une ou plusieurs instances associées de la classe Reference."
"region:label","Label for Region http://rs.tdwg.org/dwc/terms/region","Région"
"region:examples","Examples for Region http://rs.tdwg.org/dwc/terms/region","Multi-pays : `Plaine d'Europe du Nord`, Multi-états/Province : `Pacific Northwest`, Étendue d'eau : `Southern`, Bassins et provinces géologiques : `Michigan Basin`, `Mazon Creek`, `Bundenbach`"
"region:definition","Definition for Region http://rs.tdwg.org/dwc/terms/region","Le nom d'une aire spatiale ou d'un lieu nommé de n'importe quelles dimensions à l'intérieur d'une ou de plusieurs zones administratives."
"region:notes","Notes for Region http://rs.tdwg.org/dwc/terms/region","La pratique optimale recommandée est d'utiliser ce champ dans les situations où les champs de localisation administrative (country, stateProvince, county, etc.) fournissent une description insuffisante. Pour les collections géologiques, on peut citer les bassins, les provinces et les gisements de fossiles."
"waterBodyType:label","Label for Waterbody Type http://rs.tdwg.org/dwc/terms/waterBodyType","Type d'Étendue d'Eau"
"waterBodyType:definition","Definition for Waterbody Type http://rs.tdwg.org/dwc/terms/waterBodyType","Un terme qui indique le type d'une masse d'eau."
"waterBodyType:notes","Notes for Waterbody Type http://rs.tdwg.org/dwc/terms/waterBodyType","Il est recommandé d'utiliser un vocabulaire contrôlé, tel que ceux trouvés sur https://www.usgs.gov/mission-areas/water-resources/science/types-water et https://sciencetrends.com/types-bodies-water-complete-list/."
"hasIdentifier:label","Label for Has Identifier http://rs.tdwg.org/dwc/terms/hasIdentifier","A pour Identifiant"
"hasIdentifier:definition","Definition for Has Identifier http://rs.tdwg.org/dwc/terms/hasIdentifier","Cette propriété fait référence à une ou plusieurs instances associées de la classe Identifier."
"hasMeasurementOrFact:label","Label for Has Measurement Or Fact http://rs.tdwg.org/dwc/terms/hasMeasurementOrFact","A pour Mesure ou Fait"
"hasMeasurementOrFact:definition","Definition for Has Measurement Or Fact http://rs.tdwg.org/dwc/terms/hasMeasurementOrFact","Cette propriété fait référence à une ou plusieurs instances associées de la classe MeasurementOrFact."
"hasReference:label","Label for Has Reference http://rs.tdwg.org/dwc/terms/hasReference","A pour Référence"
"hasReference:definition","Definition for Has Reference http://rs.tdwg.org/dwc/terms/hasReference","Cette propriété fait référence à une ou plusieurs instances associées de la classe Reference."
"supergroup:label","Label for Supergroup http://rs.tdwg.org/dwc/terms/supergroup","Supergroupe"
"supergroup:definition","Definition for Supergroup http://rs.tdwg.org/dwc/terms/supergroup","Nom complet du supergroupe lithostratigraphique dans lequel la ressource cataloguée a été prélevée."
"supergroup:usage","Usage for Supergroup http://rs.tdwg.org/dwc/terms/supergroup","Un supergroupe est un assemblage formalisé de groupes liés ou superposés, ou de groupes et de formations. Ces unités se sont révélées utiles dans les synthèses régionales et provinciales. Les supergroupes ne doivent être nommés que lorsque leur définition répond à un objectif concret."
"supergroup:notes","Notes for Supergroup http://rs.tdwg.org/dwc/terms/supergroup","Vocabulaire recommandé. Au moment de la rédaction, ce terme est en cours d'inclusion dans le dwc tdwg/dwc#234"
"hasReference:label","Label for Has Reference http://rs.tdwg.org/dwc/terms/hasReference","A pour Référence"
"hasReference:definition","Definition for Has Reference http://rs.tdwg.org/dwc/terms/hasReference","Cette propriété fait référence à une ou plusieurs instances associées de la classe Reference."
"identifierSource:label","Label for Identifier Source http://rs.tdwg.org/dwc/terms/identifierSource","Source de l'Identifiant"
"identifierSource:definition","Definition for Identifier Source http://rs.tdwg.org/dwc/terms/identifierSource","La source ou le créateur de l'identifiant."
"identifierSource:notes","Notes for Identifier Source http://rs.tdwg.org/dwc/terms/identifierSource","Ce terme fait référence à l'organisation, au dispositif, au logiciel ou à la base de données qui a créé l'identifiant représenté dans la propriété identifier."
"identifierType:label","Label for Identifier Type http://rs.tdwg.org/dwc/terms/identifierType","Type d'Identifiant"
"identifierType:definition","Definition for Identifier Type http://rs.tdwg.org/dwc/terms/identifierType","Le type et le format de la valeur du champ identifier."
"identifierType:notes","Notes for Identifier Type http://rs.tdwg.org/dwc/terms/identifierType","Cette propriété doit être utilisée pour aider les personnes et les logiciels à comprendre comment l'identifiant peut être utilisé (par exemple, s'il s'agit d'un IRI résoluble) et à valider l'identifiant sur la base de son format et de sa composition (par exemple, un UUID valide)."
"identifierValue:label","Label for Identifier http://rs.tdwg.org/dwc/terms/identifierValue","Identifiant"
"identifierValue:definition","Definition for Identifier http://rs.tdwg.org/dwc/terms/identifierValue","Un identifiant textuel ou numérique, un acronyme ou un IRI qui fournit une référence non ambiguë pour une entité dans un contexte donné."
"identifierValue:notes","Notes for Identifier http://rs.tdwg.org/dwc/terms/identifierValue","Il peut s'agir d'une simple valeur ou d'un IRI résoluble, et peut refléter tout identifiant utilisé pour identifier une entité (telle qu'une collection, un taxon, une institution ou une personne) incluse dans la description de la collection."
"basisOfScheme:label","Label for Basis Of Scheme http://rs.tdwg.org/dwc/terms/basisOfScheme","Base du Modèle"
"basisOfScheme:definition","Definition for Basis Of Scheme http://rs.tdwg.org/dwc/terms/basisOfScheme","Un résumé de la raison d'être ou de l'objectif du LatimerCoreScheme."
"basisOfScheme:notes","Notes for Basis Of Scheme http://rs.tdwg.org/dwc/terms/basisOfScheme","Cette propriété est destinée à résumer la raison du regroupement d'un certain nombre d'ObjectGroups au sein du LatimerCoreScheme, ainsi que l'objectif pour lequel les données sont destinées à être utilisées. Cela peut également se refléter dans les termes et les statistiques définis à l'aide des classes SchemeTerm et SchemeMeasurementOrFact respectivement. Cette approche permet d'élaborer des profils normés et réutilisables dans le cadre plus large du standard Latimer Core pour les cas d'utilisation courants des descriptions de collections."
"hasIdentifier:label","Label for Has Identifier http://rs.tdwg.org/dwc/terms/hasIdentifier","A pour Identifiant"
"hasIdentifier:definition","Definition for Has Identifier http://rs.tdwg.org/dwc/terms/hasIdentifier","Cette propriété fait référence à une ou plusieurs instances associées de la classe Identifier."
"hasObjectGroup:label","Label for Has Object Group http://rs.tdwg.org/dwc/terms/hasObjectGroup","A pour Groupe d'Objet"
"hasObjectGroup:definition","Definition for Has Object Group http://rs.tdwg.org/dwc/terms/hasObjectGroup","Cette propriété fait référence à une ou plusieurs instances associées de la classe ObjectGroup."
"hasReference:label","Label for Has Reference http://rs.tdwg.org/dwc/terms/hasReference","A pour Référence"
"hasReference:definition","Definition for Has Reference http://rs.tdwg.org/dwc/terms/hasReference","Cette propriété fait référence à une ou plusieurs instances associées de la classe Reference."
"hasSchemeMeasurementOrFact:label","Label for Has Scheme Measurement Or Fact http://rs.tdwg.org/dwc/terms/hasSchemeMeasurementOrFact","A pour Mesure ou Fait du Modèle"
"hasSchemeMeasurementOrFact:definition","Definition for Has Scheme Measurement Or Fact http://rs.tdwg.org/dwc/terms/hasSchemeMeasurementOrFact","Cette propriété fait référence à une ou plusieurs instances associées de la classe SchemeMeasurementOrFact."
"hasSchemeTerm:label","Label for Has Scheme Term http://rs.tdwg.org/dwc/terms/hasSchemeTerm","A pour Terme du Modèle"
"hasSchemeTerm:definition","Definition for Has Scheme Term http://rs.tdwg.org/dwc/terms/hasSchemeTerm","Cette propriété fait référence à une ou plusieurs instances associées de la classe SchemeTerm."
"isDistinctObjects:label","Label for Is Distinct Objects http://rs.tdwg.org/dwc/terms/isDistinctObjects","Sont des Objets Distincts"
"isDistinctObjects:definition","Definition for Is Distinct Objects http://rs.tdwg.org/dwc/terms/isDistinctObjects","Un indicateur permettant de déterminer si un objet physique peut être décrit par plus d'un ObjectGroup au sein du LatimerCoreScheme."
"isDistinctObjects:notes","Notes for Is Distinct Objects http://rs.tdwg.org/dwc/terms/isDistinctObjects","Si isDistinctObjects a pour valeur « true », aucun objet de la collection ne doit être couvert par plus d'un groupe d'objets au sein du LatimerCoreScheme. Ceci est important pour l'agrégation et l'établissement de rapports sur des statistiques telles que le nombre d'objets, car cela évite qu'un objet physique soit comptabilisé plusieurs fois."
"schemeName:label","Label for Scheme Name http://rs.tdwg.org/dwc/terms/schemeName","A pour Nom du Modèle"
"schemeName:definition","Definition for Scheme Name http://rs.tdwg.org/dwc/terms/schemeName","Un nom descriptif et bref donné au LatimerCoreScheme."
"hasIdentifier:label","Label for Has Identifier http://rs.tdwg.org/dwc/terms/hasIdentifier","A pour Identifiant"
"hasIdentifier:definition","Definition for Has Identifier http://rs.tdwg.org/dwc/terms/hasIdentifier","Cette propriété fait référence à une ou plusieurs instances associées de la classe Identifier."
"hasReference:label","Label for Has Reference http://rs.tdwg.org/dwc/terms/hasReference","A pour Référence"
"hasReference:definition","Definition for Has Reference http://rs.tdwg.org/dwc/terms/hasReference","Cette propriété fait référence à une ou plusieurs instances associées de la classe Reference."
"measurementDerivation:label","Label for Measurement Derivation http://rs.tdwg.org/dwc/terms/measurementDerivation","Origine de la Mesure"
"measurementDerivation:definition","Definition for Measurement Derivation http://rs.tdwg.org/dwc/terms/measurementDerivation","Un indicateur permettant de savoir si la mesure, le fait, la caractéristique ou l'assertion appliquée à la collection a été dérivée des chiffres déclarés ou agrégée/calculée à partir de données sous-jacentes."
"measurementDerivation:notes","Notes for Measurement Derivation http://rs.tdwg.org/dwc/terms/measurementDerivation","S'il existe des informations plus précises sur la méthode de calcul d'une mesure ou d'un fait, elles doivent être saisies à l'aide de la propriété measurementMethod."
"measurementFactText:label","Label for Fact or Narrative Text http://rs.tdwg.org/dwc/terms/measurementFactText","Faits ou Texte Narratif"
"measurementFactText:definition","Definition for Fact or Narrative Text http://rs.tdwg.org/dwc/terms/measurementFactText","La valeur du fait qualitatif, de la caractéristique ou de l'affirmation concernant la collection."
"measurementFactText:notes","Notes for Fact or Narrative Text http://rs.tdwg.org/dwc/terms/measurementFactText","Cette propriété doit également être utilisée pour stocker des informations textuelles sur la collection dans un contexte particulier, telles que des récits ou des commentaires sur l'état d'avancement de la numérisation."
"hasIdentifier:label","Label for Has Identifier http://rs.tdwg.org/dwc/terms/hasIdentifier","A pour Identifiant"
"hasIdentifier:definition","Definition for Has Identifier http://rs.tdwg.org/dwc/terms/hasIdentifier","Cette propriété fait référence à une ou plusieurs instances associées de la classe Identifier."
"hasMeasurementOrFact:label","Label for Has Measurement Or Fact http://rs.tdwg.org/dwc/terms/hasMeasurementOrFact","A pour Mesure ou Fait"
"hasMeasurementOrFact:definition","Definition for Has Measurement Or Fact http://rs.tdwg.org/dwc/terms/hasMeasurementOrFact","Cette propriété fait référence à une ou plusieurs instances associées de la classe MeasurementOrFact."
"hasParentObjectClassification:label","Label for Has Parent Object Classification http://rs.tdwg.org/dwc/terms/hasParentObjectClassification","A pour Parent dans la Classification de l'Objet"
"hasParentObjectClassification:definition","Definition for Has Parent Object Classification http://rs.tdwg.org/dwc/terms/hasParentObjectClassification","Cette propriété fait référence à une ou plusieurs instances parentales de la classe ObjectClassification."
"hasReference:label","Label for Has Reference http://rs.tdwg.org/dwc/terms/hasReference","A pour Référence"
"hasReference:definition","Definition for Has Reference http://rs.tdwg.org/dwc/terms/hasReference","Cette propriété fait référence à une ou plusieurs instances associées de la classe Reference."
"isTopParent:label","Label for Is Top Parent http://rs.tdwg.org/dwc/terms/isTopParent","Est le Parent le plus Inclusif"
"isTopParent:definition","Definition for Is Top Parent http://rs.tdwg.org/dwc/terms/isTopParent","Un indicateur qui signale que l'instance actuelle de ObjectClassification se trouve au sommet de la hiérarchie représentée par plusieurs instances imbriquées de la classe."
"isTopParent:usage","Usage for Is Top Parent http://rs.tdwg.org/dwc/terms/isTopParent","Si ce terme est utilisé, il doit être mis à `true` dans l'instance d'ObjectClassification qui représente le plus haut niveau d'une hiérarchie et à `false` dans les autres. Si la direction de la hiérarchie est évidente ou si elle n'est pas significative, ce terme ne doit pas être renseigné. "
"objectClassificationLevel:label","Label for Object Classification Level http://rs.tdwg.org/dwc/terms/objectClassificationLevel","Niveau de Classification de l'Objet"
"objectClassificationLevel:definition","Definition for Object Classification Level http://rs.tdwg.org/dwc/terms/objectClassificationLevel","Le niveau de l'ObjectClassification dans la hiérarchie."
"objectClassificationLevel:notes","Notes for Object Classification Level http://rs.tdwg.org/dwc/terms/objectClassificationLevel","Il incombe à l'utilisateur de nommer les niveaux correspondant au système de classification hiérarchique qu'il est en train de définir."
"objectClassificationName:label","Label for Object Classification Name http://rs.tdwg.org/dwc/terms/objectClassificationName","Nom de la Classification de l'Objet"
"objectClassificationName:definition","Definition for Object Classification Name http://rs.tdwg.org/dwc/terms/objectClassificationName","Titre bref décrivant cet objetClassification en tant que classe, unité ou groupe."
