"identifier","context","text"
"p040:notes","Notes for vehicles (car, train, etc.) http://rs.tdwg.org/dwc/terms/p040","Ces organismes peuvent être transportés sur ou dans le véhicule. Voir également Harrower et al. 2017. http://nora.nerc.ac.uk/id/eprint/519129"
"p041:label","Label for other means of transport http://rs.tdwg.org/dwc/terms/p041","autre moyen de transport"
"p041:definition","Definition for other means of transport http://rs.tdwg.org/dwc/terms/p041","Un terme fourre-tout pour toute dispersion liée au transport qui n'est pas couverte par d'autres termes."
"p041:notes","Notes for other means of transport http://rs.tdwg.org/dwc/terms/p041","Des exemples incluent la pollution issues des plateformes pétrolières et gazières offshore, des sites d'énergie renouvelable offshore (tels que les parcs éoliens, les pipelines, le transport de câbles, etc.). Voir également Harrower et al. 2017. http://nora.nerc.ac.uk/id/eprint/519129"
"p042:label","Label for interconnected waterways/basins/seas http://rs.tdwg.org/dwc/terms/p042","voies navigables/bassins/mers interconnectés"
"p042:definition","Definition for interconnected waterways/basins/seas http://rs.tdwg.org/dwc/terms/p042","Organismes qui se sont dispersés dans les voies d'eau artificielles créées pour relier des masses d'eau auparavant non connectées."
"p042:usage","Usage for interconnected waterways/basins/seas http://rs.tdwg.org/dwc/terms/p042","Les organismes transportés le long de ces couloirs dans les eaux de ballast ou dans les salissures de la coque DEVRAIENT être classés dans les catégories ""eaux de ballast du navire/du bateau"" ou ""salissures de la coque du navire/du bateau""."
"p042:notes","Notes for interconnected waterways/basins/seas http://rs.tdwg.org/dwc/terms/p042","Voir également Harrower et al. 2017. http://nora.nerc.ac.uk/id/eprint/519129"
"p043:label","Label for tunnels and land bridges http://rs.tdwg.org/dwc/terms/p043","tunnels et ponts terrestres"
"p043:definition","Definition for tunnels and land bridges http://rs.tdwg.org/dwc/terms/p043","Dispersion involontaire par des organismes utilisant des tunnels artificiels, des ponts, des routes et des voies ferrées."
"p043:notes","Notes for tunnels and land bridges http://rs.tdwg.org/dwc/terms/p043","Voir également Harrower et al. 2017. http://nora.nerc.ac.uk/id/eprint/519129"
"p044:label","Label for natural dispersal across borders of invasive alien organisms http://rs.tdwg.org/dwc/terms/p044","dispersion naturelle d'organismes exotiques envahissants à travers les frontières"
"p044:definition","Definition for natural dispersal across borders of invasive alien organisms http://rs.tdwg.org/dwc/terms/p044","Dispersion d'organismes vers de nouvelles régions par dispersion naturelle à partir de régions dans lesquelles ils sont étrangers."
"p044:notes","Notes for natural dispersal across borders of invasive alien organisms http://rs.tdwg.org/dwc/terms/p044","Cela désigne les espèces exotiques qui ont déjà été introduites par l'une des voies suivantes : libération dans la nature, échappée de confinement, contamination dans les transports, voyage clandestins dans les transports ou utilisation de couloirs. Voir également Harrower et al. 2017. http://nora.nerc.ac.uk/id/eprint/519129"
"p045:label","Label for release in nature http://rs.tdwg.org/dwc/terms/p045","relâchement dans la nature"
"p045:definition","Definition for release in nature http://rs.tdwg.org/dwc/terms/p045","Organismes déplacés et relâchés par l'Homme dans un environnement (semi-)naturel dans l'intention qu'ils y vivent par la suite sans aide humaine."
"p045:notes","Notes for release in nature http://rs.tdwg.org/dwc/terms/p045","Voir également Harrower et al. 2017. http://nora.nerc.ac.uk/id/eprint/519129"
"p046:label","Label for escape from confinement http://rs.tdwg.org/dwc/terms/p046","fuite de confinement"
"p046:definition","Definition for escape from confinement http://rs.tdwg.org/dwc/terms/p046","Organismes transportés intentionnellement par l'humain et destinés à être gardés en captivité ou cultivés, mais qui ont échappé par accident au contrôle de l'Homme."
"p046:notes","Notes for escape from confinement http://rs.tdwg.org/dwc/terms/p046","Voir également Harrower et al. 2017. http://nora.nerc.ac.uk/id/eprint/519129"
"p047:label","Label for transport-contaminant http://rs.tdwg.org/dwc/terms/p047","contamination lors du transport"
"p047:definition","Definition for transport-contaminant http://rs.tdwg.org/dwc/terms/p047","Terme générique désignant toutes les espèces transportées en tant que contaminants dans d'autres produits."
"p047:notes","Notes for transport-contaminant http://rs.tdwg.org/dwc/terms/p047","Une espèce exotique est un contaminant si elle a une relation trophique ou biotique avec les organismes ou les objets transportés et qu'elle en dépend dans une certaine mesure pour sa survie. Voir également Harrower et al. 2017. http://nora.nerc.ac.uk/id/eprint/519129"
"p048:label","Label for transport-stowaway http://rs.tdwg.org/dwc/terms/p048","passager clandestin"
"p048:definition","Definition for transport-stowaway http://rs.tdwg.org/dwc/terms/p048","Terme générique désignant toutes les espèces transportées par des moyens de transport où l'organisme a une interaction directe avec le transport et n'est pas simplement transporté en tant que partie ou contaminant de la cargaison."
"p048:notes","Notes for transport-stowaway http://rs.tdwg.org/dwc/terms/p048","Un passager clandestin n'a aucune relation trophique ou biotique avec les organismes ou les objets transportés. Voir également Harrower et al. 2017. http://nora.nerc.ac.uk/id/eprint/519129"
"p049:label","Label for corridor http://rs.tdwg.org/dwc/terms/p049","couloir"
"p049:definition","Definition for corridor http://rs.tdwg.org/dwc/terms/p049","Les infrastructures, telles que les ponts, les tunnels et les canaux, ont éliminé les barrières naturelles à la dispersion et ont permis à une espèce de s'installer dans un nouvel endroit."
"p049:notes","Notes for corridor http://rs.tdwg.org/dwc/terms/p049","Voir également Harrower et al. 2017. http://nora.nerc.ac.uk/id/eprint/519129"
"p050:label","Label for unaided http://rs.tdwg.org/dwc/terms/p050","sans assistance"
"p050:definition","Definition for unaided http://rs.tdwg.org/dwc/terms/p050","Organismes qui se propagent par dispersion naturelle, sans action ou aide de l'homme, à partir de régions dans lesquelles ils sont également exotique."
"p050:notes","Notes for unaided http://rs.tdwg.org/dwc/terms/p050","Ce terme fait référence à la dispersion secondaire à partir d'une zone où le taxon est également exotique. Voir également Harrower et al. 2017. http://nora.nerc.ac.uk/id/eprint/519129"
"p051:label","Label for intentional http://rs.tdwg.org/dwc/terms/p051","volontaire"
"p051:definition","Definition for intentional http://rs.tdwg.org/dwc/terms/p051","Les organismes ont été introduits dans une nouvelle région avec l'intention spécifique de les y maintenir en vie, qu'ils soient destinés à être cultivés ou relâchés dans la nature."
"p051:notes","Notes for intentional http://rs.tdwg.org/dwc/terms/p051","Voir également Harrower et al. 2017. http://nora.nerc.ac.uk/id/eprint/519129"
"p052:label","Label for unintentional http://rs.tdwg.org/dwc/terms/p052","involontaire"
"p052:definition","Definition for unintentional http://rs.tdwg.org/dwc/terms/p052","L'organisme a été introduit involontairement dans une nouvelle région."
"p052:notes","Notes for unintentional http://rs.tdwg.org/dwc/terms/p052","Voir également Harrower et al. 2017. http://nora.nerc.ac.uk/id/eprint/519129"
"p053:label","Label for corridor and dispersal http://rs.tdwg.org/dwc/terms/p053","couloir et dispersion"
"p053:definition","Definition for corridor and dispersal http://rs.tdwg.org/dwc/terms/p053","Les organismes se sont dispersés naturellement, même si cette dispersion a été facilitée par les modifications du paysage créées par les humains."
"p053:notes","Notes for corridor and dispersal http://rs.tdwg.org/dwc/terms/p053","Voir également Harrower et al. 2017. http://nora.nerc.ac.uk/id/eprint/519129"
