"identifier","context","text"
"Media:label","Label for Media Entity http://rs.tdwg.org/dwc/terms/Media","Entidad material"
"Media:rdfs_comment","Comment for Media Entity http://rs.tdwg.org/dwc/terms/Media","Un recurso en formato digital o físico."
"Media:dcterms_description","Description for Media Entity http://rs.tdwg.org/dwc/terms/Media","Una instancia de medio textual digital puede representarse mejor como un dcterms:BibliographicResource."
"fundingAttribution:label","Label for Funding Attribution http://rs.tdwg.org/dwc/terms/fundingAttribution","Atribución de Financiamiento"
"fundingAttribution:rdfs_comment","Comment for Funding Attribution http://rs.tdwg.org/dwc/terms/fundingAttribution","Descripción textual de las organizaciones o personas que financiaron la creación del recurso."
"fundingAttribution:dcterms_description","Description for Funding Attribution http://rs.tdwg.org/dwc/terms/fundingAttribution","Indique el nombre oficial completo del organismo financiador. Debe incluirse el nombre íntegro, sin abreviaturas, a menos que la abreviatura sea una forma oficial y comúnmente reconocida (por ejemplo, NSF para la National Science Foundation). La práctica recomendada consiste en separar los valores de la lista mediante un espacio, una barra vertical y otro espacio (` | `)."
