term_localName,label,rdfs_comment,skos_scopeNote,dcterms_description,examples,rdf_type,tdwgutility_organizedInClass,tdwgutility_decision,tdwgutility_layer,tdwgutility_required,tdwgutility_repeatable
Media,Media Entity,A digital or physical media resource.,An instance of digital textual media may be better represented as a dcterms:BibliographicResource.,This term is equivalent to the ABCD term http://rs.tdwg.org/abcd/terms/MultimediaObject .,`dcmi:Sound`; `dcmi:StillImage`; `dcmi:MovingImage`; `dcmi:InteractiveResource`;`ac:Digital3DResource`,http://www.w3.org/2000/01/rdf-schema#Class,http://rs.tdwg.org/dwc/terms/attributes/Management,,,No,
comments,Comments,"Any comment provided on the media resource, as free-form text.",Best practice would also identify the commenter.,"Comments may refer to the resource itself (e.g., asserting a taxon name or location of a biological subject in an image), or to the relation between resource and associated metadata (e.g., asserting that the taxon name given in the metadata is wrong, without asserting a positive identification). There is a separate item for Reviewer Comments, which is defined more as an expert-level review. Implementers or communities of practice might establish conventions about the meaning of the absence of a commenter, but this specification is silent on that matter.",,http://www.w3.org/1999/02/22-rdf-syntax-ns#Property,http://rs.tdwg.org/dwc/terms/attributes/Management,,,No,Yes
metadataLanguage,Metadata Language,"The URI of the language of description and other metadata (but not necessarily of the image itself) , from the ISO639-2 list of URIs for ISO 3-letter language codes, http://id.loc.gov/vocabulary/iso639-2.","At least one of ac:metadataLanguage and ac:metadataLanguageLiteral MUST be supplied but, when feasible, supplying both might make the metadata more widely useful. They must specify the same language. In case of ambiguity, ac:metadataLanguage prevails.","This is NOT dcterms:language, which is about the resource, not the metadata. Metadata Language is deliberately single-valued, imposing on unstructured serializations a requirement that multi-lingual metadata be represented as separate, complete, metadata records. Audiovisual Core requires that each record also contains the language-neutral terms. In the absence of this requirement, metadata consumers would need to know which terms are language-neutral and merge these terms from all provided metadataLanguages into a single record. Metadata consumers may re-combine the information based on the dcterms:identifier that identifies the multimedia resource. Nothing in this document would, however, prevent an implementer, e.g., of an XML-Schema representation, from providing a fully hierarchical schema in which language neutral terms occur only a single time, and only the language-specific terms are repeated in a way that unambiguously relates them to a metadata language. In RDF it may be a simple repetition of plain literals associated with a language (e.g., xml:lang attribute in RDF/XML). The language attribute would then be required in Audiovisual Core and would replace ac:metadataLanguage.",,http://www.w3.org/1999/02/22-rdf-syntax-ns#Property,http://rs.tdwg.org/dwc/terms/attributes/Management,,,Yes,No
metadataLanguageLiteral,Metadata Language,Language of description and other metadata (but not necessarily of the image itself) represented as an ISO639-2 three letter language code.,"ISO639-1 two-letter codes are permitted but deprecated. At least one of ac:metadataLanguage and ac:metadataLanguageLiteral MUST be supplied but, when feasible, supplying both might make the metadata more widely useful. They MUST specify the same language. In case of ambiguity, ac:metadataLanguage prevails. ","This is NOT dc:language, which is about the resource, not the metadata. Metadata Language is deliberately single-valued, imposing on unstructured serializations a requirement that multi-lingual metadata be represented as separate, complete, metadata records. Audiovisual Core requires that each record also contains the language-neutral terms. In the absence of this requirement, metadata consumers would need to know which terms are language-neutral and merge these terms from all provided metadataLanguages into a single record. Metadata consumers may re-combine the information based on the dcterms:identifier that identifies the multimedia resource. Nothing in this document would, however, prevent an implementer, e.g., of an XML-Schema representation, from providing a fully hierarchical schema in which language neutral terms occur only a single time, and only the language-specific terms are repeated in a way that unambiguously relates them to a metadata language. In RDF it may be a simple repetition of plain literals associated with a language (e.g., xml:lang attribute in RDF/XML). The language attribute would then be required in Audiovisual Core and would replace ac:metadataLanguage.",,http://www.w3.org/1999/02/22-rdf-syntax-ns#Property,http://rs.tdwg.org/dwc/terms/attributes/Management,,,Yes,No
reviewerComments,Reviewer Comments,"Any comment provided by a reviewer with expertise in the subject, as free-form text.",,"Reviewer Comments may refer to the resource itself (e.g., asserting a taxon name or location of a biological subject in an image), or to the relation between resource and associated metadata (e.g., asserting that the taxon name given in the metadata is wrong, without asserting a positive identification). There is a separate item ""Comments"" for text from commenters of unrecorded expertise.",,http://www.w3.org/1999/02/22-rdf-syntax-ns#Property,http://rs.tdwg.org/dwc/terms/attributes/Management,,,No,Yes
attributionLinkURL,Attribution Link URL,"The URL where information about ownership, attribution, etc. of the resource may be found.",,"This URL may be used in creating a clickable logo. Providers should consider making this link as specific and useful to consumers as possible, e.g., linking to a metadata page of the specific image resource rather than to a generic page describing the owner or provider of a resource.",,http://www.w3.org/1999/02/22-rdf-syntax-ns#Property,http://rs.tdwg.org/dwc/terms/attributes/Attribution,,,No,No
metadataProvider,Metadata Provider,URI of person or organization originally responsible for providing the resource metadata record.,,"Media resources and their metadata may be served from different institutions, e.g., in the case of aggregators adding user annotations, taxon identifications, or ratings. Compare Provider. See also the entry for ac:metadataProviderLiteral and the section Namespaces, Prefixes and Term Names in the Audiovisual Core Term List document for discussion of the rationale for separate terms taking URI values from those taking Literal values where both are possible. Normal practice is to use the same Label if both are provided. Labels have no effect on information discovery and are only suggestions.",,http://www.w3.org/1999/02/22-rdf-syntax-ns#Property,http://purl.org/dc/terms/Agent,,,No,Yes
metadataProviderLiteral,Metadata Provider,Name of the person or organization originally responsible for providing the resource metadata record.,,"Media resources and their metadata may be served from different institutions, e.g., in the case of aggregators adding user annotations, taxon identifications, or ratings. Compare Provider. See also the entry for ac:metadataProvider in this document and the section Namespaces, Prefixes and Term Names for discussion of the rationale for separate terms taking URI values from those taking Literal values where both are possible. Normal practice is to use the same Label if both are provided. Labels have no effect on information discovery and are only suggestions.",,http://www.w3.org/1999/02/22-rdf-syntax-ns#Property,http://purl.org/dc/terms/Agent,,,No,Yes
provider,Provider,URI for person or organization responsible for presenting the media resource.,"If no separate Metadata Provider is given, this also attributes the metadata.","Media resources and their metadata may be served from different institutions, e.g., in the case of aggregators adding user annotations, taxon identifications, or ratings. See also the entry for ac:providerLiteral and the section Namespaces, Prefixes and Term Names in the Audiovisual Core Term List document for discussion of the rationale for separate terms taking URI values from those taking Literal values where both are possible. Normal practice is to use the same Label if both are provided. Labels have no effect on information discovery and are only suggestions.",,http://www.w3.org/1999/02/22-rdf-syntax-ns#Property,http://purl.org/dc/terms/Agent,,,No,No
providerLiteral,Provider,Name of the person or organization responsible for presenting the media resource.,"If no separate Metadata Provider is given, this also attributes the metadata.","Media resources and their metadata may be served from different institutions, e.g., in the case of aggregators adding user annotations, taxon identifications, or ratings. See also the entry for ac:provider and the section Namespaces, Prefixes and Term Names in the Audiovisual Core Term List document for discussion of the rationale for separate terms taking URI values from those taking Literal values where both are possible. Normal practice is to use the same Label if both are provided. Labels have no effect on information discovery and are only suggestions.",,http://www.w3.org/1999/02/22-rdf-syntax-ns#Property,http://purl.org/dc/terms/Agent,,,No,No
physicalSetting,Physical Setting,"The setting of the content represented in media such as images, sounds, and movies if the provider deems them relevant.","Constrained vocabulary of: ""Natural"" = Object in its natural setting of the object (e.g., living organisms in their natural environment); ""Artificial"" = Object in an artificial environment (e.g., living organisms in an artificial environment such as a zoo, garden, greenhouse, or laboratory); ""Edited"" = Human media editing of a natural setting or media acquisition with a separate media background such as a photographic backdrop.",Multiple values may be needed for movies or montages. See also ac:resourceCreationTechnique which should be used to describe any modifications to the resource itself. Communities of practice should form best practices for the use of these controlled terms.,,http://www.w3.org/1999/02/22-rdf-syntax-ns#Property,http://rs.tdwg.org/dwc/terms/attributes/ContentCoverage,,,No,Yes
taxonCount,Taxon Count,An exact or estimated number of taxa at the lowest applicable taxon rank (usually species or infraspecific) represented by the media resource (item or collection).,The count SHOULD contain only the taxa covered fully or primarily by the resource. This SHOULD be a single integer number. ,"Primarily intended for resource collections and singular resources dealing with sets of taxa (e.g., identification tools, videos). It is recommended to give an exact or estimated number of specific taxa when a complete list of taxa is not available or practical. For a taxon page and most images this will be ""1"", i.e., other taxa mentioned on the side or in the background should not be counted. However, sometimes a resource may illustrate an ecological or behavioral entity with multiple species, e.g., a host-pathogen interaction; taxon count would then indicate the known number of species in this interaction. Leave the field empty if you cannot estimate the information (do not enter 0). Additional taxon counts at higher levels (e.g., how many families are covered by a digital Fauna) should be given verbatim in the resource description, not here.",,http://www.w3.org/1999/02/22-rdf-syntax-ns#Property,http://rs.tdwg.org/dwc/terms/attributes/TaxonomicCoverage,,,No,No
taxonCoverage,Taxon Coverage,"A higher taxon (e.g., a genus, family, or order) at the level of the genus or higher, that covers all taxa that are the primary subject of the resource (which may be a media item or a collection).",,"Example: Where the subject of an image is several species of ducks with trees visible in the background, Taxon Coverage would still be Anatidae (and not Biota). Example: ""Aves"" for a bird key or a bird image collection. Do not add a rank (""Class Aves"") in this field. If the resource contains a single taxon, this should be placed in Scientific Taxon Name. In this case Taxon Coverage may be left empty, but if not, care should be taken that the entries do not conflict. Example: If Scientific Taxon Name is Quercus alba then Taxon Coverage, if provided at all, should be Quercus.",,http://www.w3.org/1999/02/22-rdf-syntax-ns#Property,http://rs.tdwg.org/dwc/terms/attributes/TaxonomicCoverage,,,No,No
derivedFrom,Derived From,A reference to an original resource from which the current one is derived.,"Human readable, or doi number, or URL. Simple name of parent for human readable.","Derivation of one resource from another is of special interest for identification tools (e.g., a key from an unpublished data set, as in FRIDA, or a PDA key from a PC or web key) or web services (e.g., a name synonymization service being derived from a specific data set). It may very rarely also be known where one image or sound recording is derived from another (but compare the separate mechanism to be used for quality/resolution levels). Can be repeated if a montage of images.",,http://www.w3.org/1999/02/22-rdf-syntax-ns#Property,http://rs.tdwg.org/dwc/terms/attributes/RelatedResources,,,No,Yes
relatedResourceID,Related Resource ID,"Resource related in ways not specified through a collection, e.g., before-after images; time-lapse series; different orientations/angles of view",,"The value references a related media item. Examples of relations are: Images taken in a sequence or defined time series, an exposure or focus series (e.g., for stacking), different framing or views (top, side, bottom) of the same subject, or an overview plus several details. The property makes such related media items discoverable, but does not indicate the nature of this relationship. More specific properties may be defined in a later version of AC.",,http://www.w3.org/1999/02/22-rdf-syntax-ns#Property,http://rs.tdwg.org/dwc/terms/attributes/RelatedResources,,,No,Yes
commentDate,Date and Time of Comment,The date and time that a comment was created.,"The date and time MUST comply with the World Wide Web Consortium (W3C) datetime practice, https://www.w3.org/TR/NOTE-datetime, which requires that date and time representation correspond to ISO 8601:1998, but with year fields always comprising 4 digits. This makes datetime records compliant with 8601:2004, https://www.iso.org/standard/40874.html. AC datetime values MAY also follow 8601:2004 for ranges by separating two ISO 8601 datetime fields by a solidus (""forward slash"", '/').",,,http://www.w3.org/1999/02/22-rdf-syntax-ns#Property,http://rs.tdwg.org/dwc/terms/attributes/Management,,,No,No
digitizationDate,Date and Time Digitized,"Date the first digital version was created, if different from Original Date and Time found in the Temporal Coverage Vocabulary.","The date and time MUST comply with the World Wide Web Consortium (W3C) datetime practice, https://www.w3.org/TR/NOTE-datetime, which requires that date and time representation correspond to ISO 8601:1998, but with year fields always comprising 4 digits. This makes datetime records compliant with 8601:2004, https://www.iso.org/standard/40874.html. AC datetime values MAY also follow 8601:2004 for ranges by separating two ISO 8601 datetime fields by a solidus (""forward slash"", '/'). Use the international (ISO/xml) format yyyy-mm-ddThh:mm (e. g. ""2007-12-31"" or ""2007-12-31T14:59""). Where available, timezone information SHOULD be added. ","This is often not the media creation or modification date. For example, if photographic prints have been scanned, the date of that scanning is what this term carries, but Original Date and Time is that depicted in the print. In the case of digital images containing EXIF, whereas the EXIF capture date does not contain time zone information, but EXIF GPSDateStamp and GPSTimeStamp may be relevant as these include time-zone information. See also Metadata Working Group Guidelines for Handling Image Metadata, Version 2.0 (November 2010), https://web.archive.org/web/20180919181934/http://www.metadataworkinggroup.org/pdf/mwg_guidance.pdf, which has best practice advice on handling time-zone-less EXIF date/time data. See also the Wikipedia ISO 8601 entry, https://en.wikipedia.org/wiki/ISO_8601, for further explanation and examples.",,http://www.w3.org/1999/02/22-rdf-syntax-ns#Property,http://rs.tdwg.org/dwc/terms/attributes/ResourceCreation,,,No,No
