standard,label,directoryName,summary,cover_image,cover_image_by,cover_image_ref,tags,github,website,website_title,status,description
http://www.tdwg.org/standards/147,TDWG Standards Documentation Standard,sds,The TDWG Standards Documentation Standard (SDS) consists of a single document: the [Standards Documentation Specification](https://github.com/tdwg/vocab/blob/master/sds/documentation-specification.md). That document defines how TDWG standards are to be presented. It provides details about the hierarchical structure of standards and versioning of standards components. It specifies how the properties of standards and their components are to be described in human-readable and machine-readable terms.,https://images.unsplash.com/photo-1497796742626-fe30f204ec54,Lysander Yuen,https://unsplash.com/photos/wk833OrQLJE,"technical specification, current standard, 2017",https://github.com/tdwg/vocab/tree/master/sds,,,,A standard that documents how standards should be described in human- and machine-readable terms.
http://www.tdwg.org/standards/642,Vocabulary Maintenance Standard,vms,The TDWG Vocabulary Maintenance Standard consists of a single document: the [Vocabulary Maintenance Specification](https://github.com/tdwg/vocab/blob/master/vms/maintenance-specification.md). That document describes the processes used to modify TDWG vocabularies and their associated documents.,https://images.unsplash.com/photo-1502911679107-2b54f5c0292c,Igor Ovsyannykov,https://unsplash.com/photos/VkFhaQHVcE4,"best practice, current standard, 2017",https://github.com/tdwg/vocab/tree/master/vms,,,,A standard that describes the processes used to modify TDWG vocabularies and their associated documents.
http://www.tdwg.org/standards/638,Audubon Core Multimedia Resources Metadata Schema,ac,"The Audubon Core (AC) is a set of vocabularies designed to represent metadata for biodiversity multimedia resources and collections. These vocabularies aim to represent information that will help to determine whether a particular resource or collection will be fit for some particular biodiversity science application before acquiring the media. Among others, the vocabularies address such concerns as the management of the media and collections, descriptions of their content, their taxonomic, geographic, and temporal coverage, and the appropriate ways to retrieve, attribute and reproduce them.",https://images.unsplash.com/photo-1430990480609-2bf7c02a6b1a,Mikhail Vasilyev,https://unsplash.com/photos/gGC63oug3iY,"technical specification, current standard, 2013",https://github.com/tdwg/ac,https://tdwg.github.io/ac/,Audubon Core website,,The Audubon Core is a set of vocabularies designed to represent metadata for biodiversity multimedia resources and collections.
http://www.tdwg.org/standards/150,GUID and Life Sciences Identifiers Applicability Statements,guid-as,The Global Unique Identifiers (GUID) applicability statements consist of an applicability statement on the use of GUIDs for the biodiversity information community in general ([Richards 2010]({static}tdwg_guid_applicability_statement.pdf)) and the use of Life Science Identifiers (LSID) in specific ([Pereira et al. 2009]({static}tdwg_lsid_applicability_statement.pdf)).,https://c2.staticflickr.com/4/3516/3701836175_5567871dc6_o.jpg,Erik de Vos,https://www.flickr.com/photos/mrcollaborator/3701836175,"applicability statement, current standard, 2011",https://github.com/tdwg/guid-as,,,,This standard provides guidance on how to use GUIDs to meet specific requirements of the biodiversity information community.
http://www.tdwg.org/standards/450,Darwin Core,dwc,"Darwin Core is a standard maintained by the [Darwin Core maintenance group](../../community/dwc). It includes a glossary of terms intended to **facilitate the sharing of information about biological diversity** by providing identifiers, labels, and definitions. Darwin Core is primarily based on taxa, their occurrence in nature as documented by observations, specimens, samples, and related information.",https://images.unsplash.com/photo-1492031215329-791748ee1253,Alex Guillaume,https://unsplash.com/photos/0MC0o-xLucM,"technical specification, current standard, 2009",https://github.com/tdwg/dwc,https://dwc.tdwg.org,Darwin Core website,,"This vocabulary standard includes a glossary of terms intended to facilitate the sharing of information about biological diversity by providing identifiers, labels, and definitions. "
http://www.tdwg.org/standards/449,TDWG Access Protocol for Information Retrieval (TAPIR),tapir,"TAPIR is a computer protocol designed for discovery, search and retrieval of distributed data over the Internet. TAPIR consists of a [specification](http://tdwg.github.io/tapir/docs/) that determines how client applications seeking information should communicate with server applications hosting data. TAPIR is an approved TDWG standard.",https://c1.staticflickr.com/7/6158/6263150201_a4c9705ff9_b.jpg,Biodiversity Heritage Library,https://www.flickr.com/photos/biodivlibrary/6263150201,"technical specification, current standard, 2010",https://github.com/tdwg/tapir,http://tdwg.github.io/tapir/docs/,TAPIR specification,,"TAPIR is a computer protocol designed for discovery, search and retrieval of distributed data over the Internet. "
http://www.tdwg.org/standards/115,Access to Biological Collection Data (ABCD) Schema,abcd,The Access to Biological Collections Data (ABCD) Schema is an evolving comprehensive standard for the access to and exchange of data about specimens and observations (a.k.a. primary biodiversity data).,https://c1.staticflickr.com/1/839/41611348922_d4030a5197_b.jpg,Natural History Museum: Coleoptera Section,https://www.flickr.com/photos/nhm_beetle_id/41611348922/,"technical specification, 2005 standard, 2005",https://github.com/tdwg/abcd,https://abcd.tdwg.org/xml/documentation/primer/2.06/,ABCD version 2.06,,"A common data specification for biological collection units, including living and preserved specimens, along with field observations that did not produce voucher specimens. It is intended to support the exchange and integration of detailed primary collection and observation data."
http://www.tdwg.org/standards/116,Structured Descriptive Data,sdd,"The goal of the SDD standard is to allow capture, transport, caching and archiving of descriptive data (data describing a taxon or specimen), using a platform- and application-independent, international standard. Such a standard is crucial to enabling lossless porting of data between existing and future software platforms including identification, data-mining and analysis tools, and federated databases.",https://c1.staticflickr.com/5/4871/32317503938_1eb7c72aeb_h.jpg,Biodiversity Heritage Library,https://www.flickr.com/photos/biodivlibrary/32317503938,"technical specification, 2005 standard, 2005",https://github.com/tdwg/sdd,,,,An international XML-based standard for capturing and managing descriptive data for organisms.
http://www.tdwg.org/standards/117,Taxonomic Concept Transfer Schema,tcs,"The TCS schema was conceived to allow the representation of taxonomic concepts as defined in published taxonomic classifications, revisions and databases. As such, it specifies the structure for XML documents to be used for the transfer of defined concepts. Valid transfer documents may either explicitly detail the defining components of taxon concepts, transfer GUIDs referring to defined taxon concepts (if and when these are available) or a mixture of the two.",https://images.unsplash.com/photo-1502912143929-50c8a1ce1f69,Fancycrave,https://unsplash.com/photos/4A8ZSlAOUqs,"technical specification, 2005 standard, 2005",https://github.com/tdwg/tcs,,,,An XML schema that provides a mechanism for the providers of taxonomic information to exchange data.
http://www.tdwg.org/standards/107,Description Language for Taxonomy (DELTA) ,delta,"The DELTA format (DEscription Language for TAxonomy) is a flexible method for encoding taxonomic descriptions for computer processing. DELTA-format data can be used to produce natural-language descriptions, conventional or interactive keys, cladistic or phenetic classifications, and information-retrieval systems.",https://images.unsplash.com/photo-1459664018906-085c36f472af,Erol Ahmed,https://unsplash.com/photos/aIYFR0vbADk,"technical specification, 2005 standard, 1986",https://github.com/tdwg/delta,http://www.delta-intkey.com/,DELTA website,,A system for coding taxonomic descriptions so that they can be used as input to computer programs.
http://www.tdwg.org/standards/110,Herbarium Information Standards and Protocols for Interchange of Data (HISPID3),hispid3,The Herbarium Information Standards and Protocols for Interchange of Data (HISPID) is a standard format for the interchange of electronic herbarium specimen information. ,https://zenodo.org/record/2354442/files/BR0000010007433.jpg?download=1 ,Meise Botanic Garden ,https://doi.org/10.5281/zenodo.2354442 ,"technical specification, prior standard, 1996 ",https://github.com/tdwg/prior-standards/tree/master/hispid3 ,http://plantnet.rbgsyd.nsw.gov.au/HISCOM/HISPID/HISPID3/H3.html ,HISPID3 at HISCOM ,,A standard format for the interchange of electronic herbarium specimen information.
http://www.tdwg.org/standards/103,Economic Botany Data Collection Standard,economic-botany,"Studies on the uses of plants are becoming increasingly important. Standardisation of terms and a unified system to describe uses are of enormous benefit to gatherers of information, especially where exchanges of data sets are involved. The standard provides a system whereby uses of plants (in their cultural context) can be described, using standardised descriptors and terms, and attached to taxonomic data sets. It resulted from discussions at the International Working Group on Taxonomic Databases for Plant Sciences (TDWG) between 1989 and 1992.",https://images.unsplash.com/photo-1464297162577-f5295c892194,Chad Stembridge,https://unsplash.com/photos/-8FjF1p-aw0,"best practice, prior standard, 1995",https://github.com/tdwg/prior-standards/tree/master/economic-botany-data-collection-standard,https://www.kew.org/science/collections/economic-botany-collection/curation/economic-botany-data-standard,Online version at kew.org,,"A system for describing uses of plants in their cultural context using standardised descriptors and terms, and attaching those descriptions to taxonomic data sets."
http://www.tdwg.org/standards/106,Plant Occurrence and Status Scheme,poss,A standard for recording the relationship between a plant and a place,https://images.unsplash.com/photo-1524235975426-093c4bf9a327,Dieter de Vroomen,https://unsplash.com/photos/syUmgOxHYos,"prior standard, 1995",https://github.com/tdwg/prior-standards/tree/master/poss,,,,A standard for recording the relationship between a plant and a place.
http://www.tdwg.org/standards/113,Plant Names in Botanical Databases,plant-names,"This standard defines the taxonomic and nomenclatural concepts associated with the names of plants. It describes the component parts, their functions and their interrelations of significance in structuring a database. The appendices provide an outline of a preliminary data dictionary illustrating possible elements and their properties. It does not provide a data model or a data format.",https://images.unsplash.com/photo-1541170362668-5a41854decee,Micheile Henderson,https://unsplash.com/photos/DV4lEwcj774,"prior standard, 1995",https://github.com/tdwg/prior-standards/tree/master/plant-names-in-botanical-databases,,,hidden,"A standard that defines the taxonomic and nomenclatural concepts associated with the names of plants. It describes the component parts, their functions and their interrelations of significance in structuring a databas"
http://www.tdwg.org/standards/101,Authors of Plant Names,plant-names-authors,"An index of authors of plant scientific names. Includes flowering plants, gymnosperms, pteridophytes, bryophytes, algae, fungi and fossil plants. Full names, dates of birth and death when known, recommended abbreviations and groups in which names have been published, are given for each author. Authors of Plant Names has been incorporated into the [International Plant Names Index (IPNI)](http://www.ipni.org/).",https://images.unsplash.com/photo-1530027644375-9c83053d392e,Xuan Nguyen,https://unsplash.com/photos/v6V-hfxjboI,"prior standard, 1992",https://github.com/tdwg/prior-standards/tree/master/authors-of-plant-names,http://www.kew.org/data/authors.html,Authors of Plant Names at kew.org,,An index of authors of plant scientific names.
http://www.tdwg.org/standards/109,World Geographical Scheme for Recording Plant Distributions,wgsrpd,"WGSRPD provides an agreed system of geographical units at approximately ""country"" level and upwards for use in recording plant distributions. It allows adopting organizations to compare and exchange data with each other without loss of information due to incompatible geographical boundaries. The system offered covers the whole world and identifies units at four levels, firstly continental, secondly regional (or subcontinental), thirdly at what may be called ""Botanical Country"" level (which may often ignore purely political considerations), and fourthly at a slightly lower level called ""Basic Recording Units"" where political integrity is fully recognised.",https://images.unsplash.com/photo-1477650112965-999095361212,Tim Marshall,https://unsplash.com/photos/ATrQi9kdHbE,"prior standard, 1992",https://github.com/tdwg/wgsrpd,,,,A system for recording geographical units that covers the whole world and identifies units at four levels.
http://www.tdwg.org/standards/108,XDF - A Language for the Definition and Exchange of Biological Data Sets,xdf,,,,,"prior standard, 1991",https://github.com/tdwg/prior-standards/tree/master/xdf,,,hidden,A database file exchange medium to handle diverse classes of biological data required for file transfers between different database projects
http://www.tdwg.org/standards/114,Botanico-periodicum-huntianum/supplementum,bhp-supplementum,,,,,"prior standard, 1991",https://github.com/tdwg/prior-standards/tree/master/botanico-periodicum-huntianum-supplementum,,,hidden,An index of botanical publications and a supplement to Botanico-periodicum-huntianum.
http://www.tdwg.org/standards/105,Index Herbariorum. Part I: The Herbaria of the World,ih,,,,,"prior standard, 1990",https://github.com/tdwg/prior-standards/tree/master/index-herbariorum-part-i,http://sweetgum.nybg.org/science/ih/,Current online version of Index Herbariorum,hidden,"A guide that records the physical location, holdings, and contact information of the world's herbaria."
http://www.tdwg.org/standards/102,International Transfer Format for Botanic Garden Plant Records,itf2,"International Transfer Format for Botanic Garden Plant Records, version 2 (ITF2) was developed in response to requests from botanic gardens to incorporate additional data fields for transfer within the botanic gardens and allow for a more flexible transfer format than the original transfer format outlined in ITF version 01.00. It is biased towards 'Conservation Type Data Fields', but incorporates a procedure allowing for additional data fields to be identified and exchanged between gardens. It is because of this flexibility that it is believed that the ITF2 will remain relevant to botanic gardens for a long time despite the rapid change in information system technology in recent years.",https://c2.staticflickr.com/6/5347/9248091524_efa0bdbcac_b.jpg,Drriss & Marrionn,https://www.flickr.com/photos/drriss/9248091524,"prior standard, 1987",https://github.com/tdwg/prior-standards/tree/master/itf2,,,,This standard defines a machine-readable format for transferring records from botanical gardens.
http://www.tdwg.org/standards/104,Floristic Regions of the World,floristic-regions,"Floristic Regions of the World by A. Takhtajan presents a widely accepted schema of biogeographical areas defined by environmental factors and floristic composition. It is a hierarchical schema that recognizes six floristic kingdoms, 35 floristic regions and 152 floristic provinces.",https://images.unsplash.com/photo-1511497584788-876760111969,Sergei Akulich,https://unsplash.com/photos/-heLWtuAN3c,"prior standard, 1986",https://github.com/tdwg/prior-standards/tree/master/floristic-regions-of-the-world,,,,"A book that describes the floristic divisions for the whole world, lists endemic families and genera, and provides examples of endemic species for each province"
http://www.tdwg.org/standards/111,"Taxonomic Literature, Edition 2 and its Supplements",tl-2,"TL-2 is the premier publication of the [International Association for Plant Taxonomy (IAPT)](https://www.iaptglobal.org/) and [its online version](http://www.sil.si.edu/DigitalCollections/tl-2/) was made possible by the generous cooperation of the IAPT. In its print form, TL-2 is a 15 volume guide to the literature of systematic botany published between 1753 and 1940. It is organized by author and includes numbered entries for the author's publications. Suggested abbreviations for use in taxonomic publications are provided: abbreviations for the author's name, short titles and abbreviations of the short titles for publications. TL-2 is the standard by which authors' names and titles should be abbreviated.",https://c1.staticflickr.com/9/8214/8291301344_c813b42546_b.jpg,Biodiversity Heritage Library,https://www.flickr.com/photos/biodivlibrary/8291301344,"prior standard, 1976",https://github.com/tdwg/prior-standards/tree/master/taxonomic-literature-2,http://www.sil.si.edu/DigitalCollections/tl-2/,Online version at Smithsonian Libraries,,A comprehensive bibliographical and biographical reference for systematic botany literature published between 1753 and 1940.
http://www.tdwg.org/standards/112,Botanico-periodicum-huntianum,bph,,,,,"prior standard, 1970",https://github.com/tdwg/prior-standards/tree/master/botanico-periodicum-huntianum,,,hidden,"A list of periodicals with botanical content, including abbreviations for the titles of books."
