term_localName,label,rdfs_comment,dcterms_description,examples,rdf_type,tdwgutility_abcdEquivalence,tdwgutility_organizedInClass,tdwgutility_decision,tdwgutility_usageScope
Event,Event,An action that occurs at some location during some time.,,A specimen collection process. A camera trap image capture.  A marine trawl.,http://www.w3.org/2000/01/rdf-schema#Class,DataSets/DataSet/Units/Unit/Gathering,,http://rs.tdwg.org/dwc/terms/history/decisions/#Decision-2014-10-26_15,extension
footprintSRS,Footprint SRS,"A Well-Known Text (WKT) representation of the Spatial Reference System (SRS) for the footprintWKT of the Location. Do not use this term to describe the SRS of the decimalLatitude and decimalLongitude, even if it is the same as for the footprintWKT - use the geodeticDatum instead.",,"`GEOGCS[""GCS_WGS_1984"", DATUM[""D_WGS_1984"", SPHEROID[""WGS_1984"",6378137,298.257223563]], PRIMEM[""Greenwich"",0], UNIT[""Degree"",0.0174532925199433]]` (WKT for the standard WGS84 Spatial Reference System EPSG:4326).",http://www.w3.org/1999/02/22-rdf-syntax-ns#Property,not in ABCD,http://purl.org/dc/terms/Location,,simple
FossilSpecimen,Fossil Specimen,A preserved specimen that is a fossil.,,A body fossil. A coprolite. A gastrolith. An ichnofossil. A piece of a petrified tree.,http://www.w3.org/2000/01/rdf-schema#Class,RecordBasisEnum/FossileSpecimen,,http://rs.tdwg.org/dwc/terms/history/decisions/#Decision-2014-10-26_15,extension
GeologicalContext,Geological Context,"Geological information, such as stratigraphy, that qualifies a region or place.",,A lithostratigraphic layer.,http://www.w3.org/2000/01/rdf-schema#Class,DataSets/DataSet/Units/Unit/Gathering/Stratigraphy,,http://rs.tdwg.org/dwc/terms/history/decisions/#Decision-2014-10-26_15,extension
HumanObservation,Human Observation,An output of a human observation process.,,Evidence of an Occurrence taken from field notes or literature. A record of an Occurrence without physical evidence nor evidence captured with a machine. ,http://www.w3.org/2000/01/rdf-schema#Class,RecordBasisEnum/HumanObservation,,http://rs.tdwg.org/dwc/terms/history/decisions/#Decision-2014-10-26_15,extension
Identification,Identification,"A taxonomic determination (e.g., the assignment to a taxon).",,A subspecies determination of an organism.,http://www.w3.org/2000/01/rdf-schema#Class,DataSets/DataSet/Units/Unit/Identifications/Identification,,http://rs.tdwg.org/dwc/terms/history/decisions/#Decision-2014-10-26_15,extension
LivingSpecimen,Living Specimen,A specimen that is alive.,,A living plant in a botanical garden. A living animal in a zoo.,http://www.w3.org/2000/01/rdf-schema#Class,RecordBasisEnum/LivingSpecimen,,http://rs.tdwg.org/dwc/terms/history/decisions/#Decision-2014-10-26_15,extension
MachineObservation,Machine Observation,An output of a machine observation process.,,A photograph. A video. An audio recording. A remote sensing image. A Occurrence record based on telemetry.,http://www.w3.org/2000/01/rdf-schema#Class,RecordBasisEnum/MachineObservation,,http://rs.tdwg.org/dwc/terms/history/decisions/#Decision-2014-10-26_15,extension
MaterialSample,Material Sample,"A physical result of a sampling (or subsampling) event. In biological collections, the material sample is typically collected, and either preserved or destructively processed.",,A whole organism preserved in a collection. A part of an organism isolated for some purpose. A soil sample. A marine microbial sample.,http://www.w3.org/2000/01/rdf-schema#Class,DataSets/DataSet/Units/Unit,,http://rs.tdwg.org/dwc/terms/history/decisions/#Decision-2014-10-26_15,extension
measurementAccuracy,Measurement Accuracy,The description of the potential error associated with the measurementValue.,,"`0.01`, `normal distribution with variation of 2 m`",http://www.w3.org/1999/02/22-rdf-syntax-ns#Property,DataSets/DataSet/Units/Unit/MeasurementsOrFacts/MeasurementOrFact/MeasurementOrFactAtomised/Accuracy or DataSet/Units/Unit/Gathering/SiteMeasurementsOrFacts/SiteMeasurementOrFact/MeasurementOrFactAtomised/Accuracy or DataSets/DataSet/Units/Unit/Gathering/Aspect/Accuracy or DataSets/DataSet/Units/Unit/Gathering/Altitude/MeasurementOrFactAtomised/Accuracy or DataSets/DataSet/Units/Unit/Gathering/Depth/MeasurementOrFactAtomised/Accuracy or DataSets/DataSet/Units/Unit/Gathering/Biotope/MeasurementsOrFacts/MeasurementOrFactAtomised/Accuracy or DataSets/DataSet/Units/Unit/MeasurementsOrFacts/MeasurementOrFact/MeasurementOrFactAtomised/Accuracy,http://rs.tdwg.org/dwc/terms/MeasurementOrFact,,extension
measurementDeterminedBy,Measurement Determined By,"A list (concatenated and separated) of names of people, groups, or organizations who determined the value of the MeasurementOrFact.",Recommended best practice is to separate the values in a list with space vertical bar space (` | `).,"`Rob Guralnick`, `Peter Desmet | Stijn Van Hoey`",http://www.w3.org/1999/02/22-rdf-syntax-ns#Property,DataSets/DataSet/Units/Unit/MeasurementsOrFacts/MeasurementOrFact/MeasurementOrFactAtomised/MeasuredBy or DataSets/DataSet/Units/Unit/Gathering/Altitude/MeasurementOrFactAtomised/MeasuredBy or DataSets/DataSet/Units/Unit/Gathering/Depth/MeasurementOrFactAtomised/MeasuredBy or DataSets/DataSet/Units/Unit/Gathering/Height/MeasurementOrFactAtomised/MeasuredBy or DataSets/DataSet/Units/Unit/Gathering/SiteMeasurementsOrFacts/SiteMeasurementOrFact/MeasurementOrFactAtomised/MeasuredBy or DataSets/DataSet/Units/Unit/Gathering/Biotope/MeasurementsOrFacts/MeasurementOrFactAtomised/MeasuredBy,http://rs.tdwg.org/dwc/terms/MeasurementOrFact,http://rs.tdwg.org/dwc/terms/history/decisions/#Decision-2014-10-30_16,extension
measurementDeterminedDate,Measurement Determined Date,The date on which the MeasurementOrFact was made.,Recommended best practice is to use a date that conforms to ISO 8601:2004(E).,`1963-03-08T14:07-0600` (8 Mar 1963 at 2:07pm in the time zone six hours earlier than UTC). `2009-02-20T08:40Z` (20 February 2009 8:40am UTC). `2018-08-29T15:19` (3:19pm local time on 29 August 2018). `1809-02-12` (some time during 12 February 1809). `1906-06` (some time in June 1906). `1971` (some time in the year 1971). `2007-03-01T13:00:00Z/2008-05-11T15:30:00Z` (some time during the interval between 1 March 2007 1pm UTC and 11 May 2008 3:30pm UTC). `1900/1909` (some time during the interval between the beginning of the year 1900 and the end of the year 1909). `2007-11-13/15` (some time in the interval between 13 November 2007 and 15 November 2007).,http://www.w3.org/1999/02/22-rdf-syntax-ns#Property,DataSets/DataSet/Units/Unit/MeasurementsOrFacts/MeasurementOrFact/MeasurementOrFactAtomised/MeasurementDateTime or DataSets/DataSet/Units/Unit/Gathering/Altitude/MeasurementOrFactAtomised/MeasurementDateTime or DataSets/DataSet/Units/Unit/Gathering/Depth/MeasurementOrFactAtomised/MeasurementDateTime or DataSets/DataSet/Units/Unit/Gathering/Height/MeasurementOrFactAtomised/MeasurementDateTime or DataSets/DataSet/Units/Unit/Gathering/SiteMeasurementsOrFacts/SiteMeasurementOrFact/MeasurementOrFactAtomised/MeasurementDateTime or DataSets/DataSet/Units/Unit/Gathering/Biotope/MeasurementsOrFacts/MeasurementOrFactAtomised/MeasurementDateTime,http://rs.tdwg.org/dwc/terms/MeasurementOrFact,,extension
measurementID,Measurement ID,"An identifier for the MeasurementOrFact (information pertaining to measurements, facts, characteristics, or assertions). May be a global unique identifier or an identifier specific to the data set.",,`9c752d22-b09a-11e8-96f8-529269fb1459`,http://www.w3.org/1999/02/22-rdf-syntax-ns#Property,not in ABCD,http://rs.tdwg.org/dwc/terms/MeasurementOrFact,,extension
measurementMethod,Measurement Method,"A description of or reference to (publication, URI) the method or protocol used to determine the measurement, fact, characteristic, or assertion.",,`minimum convex polygon around burrow entrances` (for a home range area). `barometric altimeter` (for an elevation).,http://www.w3.org/1999/02/22-rdf-syntax-ns#Property,/DataSets/DataSet/Units/Unit/MeasurementsOrFacts/MeasurementOrFact/MeasurementOrFactAtomised/Method or /DataSets/DataSet/Units/Unit/Gathering/Biotope/MeasurementsOrFacts/MeasurementOrFactAtomised/Method or /DataSets/DataSet/Units/Unit/Gathering/SiteMeasurementsOrFacts/SiteMeasurementOrFact/MeasurementOrFactAtomised/Method,http://rs.tdwg.org/dwc/terms/MeasurementOrFact,,extension
MeasurementOrFact,Measurement or Fact,A measurement of or fact about an rdfs:Resource (http://www.w3.org/2000/01/rdf-schema#Resource).,"Resources can be thought of as identifiable records or instances of classes and may include, but need not be limited to dwc:Occurrence, dwc:Organism, dwc:MaterialSample, dwc:Event, dwc:Location, dwc:GeologicalContext, dwc:Identification, or dwc:Taxon.",The weight of an organism in grams. The number of placental scars. Surface water temperature in Celsius.,http://www.w3.org/2000/01/rdf-schema#Class,Datasets/Dataset/Units/Unit/MeasurementsOrFacts or DataSets/DataSet/Units/Unit/Gathering/SiteMeasurementsOrFacts,,http://rs.tdwg.org/dwc/terms/history/decisions/#Decision-2014-10-26_15,extension
measurementRemarks,Measurement Remarks,Comments or notes accompanying the MeasurementOrFact.,,`tip of tail missing`,http://www.w3.org/1999/02/22-rdf-syntax-ns#Property,not in ABCD,http://rs.tdwg.org/dwc/terms/MeasurementOrFact,,extension
measurementType,Measurement Type,"The nature of the measurement, fact, characteristic, or assertion.",Recommended best practice is to use a controlled vocabulary.,"`tail length`, `temperature`, `trap line length`, `survey area`, `trap type`",http://www.w3.org/1999/02/22-rdf-syntax-ns#Property,DataSets/DataSet/Units/Unit/MeasurementsOrFacts/MeasurementOrFact/MeasurementOrFactAtomised/Parameter or DataSets/DataSet/Units/Unit/Gathering/SiteMeasurementsOrFacts/MeasurementOrFact/MeasurementOrFactAtomised/Parameter,http://rs.tdwg.org/dwc/terms/MeasurementOrFact,,extension
measurementUnit,Measurement Unit,The units associated with the measurementValue.,Recommended best practice is to use the International System of Units (SI).,"`mm`, `C`, `km`, `ha`",http://www.w3.org/1999/02/22-rdf-syntax-ns#Property,DataSets/DataSet/Units/Unit/Gathering/SiteMeasurementsOrFacts/MeasurementOrFact/MeasurementOrFactAtomised/UnitOfMeasurement or DataSets/DataSet/Units/Unit/Gathering/SiteMeasurementsOrFacts/MeasurementOrFact/MeasurementOrFactAtomised/UnitOfMeasurement,http://rs.tdwg.org/dwc/terms/MeasurementOrFact,,extension
measurementValue,Measurement Value,"The value of the measurement, fact, characteristic, or assertion.",,"`45`, `20`, `1`, `14.5`, `UV-light`",http://www.w3.org/1999/02/22-rdf-syntax-ns#Property,DataSets/DataSet/Units/Unit/MeasurementsOrFacts/MeasurementOrFact/MeasurementOrFactAtomised/LowerValue or DataSets/DataSet/Units/Unit/MeasurementsOrFacts/MeasurementOrFact/MeasurementOrFactAtomised/UpperValue or DataSets/DataSet/Units/Unit/Gathering/SiteMeasurementsOrFacts/SiteMeasurementOrFact/MeasurementOrFactAtomised/LowerValue or DataSets/DataSet/Units/Unit/Gathering/SiteMeasurementsOrFacts/SiteMeasurementOrFact/MeasurementOrFactAtomised/UpperValue or DataSets/DataSet/Units/Unit/Gathering/Altitude/MeasurementOrFactAtomised/LowerValue or DataSets/DataSet/Units/Unit/Gathering/Altitude/MeasurementOrFactAtomised/UpperValue or DataSets/DataSet/Units/Unit/Gathering/Depth/MeasurementOrFactAtomised/LowerValue or DataSets/DataSet/Units/Unit/Gathering/Depth/MeasurementOrFactAtomised/UpperValue or DataSets/DataSet/Units/Unit/Gathering/Biotope/MeasurementsOrFacts/MeasurementOrFactAtomised/LowerValue or DataSets/DataSet/Units/Unit/Gathering/Biotope/MeasurementsOrFacts/MeasurementOrFactAtomised/UpperValue or DataSets/DataSet/Units/Unit/Gathering/Height/MeasurementOrFactAtomised/LowerValue or DataSets/DataSet/Units/Unit/Gathering/Height/MeasurementOrFactAtomised/UpperValue,http://rs.tdwg.org/dwc/terms/MeasurementOrFact,,extension
Occurrence,Occurrence,An existence of an Organism (sensu http://rs.tdwg.org/dwc/terms/Organism) at a particular place at a particular time.,,A wolf pack on the shore of Kluane Lake in 1988. A virus in a plant leaf in a the New York Botanical Garden at 15:29 on 2014-10-23. A fungus in Central Park in the summer of 1929.,http://www.w3.org/2000/01/rdf-schema#Class,DataSets/DataSet/Units/Unit,,http://rs.tdwg.org/dwc/terms/history/decisions/#Decision-2014-10-26_15,extension
Organism,Organism,A particular organism or defined group of organisms considered to be taxonomically homogeneous.,"Instances of the dwc:Organism class are intended to facilitate linking one or more dwc:Identification instances to one or more dwc:Occurrence instances. Therefore, things that are typically assigned scientific names (such as viruses, hybrids, and lichens) and aggregates whose occurrences are typically recorded (such as packs, clones, and colonies) are included in the scope of this class.",A specific bird. A specific wolf pack. A specific instance of a bacterial culture.,http://www.w3.org/2000/01/rdf-schema#Class,not in ABCD,,http://rs.tdwg.org/dwc/terms/history/decisions/#Decision-2014-10-26_14,extension
PreservedSpecimen,Preserved Specimen,A specimen that has been preserved.,,A plant on an herbarium sheet. A cataloged lot of fish in a jar.,http://www.w3.org/2000/01/rdf-schema#Class,RecordBasisEnum/PreservedSpecimen,,http://rs.tdwg.org/dwc/terms/history/decisions/#Decision-2014-10-26_15,extension
relatedResourceID,Related Resource ID,"An identifier for a related resource (the object, rather than the subject of the relationship).",,`dc609808-b09b-11e8-96f8-529269fb1459`,http://www.w3.org/1999/02/22-rdf-syntax-ns#Property,DataSets/DataSet/Units/Unit/Associations/UnitAssociation/AssociatedUnitSourceInstitutionCode + DataSets/DataSet/Units/Unit/Associations/UnitAssociation/AssociatedUnitSourceName + DataSets/DataSet/Units/Unit/Associations/UnitAssociation/AssociatedUnitID,http://rs.tdwg.org/dwc/terms/ResourceRelationship,,extension
relationshipAccordingTo,Relationship According To,"The source (person, organization, publication, reference) establishing the relationship between the two resources.",,`Julie Woodruff`,http://www.w3.org/1999/02/22-rdf-syntax-ns#Property,not in ABCD,http://rs.tdwg.org/dwc/terms/ResourceRelationship,,extension
relationshipEstablishedDate,Relationship Established Date,The date-time on which the relationship between the two resources was established.,Recommended best practice is to use a date that conforms to ISO 8601:2004(E).,`1963-03-08T14:07-0600` (8 Mar 1963 at 2:07pm in the time zone six hours earlier than UTC). `2009-02-20T08:40Z` (20 February 2009 8:40am UTC). `2018-08-29T15:19` (3:19pm local time on 29 August 2018). `1809-02-12` (some time during 12 February 1809). `1906-06` (some time in June 1906). `1971` (some time in the year 1971). `2007-03-01T13:00:00Z/2008-05-11T15:30:00Z` (some time during the interval between 1 March 2007 1pm UTC and 11 May 2008 3:30pm UTC). `1900/1909` (some time during the interval between the beginning of the year 1900 and the end of the year 1909). `2007-11-13/15` (some time in the interval between 13 November 2007 and 15 November 2007).,http://www.w3.org/1999/02/22-rdf-syntax-ns#Property,not in ABCD,http://rs.tdwg.org/dwc/terms/ResourceRelationship,,extension
relationshipOfResource,Relationship Of Resource,The relationship of the resource identified by relatedResourceID to the subject (optionally identified by the resourceID).,Recommended best practice is to use a controlled vocabulary.,"`sameAs`, `duplicate of`, `mother of`, `endoparasite of`, `host to`, `sibling of`, `valid synonym of`, `located within`",http://www.w3.org/1999/02/22-rdf-syntax-ns#Property,DataSets/DataSet/Units/Unit/Associations/UnitAssociation/AssociationType,http://rs.tdwg.org/dwc/terms/ResourceRelationship,,extension
relationshipRemarks,Relationship Remarks,Comments or notes about the relationship between the two resources.,,"`mother and offspring collected from the same nest`, `pollinator captured in the act`",http://www.w3.org/1999/02/22-rdf-syntax-ns#Property,DataSets/DataSet/Units/Unit/Associations/UnitAssociation/Comments,http://rs.tdwg.org/dwc/terms/ResourceRelationship,,extension
resourceID,Resource ID,An identifier for the resource that is the subject of the relationship.,,`f809b9e0-b09b-11e8-96f8-529269fb1459`,http://www.w3.org/1999/02/22-rdf-syntax-ns#Property,not in ABCD,http://rs.tdwg.org/dwc/terms/ResourceRelationship,,extension
ResourceRelationship,Resource Relationship,A relationship of one rdfs:Resource (http://www.w3.org/2000/01/rdf-schema#Resource) to another.,"Resources can be thought of as identifiable records or instances of classes and may include, but need not be limited to dwc:Occurrence, dwc:Organism, dwc:MaterialSample, dwc:Event, dwc:Location, dwc:GeologicalContext, dwc:Identification, or dwc:Taxon.",An instance of an Organism is the mother of another instance of an Organism. A uniquely identified Occurrence represents the same Occurrence as another uniquely identified Occurrence. A MaterialSample is a subsample of another MaterialSample.,http://www.w3.org/2000/01/rdf-schema#Class,DataSets/DataSet/Units/Unit/Associations,,http://rs.tdwg.org/dwc/terms/history/decisions/#Decision-2014-10-26_15,extension
resourceRelationshipID,Resource Relationship ID,"An identifier for an instance of relationship between one resource (the subject) and another (relatedResource, the object).",,`04b16710-b09c-11e8-96f8-529269fb1459`,http://www.w3.org/1999/02/22-rdf-syntax-ns#Property,not in ABCD,http://rs.tdwg.org/dwc/terms/ResourceRelationship,,extension
Taxon,Taxon,A group of organisms (sensu http://purl.obolibrary.org/obo/OBI_0100026) considered by taxonomists to form a homogeneous unit.,,The genus Truncorotaloides as published by Brönnimann et al. in 1953 in the Journal of Paleontology Vol. 27(6) p. 817-820.,http://www.w3.org/2000/01/rdf-schema#Class,no simple equivalent in ABCD,,http://rs.tdwg.org/dwc/terms/history/decisions/#Decision-2014-10-26_15,extension
