term_localName,label_en,label_de,label_es,label_fr,label_ko,label_nl,label_ru,label_zh-Hans,label_zh-Hant,rdfs_comment_en,rdfs_comment_de,rdfs_comment_es,rdfs_comment_fr,rdfs_comment_ko,rdfs_comment_nl,rdfs_comment_ru,rdfs_comment_zh-Hans,rdfs_comment_zh-Hant,dcterms_description_en,dcterms_description_de,dcterms_description_es,dcterms_description_fr,dcterms_description_ko,dcterms_description_nl,dcterms_description_ru,dcterms_description_zh-Hans,dcterms_description_zh-Hant,examples_en,examples_de,examples_es,examples_fr,examples_ko,examples_nl,examples_ru,examples_zh-Hans,examples_zh-Hant
georeferenceProtocol,Georeference Protocol,,,,,,,,,"A description or reference to the methods used to determine the spatial footprint, coordinates, and uncertainties.",,,,,,,,,"This term has an equivalent in the dwciri: namespace that allows only an IRI as a value, whereas this term allows for any string literal value.",,,"Ce terme a un équivalent dans le dwciri: namespace qui n'autorise qu'un IRI comme valeur, alors que ce terme autorise n'importe quelle valeur sous forme de chaîne de caractères.",,,,,,,,,,,,,,
georeferenceRemarks,Georeference Remarks,,,,,,,,,"Notes or comments about the spatial description determination, explaining assumptions made in addition or opposition to the those formalized in the method referred to in dwc:georeferenceProtocol.",,,,,,,,,,,,,,,,,,,,,,,,,,
georeferenceSources,Georeference Sources,,,,,,,,,"A list (concatenated and separated) of maps, gazetteers, or other resources used to georeference the dcterms:Location, described specifically enough to allow anyone in the future to use the same resources.",,,"Une liste (concaténée et séparée) de cartes, d'index géographique ou d'autres ressources utilisées pour géoréférencer la dcterms:Location, décrite de manière suffisamment précise pour permettre à quiconque d'utiliser les mêmes ressources à l'avenir.",,,,,,"Recommended best practice is to separate the values in a list with space vertical bar space (` | `). This term has an equivalent in the dwciri: namespace that allows only an IRI as a value, whereas this term allows for any string literal value.",,,"La pratique optimale recommandée est de séparer les valeurs d'une liste par une barre verticale (` | `). Ce terme a un équivalent dans le dwciri: namespace qui n'autorise qu'un IRI comme valeur, alors que ce terme autorise n'importe quelle valeur sous forme de chaîne de caractères.",,,,,,,,,,,,,,
georeferenceVerificationStatus,Georeference Verification Status,,,,,,,,,A categorical description of the extent to which the georeference has been verified to represent the best possible spatial description for the dcterms:Location of the dwc:Occurrence.,,,,,,,,,"Recommended best practice is to use a controlled vocabulary. This term has an equivalent in the dwciri: namespace that allows only an IRI as a value, whereas this term allows for any string literal value.",,,"La pratique optimale recommandée est d'utiliser un vocabulaire contrôlé. Ce terme a un équivalent dans le dwciri: namespace qui n'autorise qu'un IRI comme valeur, alors que ce terme autorise n'importe quelle valeur sous forme de chaîne de caractères.",,,,,,,,,,,,,,
group,Group,,,Groupe,,,,,,The full name of the lithostratigraphic group from which the dwc:MaterialEntity was collected.,,,,,,,,,,,,,,,,,,,,,,,,,,
habitat,Habitat,,,Habitat,,,,,,A category or description of the habitat in which the dwc:Event occurred.,,,Une catégorie ou description de l'habitat dans lequel le dwc:Event s'est produit.,,,,,,"This term has an equivalent in the dwciri: namespace that allows only an IRI as a value, whereas this term allows for any string literal value.",,,"Ce terme a un équivalent dans le dwciri: namespace qui n'autorise qu'un IRI comme valeur, alors que ce terme autorise n'importe quelle valeur sous forme de chaîne de caractères.",,,,,,,,,,,,,,
higherClassification,Higher Classification,,,Classification supérieure,,,,,,A list (concatenated and separated) of taxa names terminating at the rank immediately superior to the referenced dwc:Taxon.,,,Une liste (concaténée et séparée) de noms de taxons s'arrêtant au rang immédiatement supérieur au dwc:Taxon référencé.,,,,,,"Recommended best practice is to separate the values in a list with space vertical bar space (` | `), with terms in order from the highest taxonomic rank to the lowest.",,,"La pratique optimale recommandée est de séparer les valeurs dans une liste par des barres verticales (` | `), les termes étant classés du rang taxonomique le plus inclusif au moins inclusif.",,,,,,,,,,,,,,
higherGeography,Higher Geography,,,Géographie supérieure,,,,,,A list (concatenated and separated) of geographic names less specific than the information captured in the dwc:locality term.,,,Une liste (concaténée et séparée) de noms géographiques moins spécifiques que l'information saisie dans le terme dwc:locality.,,,,,,"Recommended best practice is to separate the values in a list with space vertical bar space (` | `), with terms in order from least specific to most specific.",,,"La pratique optimale recommandée est de séparer les valeurs dans une liste par des barres verticales (` | `), les termes étant classés du moins précis au plus précis.",,,,,,"`North Atlantic Ocean`; `South America | Argentina | Patagonia | Parque Nacional Nahuel Huapi | Neuquén | Los Lagos` with accompanying values `South America` (continent) `Argentina` (country), `Neuquén` (first order division), and `Los Lagos` (second order division)",,,"`North Atlantic Ocean`; `South America | Argentina | Patagonia | Parque Nacional Nahuel Huapi | Neuquén | Los Lagos` avec les valeurs associées `South America` (continent) `Argentina` (country), `Neuquén` (first order division), et `Los Lagos` (second order division)",,,,,
higherGeographyID,Higher Geography ID,,,Identifiant de la géographie supérieure,,,,,,An identifier for the geographic region within which the dcterms:Location occurred.,,,,,,,,,Recommended best practice is to use a persistent identifier from a controlled vocabulary such as the Getty Thesaurus of Geographic Names.,,,La pratique optimale recommandée consiste à utiliser un identifiant permanent issu d'un vocabulaire contrôlé tel que le Getty Thesaurus of Geographic Names.,,,,,,"`http://vocab.getty.edu/tgn/1002002` (Antártida e Islas del Atlántico Sur, Territorio Nacional de la Tierra del Fuego, Argentina).",,,"`http://vocab.getty.edu/tgn/1002002` (Antártida e Islas del Atlántico Sur, Territorio Nacional de la Tierra del Fuego, Argentina).",,,,,
highestBiostratigraphicZone,Highest Biostratigraphic Zone,,,,,,,,,The full name of the highest possible geological biostratigraphic zone of the stratigraphic horizon from which the dwc:MaterialEntity was collected.,,,,,,,,,,,,,,,,,,,,,,,,,,
HumanObservation,Human Observation,,,Observation humaine,,,,,,An output of a human observation process.,,,,,,,,,,,,,,,,,,,,,,,,,,
Identification,Identification,,,Identification,,,,,,"A taxonomic determination (e.g., the assignment to a dwc:Taxon).",,,"Une identification taxonomique (par exemple, l'affectation à un dwc:Taxon).",,,,,,,,,,,,,,,,,,,,,,,
identificationID,Identification ID,,,Identifiant de l'identification,,,,,,An identifier for the dwc:Identification (the body of information associated with the assignment of a scientific name). May be a global unique identifier or an identifier specific to the data set.,,,,,,,,,,,,,,,,,,,,,,,,,,
identificationQualifier,Identification Qualifier,,,,,,,,,"A brief phrase or a standard term (""cf."", ""aff."") to express the determiner's doubts about the dwc:Identification.",,,"Une phrase courte ou une abréviation standardisée (""cf."", ""aff."") pour exprimer les doutes liés à l'identification.",,,,,,"This term has an equivalent in the dwciri: namespace that allows only an IRI as a value, whereas this term allows for any string literal value.",,,"Ce terme a un équivalent dans le dwciri: namespace qui n'autorise qu'une IRI comme valeur, alors que ce terme autorise n'importe quelle valeur sous forme de chaîne de caractères.",,,,,,"`aff. agrifolia var. oxyadenia` (for `Quercus aff. agrifolia var. oxyadenia` with accompanying values `Quercus` in genus, `agrifolia`  in specificEpithet, `oxyadenia`  in infraspecificEpithet, and `var.` in taxonRank); `cf. var. oxyadenia` (for `Quercus agrifolia cf. var. oxyadenia` with accompanying values `Quercus` in genus, `agrifolia` in specificEpithet, `oxyadenia` in infraspecificEpithet, and `var.` in taxonRank)",,,"`aff. agrifolia var. oxyadenia` (pour `Quercus aff. agrifolia var. oxyadenia` avec les valeurs associées `Quercus` dans genus, `agrifolia` dans specificEpithet, `oxyadenia` dans infraspecificEpithet, et `var. ` dans taxonRank) ; `cf. var. oxyadenia` (pour `Quercus agrifolia cf. var. oxyadenia` avec les valeurs associées `Quercus` dans le genus, `agrifolia` dans specificEpithet, `oxyadenia` dans infraspecificEpithet, et `var.` dans taxonRank)",,,,,
identificationReferences,Identification References,,,,,,,,,"A list (concatenated and separated) of references (publication, global unique identifier, URI) used in the dwc:Identification.",,,"Une liste (concaténée et séparée) des références (publication, identifiant unique global (GUI), URI) utilisées pour la dwc:Identification.",,,,,,Recommended best practice is to separate the values in a list with space vertical bar space (` | `).,,,,,,,,,,,,,,,,,
identificationRemarks,Identification Remarks,,,,,,,,,Comments or notes about the dwc:Identification.,,,Commentaires ou notes sur la dwc:Identification.,,,,,,,,,,,,,,,,,,,,,,,
identificationVerificationStatus,Identification Verification Status,,,,,,,,,A categorical indicator of the extent to which the taxonomic identification has been verified to be correct.,,,,,,,,,"Recommended best practice is to use a controlled vocabulary such as that used in HISPID and ABCD. This term has an equivalent in the dwciri: namespace that allows only an IRI as a value, whereas this term allows for any string literal value.",,,"La pratique optimale recommandée est d'utiliser un vocabulaire contrôlé tel que celui utilisé dans HISPID et ABCD. Ce terme a un équivalent dans le dwciri: namespace qui n'autorise qu'un IRI comme valeur, alors que ce terme autorise n'importe quelle valeur sous forme de chaîne de caractères.",,,,,,"`0` (""unverified"" in HISPID/ABCD).",,,"`0` (""unverified""/non vérifié dans HISPID/ABCD).",,,,,
identifiedBy,Identified By,,,Identifié par,,,,,,"A list (concatenated and separated) of names of people, groups, or organizations who assigned the dwc:Taxon to the subject.",,,"Une liste (concaténée et séparée) de noms de personnes, de groupes ou d'organisations qui ont attribué le dwc:Taxon au sujet.",,,,,,"Recommended best practice is to separate the values in a list with space vertical bar space (` | `). This term has an equivalent in the dwciri: namespace that allows only an IRI as a value, whereas this term allows for any string literal value.",,,"La pratique optimale recommandée est de séparer les valeurs d'une liste par une barre verticale (` | `). Ce terme a un équivalent dans le dwciri: namespace qui n'autorise qu'un IRI comme valeur, alors que ce terme autorise n'importe quelle valeur sous forme de chaîne de caractères.",,,,,,,,,,,,,,
identifiedByID,Identified By ID,,,,,,,,,"A list (concatenated and separated) of the globally unique identifier for the person, people, groups, or organizations responsible for assigning the dwc:Taxon to the subject.",,,,,,,,,"Recommended best practice is to provide a single identifier that disambiguates the details of the identifying agent. If a list is used, the order of the identifiers on the list should not be assumed to convey any semantics. Recommended best practice is to separate the values in a list with space vertical bar space (` | `).",,,,,,,,,`https://orcid.org/0000-0002-1825-0097` (for an individual); `https://orcid.org/0000-0002-1825-0097 | https://orcid.org/0000-0002-1825-0098` (for a list of people),,,`https://orcid.org/0000-0002-1825-0097` (pour un individu) ; `https://orcid.org/0000-0002-1825-0097 | https://orcid.org/0000-0002-1825-0098` (pour une liste de personnes),,,,,
individualCount,Individual Count,,,Nombre d'individus,,,,,,The number of individuals present at the time of the dwc:Occurrence.,,,Le nombre d'individus présents au moment de la dwc:Occurrence.,,,,,,,,,,,,,,,,,,,,,,,
informationWithheld,Information Withheld,,,Information non renseignée,,,,,,"Additional information that exists, but that has not been shared in the given record.",,,"Informations supplémentaires qui existent, mais qui n'ont pas été partagées dans l'enregistrement correspondant.",,,,,,"This term has an equivalent in the dwciri: namespace that allows only an IRI as a value, whereas this term allows for any string literal value.",,,"Ce terme a un équivalent dans le dwciri: namespace qui n'autorise qu'un IRI comme valeur, alors que ce terme autorise n'importe quelle valeur sous forme de chaîne de caractères.",,,,,,,,,,,,,,
infragenericEpithet,Infrageneric Epithet,,,Épithète infragénérique,,,,,,The infrageneric part of a binomial name at ranks above species but below genus.,,,Partie infragénérique d'un nom binomial dont le rang est supérieur à celui de l'espèce mais inférieur à celui du genre.,,,,,,"The term dwc:infragenericEpithet should be used in conjunction with dwc:genericName, dwc:specificEpithet, dwc:infraspecificEpithet, dwc:taxonRank and dwc:scientificNameAuthorship to represent the individual elements of the complete dwc:scientificName. It can be used to indicate the subgenus placement of a species, which in zoology is often given in parentheses. Can also be used to share infrageneric names such as botanical sections (e.g., `Vicia sect. Cracca`).",,,"Le terme dwc:infragenericEpithet doit être utilisé conjointement avec dwc:genericName, dwc:specificEpithet, dwc:infraspecificEpithet, dwc:taxonRank et dwc:scientificNameAuthorship pour représenter les éléments individuels du dwc:scientificName complet. Il peut être utilisé pour indiquer l'emplacement du sous-genre d'une espèce, qui est souvent indiqué entre parenthèses en zoologie. Il peut également être utilisé pour partager des noms infragénériques tels que des sections en botanique (par exemple, `Vicia sect. Cracca`).",,,,,,`Abacetillus` (for scientificName `Abacetus (Abacetillus) ambiguus`); `Cracca` (for scientificName `Vicia sect. Cracca`),,,`Abacetillus` (pour le scientificName`Abacetus (Abacetillus) ambiguus`) ; `Cracca` (pour le scientificName `Vicia sect. Cracca`),,,,,
infraspecificEpithet,Infraspecific Epithet,,,Épithète infraspécifique,,,,,,"The name of the lowest or terminal infraspecific epithet of the dwc:scientificName, excluding any rank designation.",,,"Le nom de l'épithète infraspécifique la plus basse ou la dernière du dwc:scientificName, à l'exclusion de toute mention du rang.",,,,,,"In botany, name strings in literature and identifications may have multiple infraspecific ranks. According to the International Code of Nomenclature for algae, fungi, and plants (Schenzhen Code Articles 6.7 & Art. 24.1), valid names only have two epithets, with the lowest rank being the dwc:infraspecificEpithet. For example: the dwc:infraspecificEpithet in the string `Indigofera charlieriana subsp. sessilis var. scaberrima` is `scaberrima` and the dwc:scientificName is `Indigofera charlieriana var. scaberrima (Schinz) J.B.Gillett`. Use dwc:verbatimIdentification for the full name string used in a dwc:Identification.",,,"En botanique, les suites de noms dans la littérature et les identifications peuvent avoir plusieurs rangs infraspécifiques. Selon le Code international de nomenclature pour les algues, les champignons et les plantes (Code de Schenzhen, articles 6.7 et 24.1), les noms valides n'ont que deux épithètes, le rang le plus bas étant le dwc:infraspecificEpithet. Par exemple : le dwc:infraspecificEpithet dans la chaîne `Indigofera charlieriana subsp. sessilis var. scaberrima` est `scaberrima` et le dwc:scientificName est `Indigofera charlieriana var. scaberrima (Schinz) J.B.Gillett`. Utilisez dwc:verbatimIdentification pour la suite de noms complète utilisée dans un dwc:Identification.",,,,,,"`concolor` (for scientificName `Puma concolor concolor (Linnaeus, 1771)`); `oxyadenia` (for scientificName `Quercus agrifolia var. oxyadenia (Torr.) J.T. Howell`); `laxa` (for scientificName `Cheilanthes hirta f. laxa (Kunze) W.Jacobsen & N.Jacobsen`); `scaberrima` (for scientificName `Indigofera charlieriana var. scaberrima (Schinz) J.B.Gillett`)",,,"`concolor` (pour le scientificName `Puma concolor concolor (Linnaeus, 1771)`) ; `oxyadenia` (pour le scientificName `Quercus agrifolia var. oxyadenia (Torr.) J.T. Howell`) ; `laxa` (pour le scientificName `Cheilanthes hirta f. laxa (Kunze) W.Jacobsen & N.Jacobsen`) ; `scaberrima` (pour le scientificName `Indigofera charlieriana var. scaberrima (Schinz) J.B.Gillett`)",,,,,
institutionCode,Institution Code,,,Code de l'institution,,,,,,The name (or acronym) in use by the institution having custody of the object(s) or information referred to in the record.,,,Le nom (ou l'acronyme) en vigueur pour l'institution qui a la garde de l'objet (ou des objets) ou de l'information mentionnée dans l'enregistrement.,,,,,,,,,,,,,,,,,,,,,,,
institutionID,Institution ID,,,Identifiant de l'institution,,,,,,An identifier for the institution having custody of the object(s) or information referred to in the record.,,,Un identifiant de l'institution qui a la garde de l'objet (ou des objets) ou de l'information mentionnée dans l'enregistrement.,,,,,,"For physical specimens, the recommended best practice is to use a globally unique and resolvable identifier from a collections registry such as the Research Organization Registry (ROR) or the GBIF Registry of Scientific Collections (https://www.gbif.org/grscicoll).",,,"Pour les spécimens physiques, la pratique optimale recommandée est d'utiliser un identifiant unique et résoluble à l'échelle mondiale provenant d'un registre de collections tel que le Research Organization Registry (ROR) ou le GBIF Registry of Scientific Collections (https://www.gbif.org/grscicoll).",,,,,,,,,,,,,,
island,Island,,,Île,,,,,,The name of the island on or near which the dcterms:Location occurs.,,,Le nom de l'île sur laquelle ou à proximité de laquelle se trouve la dcterms:Location.,,,,,,Recommended best practice is to use a controlled vocabulary such as the Getty Thesaurus of Geographic Names.,,,La pratique optimale recommandée consiste à utiliser un vocabulaire contrôlé tel que le Getty Thesaurus of Geographic Names.,,,,,,,,,,,,,,
islandGroup,Island Group,,,Groupement d'îles,,,,,,The name of the island group in which the dcterms:Location occurs.,,,Le nom du groupement d'îles dans lequel se trouve la dcterms:Location.,,,,,,Recommended best practice is to use a controlled vocabulary such as the Getty Thesaurus of Geographic Names.,,,La pratique optimale recommandée consiste à utiliser un vocabulaire contrôlé tel que le Getty Thesaurus of Geographic Names.,,,,,,,,,,,,,,
kingdom,Kingdom,,,Règne,,,,,,The full scientific name of the kingdom in which the dwc:Taxon is classified.,,,Le nom scientifique complet du règne dans lequel le dwc:Taxon est classé.,,,,,,,,,,,,,,,,,,,,,,,
latestAgeOrHighestStage,Latest Age Or Highest Stage,,,,,,,,,The full name of the latest possible geochronologic age or highest chronostratigraphic stage attributable to the stratigraphic horizon from which the dwc:MaterialEntity was collected.,,,,,,,,,,,,,,,,,,,,,,,,,,
latestEonOrHighestEonothem,Llatest Eon Or Highest Eonothem,,,,,,,,,"The full name of the latest possible geochronologic eon or highest chrono-stratigraphic eonothem or the informal name (""Precambrian"") attributable to the stratigraphic horizon from which the dwc:MaterialEntity was collected.",,,,,,,,,,,,,,,,,,,,,,,,,,
latestEpochOrHighestSeries,Latest Epoch Or Highest Series,,,,,,,,,The full name of the latest possible geochronologic epoch or highest chronostratigraphic series attributable to the stratigraphic horizon from which the dwc:MaterialEntity was collected.,,,,,,,,,,,,,,,,,,,,,,,,,,
latestEraOrHighestErathem,Latest Era Or Highest Erathem,,,,,,,,,The full name of the latest possible geochronologic era or highest chronostratigraphic erathem attributable to the stratigraphic horizon from which the dwc:MaterialEntity was collected.,,,,,,,,,,,,,,,,,,,,,,,,,,
latestPeriodOrHighestSystem,Latest Period Or Highest System,,,,,,,,,The full name of the latest possible geochronologic period or highest chronostratigraphic system attributable to the stratigraphic horizon from which the dwc:MaterialEntity was collected.,,,Le nom complet de la dernière période géochronologique possible ou du système chronostratigraphique le plus élevé attribuable à l'horizon stratigraphique à partir duquel la dwc:MaterialEntity a été collectée.,,,,,,,,,,,,,,,,,,,,,,,
lifeStage,Life Stage,,,Stade de développement,,,,,,The age class or life stage of the dwc:Organism(s) at the time the dwc:Occurrence was recorded.,,,La classe d'âge ou le stade de vie du ou des dwc:Organism(s) au moment où la dwc:Occurrence a été enregistrée.,,,,,,"Recommended best practice is to use a controlled vocabulary. This term has an equivalent in the dwciri: namespace that allows only an IRI as a value, whereas this term allows for any string literal value.",,,"La pratique optimale recommandée est d'utiliser un vocabulaire contrôlé. Ce terme a un équivalent dans le dwciri: namespace qui n'autorise qu'un IRI comme valeur, alors que ce terme autorise n'importe quelle valeur sous forme de chaîne de caractères.",,,,,,,,,,,,,,
lithostratigraphicTerms,Lithostratigraphic Terms,,,,,,,,,The combination of all litho-stratigraphic names for the rock from which the dwc:MaterialEntity was collected.,,,,,,,,,,,,,,,,,,,,,,,,,,
LivingSpecimen,Living Specimen,,,Spécimen vivant,,,,,,A specimen that is alive.,,,Un spécimen qui est en vie.,,,,,,,,,,,,,,,,,,,,,,,
locality,Locality,,,Localité,,,,,,The specific description of the place.,,,La description précise du lieu.,,,,,,"Less specific geographic information can be provided in other geographic terms (dwc:higherGeography, dwc:continent, dwc:country, dwc:stateProvince, dwc:county, dwc:municipality, dwc:waterBody, dwc:island, dwc:islandGroup). This term may contain information modified from the original to correct perceived errors or standardize the description.",,,,,,,,,,,,,,,,,
locationAccordingTo,Location According To,,,,,,,,,"Information about the source of this dcterms:Location information. Could be a publication (gazetteer), institution, or team of individuals.",,,"Informations sur la source des informations sur la dcterms:Location. Il peut s'agir d'une publication (gazetteer/index géographique), d'une institution ou d'un ensemble d'individus.",,,,,,"This term has an equivalent in the dwciri: namespace that allows only an IRI as a value, whereas this term allows for any string literal value.",,,"Ce terme a un équivalent dans le dwciri: namespace qui n'autorise qu'un IRI comme valeur, alors que ce terme autorise n'importe quelle valeur sous forme de chaîne de caractères.",,,,,,,,,,,,,,
locationID,Location ID,,,,,,,,,An identifier for the set of dcterms:Location information. May be a global unique identifier or an identifier specific to the data set.,,,,,,,,,,,,,,,,,,,,,,,,,,
locationRemarks,Location Remarks,,,,,,,,,Comments or notes about the dcterms:Location.,,,,,,,,,,,,,,,,,,,,,,,,,,
lowestBiostratigraphicZone,Lowest Biostratigraphic Zone,,,,,,,,,The full name of the lowest possible geological biostratigraphic zone of the stratigraphic horizon from which the dwc:MaterialEntity was collected.,,,,,,,,,,,,,,,,,,,,,,,,,,
MachineObservation,Machine Observation,,,Observation faite par une machine,,,,,,An output of a machine observation process.,,,,,,,,,,,,,,,,,,,,,,,,,,
MaterialCitation,Material Citation,,,,,,,,,"A reference to or citation of one, a part of, or multiple specimens in scholarly publications.",,,,,,,,,"This class constitutes a new value for the controlled vocabulary in the recommendations for basisOfRecord. When importing Darwin Core Archives of literature-based datasets to GBIF, the basisOfRecord should be changed from ""Occurrence"", ""PreservedSpecimen"" or ""Literature"" to ""MaterialCitation"".",,,,,,,,,,,,,,,,,
MaterialEntity,Material Entity,,,,,,,,,"An entity that can be identified, exists for some period of time, and consists in whole or in part of physical matter while it exists.",,,,,,,,,"The term is defined at the most general level to admit descriptions of any subtype of material entity within the scope of Darwin Core. In particular, any kind of material sample, preserved specimen, fossil, or exemplar from living collections is intended to be subsumed under this term.",,,,,,,,,,,,,,,,,
materialEntityID,Material Entity ID,,,,,,,,,An identifier for a particular instance of a dwc:MaterialEntity.,,,,,,,,,"Values of dwc:materialEntityID are intended to uniquely and persistently identify a particular dwc:MaterialEntity within some context. Examples of context include a particular sample collection, an organization, or the worldwide scale. Recommended best practice is to use a persistent, globally unique identifier. The identifier is bound to a physical object (the dwc:MaterialEntity) as opposed to a particular digital record (representation) of that physical object.",,,,,,,,,,,,,,,,,
materialEntityRemarks,Material Entity Remarks,,,,,,,,,Comments or notes about the dwc:MaterialEntity instance.,,,,,,,,,,,,,,,,,,,,,,,,,,
MaterialSample,Material Sample,,,,,,,,,A material entity that represents an entity of interest in whole or in part.,,,,,,,,,,,,,,,,,,,,,,,,,,
