"identifier","context","text"
"earliestEonOrLowestEonothem:rdfs_comment","Comment for Earliest Eon Or Lowest Eonothem http://rs.tdwg.org/dwc/terms/earliestEonOrLowestEonothem","Le nom complet de l'éon géochronologique le plus ancien possible ou de l'éonothème chrono-stratigraphique le plus bas, ou le nom informel (""Précambrien"") attribuable à l'horizon stratigraphique à partir duquel l'entité dwc:MaterialEntity a été collectée."
"earliestEpochOrLowestSeries:label","Label for Earliest Epoch Or Lowest Series http://rs.tdwg.org/dwc/terms/earliestEpochOrLowestSeries","Époque la plus ancienne ou série la plus basse"
"earliestEpochOrLowestSeries:rdfs_comment","Comment for Earliest Epoch Or Lowest Series http://rs.tdwg.org/dwc/terms/earliestEpochOrLowestSeries","Le nom complet de l'époque géochronologique la plus ancienne possible ou de la série chronostratigraphique la plus basse attribuable à l'horizon stratigraphique à partir duquel l'entité dwc:MaterialEntity a été collectée."
"earliestEraOrLowestErathem:label","Label for Earliest Era Or Lowest Erathem http://rs.tdwg.org/dwc/terms/earliestEraOrLowestErathem","Première ère ou érathème inférieur"
"earliestEraOrLowestErathem:rdfs_comment","Comment for Earliest Era Or Lowest Erathem http://rs.tdwg.org/dwc/terms/earliestEraOrLowestErathem","Le nom complet de l'ère géochronologique potentielle la plus ancienne ou de l'érythème chronostratigraphique le plus bas attribuable à l'horizon stratigraphique à partir duquel la dwc:MaterialEntity a été collectée."
"earliestPeriodOrLowestSystem:label","Label for Earliest Period Or Lowest System http://rs.tdwg.org/dwc/terms/earliestPeriodOrLowestSystem","Première période ou système inférieur"
"earliestPeriodOrLowestSystem:rdfs_comment","Comment for Earliest Period Or Lowest System http://rs.tdwg.org/dwc/terms/earliestPeriodOrLowestSystem","Le nom complet de la période géochronologique la plus ancienne possible ou du système chronostratigraphique le plus bas attribuable à l'horizon stratigraphique à partir duquel la dwc:MaterialEntity a été collectée."
"endDayOfYear:label","Label for End Day Of Year http://rs.tdwg.org/dwc/terms/endDayOfYear","Numéro du jour de fin"
"endDayOfYear:rdfs_comment","Comment for End Day Of Year http://rs.tdwg.org/dwc/terms/endDayOfYear","Le dernier jour entier de l'année où le dwc:Event s'est produit (1 pour le 1er janvier, 365 pour le 31 décembre, sauf si l'année est bissextile, auquel cas le 31 décembre aura le numéro 366)."
"endDayOfYear:examples","Examples for End Day Of Year http://rs.tdwg.org/dwc/terms/endDayOfYear","`1` (1er janvier) ; `32` (1er février) ; `366` (31 décembre) ; `365` (30 décembre d'une année bissextile, 31 décembre d'une année commune)"
"establishmentMeans:label","Label for Establishment Means http://rs.tdwg.org/dwc/terms/establishmentMeans","Moyens d'implantation"
"establishmentMeans:rdfs_comment","Comment for Establishment Means http://rs.tdwg.org/dwc/terms/establishmentMeans","Indication selon laquelle un dwc:Organism a été introduit en un lieu et à un moment donnés par l'activité directe ou indirecte de l'humain moderne."
"establishmentMeans:dcterms_description","Description for Establishment Means http://rs.tdwg.org/dwc/terms/establishmentMeans","La pratique optimale recommandée est d'utiliser les valeurs permises par le vocabulaire contrôlé dédié à ce terme, dont la liste figure à l'adresse http://rs.tdwg.org/dwc/doc/em/. Pour plus de détails, voir https://doi.org/10.3897/biss.3.38084. Ce terme a un équivalent dans le dwciri: namespace qui n'autorise qu'un IRI comme valeur, alors que ce terme autorise n'importe quelle valeur sous forme de chaîne de caractères."
"Event:label","Label for Event http://rs.tdwg.org/dwc/terms/Event","Événement"
"Event:rdfs_comment","Comment for Event http://rs.tdwg.org/dwc/terms/Event","Une action qui se produit à un endroit donné pendant un temps donné."
"eventDate:label","Label for Event Date http://rs.tdwg.org/dwc/terms/eventDate","Date de l'événement"
"eventDate:rdfs_comment","Comment for Event Date http://rs.tdwg.org/dwc/terms/eventDate","La date et l'heure ou l'intervalle pendant lesquels un dwc:Event s'est produit. Pour les occurrences, il s'agit de la date à laquelle le dwc:Event a été enregistré. Ce terme ne convient pas pour un temps dans un contexte géologique."
"eventDate:dcterms_description","Description for Event Date http://rs.tdwg.org/dwc/terms/eventDate","La pratique optimale recommandée est d'utiliser une date conforme à la norme ISO 8601-1:2019."
"eventDate:examples","Examples for Event Date http://rs.tdwg.org/dwc/terms/eventDate","`1963-03-08T14:07-0600` (8 mars 1963 à 14h07 dans le fuseau horaire six heures plus tôt que l'UTC) ; `2009-02-20T08:40Z` (20 février 2009 8h40 UTC) ; `2018-08-29T15:19` (15 h 19, heure locale, le 29 août 2018) ; `1809-02-12` (durant le 12 février 1809) ; `1906-06` (durant juin 1906) ; `1971` (durant l'année 1971) ;`2007-03-01T13:00:00Z/2008-05-11T15:30:00Z` (durant une période comprise entre le 1er mars 2007, 13 heures UTC, et le 11 mai 2008, 15 heures 30 UTC) ; `1900/1909` (durant une période comprise entre le début de l'année 1900 et la fin de l'année 1909) ; `2007-11-13/15` (durant une période comprise entre le 13 novembre 2007 et le 15 novembre 2007)"
"eventID:label","Label for Event ID http://rs.tdwg.org/dwc/terms/eventID","Identifiant de l'événement"
"eventID:rdfs_comment","Comment for Event ID http://rs.tdwg.org/dwc/terms/eventID","Un identifiant pour l'ensemble des informations associées à un dwc:Event (quelque chose qui se produit à un endroit et à un temps donnés). Il peut s'agir d'un identifiant unique global ou d'un identifiant spécifique à un jeu de données."
"eventRemarks:label","Label for Event Remarks http://rs.tdwg.org/dwc/terms/eventRemarks","Remarques sur l'événement"
"eventRemarks:rdfs_comment","Comment for Event Remarks http://rs.tdwg.org/dwc/terms/eventRemarks","Commentaires ou notes sur le dwc:Event."
"eventTime:label","Label for Event Time http://rs.tdwg.org/dwc/terms/eventTime","Heure de l'événement"
"eventTime:rdfs_comment","Comment for Event Time http://rs.tdwg.org/dwc/terms/eventTime","Le moment ou l'intervalle de temps pendant lequel un dwc:Event s'est produit."
"eventTime:dcterms_description","Description for Event Time http://rs.tdwg.org/dwc/terms/eventTime","La pratique optimale recommandée est d'utiliser une heure conforme à la norme ISO 8601-1:2019."
"eventTime:examples","Examples for Event Time http://rs.tdwg.org/dwc/terms/eventTime","`14:07-0600` (14:07 dans le fuseau horaire six heures plus tôt que UTC) ; `08:40:21Z` (8:40:21 UTC) ; `13:00:00Z/15:30:00Z` (l'intervalle entre 13:00 UTC et 15:30pm UTC)"
"eventType:label","Label for Event Type http://rs.tdwg.org/dwc/terms/eventType","Type d'événement"
"eventType:rdfs_comment","Comment for Event Type http://rs.tdwg.org/dwc/terms/eventType","La nature du dwc:Event."
"eventType:dcterms_description","Description for Event Type http://rs.tdwg.org/dwc/terms/eventType","La pratique optimale recommandée est d'utiliser un vocabulaire contrôlé. Indépendamment du dwc:eventType, l'intervalle du dwc:event peut être saisi dans dwc:eventDate. Ce terme a un équivalent dans le dwciri: namespace qui n'autorise qu'une IRI comme valeur, alors que ce terme autorise n'importe quelle valeur sous forme de chaîne de caractères."
"family:label","Label for Family http://rs.tdwg.org/dwc/terms/family","Famille"
"family:rdfs_comment","Comment for Family http://rs.tdwg.org/dwc/terms/family","Le nom scientifique complet de la famille dans laquelle le dwc:Taxon est classé."
"fieldNotes:label","Label for Field Notes http://rs.tdwg.org/dwc/terms/fieldNotes","Notes de terrain"
"fieldNotes:rdfs_comment","Comment for Field Notes http://rs.tdwg.org/dwc/terms/fieldNotes","L'un des éléments suivants : a) un indicateur de l'existence de, b) une référence à (publication, URI), ou c) les notes prises sur le terrain concernant le dwc:Event."
"fieldNotes:dcterms_description","Description for Field Notes http://rs.tdwg.org/dwc/terms/fieldNotes","Ce terme a un équivalent dans le dwciri: namespace qui n'autorise qu'une IRI comme valeur, alors que ce terme autorise n'importe quelle valeur sous forme de chaîne de caractères."
"fieldNumber:label","Label for Field Number http://rs.tdwg.org/dwc/terms/fieldNumber","Numéro de terrain"
"fieldNumber:rdfs_comment","Comment for Field Number http://rs.tdwg.org/dwc/terms/fieldNumber","Identifiant donné au dwc:Event sur le terrain. Il sert souvent de lien entre les notes de terrain et le dwc:Event."
"fieldNumber:dcterms_description","Description for Field Number http://rs.tdwg.org/dwc/terms/fieldNumber","Ce terme a un équivalent dans le dwciri: namespace qui n'autorise qu'un IRI comme valeur, alors que ce terme autorise n'importe quelle valeur sous forme de chaîne de caractères."
"footprintSpatialFit:label","Label for Footprint Spatial Fit http://rs.tdwg.org/dwc/terms/footprintSpatialFit",""
"footprintSpatialFit:rdfs_comment","Comment for Footprint Spatial Fit http://rs.tdwg.org/dwc/terms/footprintSpatialFit",""
"footprintSpatialFit:dcterms_description","Description for Footprint Spatial Fit http://rs.tdwg.org/dwc/terms/footprintSpatialFit","Des explications détaillées avec des exemples illustrés figurent dans le document 'Georeferencing Best Practices', par Chapman et Wieczorek, 2020 (https://doi.org/10.15468/doc-gg7h-s853)."
"footprintSRS:label","Label for Footprint SRS http://rs.tdwg.org/dwc/terms/footprintSRS",""
"footprintSRS:rdfs_comment","Comment for Footprint SRS http://rs.tdwg.org/dwc/terms/footprintSRS","L'ellipsoïde, le système de référence géodésique ou le système de référence spatiale (SRS) sur lequel la géométrie donnée dans dwc:footprintWKT est basée."
"footprintSRS:dcterms_description","Description for Footprint SRS http://rs.tdwg.org/dwc/terms/footprintSRS","La pratique optimale recommandée est d'utiliser le code EPSG du SRS, s'il est connu. Sinon, utilisez un vocabulaire contrôlé pour le nom ou le code du système de référence géodésique, s'il est connu. Sinon, utilisez un vocabulaire contrôlé pour le nom ou le code de l'ellipsoïde, s'il est connu. Si aucun de ces éléments n'est connu, utiliser la valeur `unknown` (inconnu). Il est également permis de fournir le SRS en Well-Known-Text, en particulier si aucun code EPSG ne fournit les valeurs nécessaires pour les attributs du SRS. N'utilisez pas ce terme pour décrire le SRS de dwc:decimalLatitude et de dwc:decimalLongitude, ni de coordonnées verbatim - utilisez plutôt dwc:geodeticDatum et dwc:verbatimSRS respectivement. Ce terme a un équivalent dans le dwciri: namespace qui n'autorise qu'un IRI comme valeur, alors que ce terme autorise n'importe quelle valeur sous forme de chaîne de caractères."
"footprintSRS:examples","Examples for Footprint SRS http://rs.tdwg.org/dwc/terms/footprintSRS",""
"footprintWKT:label","Label for Footprint WKT http://rs.tdwg.org/dwc/terms/footprintWKT",""
"footprintWKT:rdfs_comment","Comment for Footprint WKT http://rs.tdwg.org/dwc/terms/footprintWKT",""
"footprintWKT:dcterms_description","Description for Footprint WKT http://rs.tdwg.org/dwc/terms/footprintWKT","Ce terme a un équivalent dans le dwciri: namespace qui n'autorise qu'une IRI comme valeur, alors que ce terme autorise n'importe quelle valeur sous forme de chaîne de caractères."
"footprintWKT:examples","Examples for Footprint WKT http://rs.tdwg.org/dwc/terms/footprintWKT",""
"formation:label","Label for Formation http://rs.tdwg.org/dwc/terms/formation","Formation"
"formation:rdfs_comment","Comment for Formation http://rs.tdwg.org/dwc/terms/formation","Le nom complet de la formation lithostratigraphique à partir de laquelle la dwc:MaterialEntity a été collectée."
"FossilSpecimen:label","Label for Fossil Specimen http://rs.tdwg.org/dwc/terms/FossilSpecimen","Spécimen fossile"
"FossilSpecimen:rdfs_comment","Comment for Fossil Specimen http://rs.tdwg.org/dwc/terms/FossilSpecimen","Un spécimen fossile en collection ."
"genericName:label","Label for Generic Name http://rs.tdwg.org/dwc/terms/genericName","Nom générique"
"genericName:rdfs_comment","Comment for Generic Name http://rs.tdwg.org/dwc/terms/genericName","La partie générique du dwc:scientificName sans l'autorité."
"genericName:dcterms_description","Description for Generic Name http://rs.tdwg.org/dwc/terms/genericName","Pour les synonymes, le genre accepté et la partie générique du nom peuvent être différents. Le terme dwc:genericName doit être utilisé avec dwc:specificEpithet pour former un binôme et avec dwc:infraspecificEpithet pour former un trinôme. Le terme dwc:genericName ne doit être utilisé que pour les combinaisons. Les uninomiaux de rang genre n'ont pas de dwc:genericName."
"genericName:examples","Examples for Generic Name http://rs.tdwg.org/dwc/terms/genericName","`Felis` (pour le nom scientifique `Felis concolor`, avec les valeurs associées de `Puma concolor` dans acceptedNameUsage et `Puma` dans genus)"
"genus:label","Label for Genus http://rs.tdwg.org/dwc/terms/genus","Genre"
"genus:rdfs_comment","Comment for Genus http://rs.tdwg.org/dwc/terms/genus","Le nom scientifique complet du genre dans lequel le dwc:Taxon est classé."
"geodeticDatum:label","Label for Geodetic Datum http://rs.tdwg.org/dwc/terms/geodeticDatum","Système géodésique"
"geodeticDatum:rdfs_comment","Comment for Geodetic Datum http://rs.tdwg.org/dwc/terms/geodeticDatum","L'ellipsoïde, le système de référence géodésique ou le système de référence spatiale (SRS) sur lequel sont basées les coordonnées géographiques données dans dwc:decimalLatitude et dwc:decimalLongitude."
"geodeticDatum:dcterms_description","Description for Geodetic Datum http://rs.tdwg.org/dwc/terms/geodeticDatum","La pratique optimale recommandée est d'utiliser le code EPSG du SRS, s'il est connu. Sinon, utilisez un vocabulaire contrôlé pour le nom ou le code du système de référence géodésique, s'il est connu. Sinon, utilisez un vocabulaire contrôlé pour le nom ou le code de l'ellipsoïde, s'il est connu. Si aucun de ces éléments n'est connu, utiliser la valeur `unknown` (inconnu). Ce terme a un équivalent dans le dwciri: namespace qui n'autorise qu'un IRI comme valeur, alors que ce terme autorise n'importe quelle valeur sous forme de chaîne de caractères."
"GeologicalContext:label","Label for Geological Context http://rs.tdwg.org/dwc/terms/GeologicalContext","Contexte géologique"
"GeologicalContext:rdfs_comment","Comment for Geological Context http://rs.tdwg.org/dwc/terms/GeologicalContext","Information géologique, telle que la stratigraphie, qui qualifie une région ou un lieu."
"geologicalContextID:label","Label for Geological Context ID http://rs.tdwg.org/dwc/terms/geologicalContextID","Identifiant du contexte géologique"
"geologicalContextID:rdfs_comment","Comment for Geological Context ID http://rs.tdwg.org/dwc/terms/geologicalContextID","Un identifiant pour l'ensemble des informations associées à un dwc:GeologicalContext (l'emplacement dans un contexte géologique, tel que la stratigraphie). Il peut s'agir d'un identifiant unique global (GUI) ou d'un identifiant spécifique à un jeu de données."
"georeferencedBy:label","Label for Georeferenced By http://rs.tdwg.org/dwc/terms/georeferencedBy","Géoréférencé par"
"georeferencedBy:rdfs_comment","Comment for Georeferenced By http://rs.tdwg.org/dwc/terms/georeferencedBy","Une liste (concaténée et séparée) de noms de personnes, de groupes ou d'organisations qui ont déterminé le géoréférencement (représentation spatiale) utilisé pour la dcterms:Location."
"georeferencedBy:dcterms_description","Description for Georeferenced By http://rs.tdwg.org/dwc/terms/georeferencedBy","La pratique optimale recommandée est de séparer les valeurs d'une liste par une barre verticale (` | `). Ce terme a un équivalent dans le dwciri: namespace qui n'autorise qu'un IRI comme valeur, alors que ce terme autorise n'importe quelle valeur sous forme de chaîne de caractères."
"georeferencedDate:label","Label for Georeferenced Date http://rs.tdwg.org/dwc/terms/georeferencedDate","Date de géoréférencement"
"georeferencedDate:rdfs_comment","Comment for Georeferenced Date http://rs.tdwg.org/dwc/terms/georeferencedDate","Date à laquelle la dcterms:Location a été géoréférencée."
"georeferencedDate:dcterms_description","Description for Georeferenced Date http://rs.tdwg.org/dwc/terms/georeferencedDate","La pratique optimale recommandée est d'utiliser une date conforme à la norme ISO 8601-1:2019."
"georeferencedDate:examples","Examples for Georeferenced Date http://rs.tdwg.org/dwc/terms/georeferencedDate",""
"georeferenceProtocol:label","Label for Georeference Protocol http://rs.tdwg.org/dwc/terms/georeferenceProtocol","Protocole de géoréférence"
"georeferenceProtocol:rdfs_comment","Comment for Georeference Protocol http://rs.tdwg.org/dwc/terms/georeferenceProtocol",""
"georeferenceProtocol:dcterms_description","Description for Georeference Protocol http://rs.tdwg.org/dwc/terms/georeferenceProtocol","Ce terme a un équivalent dans le dwciri: namespace qui n'autorise qu'un IRI comme valeur, alors que ce terme autorise n'importe quelle valeur sous forme de chaîne de caractères."
"georeferenceRemarks:label","Label for Georeference Remarks http://rs.tdwg.org/dwc/terms/georeferenceRemarks","Remarques sur le géoréférencement"
"georeferenceRemarks:rdfs_comment","Comment for Georeference Remarks http://rs.tdwg.org/dwc/terms/georeferenceRemarks","Des notes ou des commentaires sur la définition de la description spatiale, expliquant les hypothèses formulées en plus ou en contradiction avec celles formalisées dans la méthode mentionnée dans dwc:georeferenceProtocol."
"georeferenceSources:label","Label for Georeference Sources http://rs.tdwg.org/dwc/terms/georeferenceSources",""
"georeferenceSources:rdfs_comment","Comment for Georeference Sources http://rs.tdwg.org/dwc/terms/georeferenceSources","Une liste (concaténée et séparée) de cartes, d'index géographique ou d'autres ressources utilisées pour géoréférencer la dcterms:Location, décrite de manière suffisamment précise pour permettre à quiconque d'utiliser les mêmes ressources à l'avenir."
"georeferenceSources:dcterms_description","Description for Georeference Sources http://rs.tdwg.org/dwc/terms/georeferenceSources","La pratique optimale recommandée est de séparer les valeurs d'une liste par une barre verticale (` | `). Ce terme a un équivalent dans le dwciri: namespace qui n'autorise qu'un IRI comme valeur, alors que ce terme autorise n'importe quelle valeur sous forme de chaîne de caractères."
"georeferenceVerificationStatus:label","Label for Georeference Verification Status http://rs.tdwg.org/dwc/terms/georeferenceVerificationStatus",""
"georeferenceVerificationStatus:rdfs_comment","Comment for Georeference Verification Status http://rs.tdwg.org/dwc/terms/georeferenceVerificationStatus","Une description qualitative de la mesure dans laquelle la géoréférence est considérée comme représentant la meilleure description spatiale possible pour la dcterms:Location de la dwc:Occurrence."
"georeferenceVerificationStatus:dcterms_description","Description for Georeference Verification Status http://rs.tdwg.org/dwc/terms/georeferenceVerificationStatus","La pratique optimale recommandée est d'utiliser un vocabulaire contrôlé. Ce terme a un équivalent dans le dwciri: namespace qui n'autorise qu'un IRI comme valeur, alors que ce terme autorise n'importe quelle valeur sous forme de chaîne de caractères."
"group:label","Label for Group http://rs.tdwg.org/dwc/terms/group","Groupe"
"group:rdfs_comment","Comment for Group http://rs.tdwg.org/dwc/terms/group","Le nom complet du groupe lithostratigraphique à partir duquel l'entité dwc:MaterialEntity a été collectée."
"habitat:label","Label for Habitat http://rs.tdwg.org/dwc/terms/habitat","Habitat"
"habitat:rdfs_comment","Comment for Habitat http://rs.tdwg.org/dwc/terms/habitat","Une catégorie ou description de l'habitat dans lequel le dwc:Event s'est produit."
"habitat:dcterms_description","Description for Habitat http://rs.tdwg.org/dwc/terms/habitat","Ce terme a un équivalent dans le dwciri: namespace qui n'autorise qu'un IRI comme valeur, alors que ce terme autorise n'importe quelle valeur sous forme de chaîne de caractères."
"higherClassification:label","Label for Higher Classification http://rs.tdwg.org/dwc/terms/higherClassification","Classification supérieure"
"higherClassification:rdfs_comment","Comment for Higher Classification http://rs.tdwg.org/dwc/terms/higherClassification","Une liste (concaténée et séparée) de noms de taxons s'arrêtant au rang immédiatement supérieur au dwc:Taxon référencé."
"higherClassification:dcterms_description","Description for Higher Classification http://rs.tdwg.org/dwc/terms/higherClassification","La pratique optimale recommandée est de séparer les valeurs dans une liste par des barres verticales (` | `), les termes étant classés du rang taxonomique le plus inclusif au moins inclusif."
"higherGeography:label","Label for Higher Geography http://rs.tdwg.org/dwc/terms/higherGeography","Géographie supérieure"
"higherGeography:rdfs_comment","Comment for Higher Geography http://rs.tdwg.org/dwc/terms/higherGeography","Une liste (concaténée et séparée) de noms géographiques moins spécifiques que l'information saisie dans le terme dwc:locality."
"higherGeography:dcterms_description","Description for Higher Geography http://rs.tdwg.org/dwc/terms/higherGeography","La pratique optimale recommandée est de séparer les valeurs dans une liste par des barres verticales (` | `), les termes étant classés du moins précis au plus précis."
"higherGeography:examples","Examples for Higher Geography http://rs.tdwg.org/dwc/terms/higherGeography","`North Atlantic Ocean`; `South America | Argentina | Patagonia | Parque Nacional Nahuel Huapi | Neuquén | Los Lagos` avec les valeurs associées `South America` (continent) `Argentina` (country), `Neuquén` (first order division), et `Los Lagos` (second order division)"
"higherGeographyID:label","Label for Higher Geography ID http://rs.tdwg.org/dwc/terms/higherGeographyID","Identifiant de la géographie supérieure"
"higherGeographyID:rdfs_comment","Comment for Higher Geography ID http://rs.tdwg.org/dwc/terms/higherGeographyID",""
"higherGeographyID:dcterms_description","Description for Higher Geography ID http://rs.tdwg.org/dwc/terms/higherGeographyID","La pratique optimale recommandée consiste à utiliser un identifiant permanent issu d'un vocabulaire contrôlé tel que le Getty Thesaurus of Geographic Names."
"higherGeographyID:examples","Examples for Higher Geography ID http://rs.tdwg.org/dwc/terms/higherGeographyID","`http://vocab.getty.edu/tgn/1002002` (Antártida e Islas del Atlántico Sur, Territorio Nacional de la Tierra del Fuego, Argentina)."
"highestBiostratigraphicZone:label","Label for Highest Biostratigraphic Zone http://rs.tdwg.org/dwc/terms/highestBiostratigraphicZone","Zone biostratigraphique la plus élevée"
"highestBiostratigraphicZone:rdfs_comment","Comment for Highest Biostratigraphic Zone http://rs.tdwg.org/dwc/terms/highestBiostratigraphicZone","Le nom complet de la zone géologique biostratigraphique la plus élevée possible de l'horizon stratigraphique à partir duquel l'entité dwc:MaterialEntity a été collectée."
"HumanObservation:label","Label for Human Observation http://rs.tdwg.org/dwc/terms/HumanObservation","Observation humaine"
"HumanObservation:rdfs_comment","Comment for Human Observation http://rs.tdwg.org/dwc/terms/HumanObservation","Le résultat du processus d'une observation humaine."
"Identification:label","Label for Identification http://rs.tdwg.org/dwc/terms/Identification","Identification"
"Identification:rdfs_comment","Comment for Identification http://rs.tdwg.org/dwc/terms/Identification","Une identification taxonomique (par exemple, l'affectation à un dwc:Taxon)."
"identificationID:label","Label for Identification ID http://rs.tdwg.org/dwc/terms/identificationID","Identifiant de l'identification"
"identificationID:rdfs_comment","Comment for Identification ID http://rs.tdwg.org/dwc/terms/identificationID",""
"identificationQualifier:label","Label for Identification Qualifier http://rs.tdwg.org/dwc/terms/identificationQualifier","Qualificatif de l'identification"
"identificationQualifier:rdfs_comment","Comment for Identification Qualifier http://rs.tdwg.org/dwc/terms/identificationQualifier","Une phrase courte ou une abréviation standardisée (""cf."", ""aff."") pour exprimer les doutes liés à l'identification."
"identificationQualifier:dcterms_description","Description for Identification Qualifier http://rs.tdwg.org/dwc/terms/identificationQualifier","Ce terme a un équivalent dans le dwciri: namespace qui n'autorise qu'une IRI comme valeur, alors que ce terme autorise n'importe quelle valeur sous forme de chaîne de caractères."
"identificationQualifier:examples","Examples for Identification Qualifier http://rs.tdwg.org/dwc/terms/identificationQualifier","`aff. agrifolia var. oxyadenia` (pour `Quercus aff. agrifolia var. oxyadenia` avec les valeurs associées `Quercus` dans genus, `agrifolia` dans specificEpithet, `oxyadenia` dans infraspecificEpithet, et `var. ` dans taxonRank) ; `cf. var. oxyadenia` (pour `Quercus agrifolia cf. var. oxyadenia` avec les valeurs associées `Quercus` dans le genus, `agrifolia` dans specificEpithet, `oxyadenia` dans infraspecificEpithet, et `var.` dans taxonRank)"
"identificationReferences:label","Label for Identification References http://rs.tdwg.org/dwc/terms/identificationReferences","Références associées à l'identification"
