"identifier","context","text"
"identificationReferences:dcterms_description","Description for Identification References http://rs.tdwg.org/dwc/terms/identificationReferences","Doporučeným postupem je oddělovat hodnoty v seznamu mezerou svislou čarou mezerou (` | `)."
"identificationRemarks:label","Label for Identification Remarks http://rs.tdwg.org/dwc/terms/identificationRemarks","Poznámky k identifikaci"
"identificationRemarks:rdfs_comment","Comment for Identification Remarks http://rs.tdwg.org/dwc/terms/identificationRemarks","Komentáře nebo poznámky k dwc:Identification."
"identificationVerificationStatus:label","Label for Identification Verification Status http://rs.tdwg.org/dwc/terms/identificationVerificationStatus","Stav ověření identifikace"
"identificationVerificationStatus:rdfs_comment","Comment for Identification Verification Status http://rs.tdwg.org/dwc/terms/identificationVerificationStatus","Kategoriální ukazatel míry, do jaké byla ověřena správnost taxonomické identifikace."
"identificationVerificationStatus:dcterms_description","Description for Identification Verification Status http://rs.tdwg.org/dwc/terms/identificationVerificationStatus","Doporučeným osvědčeným postupem je používat řízený slovník, jako je slovník používaný v HISPID a ABCD. Tento termín má ekvivalent ve jmenném prostoru dwciri:, který umožňuje jako hodnotu pouze IRI, zatímco tento termín umožňuje jakoukoli řetězcovou literální hodnotu."
"identificationVerificationStatus:examples","Examples for Identification Verification Status http://rs.tdwg.org/dwc/terms/identificationVerificationStatus","`0` („neověřeno“ v HISPID/ABCD)."
"identifiedBy:label","Label for Identified By http://rs.tdwg.org/dwc/terms/identifiedBy","Identifikováno kým"
"identifiedBy:rdfs_comment","Comment for Identified By http://rs.tdwg.org/dwc/terms/identifiedBy","Seznam (spojený a oddělený) jmen osob, skupin nebo organizací, které přiřadily dwc:Taxon k subjektu."
"identifiedBy:dcterms_description","Description for Identified By http://rs.tdwg.org/dwc/terms/identifiedBy","Doporučeným postupem je oddělovat hodnoty v seznamu mezerou svislou čarou mezerou (` | `). Tento termín má ekvivalent ve jmenném prostoru dwciri:, který jako hodnotu povoluje pouze IRI, zatímco tento termín povoluje jakoukoli řetězcovou literální hodnotu."
"identifiedByID:label","Label for Identified By ID http://rs.tdwg.org/dwc/terms/identifiedByID","Identifikováno podle ID"
"identifiedByID:rdfs_comment","Comment for Identified By ID http://rs.tdwg.org/dwc/terms/identifiedByID","Seznam (spojený a oddělený) globálně jedinečného identifikátoru osoby, osob, skupin nebo organizací odpovědných za přiřazení dwc:Taxon subjektu."
"identifiedByID:dcterms_description","Description for Identified By ID http://rs.tdwg.org/dwc/terms/identifiedByID","Doporučeným osvědčeným postupem je uvedení jediného identifikátoru, který jednoznačně určuje údaje o identifikačním prostředku. Pokud je použit seznam, nemělo by se předpokládat, že pořadí identifikátorů v seznamu vyjadřuje jakoukoli sémantiku. Doporučeným osvědčeným postupem je oddělit hodnoty v seznamu mezerou svislou čarou mezerou (` | `)."
"identifiedByID:examples","Examples for Identified By ID http://rs.tdwg.org/dwc/terms/identifiedByID","`https://orcid.org/0000-0002-1825-0097` (pro jednotlivce); `https://orcid.org/0000-0002-1825-0097 | https://orcid.org/0000-0002-1825-0098` (pro seznam osob)"
"individualCount:label","Label for Individual Count http://rs.tdwg.org/dwc/terms/individualCount","Individuální počet"
"individualCount:rdfs_comment","Comment for Individual Count http://rs.tdwg.org/dwc/terms/individualCount","Počet osob přítomných v době dwc:Occurrence."
"informationWithheld:label","Label for Information Withheld http://rs.tdwg.org/dwc/terms/informationWithheld","Zatajené informace"
"informationWithheld:rdfs_comment","Comment for Information Withheld http://rs.tdwg.org/dwc/terms/informationWithheld","Další informace, které existují, ale nebyly sdíleny v daném záznamu."
"informationWithheld:dcterms_description","Description for Information Withheld http://rs.tdwg.org/dwc/terms/informationWithheld","Tento termín má ekvivalent ve jmenném prostoru dwciri:, který jako hodnotu umožňuje pouze IRI, zatímco tento termín umožňuje zadat jakoukoli řetězcovou literální hodnotu."
"infragenericEpithet:label","Label for Infrageneric Epithet http://rs.tdwg.org/dwc/terms/infragenericEpithet","Infragenerický epiteton"
"infragenericEpithet:rdfs_comment","Comment for Infrageneric Epithet http://rs.tdwg.org/dwc/terms/infragenericEpithet","Infragenerická část binomického názvu, která je vyšší než druh, ale nižší než rod."
"infragenericEpithet:dcterms_description","Description for Infrageneric Epithet http://rs.tdwg.org/dwc/terms/infragenericEpithet","Termín dwc:infragenericEpithet by měl být používán ve spojení s dwc:genericName, dwc:specificEpithet, dwc:infraspecificEpithet, dwc:taxonRank a dwc:scientificNameAuthorship, aby reprezentoval jednotlivé prvky kompletního dwc:scientificName. Lze je použít k označení zařazení druhu do podrodu, které se v zoologii často uvádí v závorce. Může být také použit pro sdílení infragenerických jmen, jako jsou botanické sekce (např. `Vicia sect. Cracca`)."
"infragenericEpithet:examples","Examples for Infrageneric Epithet http://rs.tdwg.org/dwc/terms/infragenericEpithet","`Abacetillus` (pro vědecký název `Abacetus (Abacetillus) ambiguus`); `Cracca` (pro vědecký název `Vicia sect. Cracca`)"
"infraspecificEpithet:label","Label for Infraspecific Epithet http://rs.tdwg.org/dwc/terms/infraspecificEpithet","Infraspecifický epithet"
"infraspecificEpithet:rdfs_comment","Comment for Infraspecific Epithet http://rs.tdwg.org/dwc/terms/infraspecificEpithet","Název nejnižšího nebo koncového infraspecifického epiteta dwc:scientificName, s výjimkou označení zařazení."
"infraspecificEpithet:dcterms_description","Description for Infraspecific Epithet http://rs.tdwg.org/dwc/terms/infraspecificEpithet","V botanice mohou mít řetězce názvů v literatuře a identifikacích více infraspecifických řad. Podle Mezinárodního kodexu názvosloví pro řasy, houby a rostliny (Schenzhenův kodex, čl. 6.7 a čl. 24.1) mají platné názvy pouze dva epithety, přičemž nejnižší zařazení je dwc:infraspecificEpithet. Například: dwc:infraspecificEpithet v řetězci `Indigofera charlieriana subsp. sessilis var. scaberrima` je `scaberrima` a dwc:scientificName je `Indigofera charlieriana var. scaberrima (Schinz) J.B.Gillett`. Pro celý řetězec názvu použitý v dwc:Identification použijte dwc:verbatimIdentification."
"infraspecificEpithet:examples","Examples for Infraspecific Epithet http://rs.tdwg.org/dwc/terms/infraspecificEpithet","`concolor` (pro vědecký název `Puma concolor concolor (Linnaeus, 1771)`); `oxyadenia` (pro vědecký název `Quercus agrifolia var. oxyadenia (Torr.) J.T. Howell`); `laxa` (pro vědecký název `Cheilanthes hirta f. laxa (Kunze) W.Jacobsen & N.Jacobsen`); `scaberrima` (pro vědecký název `Indigofera charlieriana var. scaberrima (Schinz) J.B.Gillett`)"
"institutionCode:label","Label for Institution Code http://rs.tdwg.org/dwc/terms/institutionCode","Kód instituce"
"institutionCode:rdfs_comment","Comment for Institution Code http://rs.tdwg.org/dwc/terms/institutionCode","Název (nebo zkratka) používaný institucí, která má v péči předmět(y) nebo informace uvedené v záznamu."
"institutionID:label","Label for Institution ID http://rs.tdwg.org/dwc/terms/institutionID","ID Instituce"
"institutionID:rdfs_comment","Comment for Institution ID http://rs.tdwg.org/dwc/terms/institutionID","Identifikátor instituce, která má v péči předmět(y) nebo informace uvedené v záznamu."
"institutionID:dcterms_description","Description for Institution ID http://rs.tdwg.org/dwc/terms/institutionID","U fyzických exemplářů je doporučeným osvědčeným postupem použití celosvětově jedinečného a rozlišitelného identifikátoru z registru sbírek, jako je registr výzkumných organizací (ROR) nebo registr vědeckých sbírek GBIF (https://www.gbif.org/grscicoll)."
"island:label","Label for Island http://rs.tdwg.org/dwc/terms/island","Ostrov"
"island:rdfs_comment","Comment for Island http://rs.tdwg.org/dwc/terms/island","Název ostrova, na kterém nebo v jehož blízkosti se dcterms:Location vyskytuje."
"island:dcterms_description","Description for Island http://rs.tdwg.org/dwc/terms/island","Doporučeným osvědčeným postupem je používat řízený slovník, například Getty Thesaurus of Geographic Names."
"islandGroup:label","Label for Island Group http://rs.tdwg.org/dwc/terms/islandGroup","Skupina ostrovů"
"islandGroup:rdfs_comment","Comment for Island Group http://rs.tdwg.org/dwc/terms/islandGroup","Název skupiny ostrovů, ve které se dcterms:Location vyskytuje."
"islandGroup:dcterms_description","Description for Island Group http://rs.tdwg.org/dwc/terms/islandGroup","Doporučeným osvědčeným postupem je používat řízený slovník, například Getty Thesaurus of Geographic Names."
"kingdom:label","Label for Kingdom http://rs.tdwg.org/dwc/terms/kingdom","Říše"
"kingdom:rdfs_comment","Comment for Kingdom http://rs.tdwg.org/dwc/terms/kingdom","Úplný vědecký název říše, do které je dwc:Taxon zařazen."
"latestAgeOrHighestStage:label","Label for Latest Age Or Highest Stage http://rs.tdwg.org/dwc/terms/latestAgeOrHighestStage","Poslední věk nebo nejvyšší stadium"
"latestAgeOrHighestStage:rdfs_comment","Comment for Latest Age Or Highest Stage http://rs.tdwg.org/dwc/terms/latestAgeOrHighestStage","Úplný název nejpozdějšího možného geochronologického stáří nebo nejvyššího chronostratigrafického stupně, který lze přiřadit stratigrafickému horizontu, z něhož byl dwc:MaterialEntity odebrán."
"latestEonOrHighestEonothem:label","Label for Llatest Eon Or Highest Eonothem http://rs.tdwg.org/dwc/terms/latestEonOrHighestEonothem","Nejnovější Eon nebo nejvyšší Eonothem"
"latestEonOrHighestEonothem:rdfs_comment","Comment for Llatest Eon Or Highest Eonothem http://rs.tdwg.org/dwc/terms/latestEonOrHighestEonothem","Úplný název nejpozdějšího možného geochronologického eonu nebo nejvyššího chronostratigrafického eonotému nebo neformální název (""prekambrium""), který lze přiřadit stratigrafickému horizontu, z něhož byl dwc:MaterialEntity získán."
"latestEpochOrHighestSeries:label","Label for Latest Epoch Or Highest Series http://rs.tdwg.org/dwc/terms/latestEpochOrHighestSeries","Nejnovější epocha nebo nejvyšší série"
"latestEpochOrHighestSeries:rdfs_comment","Comment for Latest Epoch Or Highest Series http://rs.tdwg.org/dwc/terms/latestEpochOrHighestSeries","Úplný název nejnovější možné geochronologické epochy nebo nejvyšší chronostratigrafické řady, kterou lze přiřadit stratigrafickému horizontu, z něhož byl dwc:MaterialEntity získán."
"latestEraOrHighestErathem:label","Label for Latest Era Or Highest Erathem http://rs.tdwg.org/dwc/terms/latestEraOrHighestErathem","Nejnovější éra nebo nejvyšší Erathem"
"latestEraOrHighestErathem:rdfs_comment","Comment for Latest Era Or Highest Erathem http://rs.tdwg.org/dwc/terms/latestEraOrHighestErathem","Úplný název nejpozdější možné geochronologické éry nebo nejvyššího chronostratigrafického eratému, který lze přiřadit stratigrafickému horizontu, z něhož byl dwc:MaterialEntity získán."
"latestPeriodOrHighestSystem:label","Label for Latest Period Or Highest System http://rs.tdwg.org/dwc/terms/latestPeriodOrHighestSystem","Poslední období nebo nejvyšší systém"
"latestPeriodOrHighestSystem:rdfs_comment","Comment for Latest Period Or Highest System http://rs.tdwg.org/dwc/terms/latestPeriodOrHighestSystem","Úplný název posledního možného geochronologického období nebo nejvyššího chronostratigrafického systému, který lze přiřadit stratigrafickému horizontu, z něhož byl dwc:MaterialEntity odebrán."
"lifeStage:label","Label for Life Stage http://rs.tdwg.org/dwc/terms/lifeStage","Životní fáze"
"lifeStage:rdfs_comment","Comment for Life Stage http://rs.tdwg.org/dwc/terms/lifeStage","Věková třída nebo životní stadium dwc:Organismu(ů) v době, kdy byl zaznamenán dwc:Výskyt."
"lifeStage:dcterms_description","Description for Life Stage http://rs.tdwg.org/dwc/terms/lifeStage","Doporučeným osvědčeným postupem je používat řízený slovník. Tento termín má ekvivalent ve jmenném prostoru dwciri:, který jako hodnotu umožňuje pouze IRI, zatímco tento termín umožňuje jakoukoli řetězcovou literální hodnotu."
"lithostratigraphicTerms:label","Label for Lithostratigraphic Terms http://rs.tdwg.org/dwc/terms/lithostratigraphicTerms","Litostratigrafické termíny"
"lithostratigraphicTerms:rdfs_comment","Comment for Lithostratigraphic Terms http://rs.tdwg.org/dwc/terms/lithostratigraphicTerms","Kombinace všech litostratigrafických názvů pro horninu, ze které byla dwc:MaterialEntity získána."
"LivingSpecimen:label","Label for Living Specimen http://rs.tdwg.org/dwc/terms/LivingSpecimen","Živý exemplář"
"LivingSpecimen:rdfs_comment","Comment for Living Specimen http://rs.tdwg.org/dwc/terms/LivingSpecimen","Exemplář, který je naživu."
"locality:label","Label for Locality http://rs.tdwg.org/dwc/terms/locality","Lokalita"
"locality:rdfs_comment","Comment for Locality http://rs.tdwg.org/dwc/terms/locality","Konkrétní popis místa."
"locality:dcterms_description","Description for Locality http://rs.tdwg.org/dwc/terms/locality","Méně specifické geografické informace lze poskytnout v jiných geografických termínech (dwc:higherGeography, dwc:continent, dwc:country, dwc:stateProvince, dwc:county, dwc:municipality, dwc:waterBody, dwc:island, dwc:islandGroup). Tento termín může obsahovat informace upravené oproti originálu za účelem opravy zjištěných chyb nebo standardizace popisu."
"locationAccordingTo:label","Label for Location According To http://rs.tdwg.org/dwc/terms/locationAccordingTo","Poloha podle"
"locationAccordingTo:rdfs_comment","Comment for Location According To http://rs.tdwg.org/dwc/terms/locationAccordingTo","Informace o zdroji této infomace dcterms:Lokalita. Může se jednat o publikaci (vydavatelem), instituci nebo týmem osob."
"locationAccordingTo:dcterms_description","Description for Location According To http://rs.tdwg.org/dwc/terms/locationAccordingTo","Tento termín má ekvivalent ve jmenném prostoru dwciri:, který jako hodnotu umožňuje pouze IRI, zatímco tento termín umožňuje zadat jakoukoli řetězcovou literální hodnotu."
"locationID:label","Label for Location ID http://rs.tdwg.org/dwc/terms/locationID","ID lokality"
"locationID:rdfs_comment","Comment for Location ID http://rs.tdwg.org/dwc/terms/locationID","Identifikátor sady dcterms:Location information. Může to být globální jedinečný identifikátor nebo identifikátor specifický pro danou datovou sadu."
"locationRemarks:label","Label for Location Remarks http://rs.tdwg.org/dwc/terms/locationRemarks","Poznámky k poloze"
"locationRemarks:rdfs_comment","Comment for Location Remarks http://rs.tdwg.org/dwc/terms/locationRemarks","Komentáře nebo poznámky k dcterms:Lokalita."
"lowestBiostratigraphicZone:label","Label for Lowest Biostratigraphic Zone http://rs.tdwg.org/dwc/terms/lowestBiostratigraphicZone","Nejnižší biostratigrafická zóna"
"lowestBiostratigraphicZone:rdfs_comment","Comment for Lowest Biostratigraphic Zone http://rs.tdwg.org/dwc/terms/lowestBiostratigraphicZone","Úplný název nejnižší možné geologické biostratigrafické zóny stratigrafického horizontu, ze kterého byl dwc:MaterialEntity odebrán."
"MachineObservation:label","Label for Machine Observation http://rs.tdwg.org/dwc/terms/MachineObservation","Strojové pozorování"
"MachineObservation:rdfs_comment","Comment for Machine Observation http://rs.tdwg.org/dwc/terms/MachineObservation","Výstup procesu strojového pozorování."
"MaterialCitation:label","Label for Material Citation http://rs.tdwg.org/dwc/terms/MaterialCitation","Citace materiálu"
"MaterialCitation:rdfs_comment","Comment for Material Citation http://rs.tdwg.org/dwc/terms/MaterialCitation","Odkaz na jeden exemplář, jeho část nebo více exemplářů ve vědeckých publikacích nebo jejich citace."
"MaterialCitation:dcterms_description","Description for Material Citation http://rs.tdwg.org/dwc/terms/MaterialCitation","Tato třída představuje novou hodnotu pro řízený slovník v doporučeních pro basisOfRecord. Při importu datových sad založených na literatuře z Darwin Core Archives do GBIF by se měl basisOfRecord změnit z ""Occurrence"", ""PreservedSpecimen"" nebo ""Literature"" na ""MaterialCitation""."
"MaterialEntity:label","Label for Material Entity http://rs.tdwg.org/dwc/terms/MaterialEntity","Materiální entita"
"MaterialEntity:rdfs_comment","Comment for Material Entity http://rs.tdwg.org/dwc/terms/MaterialEntity","Entita, kterou lze identifikovat, existuje po určitou dobu a skládá se zcela nebo zčásti z fyzické hmoty, dokud existuje."
"MaterialEntity:dcterms_description","Description for Material Entity http://rs.tdwg.org/dwc/terms/MaterialEntity","Tento termín je definován na nejobecnější úrovni, aby umožnil popis jakéhokoli podtypu hmotné entity v rámci rozsahu působnosti Darwin Core. Pod tento termín je zejména třeba zahrnout jakýkoli druh vzorku materiálu, konzervovaný vzorek, fosilii nebo exemplář z živých sbírek."
"materialEntityID:label","Label for Material Entity ID http://rs.tdwg.org/dwc/terms/materialEntityID","ID materiální entity"
"materialEntityID:rdfs_comment","Comment for Material Entity ID http://rs.tdwg.org/dwc/terms/materialEntityID","Identifikátor konkrétní instance dwc:MaterialEntity."
"materialEntityID:dcterms_description","Description for Material Entity ID http://rs.tdwg.org/dwc/terms/materialEntityID","Hodnoty dwc:materialEntityID jsou určeny k jednoznačné a trvalé identifikaci konkrétní dwc:MaterialEntity v rámci určitého kontextu. Příklady kontextu zahrnují konkrétní sbírku vzorků, organizaci nebo celosvětové měřítko. Doporučeným osvědčeným postupem je používat trvalý, celosvětově jedinečný identifikátor. Identifikátor je vázán na fyzický objekt (dwc:MaterialEntity) na rozdíl od konkrétního digitálního záznamu (reprezentace) tohoto fyzického objektu."
"materialEntityRemarks:label","Label for Material Entity Remarks http://rs.tdwg.org/dwc/terms/materialEntityRemarks","Poznámky k materiálním entitám"
"materialEntityRemarks:rdfs_comment","Comment for Material Entity Remarks http://rs.tdwg.org/dwc/terms/materialEntityRemarks","Komentáře nebo poznámky k instanci dwc:MaterialEntity."
"MaterialSample:label","Label for Material Sample http://rs.tdwg.org/dwc/terms/MaterialSample","Vzorek materiálu"
"MaterialSample:rdfs_comment","Comment for Material Sample http://rs.tdwg.org/dwc/terms/MaterialSample","Významný subjekt, který představuje zájmový subjekt jako celek nebo jeho část."
"materialSampleID:label","Label for Material Sample ID http://rs.tdwg.org/dwc/terms/materialSampleID","ID vzorku materiálu"
"materialSampleID:rdfs_comment","Comment for Material Sample ID http://rs.tdwg.org/dwc/terms/materialSampleID","Identifikátor dwc:MaterialSample (na rozdíl od konkrétního digitálního záznamu dwc:MaterialSample). Pokud neexistuje trvalý globální jedinečný identifikátor, vytvořte jej z kombinace identifikátorů v záznamu, která bude co nejpřesněji zajišťovat globální jedinečnost dwc:materialSampleID."
"materialSampleID:dcterms_description","Description for Material Sample ID http://rs.tdwg.org/dwc/terms/materialSampleID","Doporučeným osvědčeným postupem je použití trvalého, globálně jedinečného identifikátoru."
"maximumDepthInMeters:label","Label for Maximum Depth In Meters http://rs.tdwg.org/dwc/terms/maximumDepthInMeters","Maximální hloubka v metrech"
"maximumDepthInMeters:rdfs_comment","Comment for Maximum Depth In Meters http://rs.tdwg.org/dwc/terms/maximumDepthInMeters","Větší hloubka rozsahu hloubky pod místním povrchem v metrech."
"maximumDistanceAboveSurfaceInMeters:label","Label for Maximum Distance Above Surface In Meters http://rs.tdwg.org/dwc/terms/maximumDistanceAboveSurfaceInMeters","Maximální vzdálenost nad povrchem v metrech"
"maximumDistanceAboveSurfaceInMeters:rdfs_comment","Comment for Maximum Distance Above Surface In Meters http://rs.tdwg.org/dwc/terms/maximumDistanceAboveSurfaceInMeters","Větší vzdálenost v rozsahu vzdálenosti od referenční plochy ve svislém směru v metrech. Kladné hodnoty použijte pro místa nad povrchem, záporné hodnoty pro místa pod povrchem. Pokud jsou uvedeny míry hloubky, je referenčním povrchem místo dané hloubkou, jinak je referenčním povrchem místo dané nadmořskou výškou."
"maximumDistanceAboveSurfaceInMeters:examples","Examples for Maximum Distance Above Surface In Meters http://rs.tdwg.org/dwc/terms/maximumDistanceAboveSurfaceInMeters","`-1.5` (pod hladinou); `4.2` (nad hladinou); Pro 1,5metrové jádro sedimentu ze dna jezera (v hloubce 20m) v nadmořské výšce 300m: verbatimElevation: `300m` minimumElevationInMeters: `300`, maximumElevationInMeters: `300`, verbatimDepth: `20m`, minimumDepthInMeters: `20`, maximumDepthInMeters: MinimumDistanceAboveSurfaceInMeters: `0`, maximumDistanceAboveSurfaceInMeters: `-1.5`."
"maximumElevationInMeters:label","Label for Maximum Elevation In Meters http://rs.tdwg.org/dwc/terms/maximumElevationInMeters","Maximální nadmořská výška v metrech"
"maximumElevationInMeters:rdfs_comment","Comment for Maximum Elevation In Meters http://rs.tdwg.org/dwc/terms/maximumElevationInMeters","Horní hranice rozsahu výšky (obvykle nad mořem) v metrech."
"measurementAccuracy:label","Label for Measurement Accuracy http://rs.tdwg.org/dwc/terms/measurementAccuracy","Přesnost měření"
"measurementAccuracy:rdfs_comment","Comment for Measurement Accuracy http://rs.tdwg.org/dwc/terms/measurementAccuracy","Popis potenciální chyby spojené s dwc:measurementValue."
"measurementDeterminedBy:label","Label for Measurement Determined By http://rs.tdwg.org/dwc/terms/measurementDeterminedBy","Měření Určeno podle"
"measurementDeterminedBy:rdfs_comment","Comment for Measurement Determined By http://rs.tdwg.org/dwc/terms/measurementDeterminedBy","Seznam (spojený a oddělený) jmen osob, skupin nebo organizací, které určily hodnotu dwc:MeasurementOrFact."
"measurementDeterminedBy:dcterms_description","Description for Measurement Determined By http://rs.tdwg.org/dwc/terms/measurementDeterminedBy","Doporučeným postupem je oddělovat hodnoty v seznamu mezerou svislou čarou mezerou (` | `). Tento termín má ekvivalent ve jmenném prostoru dwciri:, který jako hodnotu povoluje pouze IRI, zatímco tento termín povoluje jakoukoli řetězcovou literální hodnotu."
"measurementDeterminedDate:label","Label for Measurement Determined Date http://rs.tdwg.org/dwc/terms/measurementDeterminedDate","Stanovené datum měření"
"measurementDeterminedDate:rdfs_comment","Comment for Measurement Determined Date http://rs.tdwg.org/dwc/terms/measurementDeterminedDate","Datum, kdy bylo dwc:MeasurementOrFact provedeno."
"measurementDeterminedDate:dcterms_description","Description for Measurement Determined Date http://rs.tdwg.org/dwc/terms/measurementDeterminedDate","Doporučeným osvědčeným postupem je používat datum, které je v souladu s normou ISO 8601-1:2019."
"measurementDeterminedDate:examples","Examples for Measurement Determined Date http://rs.tdwg.org/dwc/terms/measurementDeterminedDate","`1963-03-08T14:07-0600` (8. března 1963 ve 14:07 v časovém pásmu o šest hodin dříve než UTC); `2009-02-20T08:40Z` (20. února 2009 8:40 UTC); `2018-08-29T15:19` (3: (někdy v průběhu 12. února 1809); `1906-06` (někdy v červnu 1906); `1971` (někdy v roce 1971); `2007-03-01T13: 00:00Z/2008-05-11T15:30:00Z` (někdy v intervalu od 1. března 2007 13:00 UTC do 11. května 2008 15:30 UTC); `1900/1909` (někdy v intervalu od začátku roku 1900 do konce roku 1909); `2007-11-13/15` (někdy v intervalu od 13. listopadu 2007 do 15. listopadu 2007)"
"measurementID:label","Label for Measurement ID http://rs.tdwg.org/dwc/terms/measurementID","ID měření"
"measurementID:rdfs_comment","Comment for Measurement ID http://rs.tdwg.org/dwc/terms/measurementID","Identifikátor dwc:MeasurementOrFact (informace týkající se měření, faktů, charakteristik nebo tvrzení). Může to být globální jedinečný identifikátor nebo identifikátor specifický pro datovou sadu."
"measurementMethod:label","Label for Measurement Method http://rs.tdwg.org/dwc/terms/measurementMethod","Metoda měření"
"measurementMethod:rdfs_comment","Comment for Measurement Method http://rs.tdwg.org/dwc/terms/measurementMethod","Popis nebo odkaz na (publikaci, URI) metodu nebo protokol použitý k určení měření, skutečnosti, vlastnosti nebo tvrzení."
"measurementMethod:dcterms_description","Description for Measurement Method http://rs.tdwg.org/dwc/terms/measurementMethod","Tento termín má ekvivalent ve jmenném prostoru dwciri:, který jako hodnotu umožňuje pouze IRI, zatímco tento termín umožňuje zadat jakoukoli řetězcovou literální hodnotu."
"measurementMethod:examples","Examples for Measurement Method http://rs.tdwg.org/dwc/terms/measurementMethod","`minimální konvexní polygon kolem vchodů do nory` (pro oblast domovského okrsku); `barometrický výškoměr` (pro nadmořskou výšku)"
