term_localName,label_en,label_de,label_es,label_fr,label_ko,label_nl,label_ru,label_zh-Hans,label_zh-Hant,rdfs_comment_en,rdfs_comment_de,rdfs_comment_es,rdfs_comment_fr,rdfs_comment_ko,rdfs_comment_nl,rdfs_comment_ru,rdfs_comment_zh-Hans,rdfs_comment_zh-Hant,dcterms_description_en,dcterms_description_de,dcterms_description_es,dcterms_description_fr,dcterms_description_ko,dcterms_description_nl,dcterms_description_ru,dcterms_description_zh-Hans,dcterms_description_zh-Hant,examples_en,examples_de,examples_es,examples_fr,examples_ko,examples_nl,examples_ru,examples_zh-Hans,examples_zh-Hant
acceptedNameUsage,Accepted Name Usage,,Nombre aceptado en uso,Nom Valide,,,,,有效學名使用,"The full name, with authorship and date information if known, of the currently valid (zoological) or accepted (botanical) dwc:Taxon.",,"El nombre completo, con autoría e información de fecha si se conoce, del taxón actualmente válido (zoológico) o aceptado (botánico) dwc:Taxon.","Le nom complet, avec les informations relatives à l'auteur et à la date si elles sont connues, du dwc:Taxon actuellement valide (en zoologie) ou accepté (en botanique).",,,,,目前有效（動物）或接受（植物）並包含命名作者及年代（若已知）的完整學名。,"The full scientific name, with authorship and date information if known, of the accepted (botanical) or valid (zoological) name in cases where the provided dwc:scientificName is considered by the reference indicated in the dwc:accordingTo property, or of the content provider, to be a synonym or misapplied name. When applied to a dwc:Organism or dwc:Occurrence, this term should be used in cases where a content provider regards the provided dwc:scientificName to be inconsistent with the taxonomic perspective of the content provider. For example, there are many discrepancies within specimen collections and observation datasets between the recorded name (e.g., the most recent identification from an expert who examined a specimen, or a field identification for an observed dwc:Organism), and the name asserted by the content provider to be taxonomically accepted.",,,"Le nom scientifique complet, avec les informations sur l'auteur et la date si elles sont connues, du nom accepté (botanique) ou valide (zoologie) dans les cas où le dwc:scientificName fourni est considéré par la référence indiquée dans la propriété dwc:accordingTo, ou par le fournisseur de données comme un synonyme ou un nom mal appliqué. Lorsqu'il est appliqué à un dwc:Organism ou à une dwc:Occurrence, ce terme doit être utilisé dans les cas où un fournisseur de données considère que le dwc:scientificName fourni n'est pas cohérent avec l'opinion taxonomique du fournisseur de données. Par exemple, il existe de nombreuses divergences dans les collections et les ensembles de données d'observation entre le nom indiqué (par exemple, l'identification la plus récente d'un expert qui a examiné un spécimen, ou une identification sur le terrain pour un dwc:Organism observé) et le nom avancé par le fournisseur de données comme étant valable sur le plan taxonomique.",,,,,,`Tamias minimus` (valid name for `Eutamias minimus`),,,`Tamias minimus` (nom valide pour `Eutamias minimus`),,,,,
acceptedNameUsageID,Accepted Name Usage ID,,,Code du nom valide,,,,,有效學名使用識別碼,An identifier for the name usage (documented meaning of the name according to a source) of the currently valid (zoological) or accepted (botanical) taxon.,,,Un identifiant pour l'usage du nom (signification documentée du nom selon une source) du taxon actuellement valide (zoologie) ou accepté (botanique).,,,,,目前動物學有效或植物學接受的學名使用（根據來源所記載的學名涵義）識別碼。,This term should be used for synonyms or misapplied names to refer to the dwc:taxonID of a dwc:Taxon record that represents the accepted (botanical) or valid (zoological) name. For Darwin Core Archives the related record should be present locally in the same archive.,,,"Ce terme devrait être utilisé pour les synonymes ou les noms mal appliqués pour se référer au dwc:taxonID d'un enregistrement dwc:Taxon qui représente le nom accepté (botanique) ou valide (zoologie). Pour les Archives Darwin Core, l'enregistrement correspondant doit être présent dans la même archive.",,,,,,`tsn:41107` (ITIS); `urn:lsid:ipni.org:names:320035-2` (IPNI); `2704179` (GBIF); `6W3C4` (COL),,,`tsn:41107` (ITIS); `urn:lsid:ipni.org:names:320035-2` (IPNI); `2704179` (GBIF); `6W3C4` (COL),,,,,
associatedMedia,Associated Media,,Medios asociados,Média associé,,,,,,"A list (concatenated and separated) of identifiers (publication, global unique identifier, URI) of media associated with the dwc:Occurrence.",,,"Une liste (concaténée et séparée) d'identifiants (publication, identifiant unique global (GUI), URI) des médias associés à la dwc:Occurrence.",,,,,,,,,,,,,,,,,,,,,,,
associatedOccurrences,Associated Occurrences,,,Occurrences associées,,,,,,A list (concatenated and separated) of identifiers of other dwc:Occurrence records and their associations to this dwc:Occurrence.,,,Une liste (concaténée et séparée) d'identifiants d'autres enregistrements de dwc:Occurrence et de leurs associations à cette dwc:Occurrence.,,,,,,"This term can be used to provide a list of associations to other dwc:Occurrences. Note that the dwc:ResourceRelationship class is an alternative means of representing associations, and with more detail. Recommended best practice is to separate the values in a list with space vertical bar space (` | `).",,,"Ce terme peut être utilisé pour fournir une liste d'associations avec d'autres dwc:Occurrences. Notez que la classe dwc:ResourceRelationship est un autre moyen de représenter les associations, avec plus de détails. La pratique optimale recommandée est de séparer les valeurs d'une liste par une barre verticale (` | `).",,,,,,,,,,,,,,
associatedOrganisms,Associated Organisms,,,Organismes associés,,,,,,A list (concatenated and separated) of identifiers of other dwc:Organisms and the associations of this dwc:Organism to each of them.,,,Une liste (concaténée et séparée) d'identifiants d'autres dwc:Organisms et les associations de cet dwc:Organism à chacun d'entre eux.,,,,,,"This term can be used to provide a list of associations to other dwc:Organisms. Note that the dwc:ResourceRelationship class is an alternative means of representing associations, and with more detail. Recommended best practice is to separate the values in a list with space vertical bar space (` | `).",,,"Ce terme peut être utilisé pour fournir une liste d'associations avec d'autres dwc:Organisms. Notez que la classe dwc:ResourceRelationship est un autre moyen de représenter les associations, avec plus de détails. La pratique optimale recommandée est de séparer les valeurs d'une liste par une barre verticale (` | `).",,,,,,,,,,,,,,
associatedReferences,Associated References,,Referencias asociadas,Références associées,,,,,,"A list (concatenated and separated) of identifiers (publication, bibliographic reference, global unique identifier, URI) of literature associated with the dwc:Occurrence.",,,"Une liste (concaténée et séparée) d'identifiants (publication, référence bibliographique, identifiant unique global (GUI), URI) de la littérature associée à la dwc:Occurrence.",,,,,,"Recommended best practice is to separate the values in a list with space vertical bar space (` | `). Note that the dwc:ResourceRelationship class is an alternative means of representing associations, and with more detail. Note also that the intended usage of the term dcterms:references in Darwin Core when applied to a dwc:Occurrence is to point to the definitive source representation of that dwc:Occurrence if one is available. Note also that the intended usage of dcterms:bibliographicCitation in Darwin Core when applied to a dwc:Occurrence is to provide the preferred way to cite the dwc:Occurrence itself.",,,"La pratique optimale recommandée est de séparer les valeurs d'une liste par une barre verticale (` | `). Notez que la classe dwc:ResourceRelationship est un autre moyen de représenter les associations, avec plus de détails. Notez également que l'usage prévu du terme dcterms:references dans le Darwin Core, lorsqu'il est appliqué à une dwc:Occurrence, est de pointer vers la source originale de cette dwc:Occurrence s'il y en a une. Notez également que l'usage prévu du terme dcterms:bibliographicCitation dans le Darwin Core lorsqu'il est appliqué à une dwc:Occurrence est de fournir la manière optimale de citer la dwc:Occurrence elle-même.",,,,,,,,,,,,,,
associatedSequences,Associated Sequences,,Secuencias asociadas,Séquences associées,,,,,,"A list (concatenated and separated) of identifiers (publication, global unique identifier, URI) of genetic sequence information associated with the dwc:MaterialEntity.",,,"Une liste (concaténée et séparée) d'identifiants (publication, identifiant unique global (GUI), URI) d'informations sur la séquence génétique associée à la dwc:MaterialEntity.",,,,,,,,,,,,,,,,,,,,,,,
associatedTaxa,Associated Taxa,,Taxones asociados,Taxons associés,,,,,,A list (concatenated and separated) of identifiers or names of dwc:Taxon records and the associations of this dwc:Occurrence to each of them.,,,Une liste (concaténée et séparée) d'identifiants ou des noms des enregistrements de dwc:Taxon et les associations de cette dwc:Occurrence à chacun d'entre eux.,,,,,,"This term can be used to provide a list of associations to dwc:Taxon records other than the one defined in the dwc:Occurrence. Note that the dwc:ResourceRelationship class is an alternative means of representing associations, and with more detail. This term is not apt for establishing relationships between dwc:Taxon records, only between specific dwc:Occurrences of a dwc:Organism with other dwc:Taxon records. Recommended best practice is to separate the values in a list with space vertical bar space (` | `).",,,,,,,,,,,,,,,,,
basisOfRecord,Basis Of Record,,,Catégorie d'enregistrement,,,,,,The specific nature of the data record.,,,La nature précise de l'enregistrement.,,,,,,Recommended best practice is to use a controlled vocabulary such as the set of local names of the identifiers for classes in Darwin Core.,,,La pratique optimale recommandée est d'utiliser un vocabulaire contrôlé tel que l'ensemble des noms locaux des identifiants de classes du Darwin Core.,,,,,,,,,,,,,,
bed,Bed,,Capa,Lit,,,,,,The full name of the lithostratigraphic bed from which the dwc:MaterialEntity was collected.,,,Le nom complet du lit lithostratigraphique à partir de laquelle l'entité dwc:MaterialEntity a été collectée.,,,,,,,,,,,,,,,,,,,,,,,
behavior,Behavior,,,Comportement,,,,,,The behavior shown by the subject at the time the dwc:Occurrence was recorded.,,,Le comportement du sujet de l'observation au moment où la dwc:Occurrence a été enregistrée.,,,,,,"This term has an equivalent in the dwciri: namespace that allows only an IRI as a value, whereas this term allows for any string literal value.",,,"Ce terme a un équivalent dans le dwciri: namespace qui n'autorise qu'un IRI comme valeur, alors que ce terme autorise n'importe quelle valeur sous forme de chaîne de caractères.",,,,,,,,,,,,,,
caste,Caste,,,Caste,,,,,,Categorisation of individuals for eusocial species (including some mammals and arthropods).,,,Catégorisation des individus pour les espèces eusociales (y compris quelques mammifères et arthropodes).,,,,,,"Recommended best practice is to use a controlled vocabulary that aligns best with the dwc:Taxon. This term has an equivalent in the dwciri: namespace that allows only an IRI as a value, whereas this term allows for any string literal value.",,,"La pratique optimale recommandée est d'utiliser un vocabulaire contrôlé qui correspond le mieux au dwc:Taxon. Ce terme a un équivalent dans le dwciri: namespace qui n'autorise qu'un IRI comme valeur, alors que ce terme autorise n'importe quelle valeur sous forme de chaîne de caractères.",,,,,,,,,,,,,,
catalogNumber,Catalog Number,,Número de catálogo,Numéro de catalogue,,,,,,An identifier (preferably unique) for the record within the data set or collection.,,,Un identifiant (de préférence unique) pour l'enregistrement dans la série de données ou dans la collection.,,,,,,,,,,,,,,,,,,,,,,,
class,Class,,Clase,Classe,,Klasse,,,,The full scientific name of the class in which the dwc:Taxon is classified.,,,Le nom scientifique complet de la classe dans laquelle le dwc:Taxon est classé.,,,,,,,,,,,,,,,,,,,,,,,
collectionCode,Collection Code,,,Code de la collection,,,,,,"The name, acronym, coden, or initialism identifying the collection or data set from which the record was derived.",,,"Le nom, l'acronyme, le coden ou le sigle identifiant la collection ou la série de données à partir desquelles l'enregistrement a été obtenu.",,,,,,,,,,,,,,,,,,,,,,,
collectionID,Collection ID,,,Identifiant de la collection,,,,,,An identifier for the collection or dataset from which the record was derived.,,,Un identifiant de la collection ou la série de données à partir desquelles l'enregistrement a été obtenu.,,,,,,"For physical specimens, the recommended best practice is to use a globally unique and resolvable identifier from a collections registry such as the GBIF Registry of Scientific Collections (https://www.gbif.org/grscicoll).",,,"Pour les spécimens physiques, la pratique optimale recommandée est d'utiliser un identifiant unique et résoluble à l'échelle mondiale provenant d'un registre de collections tel que le GBIF Registry of Scientific Collections (https://www.gbif.org/grscicoll).",,,,,,,,,,,,,,
continent,Continent,,Continente,Continent,,Continent,,,,The name of the continent in which the dcterms:Location occurs.,,,Le nom du continent dans lequel se trouve la dcterms:Location.,,,,,,"Recommended best practice is to use a controlled vocabulary such as the Getty Thesaurus of Geographic Names. Recommended best practice is to leave this field blank if the dcterms:Location spans multiple entities at this administrative level or if the dcterms:Location might be in one or another of multiple possible entities at this level. Multiplicity and uncertainty of the geographic entity can be captured either in the term dwc:higherGeography or in the term dwc:locality, or both.",,,"La pratique optimale recommandée est d'utiliser un vocabulaire contrôlé tel que le Getty Thesaurus of Geographic Names. La pratique optimale recommandée est de laisser ce champ vide si la dcterms:Location recouvre plusieurs entités à ce niveau administratif ou si la dcterms:Location pourrait se trouver dans l'une ou l'autre des multiples entités possibles à ce niveau. La multiplicité et l'incertitude de l'entité géographique peuvent être renseignées soit dans le terme dwc:higherGeography, soit dans le terme dwc:locality, soit dans les deux.",,,,,,,,,,,,,,
coordinatePrecision,Coordinate Precision,,,Précision des coordonnées,,,,,,A decimal representation of the precision of the coordinates given in the dwc:decimalLatitude and dwc:decimalLongitude.,,,Une représentation décimale de la précision des coordonnées données dans dwc:decimalLatitude et dwc:decimalLongitude.,,,,,,,,,,,,,,,`0.00001` (normal GPS limit for decimal degrees); `0.000278` (nearest second); `0.01667` (nearest minute); `1.0` (nearest degree),,,`0.00001` (limite normale des GPS pour les degrés décimaux) ; `0.000278` (seconde la plus proche) ; `0.01667` (minute la plus proche) ; `1.0` (degré le plus proche),,,,,
coordinateUncertaintyInMeters,Coordinate Uncertainty In Meters,,,Incertitude des coordonnées en mètres,,,,,,"The horizontal distance (in meters) from the given dwc:decimalLatitude and dwc:decimalLongitude describing the smallest circle containing the whole of the dcterms:Location. Leave the value empty if the uncertainty is unknown, cannot be estimated, or is not applicable (because there are no coordinates). Zero is not a valid value for this term.",,,"La distance horizontale (en mètres) à partir des coordonnées de dwc:decimalLatitude et de dwc:decimalLongitude, décrivant le plus petit cercle contenant l'ensemble de la dcterms:Location. Laisser la valeur vide si l'incertitude est inconnue, ne peut être estimée ou n'est pas applicable (parce qu'il n'y a pas de coordonnées). Zéro n'est pas une valeur valide pour ce terme.",,,,,,,,,,,,,,,`30` (reasonable lower limit on or after 2000-05-01 of a GPS reading under good conditions if the actual precision was not recorded at the time); `100` (reasonable lower limit before 2000-05-01 of a GPS reading under good conditions if the actual precision was not recorded at the time); `71` (uncertainty for a UTM coordinate having 100 meter precision and a known spatial reference system),,,`30` (limite inférieure raisonnable à partir du 2000-05-01 d'un relevé GPS dans de bonnes conditions si la précision réelle n'a pas été enregistrée à ce moment-là) ; `100` (limite inférieure raisonnable jusqu'au 2000-05-01 d'un relevé GPS dans de bonnes conditions si la précision réelle n'a pas été enregistrée à ce moment-là) ; `71` (incertitude pour une coordonnée UTM ayant une précision de 100 mètres et un système de référence spatial connu),,,,,
country,Country,,,Pays,,,,,,The name of the country or major administrative unit in which the dcterms:Location occurs.,,,Le nom du pays ou de l'unité administrative principale dans lesquels se trouve la dcterms:Location.,,,,,,"Recommended best practice is to use a controlled vocabulary such as the Getty Thesaurus of Geographic Names. Recommended best practice is to leave this field blank if the dcterms:Location spans multiple entities at this administrative level or if the dcterms:Location might be in one or another of multiple possible entities at this level. Multiplicity and uncertainty of the geographic entity can be captured either in the term dwc:higherGeography or in the term dwc:locality, or both.",,,"La pratique optimale recommandée est d'utiliser un vocabulaire contrôlé tel que le Getty Thesaurus of Geographic Names. La pratique optimale recommandée est de laisser ce champ vide si la dcterms:Location recouvre plusieurs entités à ce niveau administratif ou si la dcterms:Location pourrait se trouver dans l'une ou l'autre des multiples entités possibles à ce niveau. La multiplicité et l'incertitude de l'entité géographique peuvent être renseignées soit dans le terme dwc:higherGeography, soit dans le terme dwc:locality, soit dans les deux.",,,,,,,,,,,,,,
countryCode,Country Code,,,Code du pays,,,,,,The standard code for the country in which the dcterms:Location occurs.,,,Le code standardisé du pays dans lequel se trouve la dcterms:Location.,,,,,,"Recommended best practice is to use an ISO 3166-1-alpha-2 country code. Recommended best practice is to leave this field blank if the dcterms:Location spans multiple entities at this administrative level or if the dcterms:Location might be in one or another of multiple possible entities at this level. Multiplicity and uncertainty of the geographic entity can be captured either in the term dwc:higherGeography or in the term dwc:locality, or both.",,,"La pratique optimale recommandée est d'utiliser un code pays correspondant à la norme ISO 3166-1-alpha-2. La pratique optimale recommandée est de laisser ce champ vide si la dcterms:Location recouvre plusieurs entités à ce niveau administratif ou si la dcterms:Location pourrait se trouver dans l'une ou l'autre des multiples entités possibles à ce niveau. La multiplicité et l'incertitude de l'entité géographique peuvent être renseignées soit dans le terme dwc:higherGeography, soit dans le terme dwc:locality, soit dans les deux.",,,,,,,,,,,,,,
county,Second Order Division,,,Division de second ordre,,,,,,"The full, unabbreviated name of the next smaller administrative region than stateProvince (county, shire, department, etc.) in which the dcterms:Location occurs.",,,"Le nom complet et non abrégé de la région administrative immédiatement inférieure à stateProvince (comté, département, etc.) dans laquelle se trouve la dcterms:Location.",,,,,,"Recommended best practice is to use a controlled vocabulary such as the Getty Thesaurus of Geographic Names. Recommended best practice is to leave this field blank if the dcterms:Location spans multiple entities at this administrative level or if the dcterms:Location might be in one or another of multiple possible entities at this level. Multiplicity and uncertainty of the geographic entity can be captured either in the term dwc:higherGeography or in the term dwc:locality, or both.",,,"La pratique optimale recommandée est d'utiliser un vocabulaire contrôlé tel que le Getty Thesaurus of Geographic Names. La pratique optimale recommandée est de laisser ce champ vide si la dcterms:Location recouvre plusieurs entités à ce niveau administratif ou si la dcterms:Location pourrait se trouver dans l'une ou l'autre des multiples entités possibles à ce niveau. La multiplicité et l'incertitude de l'entité géographique peuvent être renseignées soit dans le terme dwc:higherGeography, soit dans le terme dwc:locality, soit dans les deux.",,,,,,,,,,,,,,
cultivarEpithet,Cultivar Epithet,,,Épithète de cultivar,,,,,,"Part of the name of a cultivar, cultivar group or grex that follows the dwc:scientificName.",,,"Partie du nom d'un cultivar, d'un groupe de cultivars ou d'un grex qui suit le dwc:scientificName.",,,,,,"According to the Rules of the Cultivated Plant Code, a cultivar name consists of a botanical name followed by a cultivar epithet. The value given as the dwc:cultivarEpithet should exclude any quotes. The term dwc:taxonRank should be used to indicate which type of cultivated plant name (e.g. cultivar, cultivar group, grex) is concerned. This epithet, including any enclosing apostrophes or suffix, should be provided in dwc:scientificName as well.",,,"Selon les Règles du Code des plantes cultivées, un nom de cultivar se compose d'un nom botanique suivi d'une épithète de cultivar. La valeur donnée comme dwc:cultivarEpithet ne doit pas comporter de guillemets. Le terme dwc:taxonRank doit être utilisé pour indiquer quel type de nom de plante cultivée (par exemple, cultivar, groupe de cultivars, grex) est concerné. Cette épithète, y compris toute apostrophe ou tout suffixe, doit également être fournie dans dwc:scientificName.",,,,,,`King Edward` (for scientificName `Solanum tuberosum 'King Edward'` and taxonRank `cultivar`); `Mishmiense` (for scientificName `Rhododendron boothii Mishmiense Group` and taxonRank `cultivar group`); `Atlantis` (for scientificName `Paphiopedilum Atlantis grex` and taxonRank `grex`),,,King Edward` (pour le nom scientifique `Solanum tuberosum 'King Edward'` et le taxonRank `cultivar`) ; `Mishmiense` (pour le scientificName `Rhododendron boothii Mishmiense Group` et le taxonRank `cultivar group`) ; `Atlantis` (pour le scientificName `Paphiopedilum Atlantis grex` et le taxonRank `grex`),,,,,
dataGeneralizations,Data Generalizations,,,Généralisation des données,,,,,,Actions taken to make the shared data less specific or complete than in its original form. Suggests that alternative data of higher quality may be available on request.,,,Mesures prises pour rendre les données partagées moins précises ou moins complètes que dans leur forme originale. Cela peut signifier que des données de meilleure qualité peuvent être disponibles sur demande.,,,,,,"This term has an equivalent in the dwciri: namespace that allows only an IRI as a value, whereas this term allows for any string literal value.",,,"Ce terme a un équivalent dans le dwciri: namespace qui n'autorise qu'un IRI comme valeur, alors que ce terme autorise n'importe quelle valeur sous forme de chaîne de caractères.",,,,,,,,,,,,,,
datasetID,Dataset ID,,,Identifiant du jeu de données,,,,,,An identifier for the set of data. May be a global unique identifier or an identifier specific to a collection or institution.,,,Un identifiant pour le jeu de données. Il peut s'agir d'un identifiant unique global (GUI) ou d'un identifiant spécifique à une collection ou à une institution.,,,,,,,,,,,,,,,,,,,,,,,
datasetName,Dataset Name,,,Nom du jeu de données,,,,,,The name identifying the data set from which the record was derived.,,,Le nom identifiant le jeu de données à partir duquel l'enregistrement a été obtenu.,,,,,,,,,,,,,,,,,,,,,,,
