"identifier","context","text"
"identificationReferences:rdfs_comment","Comment for Identification References http://rs.tdwg.org/dwc/terms/identificationReferences","Une liste (concaténée et séparée) des références (publication, identifiant unique global (GUI), URI) utilisées pour la dwc:Identification."
"identificationReferences:dcterms_description","Description for Identification References http://rs.tdwg.org/dwc/terms/identificationReferences","La pratique optimale recommandée consiste à séparer les valeurs d'une liste par une barre verticale (` | `)."
"identificationRemarks:label","Label for Identification Remarks http://rs.tdwg.org/dwc/terms/identificationRemarks","Remarques sur l'identification"
"identificationRemarks:rdfs_comment","Comment for Identification Remarks http://rs.tdwg.org/dwc/terms/identificationRemarks","Commentaires ou notes sur la dwc:Identification."
"identificationVerificationStatus:label","Label for Identification Verification Status http://rs.tdwg.org/dwc/terms/identificationVerificationStatus",""
"identificationVerificationStatus:rdfs_comment","Comment for Identification Verification Status http://rs.tdwg.org/dwc/terms/identificationVerificationStatus","Un indicateur qualitatif de la mesure dans laquelle l'identification taxonomique a été déterminée comme étant correcte."
"identificationVerificationStatus:dcterms_description","Description for Identification Verification Status http://rs.tdwg.org/dwc/terms/identificationVerificationStatus","La pratique optimale recommandée est d'utiliser un vocabulaire contrôlé tel que celui utilisé dans HISPID et ABCD. Ce terme a un équivalent dans le dwciri: namespace qui n'autorise qu'un IRI comme valeur, alors que ce terme autorise n'importe quelle valeur sous forme de chaîne de caractères."
"identificationVerificationStatus:examples","Examples for Identification Verification Status http://rs.tdwg.org/dwc/terms/identificationVerificationStatus","`0` (""unverified""/non vérifié dans HISPID/ABCD)."
"identifiedBy:label","Label for Identified By http://rs.tdwg.org/dwc/terms/identifiedBy","Identifié par"
"identifiedBy:rdfs_comment","Comment for Identified By http://rs.tdwg.org/dwc/terms/identifiedBy","Une liste (concaténée et séparée) de noms de personnes, de groupes ou d'organisations qui ont attribué le dwc:Taxon au sujet."
"identifiedBy:dcterms_description","Description for Identified By http://rs.tdwg.org/dwc/terms/identifiedBy","La pratique optimale recommandée est de séparer les valeurs d'une liste par une barre verticale (` | `). Ce terme a un équivalent dans le dwciri: namespace qui n'autorise qu'un IRI comme valeur, alors que ce terme autorise n'importe quelle valeur sous forme de chaîne de caractères."
"identifiedByID:label","Label for Identified By ID http://rs.tdwg.org/dwc/terms/identifiedByID","Identifiant de l'identificateur"
"identifiedByID:rdfs_comment","Comment for Identified By ID http://rs.tdwg.org/dwc/terms/identifiedByID","Une liste (concaténée et séparée) de l'identifiant unique global (GUI) de la personne, des personnes, des groupes ou des organisations responsables de l'attribution du sujet à un dwc:Taxon."
"identifiedByID:dcterms_description","Description for Identified By ID http://rs.tdwg.org/dwc/terms/identifiedByID","La pratique optimale recommandée est de fournir un identifiant unique qui distingue les informations sur l'agent identificateur. Si une liste est utilisée, l'ordre des identificateurs dans la liste ne doit pas être considéré comme porteur d'une quelconque sémantique. La pratique optimale recommandée consiste à séparer les valeurs d'une liste par une barre verticale (` | `)."
"identifiedByID:examples","Examples for Identified By ID http://rs.tdwg.org/dwc/terms/identifiedByID","`https://orcid.org/0000-0002-1825-0097` (pour un individu) ; `https://orcid.org/0000-0002-1825-0097 | https://orcid.org/0000-0002-1825-0098` (pour une liste de personnes)"
"individualCount:label","Label for Individual Count http://rs.tdwg.org/dwc/terms/individualCount","Nombre d'individus"
"individualCount:rdfs_comment","Comment for Individual Count http://rs.tdwg.org/dwc/terms/individualCount","Le nombre d'individus présents au moment de la dwc:Occurrence."
"informationWithheld:label","Label for Information Withheld http://rs.tdwg.org/dwc/terms/informationWithheld","Information non renseignée"
"informationWithheld:rdfs_comment","Comment for Information Withheld http://rs.tdwg.org/dwc/terms/informationWithheld","Informations supplémentaires qui existent, mais qui n'ont pas été partagées dans l'enregistrement correspondant."
"informationWithheld:dcterms_description","Description for Information Withheld http://rs.tdwg.org/dwc/terms/informationWithheld","Ce terme a un équivalent dans le dwciri: namespace qui n'autorise qu'un IRI comme valeur, alors que ce terme autorise n'importe quelle valeur sous forme de chaîne de caractères."
"infragenericEpithet:label","Label for Infrageneric Epithet http://rs.tdwg.org/dwc/terms/infragenericEpithet","Épithète infragénérique"
"infragenericEpithet:rdfs_comment","Comment for Infrageneric Epithet http://rs.tdwg.org/dwc/terms/infragenericEpithet","Partie infragénérique d'un nom binomial dont le rang est supérieur à celui de l'espèce mais inférieur à celui du genre."
"infragenericEpithet:dcterms_description","Description for Infrageneric Epithet http://rs.tdwg.org/dwc/terms/infragenericEpithet","Le terme dwc:infragenericEpithet doit être utilisé conjointement avec dwc:genericName, dwc:specificEpithet, dwc:infraspecificEpithet, dwc:taxonRank et dwc:scientificNameAuthorship pour représenter les éléments individuels du dwc:scientificName complet. Il peut être utilisé pour indiquer l'emplacement du sous-genre d'une espèce, qui est souvent indiqué entre parenthèses en zoologie. Il peut également être utilisé pour partager des noms infragénériques tels que des sections en botanique (par exemple, `Vicia sect. Cracca`)."
"infragenericEpithet:examples","Examples for Infrageneric Epithet http://rs.tdwg.org/dwc/terms/infragenericEpithet","`Abacetillus` (pour le scientificName`Abacetus (Abacetillus) ambiguus`) ; `Cracca` (pour le scientificName `Vicia sect. Cracca`)"
"infraspecificEpithet:label","Label for Infraspecific Epithet http://rs.tdwg.org/dwc/terms/infraspecificEpithet","Épithète infraspécifique"
"infraspecificEpithet:rdfs_comment","Comment for Infraspecific Epithet http://rs.tdwg.org/dwc/terms/infraspecificEpithet","Le nom de l'épithète infraspécifique la plus basse ou la dernière du dwc:scientificName, à l'exclusion de toute mention du rang."
"infraspecificEpithet:dcterms_description","Description for Infraspecific Epithet http://rs.tdwg.org/dwc/terms/infraspecificEpithet","En botanique, les suites de noms dans la littérature et les identifications peuvent avoir plusieurs rangs infraspécifiques. Selon le Code international de nomenclature pour les algues, les champignons et les plantes (Code de Schenzhen, articles 6.7 et 24.1), les noms valides n'ont que deux épithètes, le rang le plus bas étant le dwc:infraspecificEpithet. Par exemple : le dwc:infraspecificEpithet dans la chaîne `Indigofera charlieriana subsp. sessilis var. scaberrima` est `scaberrima` et le dwc:scientificName est `Indigofera charlieriana var. scaberrima (Schinz) J.B.Gillett`. Utilisez dwc:verbatimIdentification pour la suite de noms complète utilisée dans un dwc:Identification."
"infraspecificEpithet:examples","Examples for Infraspecific Epithet http://rs.tdwg.org/dwc/terms/infraspecificEpithet","`concolor` (pour le scientificName `Puma concolor concolor (Linnaeus, 1771)`) ; `oxyadenia` (pour le scientificName `Quercus agrifolia var. oxyadenia (Torr.) J.T. Howell`) ; `laxa` (pour le scientificName `Cheilanthes hirta f. laxa (Kunze) W.Jacobsen & N.Jacobsen`) ; `scaberrima` (pour le scientificName `Indigofera charlieriana var. scaberrima (Schinz) J.B.Gillett`)"
"institutionCode:label","Label for Institution Code http://rs.tdwg.org/dwc/terms/institutionCode","Code de l'institution"
"institutionCode:rdfs_comment","Comment for Institution Code http://rs.tdwg.org/dwc/terms/institutionCode","Le nom (ou l'acronyme) en vigueur pour l'institution qui a la garde de l'objet (ou des objets) ou de l'information mentionnée dans l'enregistrement."
"institutionID:label","Label for Institution ID http://rs.tdwg.org/dwc/terms/institutionID","Identifiant de l'institution"
"institutionID:rdfs_comment","Comment for Institution ID http://rs.tdwg.org/dwc/terms/institutionID","Un identifiant de l'institution qui a la garde de l'objet (ou des objets) ou de l'information mentionnée dans l'enregistrement."
"institutionID:dcterms_description","Description for Institution ID http://rs.tdwg.org/dwc/terms/institutionID","Pour les spécimens physiques, la pratique optimale recommandée est d'utiliser un identifiant unique et résoluble à l'échelle mondiale provenant d'un registre de collections tel que le Research Organization Registry (ROR) ou le GBIF Registry of Scientific Collections (https://www.gbif.org/grscicoll)."
"island:label","Label for Island http://rs.tdwg.org/dwc/terms/island","Île"
"island:rdfs_comment","Comment for Island http://rs.tdwg.org/dwc/terms/island","Le nom de l'île sur laquelle ou à proximité de laquelle se trouve la dcterms:Location."
"island:dcterms_description","Description for Island http://rs.tdwg.org/dwc/terms/island","La pratique optimale recommandée consiste à utiliser un vocabulaire contrôlé tel que le Getty Thesaurus of Geographic Names."
"islandGroup:label","Label for Island Group http://rs.tdwg.org/dwc/terms/islandGroup","Groupement d'îles"
"islandGroup:rdfs_comment","Comment for Island Group http://rs.tdwg.org/dwc/terms/islandGroup","Le nom du groupement d'îles dans lequel se trouve la dcterms:Location."
"islandGroup:dcterms_description","Description for Island Group http://rs.tdwg.org/dwc/terms/islandGroup","La pratique optimale recommandée consiste à utiliser un vocabulaire contrôlé tel que le Getty Thesaurus of Geographic Names."
"kingdom:label","Label for Kingdom http://rs.tdwg.org/dwc/terms/kingdom","Règne"
"kingdom:rdfs_comment","Comment for Kingdom http://rs.tdwg.org/dwc/terms/kingdom","Le nom scientifique complet du règne dans lequel le dwc:Taxon est classé."
"latestAgeOrHighestStage:label","Label for Latest Age Or Highest Stage http://rs.tdwg.org/dwc/terms/latestAgeOrHighestStage","Âge le plus récent ou étage le plus haut"
"latestAgeOrHighestStage:rdfs_comment","Comment for Latest Age Or Highest Stage http://rs.tdwg.org/dwc/terms/latestAgeOrHighestStage","Le nom complet de l'âge géochronologique le plus récent possible ou de l'étage chronostratigraphique le plus haut attribuable à l'horizon stratigraphique à partir duquel l'entité dwc:MaterialEntity a été collectée."
"latestEonOrHighestEonothem:label","Label for Llatest Eon Or Highest Eonothem http://rs.tdwg.org/dwc/terms/latestEonOrHighestEonothem","Éon le plus récent ou Eonothème le plus élevé"
"latestEonOrHighestEonothem:rdfs_comment","Comment for Llatest Eon Or Highest Eonothem http://rs.tdwg.org/dwc/terms/latestEonOrHighestEonothem","Le nom complet de l'éon géochronologique le plus récent possible ou de l'éonothème chrono-stratigraphique le plus élevé, ou le nom informel (""Précambrien"") attribuable à l'horizon stratigraphique à partir duquel l'entité dwc:MaterialEntity a été collectée."
"latestEpochOrHighestSeries:label","Label for Latest Epoch Or Highest Series http://rs.tdwg.org/dwc/terms/latestEpochOrHighestSeries",""
"latestEpochOrHighestSeries:rdfs_comment","Comment for Latest Epoch Or Highest Series http://rs.tdwg.org/dwc/terms/latestEpochOrHighestSeries",""
"latestEraOrHighestErathem:label","Label for Latest Era Or Highest Erathem http://rs.tdwg.org/dwc/terms/latestEraOrHighestErathem",""
"latestEraOrHighestErathem:rdfs_comment","Comment for Latest Era Or Highest Erathem http://rs.tdwg.org/dwc/terms/latestEraOrHighestErathem",""
"latestPeriodOrHighestSystem:label","Label for Latest Period Or Highest System http://rs.tdwg.org/dwc/terms/latestPeriodOrHighestSystem",""
"latestPeriodOrHighestSystem:rdfs_comment","Comment for Latest Period Or Highest System http://rs.tdwg.org/dwc/terms/latestPeriodOrHighestSystem","Le nom complet de la dernière période géochronologique possible ou du système chronostratigraphique le plus élevé attribuable à l'horizon stratigraphique à partir duquel la dwc:MaterialEntity a été collectée."
"lifeStage:label","Label for Life Stage http://rs.tdwg.org/dwc/terms/lifeStage","Stade de développement"
"lifeStage:rdfs_comment","Comment for Life Stage http://rs.tdwg.org/dwc/terms/lifeStage","La classe d'âge ou le stade de vie du ou des dwc:Organism(s) au moment où la dwc:Occurrence a été enregistrée."
"lifeStage:dcterms_description","Description for Life Stage http://rs.tdwg.org/dwc/terms/lifeStage","La pratique optimale recommandée est d'utiliser un vocabulaire contrôlé. Ce terme a un équivalent dans le dwciri: namespace qui n'autorise qu'un IRI comme valeur, alors que ce terme autorise n'importe quelle valeur sous forme de chaîne de caractères."
"lithostratigraphicTerms:label","Label for Lithostratigraphic Terms http://rs.tdwg.org/dwc/terms/lithostratigraphicTerms",""
"lithostratigraphicTerms:rdfs_comment","Comment for Lithostratigraphic Terms http://rs.tdwg.org/dwc/terms/lithostratigraphicTerms",""
"LivingSpecimen:label","Label for Living Specimen http://rs.tdwg.org/dwc/terms/LivingSpecimen","Spécimen vivant"
"LivingSpecimen:rdfs_comment","Comment for Living Specimen http://rs.tdwg.org/dwc/terms/LivingSpecimen","Un spécimen qui est en vie."
"locality:label","Label for Locality http://rs.tdwg.org/dwc/terms/locality","Localité"
"locality:rdfs_comment","Comment for Locality http://rs.tdwg.org/dwc/terms/locality","La description précise du lieu."
"locality:dcterms_description","Description for Locality http://rs.tdwg.org/dwc/terms/locality","Des informations géographiques moins spécifiques peuvent être fournies dans d'autres termes géographiques (dwc:higherGeography, dwc:continent, dwc:country, dwc:stateProvince, dwc:county, dwc:municipality, dwc:waterBody, dwc:island, dwc:islandGroup). Ce terme peut contenir des informations modifiées par rapport à l'original afin de corriger des erreurs apparentes ou de normaliser la description."
"locationAccordingTo:label","Label for Location According To http://rs.tdwg.org/dwc/terms/locationAccordingTo","Localité selon"
"locationAccordingTo:rdfs_comment","Comment for Location According To http://rs.tdwg.org/dwc/terms/locationAccordingTo","Informations sur la source des informations sur la dcterms:Location. Il peut s'agir d'une publication (gazetteer/index géographique), d'une institution ou d'un ensemble d'individus."
"locationAccordingTo:dcterms_description","Description for Location According To http://rs.tdwg.org/dwc/terms/locationAccordingTo","Ce terme a un équivalent dans le dwciri: namespace qui n'autorise qu'un IRI comme valeur, alors que ce terme autorise n'importe quelle valeur sous forme de chaîne de caractères."
"locationID:label","Label for Location ID http://rs.tdwg.org/dwc/terms/locationID","Identifiant de la localité"
"locationID:rdfs_comment","Comment for Location ID http://rs.tdwg.org/dwc/terms/locationID","Un identifiant pour l'ensemble des informations se rapportant à la dcterms:Location. Il peut s'agir d'un identifiant unique global (GUI) ou d'un identifiant spécifique à un jeu de données."
"locationRemarks:label","Label for Location Remarks http://rs.tdwg.org/dwc/terms/locationRemarks","Remarques sur la localité"
"locationRemarks:rdfs_comment","Comment for Location Remarks http://rs.tdwg.org/dwc/terms/locationRemarks","Commentaires ou notes à propos de la dcterms:Location."
"lowestBiostratigraphicZone:label","Label for Lowest Biostratigraphic Zone http://rs.tdwg.org/dwc/terms/lowestBiostratigraphicZone",""
"lowestBiostratigraphicZone:rdfs_comment","Comment for Lowest Biostratigraphic Zone http://rs.tdwg.org/dwc/terms/lowestBiostratigraphicZone",""
"MachineObservation:label","Label for Machine Observation http://rs.tdwg.org/dwc/terms/MachineObservation","Observation faite par une machine"
"MachineObservation:rdfs_comment","Comment for Machine Observation http://rs.tdwg.org/dwc/terms/MachineObservation",""
"MaterialCitation:label","Label for Material Citation http://rs.tdwg.org/dwc/terms/MaterialCitation",""
"MaterialCitation:rdfs_comment","Comment for Material Citation http://rs.tdwg.org/dwc/terms/MaterialCitation","Une référence ou citation d'un, d'une partie ou de plusieurs spécimens dans des publications scientifiques."
"MaterialCitation:dcterms_description","Description for Material Citation http://rs.tdwg.org/dwc/terms/MaterialCitation",""
"MaterialEntity:label","Label for Material Entity http://rs.tdwg.org/dwc/terms/MaterialEntity","Entité matérielle"
"MaterialEntity:rdfs_comment","Comment for Material Entity http://rs.tdwg.org/dwc/terms/MaterialEntity","Une entité qui peut être identifiée, qui existe pendant un certain temps et qui est constituée en tout ou en partie de matière physique pendant son existence."
"MaterialEntity:dcterms_description","Description for Material Entity http://rs.tdwg.org/dwc/terms/MaterialEntity","Le terme est défini au niveau le plus général pour admettre les descriptions de tout sous-type d'entité matérielle dans le champ d'application du Darwin Core. En particulier, tout type d'échantillon matériel, de fossile, de spécimen préservé en collection ou provenant de collections vivantes est censé être inclus dans ce terme."
"materialEntityID:label","Label for Material Entity ID http://rs.tdwg.org/dwc/terms/materialEntityID","Identifiant d'entité matérielle"
"materialEntityID:rdfs_comment","Comment for Material Entity ID http://rs.tdwg.org/dwc/terms/materialEntityID","Identifiant d'une instance particulière d'une dwc:MaterialEntity."
"materialEntityID:dcterms_description","Description for Material Entity ID http://rs.tdwg.org/dwc/terms/materialEntityID","Les valeurs de dwc:materialEntityID sont destinées à identifier de manière unique et permanente une dwc:MaterialEntity particulière dans un certain contexte. Les exemples de contexte comprennent une collection d'échantillons donnée, une organisation donnée ou l'échelle globale. La pratique optimale recommandée est d'utiliser un identifiant permanent et unique au niveau mondial. L'identifiant est lié à un objet physique (la dwc:MaterialEntity) par opposition à un enregistrement numérique particulier (représentation) de cet objet physique."
"materialEntityRemarks:label","Label for Material Entity Remarks http://rs.tdwg.org/dwc/terms/materialEntityRemarks","Remarques sur l'entité matérielle"
"materialEntityRemarks:rdfs_comment","Comment for Material Entity Remarks http://rs.tdwg.org/dwc/terms/materialEntityRemarks","Commentaires ou notes sur l'instance de dwc:MaterialEntity."
"MaterialSample:label","Label for Material Sample http://rs.tdwg.org/dwc/terms/MaterialSample","Échantillon matériel"
"MaterialSample:rdfs_comment","Comment for Material Sample http://rs.tdwg.org/dwc/terms/MaterialSample","Une entité matérielle qui représente une entité d'intérêt en totalité ou en partie."
"materialSampleID:label","Label for Material Sample ID http://rs.tdwg.org/dwc/terms/materialSampleID",""
"materialSampleID:rdfs_comment","Comment for Material Sample ID http://rs.tdwg.org/dwc/terms/materialSampleID",""
"materialSampleID:dcterms_description","Description for Material Sample ID http://rs.tdwg.org/dwc/terms/materialSampleID","La pratique optimale recommandée est d'utiliser un identifiant permanent et unique au niveau mondial (GUI)."
"maximumDepthInMeters:label","Label for Maximum Depth In Meters http://rs.tdwg.org/dwc/terms/maximumDepthInMeters","Profondeur maximale en mètres"
"maximumDepthInMeters:rdfs_comment","Comment for Maximum Depth In Meters http://rs.tdwg.org/dwc/terms/maximumDepthInMeters","La plus grande profondeur d'une plage de profondeur sous la surface locale, en mètres."
"maximumDistanceAboveSurfaceInMeters:label","Label for Maximum Distance Above Surface In Meters http://rs.tdwg.org/dwc/terms/maximumDistanceAboveSurfaceInMeters","Distance maximale au-dessus de la surface en mètres"
"maximumDistanceAboveSurfaceInMeters:rdfs_comment","Comment for Maximum Distance Above Surface In Meters http://rs.tdwg.org/dwc/terms/maximumDistanceAboveSurfaceInMeters","La plus grande distance d'une plage de distances par rapport à une surface de référence dans la dimension verticale, en mètres. Utilisez des valeurs positives pour les emplacements situés au-dessus de la surface, et des valeurs négatives pour les emplacements situés en dessous. Si des mesures de profondeur sont données, la surface de référence est l'emplacement donné par la profondeur, sinon la surface de référence est l'emplacement donné par l'élévation."
"maximumDistanceAboveSurfaceInMeters:examples","Examples for Maximum Distance Above Surface In Meters http://rs.tdwg.org/dwc/terms/maximumDistanceAboveSurfaceInMeters","`-1.5` (sous la surface) ; `4.2` (au-dessus de la surface) ; Pour une carotte de sédiments de 1,5 mètre prélevée au fond d'un lac (à une profondeur de 20 m) à une altitude de 300 m : verbatimElevation : `300m` minimumElevationInMeters : `300`, maximumElevationInMeters : `300`, verbatimDepth : `20m`, minimumDepthInMeters : `20`, maximumDepthInMeters : `20`, minimumDistanceAboveSurfaceInMeters : `0`, maximumDistanceAboveSurfaceInMeters : `-1.5`."
"maximumElevationInMeters:label","Label for Maximum Elevation In Meters http://rs.tdwg.org/dwc/terms/maximumElevationInMeters","Altitude maximale en mètres"
"maximumElevationInMeters:rdfs_comment","Comment for Maximum Elevation In Meters http://rs.tdwg.org/dwc/terms/maximumElevationInMeters","Limite supérieure de la plage d'élévation (altitude, généralement au-dessus du niveau de la mer), en mètres."
"measurementAccuracy:label","Label for Measurement Accuracy http://rs.tdwg.org/dwc/terms/measurementAccuracy","Précision de la mesure"
"measurementAccuracy:rdfs_comment","Comment for Measurement Accuracy http://rs.tdwg.org/dwc/terms/measurementAccuracy","La description de l'erreur ou marge d'erreur potentielle associée à la dwc:measurementValue."
"measurementDeterminedBy:label","Label for Measurement Determined By http://rs.tdwg.org/dwc/terms/measurementDeterminedBy","Mesure effectuée par"
"measurementDeterminedBy:rdfs_comment","Comment for Measurement Determined By http://rs.tdwg.org/dwc/terms/measurementDeterminedBy","Une liste (concaténée et séparée) de noms de personnes, de groupes ou d'organisations qui ont déterminé la valeur du dwc:MeasurementOrFact."
"measurementDeterminedBy:dcterms_description","Description for Measurement Determined By http://rs.tdwg.org/dwc/terms/measurementDeterminedBy","La pratique optimale recommandée est de séparer les valeurs d'une liste par une barre verticale (` | `). Ce terme a un équivalent dans le dwciri: namespace qui n'autorise qu'un IRI comme valeur, alors que ce terme autorise n'importe quelle valeur sous forme de chaîne de caractères."
"measurementDeterminedDate:label","Label for Measurement Determined Date http://rs.tdwg.org/dwc/terms/measurementDeterminedDate","Date de la mesure"
"measurementDeterminedDate:rdfs_comment","Comment for Measurement Determined Date http://rs.tdwg.org/dwc/terms/measurementDeterminedDate","La date à laquelle la dwc:MeasurementOrFact a été effectuée."
"measurementDeterminedDate:dcterms_description","Description for Measurement Determined Date http://rs.tdwg.org/dwc/terms/measurementDeterminedDate","La pratique optimale recommandée est d'utiliser une date conforme à la norme ISO 8601-1:2019."
"measurementDeterminedDate:examples","Examples for Measurement Determined Date http://rs.tdwg.org/dwc/terms/measurementDeterminedDate","`1963-03-08T14:07-0600` (8 mars 1963 à 14h07 dans le fuseau horaire six heures plus tôt que l'UTC) ; `2009-02-20T08:40Z` (20 février 2009 8h40 UTC) ; `2018-08-29T15:19` (15 h 19, heure locale, le 29 août 2018) ; `1809-02-12` (durant le 12 février 1809) ; `1906-06` (durant juin 1906) ; `1971` (durant l'année 1971) ;`2007-03-01T13:00:00Z/2008-05-11T15:30:00Z` (durant une période comprise entre le 1er mars 2007, 13 heures UTC, et le 11 mai 2008, 15 heures 30 UTC) ; `1900/1909` (durant une période comprise entre le début de l'année 1900 et la fin de l'année 1909) ; `2007-11-13/15` (durant une période comprise entre le 13 novembre 2007 et le 15 novembre 2007)"
"measurementID:label","Label for Measurement ID http://rs.tdwg.org/dwc/terms/measurementID","Identifiant de la mesure"
"measurementID:rdfs_comment","Comment for Measurement ID http://rs.tdwg.org/dwc/terms/measurementID","Un identifiant pour le dwc:MeasurementOrFact (informations relatives aux mesures, aux faits, aux caractéristiques ou aux affirmations). Il peut s'agir d'un identifiant unique global ou d'un identifiant spécifique à un jeu de données."
"measurementMethod:label","Label for Measurement Method http://rs.tdwg.org/dwc/terms/measurementMethod","Méthode de mesure"
"measurementMethod:rdfs_comment","Comment for Measurement Method http://rs.tdwg.org/dwc/terms/measurementMethod","Une description ou référence (publication, URI) de la méthode ou du protocole utilisé pour déterminer la mesure, le fait, la caractéristique ou l'affirmation."
"measurementMethod:dcterms_description","Description for Measurement Method http://rs.tdwg.org/dwc/terms/measurementMethod","Ce terme a un équivalent dans le dwciri: namespace qui n'autorise qu'un IRI comme valeur, alors que ce terme autorise n'importe quelle valeur sous forme de chaîne de caractères."
