document_modified,term_localName,term_isDefinedBy,term_created,term_modified,term_deprecated,replaces_term,replaces1_term,replaces2_term,label,definition,usage,notes,examples,rdf_type,tdwgutility_organizedInClass,tdwgutility_required,tdwgutility_repeatable
2024-06-30T15:40:45-05:00,chronometricAgeProtocol,http://rs.tdwg.org/chrono/terms/,2024-02-28,2024-02-28,,,,,Chronometric Age Protocol,A description of or reference to the methods used to determine the chronometric age.,,,"`Radiocarbon dating using an Accelerator Mass Spectrometry`, `Pb-Pb Dating`, `41Ca - 41K Chronometer`, `U-Pb Dating using a Thermal Ionization Mass Spectrometer`, `U-Pb Radiometric Dating`, `Thermoluminescence`, `Paleomagnetism`, `Pb-Pb Chronometer as described in Amelin et al. (2002) Science 297, 1678-1683`",http://www.w3.org/1999/02/22-rdf-syntax-ns#Property,http://rs.tdwg.org/dwc/terms/attributes/ChronometricAge,No,No
2024-06-30T15:40:45-05:00,chronometricAgeRemarks,http://rs.tdwg.org/chrono/terms/,2024-02-28,2024-02-28,,,,,Chronometric Age Remarks,Notes or comments about the ChronometricAge.,,,"`Beta Analytic number: 323913` `One of the Crassostrea virginica right valve specimens from North Midden Feature 17 was chosen for AMS dating, but it is unclear exactly which specimen it was.`",http://www.w3.org/1999/02/22-rdf-syntax-ns#Property,http://rs.tdwg.org/dwc/terms/attributes/ChronometricAge,No,No
2024-06-30T15:40:45-05:00,chronometricAgeUncertaintyInYears,http://rs.tdwg.org/chrono/terms/,2024-02-28,2024-02-28,,,,,Chronometric Age Uncertainty In Years,The temporal uncertainty of the earliestChronometricAge and latestChronometicAge in years.,,The expected unit for this field is years. The value in this field is number of years before and after the values given in the earliest and latest chronometric age fields within which the actual values are estimated to be.,`100`,http://www.w3.org/1999/02/22-rdf-syntax-ns#Property,http://rs.tdwg.org/dwc/terms/attributes/ChronometricAge,No,No
2024-06-30T15:40:45-05:00,earliestChronometricAge,http://rs.tdwg.org/chrono/terms/,2024-02-28,2024-02-28,,,,,Earliest Chronometric Age,The maximum/earliest/oldest possible age of a specimen as determined by a dating method.,,"The expected unit for this field is years. This field, if populated, must have an associated earliestChronometricAgeReferenceSystem.",`100`,http://www.w3.org/1999/02/22-rdf-syntax-ns#Property,http://rs.tdwg.org/dwc/terms/attributes/ChronometricAge,No,No
2024-06-30T15:40:45-05:00,earliestChronometricAgeReferenceSystem,http://rs.tdwg.org/chrono/terms/,2024-02-28,2024-02-28,,,,,Earliest Chronometric Age Reference System,The reference system associated with the earliestChronometricAge.,,,"`kya`, `mya`, `BP`, `AD`, `BCE`",http://www.w3.org/1999/02/22-rdf-syntax-ns#Property,http://rs.tdwg.org/dwc/terms/attributes/ChronometricAge,No,No
2024-06-30T15:40:45-05:00,latestChronometricAge,http://rs.tdwg.org/chrono/terms/,2024-02-28,2024-02-28,,,,,Latest Chronometric Age,The minimum/latest/youngest possible age of a specimen as determined by a dating method.,The minimum/latest/youngest possible age of an object in the collection as determined by a dating method.,"The expected unit for this field is years. This field, if populated, must have an associated latestChronometricAgeReferenceSystem.",`27`,http://www.w3.org/1999/02/22-rdf-syntax-ns#Property,http://rs.tdwg.org/dwc/terms/attributes/ChronometricAge,No,No
2024-06-30T15:40:45-05:00,latestChronometricAgeReferenceSystem,http://rs.tdwg.org/chrono/terms/,2024-02-28,2024-02-28,,,,,Latest Chronometric Age Reference System,The reference system associated with the latestChronometricAge.,,Recommended best practice is to use a controlled vocabulary.,"`kya`, `mya`, `BP`, `AD`, `BCE`",http://www.w3.org/1999/02/22-rdf-syntax-ns#Property,http://rs.tdwg.org/dwc/terms/attributes/ChronometricAge,No,No
2024-06-30T15:40:45-05:00,verbatimChronometricAge,http://rs.tdwg.org/chrono/terms/,2024-02-28,2024-02-28,,,,,Verbatim Chronometric Age,"The verbatim age for a specimen, whether reported by a dating assay, associated references, or legacy information.","The verbatim age for the objects in the collection, whether reported by a dating assay, associated references, or legacy information.","For example, this could be the radiocarbon age as given in an AMS dating report. This could also be simply what is reported as the age of a specimen in legacy collections data.",`27 BC to 14 AD`,http://www.w3.org/1999/02/22-rdf-syntax-ns#Property,http://rs.tdwg.org/dwc/terms/attributes/ChronometricAge,No,No
